experiments/4www.gemm.csv
Problem,Provider,OperationKind,Operation,Disposition,Status,gemm_kind,m,n,k,A,B,C,alpha,beta,split_k_slices,batch_count,op_class,accum,cta_m,cta_n,cta_k,stages,warps_m,warps_n,warps_k,inst_m,inst_n,inst_k,min_cc,max_cc,Bytes,Flops,Runtime,GB/s,GFLOPs
1,CUTLASS,gemm,cutlass_tensorop_s1688111gemm_f16_32x32_32x2_tn_align4,not_verified,success,universal,4096,1024,1024,f16:row,f16:column,f32:column,1,0,1,1,tensorop,f32,32,32,32,2,1,1,1,16,8,8,75,1024,27262976,8598323200,0.914089,27.777,9406.44
1,CUTLASS,gemm,cutlass_tensorop_s1688111gemm_f16_32x32_32x2_tn_align4,not_verified,success,universal,8192,2048,2048,f16:row,f16:column,f32:column,1,0,1,1,tensorop,f32,32,32,32,2,1,1,1,16,8,8,75,1024,109051904,68753031168,3.89258,26.0913,17662.6
1,CUTLASS,gemm,cutlass_tensorop_s1688111gemm_f16_32x32_32x2_tn_align4,not_verified,success,universal,12288,3072,3072,f16:row,f16:column,f32:column,1,0,1,1,tensorop,f32,32,32,32,2,1,1,1,16,8,8,75,1024,245366784,232003731456,13.0583,17.4996,17766.7
1,CUTLASS,gemm,cutlass_tensorop_s1688111gemm_f16_32x32_32x2_tn_align4,not_verified,success,universal,16384,4096,4096,f16:row,f16:column,f32:column,1,0,1,1,tensorop,f32,32,32,32,2,1,1,1,16,8,8,75,1024,436207616,549890031616,30.5786,13.2854,17982.8
1,CUTLASS,gemm,cutlass_tensorop_s1688111gemm_f16_32x32_32x2_tn_align4,not_verified,success,universal,20480,5120,5120,f16:row,f16:column,f32:column,1,0,1,1,tensorop,f32,32,32,32,2,1,1,1,16,8,8,75,1024,681574400,1073951539200,60.9538,10.4139,17619.1
1,CUTLASS,gemm,cutlass_tensorop_s1688111gemm_f16_32x32_32x2_tn_align4,not_verified,success,universal,24576,6144,6144,f16:row,f16:column,f32:column,1,0,1,1,tensorop,f32,32,32,32,2,1,1,1,16,8,8,75,1024,981467136,1855727861760,103.958,8.79258,17850.7
1,CUTLASS,gemm,cutlass_tensorop_s1688111gemm_f16_32x32_32x2_tn_align4,not_verified,success,universal,28672,7168,7168,f16:row,f16:column,f32:column,1,0,1,1,tensorop,f32,32,32,32,2,1,1,1,16,8,8,75,1024,1335885824,2946758606848,164.31,7.57192,17934.2
1,CUTLASS,gemm,cutlass_tensorop_s1688111gemm_f16_32x32_32x2_tn_align4,not_verified,success,universal,32768,8192,8192,f16:row,f16:column,f32:column,1,0,1,1,tensorop,f32,32,32,32,2,1,1,1,16,8,8,75,1024,1744830464,4398583382016,243.44,6.67516,18068.5
1,CUTLASS,gemm,cutlass_tensorop_s1688111gemm_f16_32x32_32x2_tn_align4,not_verified,success,universal,36864,9216,9216,f16:row,f16:column,f32:column,1,0,1,1,tensorop,f32,32,32,32,2,1,1,1,16,8,8,75,1024,2208301056,6262741794816,448.37,4.58693,13967.8
1,CUTLASS,gemm,cutlass_tensorop_s1688111gemm_f16_32x32_32x2_tn_align4,not_verified,success,universal,40960,10240,10240,f16:row,f16:column,f32:column,1,0,1,1,tensorop,f32,32,32,32,2,1,1,1,16,8,8,75,1024,2726297600,8590773452800,759.462,3.34324,11311.7
1,CUTLASS,gemm,cutlass_tensorop_s1688112gemm_f16_32x32_64x2_tn_align4,not_verified,success,universal,4096,1024,1024,f16:row,f16:column,f32:column,1,0,1,1,tensorop,f32,32,32,64,2,1,1,1,16,8,8,75,1024,27262976,8598323200,0.364191,69.7179,23609.4
1,CUTLASS,gemm,cutlass_tensorop_s1688111gemm_f16_32x32_64x2_tn_align4,not_verified,success,universal,4096,1024,1024,f16:row,f16:column,f32:column,1,0,1,1,tensorop,f32,32,32,64,2,1,1,1,16,8,8,75,1024,27262976,8598323200,0.366631,69.2538,23452.2
1,CUTLASS,gemm,cutlass_tensorop_s1688112gemm_f16_32x32_64x2_tn_align4,not_verified,success,universal,8192,2048,2048,f16:row,f16:column,f32:column,1,0,1,1,tensorop,f32,32,32,64,2,1,1,1,16,8,8,75,1024,109051904,68753031168,2.69299,37.7136,25530.4
1,CUTLASS,gemm,cutlass_tensorop_s1688111gemm_f16_32x32_64x2_tn_align4,not_verified,success,universal,8192,2048,2048,f16:row,f16:column,f32:column,1,0,1,1,tensorop,f32,32,32,64,2,1,1,1,16,8,8,75,1024,109051904,68753031168,2.67616,37.9508,25690.9
1,CUTLASS,gemm,cutlass_tensorop_s1688112gemm_f16_32x32_64x2_tn_align4,not_verified,success,universal,12288,3072,3072,f16:row,f16:column,f32:column,1,0,1,1,tensorop,f32,32,32,64,2,1,1,1,16,8,8,75,1024,245366784,232003731456,9.03314,25.2975,25683.6
1,CUTLASS,gemm,cutlass_tensorop_s1688111gemm_f16_32x32_64x2_tn_align4,not_verified,success,universal,12288,3072,3072,f16:row,f16:column,f32:column,1,0,1,1,tensorop,f32,32,32,64,2,1,1,1,16,8,8,75,1024,245366784,232003731456,9.01151,25.3582,25745.3
1,CUTLASS,gemm,cutlass_tensorop_s1688112gemm_f16_32x32_64x2_tn_align4,not_verified,success,universal,16384,4096,4096,f16:row,f16:column,f32:column,1,0,1,1,tensorop,f32,32,32,64,2,1,1,1,16,8,8,75,1024,436207616,549890031616,20.8226,19.5101,26408.3
1,CUTLASS,gemm,cutlass_tensorop_s1688111gemm_f16_32x32_64x2_tn_align4,not_verified,success,universal,16384,4096,4096,f16:row,f16:column,f32:column,1,0,1,1,tensorop,f32,32,32,64,2,1,1,1,16,8,8,75,1024,436207616,549890031616,20.8316,19.5017,26397
1,CUTLASS,gemm,cutlass_tensorop_s1688112gemm_f16_32x32_64x2_tn_align4,not_verified,success,universal,20480,5120,5120,f16:row,f16:column,f32:column,1,0,1,1,tensorop,f32,32,32,64,2,1,1,1,16,8,8,75,1024,681574400,1073951539200,41.2998,15.3697,26003.8
1,CUTLASS,gemm,cutlass_tensorop_s1688111gemm_f16_32x32_64x2_tn_align4,not_verified,success,universal,20480,5120,5120,f16:row,f16:column,f32:column,1,0,1,1,tensorop,f32,32,32,64,2,1,1,1,16,8,8,75,1024,681574400,1073951539200,41.3513,15.3506,25971.4
1,CUTLASS,gemm,cutlass_tensorop_s1688112gemm_f16_32x32_64x2_tn_align4,not_verified,success,universal,24576,6144,6144,f16:row,f16:column,f32:column,1,0,1,1,tensorop,f32,32,32,64,2,1,1,1,16,8,8,75,1024,981467136,1855727861760,71.5574,12.7738,25933.4
1,CUTLASS,gemm,cutlass_tensorop_s1688111gemm_f16_32x32_64x2_tn_align4,not_verified,success,universal,24576,6144,6144,f16:row,f16:column,f32:column,1,0,1,1,tensorop,f32,32,32,64,2,1,1,1,16,8,8,75,1024,981467136,1855727861760,71.7345,12.7423,25869.4
1,CUTLASS,gemm,cutlass_tensorop_s1688112gemm_f16_32x32_64x2_tn_align4,not_verified,success,universal,28672,7168,7168,f16:row,f16:column,f32:column,1,0,1,1,tensorop,f32,32,32,64,2,1,1,1,16,8,8,75,1024,1335885824,2946758606848,113.045,11.0057,26067.1
1,CUTLASS,gemm,cutlass_tensorop_s1688111gemm_f16_32x32_64x2_tn_align4,not_verified,success,universal,28672,7168,7168,f16:row,f16:column,f32:column,1,0,1,1,tensorop,f32,32,32,64,2,1,1,1,16,8,8,75,1024,1335885824,2946758606848,113.061,11.0041,26063.3
1,CUTLASS,gemm,cutlass_tensorop_s1688112gemm_f16_32x32_64x2_tn_align4,not_verified,success,universal,32768,8192,8192,f16:row,f16:column,f32:column,1,0,1,1,tensorop,f32,32,32,64,2,1,1,1,16,8,8,75,1024,1744830464,4398583382016,165.373,9.82627,26598
1,CUTLASS,gemm,cutlass_tensorop_s1688111gemm_f16_32x32_64x2_tn_align4,not_verified,success,universal,32768,8192,8192,f16:row,f16:column,f32:column,1,0,1,1,tensorop,f32,32,32,64,2,1,1,1,16,8,8,75,1024,1744830464,4398583382016,165.528,9.81706,26573
1,CUTLASS,gemm,cutlass_tensorop_s1688112gemm_f16_32x32_64x2_tn_align4,not_verified,success,universal,36864,9216,9216,f16:row,f16:column,f32:column,1,0,1,1,tensorop,f32,32,32,64,2,1,1,1,16,8,8,75,1024,2208301056,6262741794816,241.429,8.51861,25940.3
1,CUTLASS,gemm,cutlass_tensorop_s1688111gemm_f16_32x32_64x2_tn_align4,not_verified,success,universal,36864,9216,9216,f16:row,f16:column,f32:column,1,0,1,1,tensorop,f32,32,32,64,2,1,1,1,16,8,8,75,1024,2208301056,6262741794816,241.244,8.52514,25960.2
1,CUTLASS,gemm,cutlass_tensorop_s1688112gemm_f16_32x32_64x2_tn_align4,not_verified,success,universal,40960,10240,10240,f16:row,f16:column,f32:column,1,0,1,1,tensorop,f32,32,32,64,2,1,1,1,16,8,8,75,1024,2726297600,8590773452800,333.665,7.60962,25746.7
1,CUTLASS,gemm,cutlass_tensorop_s1688111gemm_f16_32x32_64x2_tn_align4,not_verified,success,universal,40960,10240,10240,f16:row,f16:column,f32:column,1,0,1,1,tensorop,f32,32,32,64,2,1,1,1,16,8,8,75,1024,2726297600,8590773452800,333.601,7.61109,25751.7
1,CUTLASS,gemm,cutlass_tensorop_s1688121gemm_f16_32x64_32x2_tn_align4,not_verified,success,universal,4096,1024,1024,f16:row,f16:column,f32:column,1,0,1,1,tensorop,f32,32,64,32,2,1,2,1,16,8,8,75,1024,27262976,8598323200,0.399809,63.5069,21506.1
1,CUTLASS,gemm,cutlass_tensorop_s1688111gemm_f16_32x64_32x2_tn_align4,not_verified,success,universal,4096,1024,1024,f16:row,f16:column,f32:column,1,0,1,1,tensorop,f32,32,64,32,2,1,1,1,16,8,8,75,1024,27262976,8598323200,0.389368,65.2099,22082.8
1,CUTLASS,gemm,cutlass_tensorop_s1688121gemm_f16_32x64_32x2_tn_align4,not_verified,success,universal,8192,2048,2048,f16:row,f16:column,f32:column,1,0,1,1,tensorop,f32,32,64,32,2,1,2,1,16,8,8,75,1024,109051904,68753031168,3.0584,33.2077,22480.1
1,CUTLASS,gemm,cutlass_tensorop_s1688111gemm_f16_32x64_32x2_tn_align4,not_verified,success,universal,8192,2048,2048,f16:row,f16:column,f32:column,1,0,1,1,tensorop,f32,32,64,32,2,1,1,1,16,8,8,75,1024,109051904,68753031168,2.90333,34.9814,23680.8
1,CUTLASS,gemm,cutlass_tensorop_s1688121gemm_f16_32x64_32x2_tn_align4,not_verified,success,universal,12288,3072,3072,f16:row,f16:column,f32:column,1,0,1,1,tensorop,f32,32,64,32,2,1,2,1,16,8,8,75,1024,245366784,232003731456,10.182,22.4432,22785.7
1,CUTLASS,gemm,cutlass_tensorop_s1688111gemm_f16_32x64_32x2_tn_align4,not_verified,success,universal,12288,3072,3072,f16:row,f16:column,f32:column,1,0,1,1,tensorop,f32,32,64,32,2,1,1,1,16,8,8,75,1024,245366784,232003731456,9.71061,23.5326,23891.8
1,CUTLASS,gemm,cutlass_tensorop_s1688121gemm_f16_32x64_32x2_tn_align4,not_verified,success,universal,16384,4096,4096,f16:row,f16:column,f32:column,1,0,1,1,tensorop,f32,32,64,32,2,1,2,1,16,8,8,75,1024,436207616,549890031616,23.967,16.9504,22943.7
1,CUTLASS,gemm,cutlass_tensorop_s1688111gemm_f16_32x64_32x2_tn_align4,not_verified,success,universal,16384,4096,4096,f16:row,f16:column,f32:column,1,0,1,1,tensorop,f32,32,64,32,2,1,1,1,16,8,8,75,1024,436207616,549890031616,22.8352,17.7905,24080.8
1,CUTLASS,gemm,cutlass_tensorop_s1688121gemm_f16_32x64_32x2_tn_align4,not_verified,success,universal,20480,5120,5120,f16:row,f16:column,f32:column,1,0,1,1,tensorop,f32,32,64,32,2,1,2,1,16,8,8,75,1024,681574400,1073951539200,47.6948,13.3089,22517.2
1,CUTLASS,gemm,cutlass_tensorop_s1688111gemm_f16_32x64_32x2_tn_align4,not_verified,success,universal,20480,5120,5120,f16:row,f16:column,f32:column,1,0,1,1,tensorop,f32,32,64,32,2,1,1,1,16,8,8,75,1024,681574400,1073951539200,46.6364,13.6109,23028.2
1,CUTLASS,gemm,cutlass_tensorop_s1688121gemm_f16_32x64_32x2_tn_align4,not_verified,success,universal,24576,6144,6144,f16:row,f16:column,f32:column,1,0,1,1,tensorop,f32,32,64,32,2,1,2,1,16,8,8,75,1024,981467136,1855727861760,81.2271,11.2532,22846.2
1,CUTLASS,gemm,cutlass_tensorop_s1688111gemm_f16_32x64_32x2_tn_align4,not_verified,success,universal,24576,6144,6144,f16:row,f16:column,f32:column,1,0,1,1,tensorop,f32,32,64,32,2,1,1,1,16,8,8,75,1024,981467136,1855727861760,82.2849,11.1085,22552.5
1,CUTLASS,gemm,cutlass_tensorop_s1688121gemm_f16_32x64_32x2_tn_align4,not_verified,success,universal,28672,7168,7168,f16:row,f16:column,f32:column,1,0,1,1,tensorop,f32,32,64,32,2,1,2,1,16,8,8,75,1024,1335885824,2946758606848,128.721,9.66537,22892.5
1,CUTLASS,gemm,cutlass_tensorop_s1688111gemm_f16_32x64_32x2_tn_align4,not_verified,success,universal,28672,7168,7168,f16:row,f16:column,f32:column,1,0,1,1,tensorop,f32,32,64,32,2,1,1,1,16,8,8,75,1024,1335885824,2946758606848,136.244,9.13169,21628.5
1,CUTLASS,gemm,cutlass_tensorop_s1688121gemm_f16_32x64_32x2_tn_align4,not_verified,success,universal,32768,8192,8192,f16:row,f16:column,f32:column,1,0,1,1,tensorop,f32,32,64,32,2,1,2,1,16,8,8,75,1024,1744830464,4398583382016,196.804,8.25694,22350.1
1,CUTLASS,gemm,cutlass_tensorop_s1688111gemm_f16_32x64_32x2_tn_align4,not_verified,success,universal,32768,8192,8192,f16:row,f16:column,f32:column,1,0,1,1,tensorop,f32,32,64,32,2,1,1,1,16,8,8,75,1024,1744830464,4398583382016,188.904,8.60227,23284.8
1,CUTLASS,gemm,cutlass_tensorop_s1688121gemm_f16_32x64_32x2_tn_align4,not_verified,success,universal,36864,9216,9216,f16:row,f16:column,f32:column,1,0,1,1,tensorop,f32,32,64,32,2,1,2,1,16,8,8,75,1024,2208301056,6262741794816,395.727,5.19712,15825.9
1,CUTLASS,gemm,cutlass_tensorop_s1688111gemm_f16_32x64_32x2_tn_align4,not_verified,success,universal,36864,9216,9216,f16:row,f16:column,f32:column,1,0,1,1,tensorop,f32,32,64,32,2,1,1,1,16,8,8,75,1024,2208301056,6262741794816,492.632,4.1748,12712.8
1,CUTLASS,gemm,cutlass_tensorop_s1688121gemm_f16_32x64_32x2_tn_align4,not_verified,success,universal,40960,10240,10240,f16:row,f16:column,f32:column,1,0,1,1,tensorop,f32,32,64,32,2,1,2,1,16,8,8,75,1024,2726297600,8590773452800,879.071,2.88835,9772.56
1,CUTLASS,gemm,cutlass_tensorop_s1688111gemm_f16_32x64_32x2_tn_align4,not_verified,success,universal,40960,10240,10240,f16:row,f16:column,f32:column,1,0,1,1,tensorop,f32,32,64,32,2,1,1,1,16,8,8,75,1024,2726297600,8590773452800,866.523,2.93017,9914.07
1,CUTLASS,gemm,cutlass_tensorop_s1688122gemm_f16_32x64_64x2_tn_align4,not_verified,success,universal,4096,1024,1024,f16:row,f16:column,f32:column,1,0,1,1,tensorop,f32,32,64,64,2,1,2,1,16,8,8,75,1024,27262976,8598323200,0.334882,75.8196,25675.7
1,CUTLASS,gemm,cutlass_tensorop_s1688121gemm_f16_32x64_64x2_tn_align4,not_verified,success,universal,4096,1024,1024,f16:row,f16:column,f32:column,1,0,1,1,tensorop,f32,32,64,64,2,1,2,1,16,8,8,75,1024,27262976,8598323200,0.332493,76.3644,25860.2
1,CUTLASS,gemm,cutlass_tensorop_s1688112gemm_f16_32x64_64x2_tn_align4,not_verified,success,universal,4096,1024,1024,f16:row,f16:column,f32:column,1,0,1,1,tensorop,f32,32,64,64,2,1,1,1,16,8,8,75,1024,27262976,8598323200,0.471868,53.8088,18221.9
1,CUTLASS,gemm,cutlass_tensorop_s1688111gemm_f16_32x64_64x2_tn_align4,not_verified,success,universal,4096,1024,1024,f16:row,f16:column,f32:column,1,0,1,1,tensorop,f32,32,64,64,2,1,1,1,16,8,8,75,1024,27262976,8598323200,0.471651,53.8336,18230.3
1,CUTLASS,gemm,cutlass_tensorop_s1688122gemm_f16_32x64_64x2_tn_align4,not_verified,success,universal,8192,2048,2048,f16:row,f16:column,f32:column,1,0,1,1,tensorop,f32,32,64,64,2,1,2,1,16,8,8,75,1024,109051904,68753031168,2.44437,41.5496,28127.1
1,CUTLASS,gemm,cutlass_tensorop_s1688121gemm_f16_32x64_64x2_tn_align4,not_verified,success,universal,8192,2048,2048,f16:row,f16:column,f32:column,1,0,1,1,tensorop,f32,32,64,64,2,1,2,1,16,8,8,75,1024,109051904,68753031168,2.49347,40.7314,27573.2
1,CUTLASS,gemm,cutlass_tensorop_s1688112gemm_f16_32x64_64x2_tn_align4,not_verified,success,universal,8192,2048,2048,f16:row,f16:column,f32:column,1,0,1,1,tensorop,f32,32,64,64,2,1,1,1,16,8,8,75,1024,109051904,68753031168,3.35904,30.2356,20468.1
1,CUTLASS,gemm,cutlass_tensorop_s1688111gemm_f16_32x64_64x2_tn_align4,not_verified,success,universal,8192,2048,2048,f16:row,f16:column,f32:column,1,0,1,1,tensorop,f32,32,64,64,2,1,1,1,16,8,8,75,1024,109051904,68753031168,3.35927,30.2335,20466.7
1,CUTLASS,gemm,cutlass_tensorop_s1688122gemm_f16_32x64_64x2_tn_align4,not_verified,success,universal,12288,3072,3072,f16:row,f16:column,f32:column,1,0,1,1,tensorop,f32,32,64,64,2,1,2,1,16,8,8,75,1024,245366784,232003731456,8.08614,28.2602,28691.5
1,CUTLASS,gemm,cutlass_tensorop_s1688121gemm_f16_32x64_64x2_tn_align4,not_verified,success,universal,12288,3072,3072,f16:row,f16:column,f32:column,1,0,1,1,tensorop,f32,32,64,64,2,1,2,1,16,8,8,75,1024,245366784,232003731456,8.19598,27.8814,28307
1,CUTLASS,gemm,cutlass_tensorop_s1688112gemm_f16_32x64_64x2_tn_align4,not_verified,success,universal,12288,3072,3072,f16:row,f16:column,f32:column,1,0,1,1,tensorop,f32,32,64,64,2,1,1,1,16,8,8,75,1024,245366784,232003731456,10.9482,20.8725,21191.1
1,CUTLASS,gemm,cutlass_tensorop_s1688111gemm_f16_32x64_64x2_tn_align4,not_verified,success,universal,12288,3072,3072,f16:row,f16:column,f32:column,1,0,1,1,tensorop,f32,32,64,64,2,1,1,1,16,8,8,75,1024,245366784,232003731456,10.9483,20.8722,21190.8
1,CUTLASS,gemm,cutlass_tensorop_s1688122gemm_f16_32x64_64x2_tn_align4,not_verified,success,universal,16384,4096,4096,f16:row,f16:column,f32:column,1,0,1,1,tensorop,f32,32,64,64,2,1,2,1,16,8,8,75,1024,436207616,549890031616,19.5221,20.8097,28167.5
1,CUTLASS,gemm,cutlass_tensorop_s1688121gemm_f16_32x64_64x2_tn_align4,not_verified,success,universal,16384,4096,4096,f16:row,f16:column,f32:column,1,0,1,1,tensorop,f32,32,64,64,2,1,2,1,16,8,8,75,1024,436207616,549890031616,19.3397,21.0061,28433.3
1,CUTLASS,gemm,cutlass_tensorop_s1688112gemm_f16_32x64_64x2_tn_align4,not_verified,success,universal,16384,4096,4096,f16:row,f16:column,f32:column,1,0,1,1,tensorop,f32,32,64,64,2,1,1,1,16,8,8,75,1024,436207616,549890031616,25.3541,16.023,21688.4
1,CUTLASS,gemm,cutlass_tensorop_s1688111gemm_f16_32x64_64x2_tn_align4,not_verified,success,universal,16384,4096,4096,f16:row,f16:column,f32:column,1,0,1,1,tensorop,f32,32,64,64,2,1,1,1,16,8,8,75,1024,436207616,549890031616,25.3536,16.0234,21688.9
1,CUTLASS,gemm,cutlass_tensorop_s1688122gemm_f16_32x64_64x2_tn_align4,not_verified,success,universal,20480,5120,5120,f16:row,f16:column,f32:column,1,0,1,1,tensorop,f32,32,64,64,2,1,2,1,16,8,8,75,1024,681574400,1073951539200,37.2541,17.0388,28827.7
1,CUTLASS,gemm,cutlass_tensorop_s1688121gemm_f16_32x64_64x2_tn_align4,not_verified,success,universal,20480,5120,5120,f16:row,f16:column,f32:column,1,0,1,1,tensorop,f32,32,64,64,2,1,2,1,16,8,8,75,1024,681574400,1073951539200,37.9898,16.7088,28269.4
1,CUTLASS,gemm,cutlass_tensorop_s1688112gemm_f16_32x64_64x2_tn_align4,not_verified,success,universal,20480,5120,5120,f16:row,f16:column,f32:column,1,0,1,1,tensorop,f32,32,64,64,2,1,1,1,16,8,8,75,1024,681574400,1073951539200,49.2216,12.8961,21818.7
1,CUTLASS,gemm,cutlass_tensorop_s1688111gemm_f16_32x64_64x2_tn_align4,not_verified,success,universal,20480,5120,5120,f16:row,f16:column,f32:column,1,0,1,1,tensorop,f32,32,64,64,2,1,1,1,16,8,8,75,1024,681574400,1073951539200,49.2292,12.8941,21815.3
1,CUTLASS,gemm,cutlass_tensorop_s1688122gemm_f16_32x64_64x2_tn_align4,not_verified,success,universal,24576,6144,6144,f16:row,f16:column,f32:column,1,0,1,1,tensorop,f32,32,64,64,2,1,2,1,16,8,8,75,1024,981467136,1855727861760,65.0489,14.0519,28528.2
1,CUTLASS,gemm,cutlass_tensorop_s1688121gemm_f16_32x64_64x2_tn_align4,not_verified,success,universal,24576,6144,6144,f16:row,f16:column,f32:column,1,0,1,1,tensorop,f32,32,64,64,2,1,2,1,16,8,8,75,1024,981467136,1855727861760,64.5214,14.1668,28761.4
1,CUTLASS,gemm,cutlass_tensorop_s1688112gemm_f16_32x64_64x2_tn_align4,not_verified,success,universal,24576,6144,6144,f16:row,f16:column,f32:column,1,0,1,1,tensorop,f32,32,64,64,2,1,1,1,16,8,8,75,1024,981467136,1855727861760,85.2944,10.7166,21756.7
1,CUTLASS,gemm,cutlass_tensorop_s1688111gemm_f16_32x64_64x2_tn_align4,not_verified,success,universal,24576,6144,6144,f16:row,f16:column,f32:column,1,0,1,1,tensorop,f32,32,64,64,2,1,1,1,16,8,8,75,1024,981467136,1855727861760,85.3437,10.7104,21744.2
1,CUTLASS,gemm,cutlass_tensorop_s1688122gemm_f16_32x64_64x2_tn_align4,not_verified,success,universal,28672,7168,7168,f16:row,f16:column,f32:column,1,0,1,1,tensorop,f32,32,64,64,2,1,2,1,16,8,8,75,1024,1335885824,2946758606848,104.094,11.9521,28308.7
1,CUTLASS,gemm,cutlass_tensorop_s1688121gemm_f16_32x64_64x2_tn_align4,not_verified,success,universal,28672,7168,7168,f16:row,f16:column,f32:column,1,0,1,1,tensorop,f32,32,64,64,2,1,2,1,16,8,8,75,1024,1335885824,2946758606848,105.862,11.7525,27835.9
1,CUTLASS,gemm,cutlass_tensorop_s1688112gemm_f16_32x64_64x2_tn_align4,not_verified,success,universal,28672,7168,7168,f16:row,f16:column,f32:column,1,0,1,1,tensorop,f32,32,64,64,2,1,1,1,16,8,8,75,1024,1335885824,2946758606848,136.195,9.13501,21636.4
1,CUTLASS,gemm,cutlass_tensorop_s1688111gemm_f16_32x64_64x2_tn_align4,not_verified,success,universal,28672,7168,7168,f16:row,f16:column,f32:column,1,0,1,1,tensorop,f32,32,64,64,2,1,1,1,16,8,8,75,1024,1335885824,2946758606848,136.319,9.12667,21616.6
1,CUTLASS,gemm,cutlass_tensorop_s1688122gemm_f16_32x64_64x2_tn_align4,not_verified,success,universal,32768,8192,8192,f16:row,f16:column,f32:column,1,0,1,1,tensorop,f32,32,64,64,2,1,2,1,16,8,8,75,1024,1744830464,4398583382016,156.555,10.3798,28096.2
1,CUTLASS,gemm,cutlass_tensorop_s1688121gemm_f16_32x64_64x2_tn_align4,not_verified,success,universal,32768,8192,8192,f16:row,f16:column,f32:column,1,0,1,1,tensorop,f32,32,64,64,2,1,2,1,16,8,8,75,1024,1744830464,4398583382016,157.864,10.2937,27863.1
1,CUTLASS,gemm,cutlass_tensorop_s1688112gemm_f16_32x64_64x2_tn_align4,not_verified,success,universal,32768,8192,8192,f16:row,f16:column,f32:column,1,0,1,1,tensorop,f32,32,64,64,2,1,1,1,16,8,8,75,1024,1744830464,4398583382016,204.133,7.96051,21547.7
1,CUTLASS,gemm,cutlass_tensorop_s1688111gemm_f16_32x64_64x2_tn_align4,not_verified,success,universal,32768,8192,8192,f16:row,f16:column,f32:column,1,0,1,1,tensorop,f32,32,64,64,2,1,1,1,16,8,8,75,1024,1744830464,4398583382016,204.083,7.96244,21552.9
1,CUTLASS,gemm,cutlass_tensorop_s1688122gemm_f16_32x64_64x2_tn_align4,not_verified,success,universal,36864,9216,9216,f16:row,f16:column,f32:column,1,0,1,1,tensorop,f32,32,64,64,2,1,2,1,16,8,8,75,1024,2208301056,6262741794816,226.707,9.07181,27624.9
1,CUTLASS,gemm,cutlass_tensorop_s1688121gemm_f16_32x64_64x2_tn_align4,not_verified,success,universal,36864,9216,9216,f16:row,f16:column,f32:column,1,0,1,1,tensorop,f32,32,64,64,2,1,2,1,16,8,8,75,1024,2208301056,6262741794816,224.887,9.14522,27848.4
1,CUTLASS,gemm,cutlass_tensorop_s1688112gemm_f16_32x64_64x2_tn_align4,not_verified,success,universal,36864,9216,9216,f16:row,f16:column,f32:column,1,0,1,1,tensorop,f32,32,64,64,2,1,1,1,16,8,8,75,1024,2208301056,6262741794816,292.341,7.03509,21422.8
1,CUTLASS,gemm,cutlass_tensorop_s1688111gemm_f16_32x64_64x2_tn_align4,not_verified,success,universal,36864,9216,9216,f16:row,f16:column,f32:column,1,0,1,1,tensorop,f32,32,64,64,2,1,1,1,16,8,8,75,1024,2208301056,6262741794816,292.794,7.02418,21389.6
1,CUTLASS,gemm,cutlass_tensorop_s1688122gemm_f16_32x64_64x2_tn_align4,not_verified,success,universal,40960,10240,10240,f16:row,f16:column,f32:column,1,0,1,1,tensorop,f32,32,64,64,2,1,2,1,16,8,8,75,1024,2726297600,8590773452800,311.151,8.16023,27609.7
1,CUTLASS,gemm,cutlass_tensorop_s1688121gemm_f16_32x64_64x2_tn_align4,not_verified,success,universal,40960,10240,10240,f16:row,f16:column,f32:column,1,0,1,1,tensorop,f32,32,64,64,2,1,2,1,16,8,8,75,1024,2726297600,8590773452800,312.267,8.13107,27511
1,CUTLASS,gemm,cutlass_tensorop_s1688112gemm_f16_32x64_64x2_tn_align4,not_verified,success,universal,40960,10240,10240,f16:row,f16:column,f32:column,1,0,1,1,tensorop,f32,32,64,64,2,1,1,1,16,8,8,75,1024,2726297600,8590773452800,405.625,6.25963,21179.1
1,CUTLASS,gemm,cutlass_tensorop_s1688111gemm_f16_32x64_64x2_tn_align4,not_verified,success,universal,40960,10240,10240,f16:row,f16:column,f32:column,1,0,1,1,tensorop,f32,32,64,64,2,1,1,1,16,8,8,75,1024,2726297600,8590773452800,405.102,6.26771,21206.4
1,CUTLASS,gemm,cutlass_tensorop_s1688141gemm_f16_32x128_32x2_tn_align4,not_verified,success,universal,4096,1024,1024,f16:row,f16:column,f32:column,1,0,1,1,tensorop,f32,32,128,32,2,1,4,1,16,8,8,75,1024,27262976,8598323200,0.352315,72.0679,24405.2
1,CUTLASS,gemm,cutlass_tensorop_s1688121gemm_f16_32x128_32x2_tn_align4,not_verified,success,universal,4096,1024,1024,f16:row,f16:column,f32:column,1,0,1,1,tensorop,f32,32,128,32,2,1,2,1,16,8,8,75,1024,27262976,8598323200,0.344061,73.7969,24990.7
1,CUTLASS,gemm,cutlass_tensorop_s1688111gemm_f16_32x128_32x2_tn_align4,not_verified,success,universal,4096,1024,1024,f16:row,f16:column,f32:column,1,0,1,1,tensorop,f32,32,128,32,2,1,1,1,16,8,8,75,1024,27262976,8598323200,1.32386,19.1793,6494.9
1,CUTLASS,gemm,cutlass_tensorop_s1688141gemm_f16_32x128_32x2_tn_align4,not_verified,success,universal,8192,2048,2048,f16:row,f16:column,f32:column,1,0,1,1,tensorop,f32,32,128,32,2,1,4,1,16,8,8,75,1024,109051904,68753031168,2.65616,38.2366,25884.4
1,CUTLASS,gemm,cutlass_tensorop_s1688121gemm_f16_32x128_32x2_tn_align4,not_verified,success,universal,8192,2048,2048,f16:row,f16:column,f32:column,1,0,1,1,tensorop,f32,32,128,32,2,1,2,1,16,8,8,75,1024,109051904,68753031168,2.51027,40.4588,27388.7
1,CUTLASS,gemm,cutlass_tensorop_s1688111gemm_f16_32x128_32x2_tn_align4,not_verified,success,universal,8192,2048,2048,f16:row,f16:column,f32:column,1,0,1,1,tensorop,f32,32,128,32,2,1,1,1,16,8,8,75,1024,109051904,68753031168,8.94236,11.3575,7688.47
1,CUTLASS,gemm,cutlass_tensorop_s1688141gemm_f16_32x128_32x2_tn_align4,not_verified,success,universal,12288,3072,3072,f16:row,f16:column,f32:column,1,0,1,1,tensorop,f32,32,128,32,2,1,4,1,16,8,8,75,1024,245366784,232003731456,8.85332,25.8113,26205.3
1,CUTLASS,gemm,cutlass_tensorop_s1688121gemm_f16_32x128_32x2_tn_align4,not_verified,success,universal,12288,3072,3072,f16:row,f16:column,f32:column,1,0,1,1,tensorop,f32,32,128,32,2,1,2,1,16,8,8,75,1024,245366784,232003731456,8.6397,26.4495,26853.2
1,CUTLASS,gemm,cutlass_tensorop_s1688111gemm_f16_32x128_32x2_tn_align4,not_verified,success,universal,12288,3072,3072,f16:row,f16:column,f32:column,1,0,1,1,tensorop,f32,32,128,32,2,1,1,1,16,8,8,75,1024,245366784,232003731456,36.4456,6.27005,6365.76
1,CUTLASS,gemm,cutlass_tensorop_s1688141gemm_f16_32x128_32x2_tn_align4,not_verified,success,universal,16384,4096,4096,f16:row,f16:column,f32:column,1,0,1,1,tensorop,f32,32,128,32,2,1,4,1,16,8,8,75,1024,436207616,549890031616,20.7892,19.5414,26450.7
1,CUTLASS,gemm,cutlass_tensorop_s1688121gemm_f16_32x128_32x2_tn_align4,not_verified,success,universal,16384,4096,4096,f16:row,f16:column,f32:column,1,0,1,1,tensorop,f32,32,128,32,2,1,2,1,16,8,8,75,1024,436207616,549890031616,21.1793,19.1815,25963.6
1,CUTLASS,gemm,cutlass_tensorop_s1688111gemm_f16_32x128_32x2_tn_align4,not_verified,success,universal,16384,4096,4096,f16:row,f16:column,f32:column,1,0,1,1,tensorop,f32,32,128,32,2,1,1,1,16,8,8,75,1024,436207616,549890031616,69.1718,5.87306,7949.63
1,CUTLASS,gemm,cutlass_tensorop_s1688141gemm_f16_32x128_32x2_tn_align4,not_verified,success,universal,20480,5120,5120,f16:row,f16:column,f32:column,1,0,1,1,tensorop,f32,32,128,32,2,1,4,1,16,8,8,75,1024,681574400,1073951539200,42.0257,15.1042,25554.7
1,CUTLASS,gemm,cutlass_tensorop_s1688121gemm_f16_32x128_32x2_tn_align4,not_verified,success,universal,20480,5120,5120,f16:row,f16:column,f32:column,1,0,1,1,tensorop,f32,32,128,32,2,1,2,1,16,8,8,75,1024,681574400,1073951539200,77.5579,8.18441,13847.1
1,CUTLASS,gemm,cutlass_tensorop_s1688111gemm_f16_32x128_32x2_tn_align4,not_verified,success,universal,20480,5120,5120,f16:row,f16:column,f32:column,1,0,1,1,tensorop,f32,32,128,32,2,1,1,1,16,8,8,75,1024,681574400,1073951539200,139.968,4.53508,7672.85
1,CUTLASS,gemm,cutlass_tensorop_s1688141gemm_f16_32x128_32x2_tn_align4,not_verified,success,universal,24576,6144,6144,f16:row,f16:column,f32:column,1,0,1,1,tensorop,f32,32,128,32,2,1,4,1,16,8,8,75,1024,981467136,1855727861760,94.197,9.70373,19700.5
1,CUTLASS,gemm,cutlass_tensorop_s1688121gemm_f16_32x128_32x2_tn_align4,not_verified,success,universal,24576,6144,6144,f16:row,f16:column,f32:column,1,0,1,1,tensorop,f32,32,128,32,2,1,2,1,16,8,8,75,1024,981467136,1855727861760,160.946,5.67931,11530.1
1,CUTLASS,gemm,cutlass_tensorop_s1688111gemm_f16_32x128_32x2_tn_align4,not_verified,success,universal,24576,6144,6144,f16:row,f16:column,f32:column,1,0,1,1,tensorop,f32,32,128,32,2,1,1,1,16,8,8,75,1024,981467136,1855727861760,362.759,2.51975,5115.59
1,CUTLASS,gemm,cutlass_tensorop_s1688141gemm_f16_32x128_32x2_tn_align4,not_verified,success,universal,28672,7168,7168,f16:row,f16:column,f32:column,1,0,1,1,tensorop,f32,32,128,32,2,1,4,1,16,8,8,75,1024,1335885824,2946758606848,204.546,6.08245,14406.3
1,CUTLASS,gemm,cutlass_tensorop_s1688121gemm_f16_32x128_32x2_tn_align4,not_verified,success,universal,28672,7168,7168,f16:row,f16:column,f32:column,1,0,1,1,tensorop,f32,32,128,32,2,1,2,1,16,8,8,75,1024,1335885824,2946758606848,303.871,4.09431,9697.41
1,CUTLASS,gemm,cutlass_tensorop_s1688111gemm_f16_32x128_32x2_tn_align4,not_verified,success,universal,28672,7168,7168,f16:row,f16:column,f32:column,1,0,1,1,tensorop,f32,32,128,32,2,1,1,1,16,8,8,75,1024,1335885824,2946758606848,472.301,2.63421,6239.16
1,CUTLASS,gemm,cutlass_tensorop_s1688141gemm_f16_32x128_32x2_tn_align4,not_verified,success,universal,32768,8192,8192,f16:row,f16:column,f32:column,1,0,1,1,tensorop,f32,32,128,32,2,1,4,1,16,8,8,75,1024,1744830464,4398583382016,264.003,6.15523,16661.1
1,CUTLASS,gemm,cutlass_tensorop_s1688121gemm_f16_32x128_32x2_tn_align4,not_verified,success,universal,32768,8192,8192,f16:row,f16:column,f32:column,1,0,1,1,tensorop,f32,32,128,32,2,1,2,1,16,8,8,75,1024,1744830464,4398583382016,283.867,5.7245,15495.2
1,CUTLASS,gemm,cutlass_tensorop_s1688111gemm_f16_32x128_32x2_tn_align4,not_verified,success,universal,32768,8192,8192,f16:row,f16:column,f32:column,1,0,1,1,tensorop,f32,32,128,32,2,1,1,1,16,8,8,75,1024,1744830464,4398583382016,877.319,1.85223,5013.66
1,CUTLASS,gemm,cutlass_tensorop_s1688141gemm_f16_32x128_32x2_tn_align4,not_verified,success,universal,36864,9216,9216,f16:row,f16:column,f32:column,1,0,1,1,tensorop,f32,32,128,32,2,1,4,1,16,8,8,75,1024,2208301056,6262741794816,731.275,2.8124,8564.14
1,CUTLASS,gemm,cutlass_tensorop_s1688121gemm_f16_32x128_32x2_tn_align4,not_verified,success,universal,36864,9216,9216,f16:row,f16:column,f32:column,1,0,1,1,tensorop,f32,32,128,32,2,1,2,1,16,8,8,75,1024,2208301056,6262741794816,762.948,2.69565,8208.61
1,CUTLASS,gemm,cutlass_tensorop_s1688111gemm_f16_32x128_32x2_tn_align4,not_verified,success,universal,36864,9216,9216,f16:row,f16:column,f32:column,1,0,1,1,tensorop,f32,32,128,32,2,1,1,1,16,8,8,75,1024,2208301056,6262741794816,1496.92,1.37392,4183.76
1,CUTLASS,gemm,cutlass_tensorop_s1688141gemm_f16_32x128_32x2_tn_align4,not_verified,success,universal,40960,10240,10240,f16:row,f16:column,f32:column,1,0,1,1,tensorop,f32,32,128,32,2,1,4,1,16,8,8,75,1024,2726297600,8590773452800,1055.99,2.40444,8135.3
1,CUTLASS,gemm,cutlass_tensorop_s1688121gemm_f16_32x128_32x2_tn_align4,not_verified,success,universal,40960,10240,10240,f16:row,f16:column,f32:column,1,0,1,1,tensorop,f32,32,128,32,2,1,2,1,16,8,8,75,1024,2726297600,8590773452800,1081.84,2.34699,7940.9
1,CUTLASS,gemm,cutlass_tensorop_s1688111gemm_f16_32x128_32x2_tn_align4,not_verified,success,universal,40960,10240,10240,f16:row,f16:column,f32:column,1,0,1,1,tensorop,f32,32,128,32,2,1,1,1,16,8,8,75,1024,2726297600,8590773452800,2086.14,1.21711,4118.01
1,CUTLASS,gemm,cutlass_tensorop_s1688142gemm_f16_32x128_64x2_tn_align4,not_verified,success,universal,4096,1024,1024,f16:row,f16:column,f32:column,1,0,1,1,tensorop,f32,32,128,64,2,1,4,1,16,8,8,75,1024,27262976,8598323200,0.330222,76.8896,26038
1,CUTLASS,gemm,cutlass_tensorop_s1688141gemm_f16_32x128_64x2_tn_align4,not_verified,success,universal,4096,1024,1024,f16:row,f16:column,f32:column,1,0,1,1,tensorop,f32,32,128,64,2,1,4,1,16,8,8,75,1024,27262976,8598323200,0.334978,75.798,25668.4
1,CUTLASS,gemm,cutlass_tensorop_s1688122gemm_f16_32x128_64x2_tn_align4,not_verified,success,universal,4096,1024,1024,f16:row,f16:column,f32:column,1,0,1,1,tensorop,f32,32,128,64,2,1,2,1,16,8,8,75,1024,27262976,8598323200,0.531615,47.7613,16174
1,CUTLASS,gemm,cutlass_tensorop_s1688121gemm_f16_32x128_64x2_tn_align4,not_verified,success,universal,4096,1024,1024,f16:row,f16:column,f32:column,1,0,1,1,tensorop,f32,32,128,64,2,1,2,1,16,8,8,75,1024,27262976,8598323200,0.531146,47.8035,16188.3
1,CUTLASS,gemm,cutlass_tensorop_s1688112gemm_f16_32x128_64x2_tn_align4,not_verified,success,universal,4096,1024,1024,f16:row,f16:column,f32:column,1,0,1,1,tensorop,f32,32,128,64,2,1,1,1,16,8,8,75,1024,27262976,8598323200,3.18779,7.96495,2697.26
1,CUTLASS,gemm,cutlass_tensorop_s1688111gemm_f16_32x128_64x2_tn_align4,not_verified,success,universal,4096,1024,1024,f16:row,f16:column,f32:column,1,0,1,1,tensorop,f32,32,128,64,2,1,1,1,16,8,8,75,1024,27262976,8598323200,3.1796,7.98548,2704.21
1,CUTLASS,gemm,cutlass_tensorop_s1688142gemm_f16_32x128_64x2_tn_align4,not_verified,success,universal,8192,2048,2048,f16:row,f16:column,f32:column,1,0,1,1,tensorop,f32,32,128,64,2,1,4,1,16,8,8,75,1024,109051904,68753031168,2.40914,42.1572,28538.4
1,CUTLASS,gemm,cutlass_tensorop_s1688141gemm_f16_32x128_64x2_tn_align4,not_verified,success,universal,8192,2048,2048,f16:row,f16:column,f32:column,1,0,1,1,tensorop,f32,32,128,64,2,1,4,1,16,8,8,75,1024,109051904,68753031168,2.39362,42.4304,28723.4
1,CUTLASS,gemm,cutlass_tensorop_s1688122gemm_f16_32x128_64x2_tn_align4,not_verified,success,universal,8192,2048,2048,f16:row,f16:column,f32:column,1,0,1,1,tensorop,f32,32,128,64,2,1,2,1,16,8,8,75,1024,109051904,68753031168,3.84343,26.425,17888.5
1,CUTLASS,gemm,cutlass_tensorop_s1688121gemm_f16_32x128_64x2_tn_align4,not_verified,success,universal,8192,2048,2048,f16:row,f16:column,f32:column,1,0,1,1,tensorop,f32,32,128,64,2,1,2,1,16,8,8,75,1024,109051904,68753031168,3.8435,26.4245,17888.2
1,CUTLASS,gemm,cutlass_tensorop_s1688112gemm_f16_32x128_64x2_tn_align4,not_verified,success,universal,8192,2048,2048,f16:row,f16:column,f32:column,1,0,1,1,tensorop,f32,32,128,64,2,1,1,1,16,8,8,75,1024,109051904,68753031168,25.377,4.00215,2709.27
1,CUTLASS,gemm,cutlass_tensorop_s1688111gemm_f16_32x128_64x2_tn_align4,not_verified,success,universal,8192,2048,2048,f16:row,f16:column,f32:column,1,0,1,1,tensorop,f32,32,128,64,2,1,1,1,16,8,8,75,1024,109051904,68753031168,23.8733,4.25423,2879.91
1,CUTLASS,gemm,cutlass_tensorop_s1688142gemm_f16_32x128_64x2_tn_align4,not_verified,success,universal,12288,3072,3072,f16:row,f16:column,f32:column,1,0,1,1,tensorop,f32,32,128,64,2,1,4,1,16,8,8,75,1024,245366784,232003731456,7.95038,28.7427,29181.5
1,CUTLASS,gemm,cutlass_tensorop_s1688141gemm_f16_32x128_64x2_tn_align4,not_verified,success,universal,12288,3072,3072,f16:row,f16:column,f32:column,1,0,1,1,tensorop,f32,32,128,64,2,1,4,1,16,8,8,75,1024,245366784,232003731456,7.9621,28.7004,29138.5
1,CUTLASS,gemm,cutlass_tensorop_s1688122gemm_f16_32x128_64x2_tn_align4,not_verified,success,universal,12288,3072,3072,f16:row,f16:column,f32:column,1,0,1,1,tensorop,f32,32,128,64,2,1,2,1,16,8,8,75,1024,245366784,232003731456,12.563,18.1896,18467.2
1,CUTLASS,gemm,cutlass_tensorop_s1688121gemm_f16_32x128_64x2_tn_align4,not_verified,success,universal,12288,3072,3072,f16:row,f16:column,f32:column,1,0,1,1,tensorop,f32,32,128,64,2,1,2,1,16,8,8,75,1024,245366784,232003731456,12.5669,18.1839,18461.5
1,CUTLASS,gemm,cutlass_tensorop_s1688112gemm_f16_32x128_64x2_tn_align4,not_verified,success,universal,12288,3072,3072,f16:row,f16:column,f32:column,1,0,1,1,tensorop,f32,32,128,64,2,1,1,1,16,8,8,75,1024,245366784,232003731456,79.7488,2.86544,2909.18
1,CUTLASS,gemm,cutlass_tensorop_s1688111gemm_f16_32x128_64x2_tn_align4,not_verified,success,universal,12288,3072,3072,f16:row,f16:column,f32:column,1,0,1,1,tensorop,f32,32,128,64,2,1,1,1,16,8,8,75,1024,245366784,232003731456,79.7499,2.8654,2909.14
1,CUTLASS,gemm,cutlass_tensorop_s1688142gemm_f16_32x128_64x2_tn_align4,not_verified,success,universal,16384,4096,4096,f16:row,f16:column,f32:column,1,0,1,1,tensorop,f32,32,128,64,2,1,4,1,16,8,8,75,1024,436207616,549890031616,18.7266,21.6937,29364.1
1,CUTLASS,gemm,cutlass_tensorop_s1688141gemm_f16_32x128_64x2_tn_align4,not_verified,success,universal,16384,4096,4096,f16:row,f16:column,f32:column,1,0,1,1,tensorop,f32,32,128,64,2,1,4,1,16,8,8,75,1024,436207616,549890031616,18.7066,21.7169,29395.5
1,CUTLASS,gemm,cutlass_tensorop_s1688122gemm_f16_32x128_64x2_tn_align4,not_verified,success,universal,16384,4096,4096,f16:row,f16:column,f32:column,1,0,1,1,tensorop,f32,32,128,64,2,1,2,1,16,8,8,75,1024,436207616,549890031616,29.1193,13.9512,18884
1,CUTLASS,gemm,cutlass_tensorop_s1688121gemm_f16_32x128_64x2_tn_align4,not_verified,success,universal,16384,4096,4096,f16:row,f16:column,f32:column,1,0,1,1,tensorop,f32,32,128,64,2,1,2,1,16,8,8,75,1024,436207616,549890031616,29.1687,13.9276,18852.1
1,CUTLASS,gemm,cutlass_tensorop_s1688112gemm_f16_32x128_64x2_tn_align4,not_verified,success,universal,16384,4096,4096,f16:row,f16:column,f32:column,1,0,1,1,tensorop,f32,32,128,64,2,1,1,1,16,8,8,75,1024,436207616,549890031616,183.094,2.21881,3003.32
1,CUTLASS,gemm,cutlass_tensorop_s1688111gemm_f16_32x128_64x2_tn_align4,not_verified,success,universal,16384,4096,4096,f16:row,f16:column,f32:column,1,0,1,1,tensorop,f32,32,128,64,2,1,1,1,16,8,8,75,1024,436207616,549890031616,181.777,2.23488,3025.07
1,CUTLASS,gemm,cutlass_tensorop_s1688142gemm_f16_32x128_64x2_tn_align4,not_verified,success,universal,20480,5120,5120,f16:row,f16:column,f32:column,1,0,1,1,tensorop,f32,32,128,64,2,1,4,1,16,8,8,75,1024,681574400,1073951539200,38.2242,16.6064,28096.1
1,CUTLASS,gemm,cutlass_tensorop_s1688141gemm_f16_32x128_64x2_tn_align4,not_verified,success,universal,20480,5120,5120,f16:row,f16:column,f32:column,1,0,1,1,tensorop,f32,32,128,64,2,1,4,1,16,8,8,75,1024,681574400,1073951539200,38.1485,16.6393,28151.9
1,CUTLASS,gemm,cutlass_tensorop_s1688122gemm_f16_32x128_64x2_tn_align4,not_verified,success,universal,20480,5120,5120,f16:row,f16:column,f32:column,1,0,1,1,tensorop,f32,32,128,64,2,1,2,1,16,8,8,75,1024,681574400,1073951539200,57.136,11.1097,18796.4
1,CUTLASS,gemm,cutlass_tensorop_s1688121gemm_f16_32x128_64x2_tn_align4,not_verified,success,universal,20480,5120,5120,f16:row,f16:column,f32:column,1,0,1,1,tensorop,f32,32,128,64,2,1,2,1,16,8,8,75,1024,681574400,1073951539200,57.1599,11.1051,18788.5
1,CUTLASS,gemm,cutlass_tensorop_s1688112gemm_f16_32x128_64x2_tn_align4,not_verified,success,universal,20480,5120,5120,f16:row,f16:column,f32:column,1,0,1,1,tensorop,f32,32,128,64,2,1,1,1,16,8,8,75,1024,681574400,1073951539200,361.255,1.75711,2972.84
1,CUTLASS,gemm,cutlass_tensorop_s1688111gemm_f16_32x128_64x2_tn_align4,not_verified,success,universal,20480,5120,5120,f16:row,f16:column,f32:column,1,0,1,1,tensorop,f32,32,128,64,2,1,1,1,16,8,8,75,1024,681574400,1073951539200,429.262,1.47874,2501.86
1,CUTLASS,gemm,cutlass_tensorop_s1688142gemm_f16_32x128_64x2_tn_align4,not_verified,success,universal,24576,6144,6144,f16:row,f16:column,f32:column,1,0,1,1,tensorop,f32,32,128,64,2,1,4,1,16,8,8,75,1024,981467136,1855727861760,61.9068,14.7651,29976.1
1,CUTLASS,gemm,cutlass_tensorop_s1688141gemm_f16_32x128_64x2_tn_align4,not_verified,success,universal,24576,6144,6144,f16:row,f16:column,f32:column,1,0,1,1,tensorop,f32,32,128,64,2,1,4,1,16,8,8,75,1024,981467136,1855727861760,61.8196,14.786,30018.4
1,CUTLASS,gemm,cutlass_tensorop_s1688122gemm_f16_32x128_64x2_tn_align4,not_verified,success,universal,24576,6144,6144,f16:row,f16:column,f32:column,1,0,1,1,tensorop,f32,32,128,64,2,1,2,1,16,8,8,75,1024,981467136,1855727861760,97.993,9.32784,18937.4
1,CUTLASS,gemm,cutlass_tensorop_s1688121gemm_f16_32x128_64x2_tn_align4,not_verified,success,universal,24576,6144,6144,f16:row,f16:column,f32:column,1,0,1,1,tensorop,f32,32,128,64,2,1,2,1,16,8,8,75,1024,981467136,1855727861760,98.0437,9.32301,18927.6
1,CUTLASS,gemm,cutlass_tensorop_s1688112gemm_f16_32x128_64x2_tn_align4,not_verified,success,universal,24576,6144,6144,f16:row,f16:column,f32:column,1,0,1,1,tensorop,f32,32,128,64,2,1,1,1,16,8,8,75,1024,981467136,1855727861760,629.612,1.45179,2947.42
1,CUTLASS,gemm,cutlass_tensorop_s1688111gemm_f16_32x128_64x2_tn_align4,not_verified,success,universal,24576,6144,6144,f16:row,f16:column,f32:column,1,0,1,1,tensorop,f32,32,128,64,2,1,1,1,16,8,8,75,1024,981467136,1855727861760,626.747,1.45842,2960.89
1,CUTLASS,gemm,cutlass_tensorop_s1688142gemm_f16_32x128_64x2_tn_align4,not_verified,success,universal,28672,7168,7168,f16:row,f16:column,f32:column,1,0,1,1,tensorop,f32,32,128,64,2,1,4,1,16,8,8,75,1024,1335885824,2946758606848,99.0963,12.5549,29736.3
1,CUTLASS,gemm,cutlass_tensorop_s1688141gemm_f16_32x128_64x2_tn_align4,not_verified,success,universal,28672,7168,7168,f16:row,f16:column,f32:column,1,0,1,1,tensorop,f32,32,128,64,2,1,4,1,16,8,8,75,1024,1335885824,2946758606848,98.9752,12.5702,29772.7
1,CUTLASS,gemm,cutlass_tensorop_s1688122gemm_f16_32x128_64x2_tn_align4,not_verified,success,universal,28672,7168,7168,f16:row,f16:column,f32:column,1,0,1,1,tensorop,f32,32,128,64,2,1,2,1,16,8,8,75,1024,1335885824,2946758606848,155.439,8.00404,18957.6
1,CUTLASS,gemm,cutlass_tensorop_s1688121gemm_f16_32x128_64x2_tn_align4,not_verified,success,universal,28672,7168,7168,f16:row,f16:column,f32:column,1,0,1,1,tensorop,f32,32,128,64,2,1,2,1,16,8,8,75,1024,1335885824,2946758606848,155.591,7.99623,18939.1
1,CUTLASS,gemm,cutlass_tensorop_s1688112gemm_f16_32x128_64x2_tn_align4,not_verified,success,universal,28672,7168,7168,f16:row,f16:column,f32:column,1,0,1,1,tensorop,f32,32,128,64,2,1,1,1,16,8,8,75,1024,1335885824,2946758606848,983.421,1.26512,2996.44
1,CUTLASS,gemm,cutlass_tensorop_s1688111gemm_f16_32x128_64x2_tn_align4,not_verified,success,universal,28672,7168,7168,f16:row,f16:column,f32:column,1,0,1,1,tensorop,f32,32,128,64,2,1,1,1,16,8,8,75,1024,1335885824,2946758606848,989.72,1.25706,2977.37
1,CUTLASS,gemm,cutlass_tensorop_s1688142gemm_f16_32x128_64x2_tn_align4,not_verified,success,universal,32768,8192,8192,f16:row,f16:column,f32:column,1,0,1,1,tensorop,f32,32,128,64,2,1,4,1,16,8,8,75,1024,1744830464,4398583382016,147.627,11.0075,29795.3
1,CUTLASS,gemm,cutlass_tensorop_s1688141gemm_f16_32x128_64x2_tn_align4,not_verified,success,universal,32768,8192,8192,f16:row,f16:column,f32:column,1,0,1,1,tensorop,f32,32,128,64,2,1,4,1,16,8,8,75,1024,1744830464,4398583382016,147.576,11.0113,29805.6
1,CUTLASS,gemm,cutlass_tensorop_s1688122gemm_f16_32x128_64x2_tn_align4,not_verified,success,universal,32768,8192,8192,f16:row,f16:column,f32:column,1,0,1,1,tensorop,f32,32,128,64,2,1,2,1,16,8,8,75,1024,1744830464,4398583382016,229.502,7.08054,19165.8
1,CUTLASS,gemm,cutlass_tensorop_s1688121gemm_f16_32x128_64x2_tn_align4,not_verified,success,universal,32768,8192,8192,f16:row,f16:column,f32:column,1,0,1,1,tensorop,f32,32,128,64,2,1,2,1,16,8,8,75,1024,1744830464,4398583382016,229.531,7.07966,19163.4
1,CUTLASS,gemm,cutlass_tensorop_s1688112gemm_f16_32x128_64x2_tn_align4,not_verified,success,universal,32768,8192,8192,f16:row,f16:column,f32:column,1,0,1,1,tensorop,f32,32,128,64,2,1,1,1,16,8,8,75,1024,1744830464,4398583382016,1455.44,1.1165,3022.16
1,CUTLASS,gemm,cutlass_tensorop_s1688111gemm_f16_32x128_64x2_tn_align4,not_verified,success,universal,32768,8192,8192,f16:row,f16:column,f32:column,1,0,1,1,tensorop,f32,32,128,64,2,1,1,1,16,8,8,75,1024,1744830464,4398583382016,1459.31,1.11354,3014.14
1,CUTLASS,gemm,cutlass_tensorop_s1688142gemm_f16_32x128_64x2_tn_align4,not_verified,success,universal,36864,9216,9216,f16:row,f16:column,f32:column,1,0,1,1,tensorop,f32,32,128,64,2,1,4,1,16,8,8,75,1024,2208301056,6262741794816,210.094,9.78914,29809.2
1,CUTLASS,gemm,cutlass_tensorop_s1688141gemm_f16_32x128_64x2_tn_align4,not_verified,success,universal,36864,9216,9216,f16:row,f16:column,f32:column,1,0,1,1,tensorop,f32,32,128,64,2,1,4,1,16,8,8,75,1024,2208301056,6262741794816,210.2,9.78423,29794.3
1,CUTLASS,gemm,cutlass_tensorop_s1688122gemm_f16_32x128_64x2_tn_align4,not_verified,success,universal,36864,9216,9216,f16:row,f16:column,f32:column,1,0,1,1,tensorop,f32,32,128,64,2,1,2,1,16,8,8,75,1024,2208301056,6262741794816,329.272,6.24602,19020
1,CUTLASS,gemm,cutlass_tensorop_s1688121gemm_f16_32x128_64x2_tn_align4,not_verified,success,universal,36864,9216,9216,f16:row,f16:column,f32:column,1,0,1,1,tensorop,f32,32,128,64,2,1,2,1,16,8,8,75,1024,2208301056,6262741794816,329.443,6.24278,19010.1
1,CUTLASS,gemm,cutlass_tensorop_s1688112gemm_f16_32x128_64x2_tn_align4,not_verified,success,universal,36864,9216,9216,f16:row,f16:column,f32:column,1,0,1,1,tensorop,f32,32,128,64,2,1,1,1,16,8,8,75,1024,2208301056,6262741794816,2112.92,0.973365,2964.03
1,CUTLASS,gemm,cutlass_tensorop_s1688111gemm_f16_32x128_64x2_tn_align4,not_verified,success,universal,36864,9216,9216,f16:row,f16:column,f32:column,1,0,1,1,tensorop,f32,32,128,64,2,1,1,1,16,8,8,75,1024,2208301056,6262741794816,2103.53,0.977707,2977.25
1,CUTLASS,gemm,cutlass_tensorop_s1688142gemm_f16_32x128_64x2_tn_align4,not_verified,success,universal,40960,10240,10240,f16:row,f16:column,f32:column,1,0,1,1,tensorop,f32,32,128,64,2,1,4,1,16,8,8,75,1024,2726297600,8590773452800,570.283,4.45228,15064.1
1,CUTLASS,gemm,cutlass_tensorop_s1688141gemm_f16_32x128_64x2_tn_align4,not_verified,success,universal,40960,10240,10240,f16:row,f16:column,f32:column,1,0,1,1,tensorop,f32,32,128,64,2,1,4,1,16,8,8,75,1024,2726297600,8590773452800,599.02,4.23869,14341.4
1,CUTLASS,gemm,cutlass_tensorop_s1688122gemm_f16_32x128_64x2_tn_align4,not_verified,success,universal,40960,10240,10240,f16:row,f16:column,f32:column,1,0,1,1,tensorop,f32,32,128,64,2,1,2,1,16,8,8,75,1024,2726297600,8590773452800,622.837,4.07661,13793
1,CUTLASS,gemm,cutlass_tensorop_s1688121gemm_f16_32x128_64x2_tn_align4,not_verified,success,universal,40960,10240,10240,f16:row,f16:column,f32:column,1,0,1,1,tensorop,f32,32,128,64,2,1,2,1,16,8,8,75,1024,2726297600,8590773452800,557.922,4.55093,15397.8
1,CUTLASS,gemm,cutlass_tensorop_s1688112gemm_f16_32x128_64x2_tn_align4,not_verified,success,universal,40960,10240,10240,f16:row,f16:column,f32:column,1,0,1,1,tensorop,f32,32,128,64,2,1,1,1,16,8,8,75,1024,2726297600,8590773452800,3281.68,0.773709,2617.8
1,CUTLASS,gemm,cutlass_tensorop_s1688111gemm_f16_32x128_64x2_tn_align4,not_verified,success,universal,40960,10240,10240,f16:row,f16:column,f32:column,1,0,1,1,tensorop,f32,32,128,64,2,1,1,1,16,8,8,75,1024,2726297600,8590773452800,2880.34,0.881514,2982.55
1,CUTLASS,gemm,cutlass_tensorop_s1688211gemm_f16_64x32_32x2_tn_align4,not_verified,success,universal,4096,1024,1024,f16:row,f16:column,f32:column,1,0,1,1,tensorop,f32,64,32,32,2,2,1,1,16,8,8,75,1024,27262976,8598323200,0.482899,52.5796,17805.6
1,CUTLASS,gemm,cutlass_tensorop_s1688111gemm_f16_64x32_32x2_tn_align4,not_verified,success,universal,4096,1024,1024,f16:row,f16:column,f32:column,1,0,1,1,tensorop,f32,64,32,32,2,1,1,1,16,8,8,75,1024,27262976,8598323200,0.465765,54.5138,18460.7
1,CUTLASS,gemm,cutlass_tensorop_s1688211gemm_f16_64x32_32x2_tn_align4,not_verified,success,universal,8192,2048,2048,f16:row,f16:column,f32:column,1,0,1,1,tensorop,f32,64,32,32,2,2,1,1,16,8,8,75,1024,109051904,68753031168,3.39744,29.8939,20236.7
1,CUTLASS,gemm,cutlass_tensorop_s1688111gemm_f16_64x32_32x2_tn_align4,not_verified,success,universal,8192,2048,2048,f16:row,f16:column,f32:column,1,0,1,1,tensorop,f32,64,32,32,2,1,1,1,16,8,8,75,1024,109051904,68753031168,2.9169,34.8187,23570.6
1,CUTLASS,gemm,cutlass_tensorop_s1688211gemm_f16_64x32_32x2_tn_align4,not_verified,success,universal,12288,3072,3072,f16:row,f16:column,f32:column,1,0,1,1,tensorop,f32,64,32,32,2,2,1,1,16,8,8,75,1024,245366784,232003731456,10.6003,21.5575,21886.5
1,CUTLASS,gemm,cutlass_tensorop_s1688111gemm_f16_64x32_32x2_tn_align4,not_verified,success,universal,12288,3072,3072,f16:row,f16:column,f32:column,1,0,1,1,tensorop,f32,64,32,32,2,1,1,1,16,8,8,75,1024,245366784,232003731456,9.69968,23.5591,23918.7
1,CUTLASS,gemm,cutlass_tensorop_s1688211gemm_f16_64x32_32x2_tn_align4,not_verified,success,universal,16384,4096,4096,f16:row,f16:column,f32:column,1,0,1,1,tensorop,f32,64,32,32,2,2,1,1,16,8,8,75,1024,436207616,549890031616,24.0953,16.8601,22821.5
1,CUTLASS,gemm,cutlass_tensorop_s1688111gemm_f16_64x32_32x2_tn_align4,not_verified,success,universal,16384,4096,4096,f16:row,f16:column,f32:column,1,0,1,1,tensorop,f32,64,32,32,2,1,1,1,16,8,8,75,1024,436207616,549890031616,22.8354,17.7904,24080.6
1,CUTLASS,gemm,cutlass_tensorop_s1688211gemm_f16_64x32_32x2_tn_align4,not_verified,success,universal,20480,5120,5120,f16:row,f16:column,f32:column,1,0,1,1,tensorop,f32,64,32,32,2,2,1,1,16,8,8,75,1024,681574400,1073951539200,51.6991,12.2781,20773.1
1,CUTLASS,gemm,cutlass_tensorop_s1688111gemm_f16_64x32_32x2_tn_align4,not_verified,success,universal,20480,5120,5120,f16:row,f16:column,f32:column,1,0,1,1,tensorop,f32,64,32,32,2,1,1,1,16,8,8,75,1024,681574400,1073951539200,45.6335,13.9101,23534.3
1,CUTLASS,gemm,cutlass_tensorop_s1688211gemm_f16_64x32_32x2_tn_align4,not_verified,success,universal,24576,6144,6144,f16:row,f16:column,f32:column,1,0,1,1,tensorop,f32,64,32,32,2,2,1,1,16,8,8,75,1024,981467136,1855727861760,86.6304,10.5513,21421.2
1,CUTLASS,gemm,cutlass_tensorop_s1688111gemm_f16_64x32_32x2_tn_align4,not_verified,success,universal,24576,6144,6144,f16:row,f16:column,f32:column,1,0,1,1,tensorop,f32,64,32,32,2,1,1,1,16,8,8,75,1024,981467136,1855727861760,77.7163,11.7615,23878.2
1,CUTLASS,gemm,cutlass_tensorop_s1688211gemm_f16_64x32_32x2_tn_align4,not_verified,success,universal,28672,7168,7168,f16:row,f16:column,f32:column,1,0,1,1,tensorop,f32,64,32,32,2,2,1,1,16,8,8,75,1024,1335885824,2946758606848,139.283,8.93246,21156.6
1,CUTLASS,gemm,cutlass_tensorop_s1688111gemm_f16_64x32_32x2_tn_align4,not_verified,success,universal,28672,7168,7168,f16:row,f16:column,f32:column,1,0,1,1,tensorop,f32,64,32,32,2,1,1,1,16,8,8,75,1024,1335885824,2946758606848,124.399,10.0012,23688
1,CUTLASS,gemm,cutlass_tensorop_s1688211gemm_f16_64x32_32x2_tn_align4,not_verified,success,universal,32768,8192,8192,f16:row,f16:column,f32:column,1,0,1,1,tensorop,f32,64,32,32,2,2,1,1,16,8,8,75,1024,1744830464,4398583382016,196.394,8.27419,22396.7
1,CUTLASS,gemm,cutlass_tensorop_s1688111gemm_f16_64x32_32x2_tn_align4,not_verified,success,universal,32768,8192,8192,f16:row,f16:column,f32:column,1,0,1,1,tensorop,f32,64,32,32,2,1,1,1,16,8,8,75,1024,1744830464,4398583382016,181.34,8.96109,24256.1
1,CUTLASS,gemm,cutlass_tensorop_s1688211gemm_f16_64x32_32x2_tn_align4,not_verified,success,universal,36864,9216,9216,f16:row,f16:column,f32:column,1,0,1,1,tensorop,f32,64,32,32,2,2,1,1,16,8,8,75,1024,2208301056,6262741794816,883.099,2.32889,7091.77
1,CUTLASS,gemm,cutlass_tensorop_s1688111gemm_f16_64x32_32x2_tn_align4,not_verified,success,universal,36864,9216,9216,f16:row,f16:column,f32:column,1,0,1,1,tensorop,f32,64,32,32,2,1,1,1,16,8,8,75,1024,2208301056,6262741794816,281.869,7.29644,22218.6
1,CUTLASS,gemm,cutlass_tensorop_s1688211gemm_f16_64x32_32x2_tn_align4,not_verified,success,universal,40960,10240,10240,f16:row,f16:column,f32:column,1,0,1,1,tensorop,f32,64,32,32,2,2,1,1,16,8,8,75,1024,2726297600,8590773452800,847.384,2.99635,10138
1,CUTLASS,gemm,cutlass_tensorop_s1688111gemm_f16_64x32_32x2_tn_align4,not_verified,success,universal,40960,10240,10240,f16:row,f16:column,f32:column,1,0,1,1,tensorop,f32,64,32,32,2,1,1,1,16,8,8,75,1024,2726297600,8590773452800,1042.32,2.43598,8242
1,CUTLASS,gemm,cutlass_tensorop_s1688212gemm_f16_64x32_64x2_tn_align4,not_verified,success,universal,4096,1024,1024,f16:row,f16:column,f32:column,1,0,1,1,tensorop,f32,64,32,64,2,2,1,1,16,8,8,75,1024,27262976,8598323200,0.328082,77.3912,26207.9
1,CUTLASS,gemm,cutlass_tensorop_s1688211gemm_f16_64x32_64x2_tn_align4,not_verified,success,universal,4096,1024,1024,f16:row,f16:column,f32:column,1,0,1,1,tensorop,f32,64,32,64,2,2,1,1,16,8,8,75,1024,27262976,8598323200,0.340779,74.5076,25231.4
1,CUTLASS,gemm,cutlass_tensorop_s1688112gemm_f16_64x32_64x2_tn_align4,not_verified,success,universal,4096,1024,1024,f16:row,f16:column,f32:column,1,0,1,1,tensorop,f32,64,32,64,2,1,1,1,16,8,8,75,1024,27262976,8598323200,0.494885,51.3061,17374.4
1,CUTLASS,gemm,cutlass_tensorop_s1688111gemm_f16_64x32_64x2_tn_align4,not_verified,success,universal,4096,1024,1024,f16:row,f16:column,f32:column,1,0,1,1,tensorop,f32,64,32,64,2,1,1,1,16,8,8,75,1024,27262976,8598323200,0.496017,51.189,17334.7
1,CUTLASS,gemm,cutlass_tensorop_s1688212gemm_f16_64x32_64x2_tn_align4,not_verified,success,universal,8192,2048,2048,f16:row,f16:column,f32:column,1,0,1,1,tensorop,f32,64,32,64,2,2,1,1,16,8,8,75,1024,109051904,68753031168,2.54634,39.8857,27000.7
1,CUTLASS,gemm,cutlass_tensorop_s1688211gemm_f16_64x32_64x2_tn_align4,not_verified,success,universal,8192,2048,2048,f16:row,f16:column,f32:column,1,0,1,1,tensorop,f32,64,32,64,2,2,1,1,16,8,8,75,1024,109051904,68753031168,2.48433,40.8812,27674.7
1,CUTLASS,gemm,cutlass_tensorop_s1688112gemm_f16_64x32_64x2_tn_align4,not_verified,success,universal,8192,2048,2048,f16:row,f16:column,f32:column,1,0,1,1,tensorop,f32,64,32,64,2,1,1,1,16,8,8,75,1024,109051904,68753031168,3.49383,29.0691,19678.4
1,CUTLASS,gemm,cutlass_tensorop_s1688111gemm_f16_64x32_64x2_tn_align4,not_verified,success,universal,8192,2048,2048,f16:row,f16:column,f32:column,1,0,1,1,tensorop,f32,64,32,64,2,1,1,1,16,8,8,75,1024,109051904,68753031168,3.49463,29.0625,19673.9
1,CUTLASS,gemm,cutlass_tensorop_s1688212gemm_f16_64x32_64x2_tn_align4,not_verified,success,universal,12288,3072,3072,f16:row,f16:column,f32:column,1,0,1,1,tensorop,f32,64,32,64,2,2,1,1,16,8,8,75,1024,245366784,232003731456,8.27409,27.6182,28039.8
1,CUTLASS,gemm,cutlass_tensorop_s1688211gemm_f16_64x32_64x2_tn_align4,not_verified,success,universal,12288,3072,3072,f16:row,f16:column,f32:column,1,0,1,1,tensorop,f32,64,32,64,2,2,1,1,16,8,8,75,1024,245366784,232003731456,8.07794,28.2888,28720.6
1,CUTLASS,gemm,cutlass_tensorop_s1688112gemm_f16_64x32_64x2_tn_align4,not_verified,success,universal,12288,3072,3072,f16:row,f16:column,f32:column,1,0,1,1,tensorop,f32,64,32,64,2,1,1,1,16,8,8,75,1024,245366784,232003731456,11.378,20.0839,20390.5
1,CUTLASS,gemm,cutlass_tensorop_s1688111gemm_f16_64x32_64x2_tn_align4,not_verified,success,universal,12288,3072,3072,f16:row,f16:column,f32:column,1,0,1,1,tensorop,f32,64,32,64,2,1,1,1,16,8,8,75,1024,245366784,232003731456,11.3819,20.0771,20383.6
1,CUTLASS,gemm,cutlass_tensorop_s1688212gemm_f16_64x32_64x2_tn_align4,not_verified,success,universal,16384,4096,4096,f16:row,f16:column,f32:column,1,0,1,1,tensorop,f32,64,32,64,2,2,1,1,16,8,8,75,1024,436207616,549890031616,19.2372,21.1179,28584.7
1,CUTLASS,gemm,cutlass_tensorop_s1688211gemm_f16_64x32_64x2_tn_align4,not_verified,success,universal,16384,4096,4096,f16:row,f16:column,f32:column,1,0,1,1,tensorop,f32,64,32,64,2,2,1,1,16,8,8,75,1024,436207616,549890031616,18.7059,21.7177,29396.6
1,CUTLASS,gemm,cutlass_tensorop_s1688112gemm_f16_64x32_64x2_tn_align4,not_verified,success,universal,16384,4096,4096,f16:row,f16:column,f32:column,1,0,1,1,tensorop,f32,64,32,64,2,1,1,1,16,8,8,75,1024,436207616,549890031616,26.5818,15.283,20686.7
1,CUTLASS,gemm,cutlass_tensorop_s1688111gemm_f16_64x32_64x2_tn_align4,not_verified,success,universal,16384,4096,4096,f16:row,f16:column,f32:column,1,0,1,1,tensorop,f32,64,32,64,2,1,1,1,16,8,8,75,1024,436207616,549890031616,26.5846,15.2814,20684.6
1,CUTLASS,gemm,cutlass_tensorop_s1688212gemm_f16_64x32_64x2_tn_align4,not_verified,success,universal,20480,5120,5120,f16:row,f16:column,f32:column,1,0,1,1,tensorop,f32,64,32,64,2,2,1,1,16,8,8,75,1024,681574400,1073951539200,37.1463,17.0883,28911.4
1,CUTLASS,gemm,cutlass_tensorop_s1688211gemm_f16_64x32_64x2_tn_align4,not_verified,success,universal,20480,5120,5120,f16:row,f16:column,f32:column,1,0,1,1,tensorop,f32,64,32,64,2,2,1,1,16,8,8,75,1024,681574400,1073951539200,37.8062,16.79,28406.8
1,CUTLASS,gemm,cutlass_tensorop_s1688112gemm_f16_64x32_64x2_tn_align4,not_verified,success,universal,20480,5120,5120,f16:row,f16:column,f32:column,1,0,1,1,tensorop,f32,64,32,64,2,1,1,1,16,8,8,75,1024,681574400,1073951539200,51.4104,12.347,20889.8
1,CUTLASS,gemm,cutlass_tensorop_s1688111gemm_f16_64x32_64x2_tn_align4,not_verified,success,universal,20480,5120,5120,f16:row,f16:column,f32:column,1,0,1,1,tensorop,f32,64,32,64,2,1,1,1,16,8,8,75,1024,681574400,1073951539200,51.4293,12.3425,20882.1
1,CUTLASS,gemm,cutlass_tensorop_s1688212gemm_f16_64x32_64x2_tn_align4,not_verified,success,universal,24576,6144,6144,f16:row,f16:column,f32:column,1,0,1,1,tensorop,f32,64,32,64,2,2,1,1,16,8,8,75,1024,981467136,1855727861760,64.9439,14.0746,28574.3
1,CUTLASS,gemm,cutlass_tensorop_s1688211gemm_f16_64x32_64x2_tn_align4,not_verified,success,universal,24576,6144,6144,f16:row,f16:column,f32:column,1,0,1,1,tensorop,f32,64,32,64,2,2,1,1,16,8,8,75,1024,981467136,1855727861760,65.1044,14.04,28503.9
1,CUTLASS,gemm,cutlass_tensorop_s1688112gemm_f16_64x32_64x2_tn_align4,not_verified,success,universal,24576,6144,6144,f16:row,f16:column,f32:column,1,0,1,1,tensorop,f32,64,32,64,2,1,1,1,16,8,8,75,1024,981467136,1855727861760,88.4488,10.3344,20980.8
1,CUTLASS,gemm,cutlass_tensorop_s1688111gemm_f16_64x32_64x2_tn_align4,not_verified,success,universal,24576,6144,6144,f16:row,f16:column,f32:column,1,0,1,1,tensorop,f32,64,32,64,2,1,1,1,16,8,8,75,1024,981467136,1855727861760,88.4725,10.3316,20975.2
1,CUTLASS,gemm,cutlass_tensorop_s1688212gemm_f16_64x32_64x2_tn_align4,not_verified,success,universal,28672,7168,7168,f16:row,f16:column,f32:column,1,0,1,1,tensorop,f32,64,32,64,2,2,1,1,16,8,8,75,1024,1335885824,2946758606848,105.616,11.7799,27900.8
1,CUTLASS,gemm,cutlass_tensorop_s1688211gemm_f16_64x32_64x2_tn_align4,not_verified,success,universal,28672,7168,7168,f16:row,f16:column,f32:column,1,0,1,1,tensorop,f32,64,32,64,2,2,1,1,16,8,8,75,1024,1335885824,2946758606848,105.213,11.8249,28007.5
1,CUTLASS,gemm,cutlass_tensorop_s1688112gemm_f16_64x32_64x2_tn_align4,not_verified,success,universal,28672,7168,7168,f16:row,f16:column,f32:column,1,0,1,1,tensorop,f32,64,32,64,2,1,1,1,16,8,8,75,1024,1335885824,2946758606848,140.116,8.87938,21030.9
1,CUTLASS,gemm,cutlass_tensorop_s1688111gemm_f16_64x32_64x2_tn_align4,not_verified,success,universal,28672,7168,7168,f16:row,f16:column,f32:column,1,0,1,1,tensorop,f32,64,32,64,2,1,1,1,16,8,8,75,1024,1335885824,2946758606848,140.109,8.87983,21032
1,CUTLASS,gemm,cutlass_tensorop_s1688212gemm_f16_64x32_64x2_tn_align4,not_verified,success,universal,32768,8192,8192,f16:row,f16:column,f32:column,1,0,1,1,tensorop,f32,64,32,64,2,2,1,1,16,8,8,75,1024,1744830464,4398583382016,152.786,10.6358,28789.2
1,CUTLASS,gemm,cutlass_tensorop_s1688211gemm_f16_64x32_64x2_tn_align4,not_verified,success,universal,32768,8192,8192,f16:row,f16:column,f32:column,1,0,1,1,tensorop,f32,64,32,64,2,2,1,1,16,8,8,75,1024,1744830464,4398583382016,152.754,10.638,28795.1
1,CUTLASS,gemm,cutlass_tensorop_s1688112gemm_f16_64x32_64x2_tn_align4,not_verified,success,universal,32768,8192,8192,f16:row,f16:column,f32:column,1,0,1,1,tensorop,f32,64,32,64,2,1,1,1,16,8,8,75,1024,1744830464,4398583382016,208.577,7.79088,21088.5
1,CUTLASS,gemm,cutlass_tensorop_s1688111gemm_f16_64x32_64x2_tn_align4,not_verified,success,universal,32768,8192,8192,f16:row,f16:column,f32:column,1,0,1,1,tensorop,f32,64,32,64,2,1,1,1,16,8,8,75,1024,1744830464,4398583382016,208.641,7.78849,21082
1,CUTLASS,gemm,cutlass_tensorop_s1688212gemm_f16_64x32_64x2_tn_align4,not_verified,success,universal,36864,9216,9216,f16:row,f16:column,f32:column,1,0,1,1,tensorop,f32,64,32,64,2,2,1,1,16,8,8,75,1024,2208301056,6262741794816,224.382,9.1658,27911.1
1,CUTLASS,gemm,cutlass_tensorop_s1688211gemm_f16_64x32_64x2_tn_align4,not_verified,success,universal,36864,9216,9216,f16:row,f16:column,f32:column,1,0,1,1,tensorop,f32,64,32,64,2,2,1,1,16,8,8,75,1024,2208301056,6262741794816,228.974,8.98199,27351.3
1,CUTLASS,gemm,cutlass_tensorop_s1688112gemm_f16_64x32_64x2_tn_align4,not_verified,success,universal,36864,9216,9216,f16:row,f16:column,f32:column,1,0,1,1,tensorop,f32,64,32,64,2,1,1,1,16,8,8,75,1024,2208301056,6262741794816,296.832,6.92864,21098.6
1,CUTLASS,gemm,cutlass_tensorop_s1688111gemm_f16_64x32_64x2_tn_align4,not_verified,success,universal,36864,9216,9216,f16:row,f16:column,f32:column,1,0,1,1,tensorop,f32,64,32,64,2,1,1,1,16,8,8,75,1024,2208301056,6262741794816,296.781,6.92981,21102.2
1,CUTLASS,gemm,cutlass_tensorop_s1688212gemm_f16_64x32_64x2_tn_align4,not_verified,success,universal,40960,10240,10240,f16:row,f16:column,f32:column,1,0,1,1,tensorop,f32,64,32,64,2,2,1,1,16,8,8,75,1024,2726297600,8590773452800,309.892,8.19337,27721.8
1,CUTLASS,gemm,cutlass_tensorop_s1688211gemm_f16_64x32_64x2_tn_align4,not_verified,success,universal,40960,10240,10240,f16:row,f16:column,f32:column,1,0,1,1,tensorop,f32,64,32,64,2,2,1,1,16,8,8,75,1024,2726297600,8590773452800,311.564,8.14941,27573.1
1,CUTLASS,gemm,cutlass_tensorop_s1688112gemm_f16_64x32_64x2_tn_align4,not_verified,success,universal,40960,10240,10240,f16:row,f16:column,f32:column,1,0,1,1,tensorop,f32,64,32,64,2,1,1,1,16,8,8,75,1024,2726297600,8590773452800,405.922,6.25505,21163.6
1,CUTLASS,gemm,cutlass_tensorop_s1688111gemm_f16_64x32_64x2_tn_align4,not_verified,success,universal,40960,10240,10240,f16:row,f16:column,f32:column,1,0,1,1,tensorop,f32,64,32,64,2,1,1,1,16,8,8,75,1024,2726297600,8590773452800,406.018,6.25357,21158.6
1,CUTLASS,gemm,cutlass_tensorop_s1688221gemm_f16_64x64_32x2_tn_align4,not_verified,success,universal,4096,1024,1024,f16:row,f16:column,f32:column,1,0,1,1,tensorop,f32,64,64,32,2,2,2,1,16,8,8,75,1024,27262976,8598323200,0.299192,84.8641,28738.5
1,CUTLASS,gemm,cutlass_tensorop_s1688211gemm_f16_64x64_32x2_tn_align4,not_verified,success,universal,4096,1024,1024,f16:row,f16:column,f32:column,1,0,1,1,tensorop,f32,64,64,32,2,2,1,1,16,8,8,75,1024,27262976,8598323200,0.289094,87.8282,29742.3
1,CUTLASS,gemm,cutlass_tensorop_s1688121gemm_f16_64x64_32x2_tn_align4,not_verified,success,universal,4096,1024,1024,f16:row,f16:column,f32:column,1,0,1,1,tensorop,f32,64,64,32,2,1,2,1,16,8,8,75,1024,27262976,8598323200,0.286757,88.5439,29984.7
1,CUTLASS,gemm,cutlass_tensorop_s1688111gemm_f16_64x64_32x2_tn_align4,not_verified,success,universal,4096,1024,1024,f16:row,f16:column,f32:column,1,0,1,1,tensorop,f32,64,64,32,2,1,1,1,16,8,8,75,1024,27262976,8598323200,0.26944,94.2349,31911.9
1,CUTLASS,gemm,cutlass_tensorop_s1688221gemm_f16_64x64_32x2_tn_align4,not_verified,success,universal,8192,2048,2048,f16:row,f16:column,f32:column,1,0,1,1,tensorop,f32,64,64,32,2,2,2,1,16,8,8,75,1024,109051904,68753031168,2.26186,44.9022,30396.7
1,CUTLASS,gemm,cutlass_tensorop_s1688211gemm_f16_64x64_32x2_tn_align4,not_verified,success,universal,8192,2048,2048,f16:row,f16:column,f32:column,1,0,1,1,tensorop,f32,64,64,32,2,2,1,1,16,8,8,75,1024,109051904,68753031168,2.11506,48.0188,32506.4
1,CUTLASS,gemm,cutlass_tensorop_s1688121gemm_f16_64x64_32x2_tn_align4,not_verified,success,universal,8192,2048,2048,f16:row,f16:column,f32:column,1,0,1,1,tensorop,f32,64,64,32,2,1,2,1,16,8,8,75,1024,109051904,68753031168,2.1067,48.2094,32635.5
1,CUTLASS,gemm,cutlass_tensorop_s1688111gemm_f16_64x64_32x2_tn_align4,not_verified,success,universal,8192,2048,2048,f16:row,f16:column,f32:column,1,0,1,1,tensorop,f32,64,64,32,2,1,1,1,16,8,8,75,1024,109051904,68753031168,1.98345,51.205,34663.4
1,CUTLASS,gemm,cutlass_tensorop_s1688221gemm_f16_64x64_32x2_tn_align4,not_verified,success,universal,12288,3072,3072,f16:row,f16:column,f32:column,1,0,1,1,tensorop,f32,64,64,32,2,2,2,1,16,8,8,75,1024,245366784,232003731456,7.55272,30.2561,30717.9
1,CUTLASS,gemm,cutlass_tensorop_s1688211gemm_f16_64x64_32x2_tn_align4,not_verified,success,universal,12288,3072,3072,f16:row,f16:column,f32:column,1,0,1,1,tensorop,f32,64,64,32,2,2,1,1,16,8,8,75,1024,245366784,232003731456,7.05048,32.4114,32906.1
1,CUTLASS,gemm,cutlass_tensorop_s1688121gemm_f16_64x64_32x2_tn_align4,not_verified,success,universal,12288,3072,3072,f16:row,f16:column,f32:column,1,0,1,1,tensorop,f32,64,64,32,2,1,2,1,16,8,8,75,1024,245366784,232003731456,7.01844,32.5593,33056.3
1,CUTLASS,gemm,cutlass_tensorop_s1688111gemm_f16_64x64_32x2_tn_align4,not_verified,success,universal,12288,3072,3072,f16:row,f16:column,f32:column,1,0,1,1,tensorop,f32,64,64,32,2,1,1,1,16,8,8,75,1024,245366784,232003731456,6.50891,35.1081,35644
1,CUTLASS,gemm,cutlass_tensorop_s1688221gemm_f16_64x64_32x2_tn_align4,not_verified,success,universal,16384,4096,4096,f16:row,f16:column,f32:column,1,0,1,1,tensorop,f32,64,64,32,2,2,2,1,16,8,8,75,1024,436207616,549890031616,17.6003,23.082,31243.3
1,CUTLASS,gemm,cutlass_tensorop_s1688211gemm_f16_64x64_32x2_tn_align4,not_verified,success,universal,16384,4096,4096,f16:row,f16:column,f32:column,1,0,1,1,tensorop,f32,64,64,32,2,2,1,1,16,8,8,75,1024,436207616,549890031616,16.4432,24.7063,33441.8
1,CUTLASS,gemm,cutlass_tensorop_s1688121gemm_f16_64x64_32x2_tn_align4,not_verified,success,universal,16384,4096,4096,f16:row,f16:column,f32:column,1,0,1,1,tensorop,f32,64,64,32,2,1,2,1,16,8,8,75,1024,436207616,549890031616,16.4198,24.7415,33489.5
1,CUTLASS,gemm,cutlass_tensorop_s1688111gemm_f16_64x64_32x2_tn_align4,not_verified,success,universal,16384,4096,4096,f16:row,f16:column,f32:column,1,0,1,1,tensorop,f32,64,64,32,2,1,1,1,16,8,8,75,1024,436207616,549890031616,15.2809,26.5854,35985.4
1,CUTLASS,gemm,cutlass_tensorop_s1688221gemm_f16_64x64_32x2_tn_align4,not_verified,success,universal,20480,5120,5120,f16:row,f16:column,f32:column,1,0,1,1,tensorop,f32,64,64,32,2,2,2,1,16,8,8,75,1024,681574400,1073951539200,35.5187,17.8713,30236.2
