experiments/w2ww.gemm.csv
Problem,Provider,OperationKind,Operation,Disposition,Status,gemm_kind,m,n,k,A,B,C,alpha,beta,split_k_slices,batch_count,op_class,accum,cta_m,cta_n,cta_k,stages,warps_m,warps_n,warps_k,inst_m,inst_n,inst_k,min_cc,max_cc,Bytes,Flops,Runtime,GB/s,GFLOPs
1,CUTLASS,gemm,cutlass_tensorop_s1688111gemm_f16_32x32_32x2_tn_align4,not_verified,success,universal,1024,2048,1024,f16:row,f16:column,f32:column,1,0,1,1,tensorop,f32,32,32,32,2,1,1,1,16,8,8,75,1024,14680064,4299161600,0.259005,52.7862,16598.8
1,CUTLASS,gemm,cutlass_tensorop_s1688111gemm_f16_32x32_32x2_tn_align4,not_verified,success,universal,2048,4096,2048,f16:row,f16:column,f32:column,1,0,1,1,tensorop,f32,32,32,32,2,1,1,1,16,8,8,75,1024,58720256,34376515584,2.13837,25.5743,16076
1,CUTLASS,gemm,cutlass_tensorop_s1688111gemm_f16_32x32_32x2_tn_align4,not_verified,success,universal,3072,6144,3072,f16:row,f16:column,f32:column,1,0,1,1,tensorop,f32,32,32,32,2,1,1,1,16,8,8,75,1024,132120576,116001865728,6.5395,18.8159,17738.6
1,CUTLASS,gemm,cutlass_tensorop_s1688111gemm_f16_32x32_32x2_tn_align4,not_verified,success,universal,4096,8192,4096,f16:row,f16:column,f32:column,1,0,1,1,tensorop,f32,32,32,32,2,1,1,1,16,8,8,75,1024,234881024,274945015808,15.3289,14.2705,17936.4
1,CUTLASS,gemm,cutlass_tensorop_s1688111gemm_f16_32x32_32x2_tn_align4,not_verified,success,universal,5120,10240,5120,f16:row,f16:column,f32:column,1,0,1,1,tensorop,f32,32,32,32,2,1,1,1,16,8,8,75,1024,367001600,536975769600,30.4834,11.2125,17615.3
1,CUTLASS,gemm,cutlass_tensorop_s1688111gemm_f16_32x32_32x2_tn_align4,not_verified,success,universal,6144,12288,6144,f16:row,f16:column,f32:column,1,0,1,1,tensorop,f32,32,32,32,2,1,1,1,16,8,8,75,1024,528482304,927863930880,51.9792,9.46894,17850.7
1,CUTLASS,gemm,cutlass_tensorop_s1688111gemm_f16_32x32_32x2_tn_align4,not_verified,success,universal,7168,14336,7168,f16:row,f16:column,f32:column,1,0,1,1,tensorop,f32,32,32,32,2,1,1,1,16,8,8,75,1024,719323136,1473379303424,82.0128,8.1685,17965.2
1,CUTLASS,gemm,cutlass_tensorop_s1688111gemm_f16_32x32_32x2_tn_align4,not_verified,success,universal,8192,16384,8192,f16:row,f16:column,f32:column,1,0,1,1,tensorop,f32,32,32,32,2,1,1,1,16,8,8,75,1024,939524096,2199291691008,121.737,7.18763,18065.9
1,CUTLASS,gemm,cutlass_tensorop_s1688111gemm_f16_32x32_32x2_tn_align4,not_verified,success,universal,9216,18432,9216,f16:row,f16:column,f32:column,1,0,1,1,tensorop,f32,32,32,32,2,1,1,1,16,8,8,75,1024,1189085184,3131370897408,215.887,5.12964,14504.7
1,CUTLASS,gemm,cutlass_tensorop_s1688111gemm_f16_32x32_32x2_tn_align4,not_verified,success,universal,10240,20480,10240,f16:row,f16:column,f32:column,1,0,1,1,tensorop,f32,32,32,32,2,1,1,1,16,8,8,75,1024,1468006400,4295386726400,368.846,3.70666,11645.5
1,CUTLASS,gemm,cutlass_tensorop_s1688112gemm_f16_32x32_64x2_tn_align4,not_verified,success,universal,1024,2048,1024,f16:row,f16:column,f32:column,1,0,1,1,tensorop,f32,32,32,64,2,1,1,1,16,8,8,75,1024,14680064,4299161600,0.187871,72.7725,22883.5
1,CUTLASS,gemm,cutlass_tensorop_s1688111gemm_f16_32x32_64x2_tn_align4,not_verified,success,universal,1024,2048,1024,f16:row,f16:column,f32:column,1,0,1,1,tensorop,f32,32,32,64,2,1,1,1,16,8,8,75,1024,14680064,4299161600,0.18793,72.7497,22876.4
1,CUTLASS,gemm,cutlass_tensorop_s1688112gemm_f16_32x32_64x2_tn_align4,not_verified,success,universal,2048,4096,2048,f16:row,f16:column,f32:column,1,0,1,1,tensorop,f32,32,32,64,2,1,1,1,16,8,8,75,1024,58720256,34376515584,1.3741,39.7987,25017.4
1,CUTLASS,gemm,cutlass_tensorop_s1688111gemm_f16_32x32_64x2_tn_align4,not_verified,success,universal,2048,4096,2048,f16:row,f16:column,f32:column,1,0,1,1,tensorop,f32,32,32,64,2,1,1,1,16,8,8,75,1024,58720256,34376515584,1.35737,40.2893,25325.8
1,CUTLASS,gemm,cutlass_tensorop_s1688112gemm_f16_32x32_64x2_tn_align4,not_verified,success,universal,3072,6144,3072,f16:row,f16:column,f32:column,1,0,1,1,tensorop,f32,32,32,64,2,1,1,1,16,8,8,75,1024,132120576,116001865728,4.52371,27.2004,25643.1
1,CUTLASS,gemm,cutlass_tensorop_s1688111gemm_f16_32x32_64x2_tn_align4,not_verified,success,universal,3072,6144,3072,f16:row,f16:column,f32:column,1,0,1,1,tensorop,f32,32,32,64,2,1,1,1,16,8,8,75,1024,132120576,116001865728,4.51002,27.283,25720.9
1,CUTLASS,gemm,cutlass_tensorop_s1688112gemm_f16_32x32_64x2_tn_align4,not_verified,success,universal,4096,8192,4096,f16:row,f16:column,f32:column,1,0,1,1,tensorop,f32,32,32,64,2,1,1,1,16,8,8,75,1024,234881024,274945015808,10.4313,20.9706,26357.7
1,CUTLASS,gemm,cutlass_tensorop_s1688111gemm_f16_32x32_64x2_tn_align4,not_verified,success,universal,4096,8192,4096,f16:row,f16:column,f32:column,1,0,1,1,tensorop,f32,32,32,64,2,1,1,1,16,8,8,75,1024,234881024,274945015808,10.4501,20.9328,26310.2
1,CUTLASS,gemm,cutlass_tensorop_s1688112gemm_f16_32x32_64x2_tn_align4,not_verified,success,universal,5120,10240,5120,f16:row,f16:column,f32:column,1,0,1,1,tensorop,f32,32,32,64,2,1,1,1,16,8,8,75,1024,367001600,536975769600,20.6771,16.5302,25969.6
1,CUTLASS,gemm,cutlass_tensorop_s1688111gemm_f16_32x32_64x2_tn_align4,not_verified,success,universal,5120,10240,5120,f16:row,f16:column,f32:column,1,0,1,1,tensorop,f32,32,32,64,2,1,1,1,16,8,8,75,1024,367001600,536975769600,20.6852,16.5237,25959.4
1,CUTLASS,gemm,cutlass_tensorop_s1688112gemm_f16_32x32_64x2_tn_align4,not_verified,success,universal,6144,12288,6144,f16:row,f16:column,f32:column,1,0,1,1,tensorop,f32,32,32,64,2,1,1,1,16,8,8,75,1024,528482304,927863930880,35.7681,13.7605,25941.1
1,CUTLASS,gemm,cutlass_tensorop_s1688111gemm_f16_32x32_64x2_tn_align4,not_verified,success,universal,6144,12288,6144,f16:row,f16:column,f32:column,1,0,1,1,tensorop,f32,32,32,64,2,1,1,1,16,8,8,75,1024,528482304,927863930880,35.8488,13.7295,25882.7
1,CUTLASS,gemm,cutlass_tensorop_s1688112gemm_f16_32x32_64x2_tn_align4,not_verified,success,universal,7168,14336,7168,f16:row,f16:column,f32:column,1,0,1,1,tensorop,f32,32,32,64,2,1,1,1,16,8,8,75,1024,719323136,1473379303424,56.5153,11.8538,26070.4
1,CUTLASS,gemm,cutlass_tensorop_s1688111gemm_f16_32x32_64x2_tn_align4,not_verified,success,universal,7168,14336,7168,f16:row,f16:column,f32:column,1,0,1,1,tensorop,f32,32,32,64,2,1,1,1,16,8,8,75,1024,719323136,1473379303424,56.6318,11.8294,26016.8
1,CUTLASS,gemm,cutlass_tensorop_s1688112gemm_f16_32x32_64x2_tn_align4,not_verified,success,universal,8192,16384,8192,f16:row,f16:column,f32:column,1,0,1,1,tensorop,f32,32,32,64,2,1,1,1,16,8,8,75,1024,939524096,2199291691008,82.8359,10.563,26550
1,CUTLASS,gemm,cutlass_tensorop_s1688111gemm_f16_32x32_64x2_tn_align4,not_verified,success,universal,8192,16384,8192,f16:row,f16:column,f32:column,1,0,1,1,tensorop,f32,32,32,64,2,1,1,1,16,8,8,75,1024,939524096,2199291691008,82.9078,10.5539,26527
1,CUTLASS,gemm,cutlass_tensorop_s1688112gemm_f16_32x32_64x2_tn_align4,not_verified,success,universal,9216,18432,9216,f16:row,f16:column,f32:column,1,0,1,1,tensorop,f32,32,32,64,2,1,1,1,16,8,8,75,1024,1189085184,3131370897408,120.794,9.16788,25923.3
1,CUTLASS,gemm,cutlass_tensorop_s1688111gemm_f16_32x32_64x2_tn_align4,not_verified,success,universal,9216,18432,9216,f16:row,f16:column,f32:column,1,0,1,1,tensorop,f32,32,32,64,2,1,1,1,16,8,8,75,1024,1189085184,3131370897408,120.824,9.16559,25916.8
1,CUTLASS,gemm,cutlass_tensorop_s1688112gemm_f16_32x32_64x2_tn_align4,not_verified,success,universal,10240,20480,10240,f16:row,f16:column,f32:column,1,0,1,1,tensorop,f32,32,32,64,2,1,1,1,16,8,8,75,1024,1468006400,4295386726400,166.9,8.19167,25736.3
1,CUTLASS,gemm,cutlass_tensorop_s1688111gemm_f16_32x32_64x2_tn_align4,not_verified,success,universal,10240,20480,10240,f16:row,f16:column,f32:column,1,0,1,1,tensorop,f32,32,32,64,2,1,1,1,16,8,8,75,1024,1468006400,4295386726400,166.711,8.20094,25765.5
1,CUTLASS,gemm,cutlass_tensorop_s1688121gemm_f16_32x64_32x2_tn_align4,not_verified,success,universal,1024,2048,1024,f16:row,f16:column,f32:column,1,0,1,1,tensorop,f32,32,64,32,2,1,2,1,16,8,8,75,1024,14680064,4299161600,0.205856,66.4149,20884.3
1,CUTLASS,gemm,cutlass_tensorop_s1688111gemm_f16_32x64_32x2_tn_align4,not_verified,success,universal,1024,2048,1024,f16:row,f16:column,f32:column,1,0,1,1,tensorop,f32,32,64,32,2,1,1,1,16,8,8,75,1024,14680064,4299161600,0.205099,66.66,20961.4
1,CUTLASS,gemm,cutlass_tensorop_s1688121gemm_f16_32x64_32x2_tn_align4,not_verified,success,universal,2048,4096,2048,f16:row,f16:column,f32:column,1,0,1,1,tensorop,f32,32,64,32,2,1,2,1,16,8,8,75,1024,58720256,34376515584,1.55106,35.2581,22163.2
1,CUTLASS,gemm,cutlass_tensorop_s1688111gemm_f16_32x64_32x2_tn_align4,not_verified,success,universal,2048,4096,2048,f16:row,f16:column,f32:column,1,0,1,1,tensorop,f32,32,64,32,2,1,1,1,16,8,8,75,1024,58720256,34376515584,1.46805,37.2518,23416.4
1,CUTLASS,gemm,cutlass_tensorop_s1688121gemm_f16_32x64_32x2_tn_align4,not_verified,success,universal,3072,6144,3072,f16:row,f16:column,f32:column,1,0,1,1,tensorop,f32,32,64,32,2,1,2,1,16,8,8,75,1024,132120576,116001865728,5.1168,24.0476,22670.8
1,CUTLASS,gemm,cutlass_tensorop_s1688111gemm_f16_32x64_32x2_tn_align4,not_verified,success,universal,3072,6144,3072,f16:row,f16:column,f32:column,1,0,1,1,tensorop,f32,32,64,32,2,1,1,1,16,8,8,75,1024,132120576,116001865728,4.86962,25.2683,23821.6
1,CUTLASS,gemm,cutlass_tensorop_s1688121gemm_f16_32x64_32x2_tn_align4,not_verified,success,universal,4096,8192,4096,f16:row,f16:column,f32:column,1,0,1,1,tensorop,f32,32,64,32,2,1,2,1,16,8,8,75,1024,234881024,274945015808,12.0272,18.188,22860.4
1,CUTLASS,gemm,cutlass_tensorop_s1688111gemm_f16_32x64_32x2_tn_align4,not_verified,success,universal,4096,8192,4096,f16:row,f16:column,f32:column,1,0,1,1,tensorop,f32,32,64,32,2,1,1,1,16,8,8,75,1024,234881024,274945015808,11.4635,19.0823,23984.4
1,CUTLASS,gemm,cutlass_tensorop_s1688121gemm_f16_32x64_32x2_tn_align4,not_verified,success,universal,5120,10240,5120,f16:row,f16:column,f32:column,1,0,1,1,tensorop,f32,32,64,32,2,1,2,1,16,8,8,75,1024,367001600,536975769600,23.8764,14.3153,22489.8
1,CUTLASS,gemm,cutlass_tensorop_s1688111gemm_f16_32x64_32x2_tn_align4,not_verified,success,universal,5120,10240,5120,f16:row,f16:column,f32:column,1,0,1,1,tensorop,f32,32,64,32,2,1,1,1,16,8,8,75,1024,367001600,536975769600,23.4056,14.6032,22942.2
1,CUTLASS,gemm,cutlass_tensorop_s1688121gemm_f16_32x64_32x2_tn_align4,not_verified,success,universal,6144,12288,6144,f16:row,f16:column,f32:column,1,0,1,1,tensorop,f32,32,64,32,2,1,2,1,16,8,8,75,1024,528482304,927863930880,40.7295,12.0843,22781.1
1,CUTLASS,gemm,cutlass_tensorop_s1688111gemm_f16_32x64_32x2_tn_align4,not_verified,success,universal,6144,12288,6144,f16:row,f16:column,f32:column,1,0,1,1,tensorop,f32,32,64,32,2,1,1,1,16,8,8,75,1024,528482304,927863930880,41.8075,11.7727,22193.7
1,CUTLASS,gemm,cutlass_tensorop_s1688121gemm_f16_32x64_32x2_tn_align4,not_verified,success,universal,7168,14336,7168,f16:row,f16:column,f32:column,1,0,1,1,tensorop,f32,32,64,32,2,1,2,1,16,8,8,75,1024,719323136,1473379303424,64.7585,10.3449,22751.9
1,CUTLASS,gemm,cutlass_tensorop_s1688111gemm_f16_32x64_32x2_tn_align4,not_verified,success,universal,7168,14336,7168,f16:row,f16:column,f32:column,1,0,1,1,tensorop,f32,32,64,32,2,1,1,1,16,8,8,75,1024,719323136,1473379303424,71.2054,9.4083,20692
1,CUTLASS,gemm,cutlass_tensorop_s1688121gemm_f16_32x64_32x2_tn_align4,not_verified,success,universal,8192,16384,8192,f16:row,f16:column,f32:column,1,0,1,1,tensorop,f32,32,64,32,2,1,2,1,16,8,8,75,1024,939524096,2199291691008,98.3723,8.89478,22356.8
1,CUTLASS,gemm,cutlass_tensorop_s1688111gemm_f16_32x64_32x2_tn_align4,not_verified,success,universal,8192,16384,8192,f16:row,f16:column,f32:column,1,0,1,1,tensorop,f32,32,64,32,2,1,1,1,16,8,8,75,1024,939524096,2199291691008,94.9277,9.21754,23168.1
1,CUTLASS,gemm,cutlass_tensorop_s1688121gemm_f16_32x64_32x2_tn_align4,not_verified,success,universal,9216,18432,9216,f16:row,f16:column,f32:column,1,0,1,1,tensorop,f32,32,64,32,2,1,2,1,16,8,8,75,1024,1189085184,3131370897408,194.966,5.68007,16061.1
1,CUTLASS,gemm,cutlass_tensorop_s1688111gemm_f16_32x64_32x2_tn_align4,not_verified,success,universal,9216,18432,9216,f16:row,f16:column,f32:column,1,0,1,1,tensorop,f32,32,64,32,2,1,1,1,16,8,8,75,1024,1189085184,3131370897408,245.923,4.50312,12733.1
1,CUTLASS,gemm,cutlass_tensorop_s1688121gemm_f16_32x64_32x2_tn_align4,not_verified,success,universal,10240,20480,10240,f16:row,f16:column,f32:column,1,0,1,1,tensorop,f32,32,64,32,2,1,2,1,16,8,8,75,1024,1468006400,4295386726400,435.877,3.13664,9854.59
1,CUTLASS,gemm,cutlass_tensorop_s1688111gemm_f16_32x64_32x2_tn_align4,not_verified,success,universal,10240,20480,10240,f16:row,f16:column,f32:column,1,0,1,1,tensorop,f32,32,64,32,2,1,1,1,16,8,8,75,1024,1468006400,4295386726400,430.13,3.17854,9986.25
1,CUTLASS,gemm,cutlass_tensorop_s1688122gemm_f16_32x64_64x2_tn_align4,not_verified,success,universal,1024,2048,1024,f16:row,f16:column,f32:column,1,0,1,1,tensorop,f32,32,64,64,2,1,2,1,16,8,8,75,1024,14680064,4299161600,0.176709,77.3695,24329.1
1,CUTLASS,gemm,cutlass_tensorop_s1688121gemm_f16_32x64_64x2_tn_align4,not_verified,success,universal,1024,2048,1024,f16:row,f16:column,f32:column,1,0,1,1,tensorop,f32,32,64,64,2,1,2,1,16,8,8,75,1024,14680064,4299161600,0.173515,78.7937,24776.9
1,CUTLASS,gemm,cutlass_tensorop_s1688112gemm_f16_32x64_64x2_tn_align4,not_verified,success,universal,1024,2048,1024,f16:row,f16:column,f32:column,1,0,1,1,tensorop,f32,32,64,64,2,1,1,1,16,8,8,75,1024,14680064,4299161600,0.240539,56.8386,17873.1
1,CUTLASS,gemm,cutlass_tensorop_s1688111gemm_f16_32x64_64x2_tn_align4,not_verified,success,universal,1024,2048,1024,f16:row,f16:column,f32:column,1,0,1,1,tensorop,f32,32,64,64,2,1,1,1,16,8,8,75,1024,14680064,4299161600,0.24013,56.9353,17903.5
1,CUTLASS,gemm,cutlass_tensorop_s1688122gemm_f16_32x64_64x2_tn_align4,not_verified,success,universal,2048,4096,2048,f16:row,f16:column,f32:column,1,0,1,1,tensorop,f32,32,64,64,2,1,2,1,16,8,8,75,1024,58720256,34376515584,1.27947,42.7423,26867.8
1,CUTLASS,gemm,cutlass_tensorop_s1688121gemm_f16_32x64_64x2_tn_align4,not_verified,success,universal,2048,4096,2048,f16:row,f16:column,f32:column,1,0,1,1,tensorop,f32,32,64,64,2,1,2,1,16,8,8,75,1024,58720256,34376515584,1.22991,44.4645,27950.3
1,CUTLASS,gemm,cutlass_tensorop_s1688112gemm_f16_32x64_64x2_tn_align4,not_verified,success,universal,2048,4096,2048,f16:row,f16:column,f32:column,1,0,1,1,tensorop,f32,32,64,64,2,1,1,1,16,8,8,75,1024,58720256,34376515584,1.70542,32.0668,20157.2
1,CUTLASS,gemm,cutlass_tensorop_s1688111gemm_f16_32x64_64x2_tn_align4,not_verified,success,universal,2048,4096,2048,f16:row,f16:column,f32:column,1,0,1,1,tensorop,f32,32,64,64,2,1,1,1,16,8,8,75,1024,58720256,34376515584,1.70545,32.0664,20156.9
1,CUTLASS,gemm,cutlass_tensorop_s1688122gemm_f16_32x64_64x2_tn_align4,not_verified,success,universal,3072,6144,3072,f16:row,f16:column,f32:column,1,0,1,1,tensorop,f32,32,64,64,2,1,2,1,16,8,8,75,1024,132120576,116001865728,4.16399,29.5503,27858.4
1,CUTLASS,gemm,cutlass_tensorop_s1688121gemm_f16_32x64_64x2_tn_align4,not_verified,success,universal,3072,6144,3072,f16:row,f16:column,f32:column,1,0,1,1,tensorop,f32,32,64,64,2,1,2,1,16,8,8,75,1024,132120576,116001865728,4.08542,30.1186,28394.1
1,CUTLASS,gemm,cutlass_tensorop_s1688112gemm_f16_32x64_64x2_tn_align4,not_verified,success,universal,3072,6144,3072,f16:row,f16:column,f32:column,1,0,1,1,tensorop,f32,32,64,64,2,1,1,1,16,8,8,75,1024,132120576,116001865728,5.48098,22.4498,21164.4
1,CUTLASS,gemm,cutlass_tensorop_s1688111gemm_f16_32x64_64x2_tn_align4,not_verified,success,universal,3072,6144,3072,f16:row,f16:column,f32:column,1,0,1,1,tensorop,f32,32,64,64,2,1,1,1,16,8,8,75,1024,132120576,116001865728,5.48075,22.4507,21165.3
1,CUTLASS,gemm,cutlass_tensorop_s1688122gemm_f16_32x64_64x2_tn_align4,not_verified,success,universal,4096,8192,4096,f16:row,f16:column,f32:column,1,0,1,1,tensorop,f32,32,64,64,2,1,2,1,16,8,8,75,1024,234881024,274945015808,9.70882,22.5311,28319.1
1,CUTLASS,gemm,cutlass_tensorop_s1688121gemm_f16_32x64_64x2_tn_align4,not_verified,success,universal,4096,8192,4096,f16:row,f16:column,f32:column,1,0,1,1,tensorop,f32,32,64,64,2,1,2,1,16,8,8,75,1024,234881024,274945015808,9.61459,22.7519,28596.7
1,CUTLASS,gemm,cutlass_tensorop_s1688112gemm_f16_32x64_64x2_tn_align4,not_verified,success,universal,4096,8192,4096,f16:row,f16:column,f32:column,1,0,1,1,tensorop,f32,32,64,64,2,1,1,1,16,8,8,75,1024,234881024,274945015808,12.6838,17.2464,21676.9
1,CUTLASS,gemm,cutlass_tensorop_s1688111gemm_f16_32x64_64x2_tn_align4,not_verified,success,universal,4096,8192,4096,f16:row,f16:column,f32:column,1,0,1,1,tensorop,f32,32,64,64,2,1,1,1,16,8,8,75,1024,234881024,274945015808,12.685,17.2448,21674.9
1,CUTLASS,gemm,cutlass_tensorop_s1688122gemm_f16_32x64_64x2_tn_align4,not_verified,success,universal,5120,10240,5120,f16:row,f16:column,f32:column,1,0,1,1,tensorop,f32,32,64,64,2,1,2,1,16,8,8,75,1024,367001600,536975769600,19.0166,17.9736,28237.2
1,CUTLASS,gemm,cutlass_tensorop_s1688121gemm_f16_32x64_64x2_tn_align4,not_verified,success,universal,5120,10240,5120,f16:row,f16:column,f32:column,1,0,1,1,tensorop,f32,32,64,64,2,1,2,1,16,8,8,75,1024,367001600,536975769600,18.8827,18.1011,28437.5
1,CUTLASS,gemm,cutlass_tensorop_s1688112gemm_f16_32x64_64x2_tn_align4,not_verified,success,universal,5120,10240,5120,f16:row,f16:column,f32:column,1,0,1,1,tensorop,f32,32,64,64,2,1,1,1,16,8,8,75,1024,367001600,536975769600,24.5548,13.9198,21868.5
1,CUTLASS,gemm,cutlass_tensorop_s1688111gemm_f16_32x64_64x2_tn_align4,not_verified,success,universal,5120,10240,5120,f16:row,f16:column,f32:column,1,0,1,1,tensorop,f32,32,64,64,2,1,1,1,16,8,8,75,1024,367001600,536975769600,24.5585,13.9177,21865.2
1,CUTLASS,gemm,cutlass_tensorop_s1688122gemm_f16_32x64_64x2_tn_align4,not_verified,success,universal,6144,12288,6144,f16:row,f16:column,f32:column,1,0,1,1,tensorop,f32,32,64,64,2,1,2,1,16,8,8,75,1024,528482304,927863930880,33.4238,14.7257,27760.6
1,CUTLASS,gemm,cutlass_tensorop_s1688121gemm_f16_32x64_64x2_tn_align4,not_verified,success,universal,6144,12288,6144,f16:row,f16:column,f32:column,1,0,1,1,tensorop,f32,32,64,64,2,1,2,1,16,8,8,75,1024,528482304,927863930880,32.885,14.9669,28215.4
1,CUTLASS,gemm,cutlass_tensorop_s1688112gemm_f16_32x64_64x2_tn_align4,not_verified,success,universal,6144,12288,6144,f16:row,f16:column,f32:column,1,0,1,1,tensorop,f32,32,64,64,2,1,1,1,16,8,8,75,1024,528482304,927863930880,42.3701,11.6164,21899
1,CUTLASS,gemm,cutlass_tensorop_s1688111gemm_f16_32x64_64x2_tn_align4,not_verified,success,universal,6144,12288,6144,f16:row,f16:column,f32:column,1,0,1,1,tensorop,f32,32,64,64,2,1,1,1,16,8,8,75,1024,528482304,927863930880,42.3882,11.6114,21889.7
1,CUTLASS,gemm,cutlass_tensorop_s1688122gemm_f16_32x64_64x2_tn_align4,not_verified,success,universal,7168,14336,7168,f16:row,f16:column,f32:column,1,0,1,1,tensorop,f32,32,64,64,2,1,2,1,16,8,8,75,1024,719323136,1473379303424,52.0396,12.8733,28312.7
1,CUTLASS,gemm,cutlass_tensorop_s1688121gemm_f16_32x64_64x2_tn_align4,not_verified,success,universal,7168,14336,7168,f16:row,f16:column,f32:column,1,0,1,1,tensorop,f32,32,64,64,2,1,2,1,16,8,8,75,1024,719323136,1473379303424,52.9126,12.6609,27845.5
1,CUTLASS,gemm,cutlass_tensorop_s1688112gemm_f16_32x64_64x2_tn_align4,not_verified,success,universal,7168,14336,7168,f16:row,f16:column,f32:column,1,0,1,1,tensorop,f32,32,64,64,2,1,1,1,16,8,8,75,1024,719323136,1473379303424,67.8761,9.86977,21706.9
1,CUTLASS,gemm,cutlass_tensorop_s1688111gemm_f16_32x64_64x2_tn_align4,not_verified,success,universal,7168,14336,7168,f16:row,f16:column,f32:column,1,0,1,1,tensorop,f32,32,64,64,2,1,1,1,16,8,8,75,1024,719323136,1473379303424,67.8459,9.87417,21716.6
1,CUTLASS,gemm,cutlass_tensorop_s1688122gemm_f16_32x64_64x2_tn_align4,not_verified,success,universal,8192,16384,8192,f16:row,f16:column,f32:column,1,0,1,1,tensorop,f32,32,64,64,2,1,2,1,16,8,8,75,1024,939524096,2199291691008,78.0986,11.2038,28160.5
1,CUTLASS,gemm,cutlass_tensorop_s1688121gemm_f16_32x64_64x2_tn_align4,not_verified,success,universal,8192,16384,8192,f16:row,f16:column,f32:column,1,0,1,1,tensorop,f32,32,64,64,2,1,2,1,16,8,8,75,1024,939524096,2199291691008,78.9514,11.0828,27856.3
1,CUTLASS,gemm,cutlass_tensorop_s1688112gemm_f16_32x64_64x2_tn_align4,not_verified,success,universal,8192,16384,8192,f16:row,f16:column,f32:column,1,0,1,1,tensorop,f32,32,64,64,2,1,1,1,16,8,8,75,1024,939524096,2199291691008,102.044,8.57473,21552.4
1,CUTLASS,gemm,cutlass_tensorop_s1688111gemm_f16_32x64_64x2_tn_align4,not_verified,success,universal,8192,16384,8192,f16:row,f16:column,f32:column,1,0,1,1,tensorop,f32,32,64,64,2,1,1,1,16,8,8,75,1024,939524096,2199291691008,102.036,8.57542,21554.1
1,CUTLASS,gemm,cutlass_tensorop_s1688122gemm_f16_32x64_64x2_tn_align4,not_verified,success,universal,9216,18432,9216,f16:row,f16:column,f32:column,1,0,1,1,tensorop,f32,32,64,64,2,1,2,1,16,8,8,75,1024,1189085184,3131370897408,113.243,9.77917,27651.8
1,CUTLASS,gemm,cutlass_tensorop_s1688121gemm_f16_32x64_64x2_tn_align4,not_verified,success,universal,9216,18432,9216,f16:row,f16:column,f32:column,1,0,1,1,tensorop,f32,32,64,64,2,1,2,1,16,8,8,75,1024,1189085184,3131370897408,113.667,9.74271,27548.7
1,CUTLASS,gemm,cutlass_tensorop_s1688112gemm_f16_32x64_64x2_tn_align4,not_verified,success,universal,9216,18432,9216,f16:row,f16:column,f32:column,1,0,1,1,tensorop,f32,32,64,64,2,1,1,1,16,8,8,75,1024,1189085184,3131370897408,145.88,7.59135,21465.5
1,CUTLASS,gemm,cutlass_tensorop_s1688111gemm_f16_32x64_64x2_tn_align4,not_verified,success,universal,9216,18432,9216,f16:row,f16:column,f32:column,1,0,1,1,tensorop,f32,32,64,64,2,1,1,1,16,8,8,75,1024,1189085184,3131370897408,145.934,7.58853,21457.5
1,CUTLASS,gemm,cutlass_tensorop_s1688122gemm_f16_32x64_64x2_tn_align4,not_verified,success,universal,10240,20480,10240,f16:row,f16:column,f32:column,1,0,1,1,tensorop,f32,32,64,64,2,1,2,1,16,8,8,75,1024,1468006400,4295386726400,159.024,8.59739,27011
1,CUTLASS,gemm,cutlass_tensorop_s1688121gemm_f16_32x64_64x2_tn_align4,not_verified,success,universal,10240,20480,10240,f16:row,f16:column,f32:column,1,0,1,1,tensorop,f32,32,64,64,2,1,2,1,16,8,8,75,1024,1468006400,4295386726400,155.48,8.79332,27626.6
1,CUTLASS,gemm,cutlass_tensorop_s1688112gemm_f16_32x64_64x2_tn_align4,not_verified,success,universal,10240,20480,10240,f16:row,f16:column,f32:column,1,0,1,1,tensorop,f32,32,64,64,2,1,1,1,16,8,8,75,1024,1468006400,4295386726400,201.581,6.78234,21308.5
1,CUTLASS,gemm,cutlass_tensorop_s1688111gemm_f16_32x64_64x2_tn_align4,not_verified,success,universal,10240,20480,10240,f16:row,f16:column,f32:column,1,0,1,1,tensorop,f32,32,64,64,2,1,1,1,16,8,8,75,1024,1468006400,4295386726400,201.933,6.77049,21271.3
1,CUTLASS,gemm,cutlass_tensorop_s1688141gemm_f16_32x128_32x2_tn_align4,not_verified,success,universal,1024,2048,1024,f16:row,f16:column,f32:column,1,0,1,1,tensorop,f32,32,128,32,2,1,4,1,16,8,8,75,1024,14680064,4299161600,0.18087,75.5896,23769.4
1,CUTLASS,gemm,cutlass_tensorop_s1688121gemm_f16_32x128_32x2_tn_align4,not_verified,success,universal,1024,2048,1024,f16:row,f16:column,f32:column,1,0,1,1,tensorop,f32,32,128,32,2,1,2,1,16,8,8,75,1024,14680064,4299161600,0.185024,73.8923,23235.7
1,CUTLASS,gemm,cutlass_tensorop_s1688111gemm_f16_32x128_32x2_tn_align4,not_verified,success,universal,1024,2048,1024,f16:row,f16:column,f32:column,1,0,1,1,tensorop,f32,32,128,32,2,1,1,1,16,8,8,75,1024,14680064,4299161600,0.641432,21.3146,6702.44
1,CUTLASS,gemm,cutlass_tensorop_s1688141gemm_f16_32x128_32x2_tn_align4,not_verified,success,universal,2048,4096,2048,f16:row,f16:column,f32:column,1,0,1,1,tensorop,f32,32,128,32,2,1,4,1,16,8,8,75,1024,58720256,34376515584,1.35505,40.3584,25369.3
1,CUTLASS,gemm,cutlass_tensorop_s1688121gemm_f16_32x128_32x2_tn_align4,not_verified,success,universal,2048,4096,2048,f16:row,f16:column,f32:column,1,0,1,1,tensorop,f32,32,128,32,2,1,2,1,16,8,8,75,1024,58720256,34376515584,1.27147,43.0111,27036.7
1,CUTLASS,gemm,cutlass_tensorop_s1688111gemm_f16_32x128_32x2_tn_align4,not_verified,success,universal,2048,4096,2048,f16:row,f16:column,f32:column,1,0,1,1,tensorop,f32,32,128,32,2,1,1,1,16,8,8,75,1024,58720256,34376515584,4.59634,11.8981,7479.11
1,CUTLASS,gemm,cutlass_tensorop_s1688141gemm_f16_32x128_32x2_tn_align4,not_verified,success,universal,3072,6144,3072,f16:row,f16:column,f32:column,1,0,1,1,tensorop,f32,32,128,32,2,1,4,1,16,8,8,75,1024,132120576,116001865728,4.45398,27.6263,26044.6
1,CUTLASS,gemm,cutlass_tensorop_s1688121gemm_f16_32x128_32x2_tn_align4,not_verified,success,universal,3072,6144,3072,f16:row,f16:column,f32:column,1,0,1,1,tensorop,f32,32,128,32,2,1,2,1,16,8,8,75,1024,132120576,116001865728,4.32256,28.4662,26836.4
1,CUTLASS,gemm,cutlass_tensorop_s1688111gemm_f16_32x128_32x2_tn_align4,not_verified,success,universal,3072,6144,3072,f16:row,f16:column,f32:column,1,0,1,1,tensorop,f32,32,128,32,2,1,1,1,16,8,8,75,1024,132120576,116001865728,14.9961,8.20525,7735.46
1,CUTLASS,gemm,cutlass_tensorop_s1688141gemm_f16_32x128_32x2_tn_align4,not_verified,success,universal,4096,8192,4096,f16:row,f16:column,f32:column,1,0,1,1,tensorop,f32,32,128,32,2,1,4,1,16,8,8,75,1024,234881024,274945015808,10.388,21.058,26467.6
1,CUTLASS,gemm,cutlass_tensorop_s1688121gemm_f16_32x128_32x2_tn_align4,not_verified,success,universal,4096,8192,4096,f16:row,f16:column,f32:column,1,0,1,1,tensorop,f32,32,128,32,2,1,2,1,16,8,8,75,1024,234881024,274945015808,10.3985,21.0366,26440.7
1,CUTLASS,gemm,cutlass_tensorop_s1688111gemm_f16_32x128_32x2_tn_align4,not_verified,success,universal,4096,8192,4096,f16:row,f16:column,f32:column,1,0,1,1,tensorop,f32,32,128,32,2,1,1,1,16,8,8,75,1024,234881024,274945015808,34.176,6.40069,8044.97
1,CUTLASS,gemm,cutlass_tensorop_s1688141gemm_f16_32x128_32x2_tn_align4,not_verified,success,universal,5120,10240,5120,f16:row,f16:column,f32:column,1,0,1,1,tensorop,f32,32,128,32,2,1,4,1,16,8,8,75,1024,367001600,536975769600,20.7122,16.5022,25925.6
1,CUTLASS,gemm,cutlass_tensorop_s1688121gemm_f16_32x128_32x2_tn_align4,not_verified,success,universal,5120,10240,5120,f16:row,f16:column,f32:column,1,0,1,1,tensorop,f32,32,128,32,2,1,2,1,16,8,8,75,1024,367001600,536975769600,38.3197,8.91962,14013.1
1,CUTLASS,gemm,cutlass_tensorop_s1688111gemm_f16_32x128_32x2_tn_align4,not_verified,success,universal,5120,10240,5120,f16:row,f16:column,f32:column,1,0,1,1,tensorop,f32,32,128,32,2,1,1,1,16,8,8,75,1024,367001600,536975769600,67.5742,5.0581,7946.46
1,CUTLASS,gemm,cutlass_tensorop_s1688141gemm_f16_32x128_32x2_tn_align4,not_verified,success,universal,6144,12288,6144,f16:row,f16:column,f32:column,1,0,1,1,tensorop,f32,32,128,32,2,1,4,1,16,8,8,75,1024,528482304,927863930880,41.3232,11.9107,22453.8
1,CUTLASS,gemm,cutlass_tensorop_s1688121gemm_f16_32x128_32x2_tn_align4,not_verified,success,universal,6144,12288,6144,f16:row,f16:column,f32:column,1,0,1,1,tensorop,f32,32,128,32,2,1,2,1,16,8,8,75,1024,528482304,927863930880,78.9124,6.23714,11758.2
1,CUTLASS,gemm,cutlass_tensorop_s1688111gemm_f16_32x128_32x2_tn_align4,not_verified,success,universal,6144,12288,6144,f16:row,f16:column,f32:column,1,0,1,1,tensorop,f32,32,128,32,2,1,1,1,16,8,8,75,1024,528482304,927863930880,200.661,2.45283,4624.03
1,CUTLASS,gemm,cutlass_tensorop_s1688141gemm_f16_32x128_32x2_tn_align4,not_verified,success,universal,7168,14336,7168,f16:row,f16:column,f32:column,1,0,1,1,tensorop,f32,32,128,32,2,1,4,1,16,8,8,75,1024,719323136,1473379303424,90.1129,7.43425,16350.4
1,CUTLASS,gemm,cutlass_tensorop_s1688121gemm_f16_32x128_32x2_tn_align4,not_verified,success,universal,7168,14336,7168,f16:row,f16:column,f32:column,1,0,1,1,tensorop,f32,32,128,32,2,1,2,1,16,8,8,75,1024,719323136,1473379303424,150.275,4.45798,9804.57
1,CUTLASS,gemm,cutlass_tensorop_s1688111gemm_f16_32x128_32x2_tn_align4,not_verified,success,universal,7168,14336,7168,f16:row,f16:column,f32:column,1,0,1,1,tensorop,f32,32,128,32,2,1,1,1,16,8,8,75,1024,719323136,1473379303424,205.164,3.2653,7181.47
1,CUTLASS,gemm,cutlass_tensorop_s1688141gemm_f16_32x128_32x2_tn_align4,not_verified,success,universal,8192,16384,8192,f16:row,f16:column,f32:column,1,0,1,1,tensorop,f32,32,128,32,2,1,4,1,16,8,8,75,1024,939524096,2199291691008,129.816,6.74032,16941.6
1,CUTLASS,gemm,cutlass_tensorop_s1688121gemm_f16_32x128_32x2_tn_align4,not_verified,success,universal,8192,16384,8192,f16:row,f16:column,f32:column,1,0,1,1,tensorop,f32,32,128,32,2,1,2,1,16,8,8,75,1024,939524096,2199291691008,140.497,6.22789,15653.7
1,CUTLASS,gemm,cutlass_tensorop_s1688111gemm_f16_32x128_32x2_tn_align4,not_verified,success,universal,8192,16384,8192,f16:row,f16:column,f32:column,1,0,1,1,tensorop,f32,32,128,32,2,1,1,1,16,8,8,75,1024,939524096,2199291691008,321.673,2.72016,6837.05
1,CUTLASS,gemm,cutlass_tensorop_s1688141gemm_f16_32x128_32x2_tn_align4,not_verified,success,universal,9216,18432,9216,f16:row,f16:column,f32:column,1,0,1,1,tensorop,f32,32,128,32,2,1,4,1,16,8,8,75,1024,1189085184,3131370897408,362.339,3.05631,8642.09
1,CUTLASS,gemm,cutlass_tensorop_s1688121gemm_f16_32x128_32x2_tn_align4,not_verified,success,universal,9216,18432,9216,f16:row,f16:column,f32:column,1,0,1,1,tensorop,f32,32,128,32,2,1,2,1,16,8,8,75,1024,1189085184,3131370897408,380.664,2.90919,8226.08
1,CUTLASS,gemm,cutlass_tensorop_s1688111gemm_f16_32x128_32x2_tn_align4,not_verified,success,universal,9216,18432,9216,f16:row,f16:column,f32:column,1,0,1,1,tensorop,f32,32,128,32,2,1,1,1,16,8,8,75,1024,1189085184,3131370897408,522.502,2.11946,5993.03
1,CUTLASS,gemm,cutlass_tensorop_s1688141gemm_f16_32x128_32x2_tn_align4,not_verified,success,universal,10240,20480,10240,f16:row,f16:column,f32:column,1,0,1,1,tensorop,f32,32,128,32,2,1,4,1,16,8,8,75,1024,1468006400,4295386726400,522.066,2.6188,8227.67
1,CUTLASS,gemm,cutlass_tensorop_s1688121gemm_f16_32x128_32x2_tn_align4,not_verified,success,universal,10240,20480,10240,f16:row,f16:column,f32:column,1,0,1,1,tensorop,f32,32,128,32,2,1,2,1,16,8,8,75,1024,1468006400,4295386726400,536.769,2.54707,8002.3
1,CUTLASS,gemm,cutlass_tensorop_s1688111gemm_f16_32x128_32x2_tn_align4,not_verified,success,universal,10240,20480,10240,f16:row,f16:column,f32:column,1,0,1,1,tensorop,f32,32,128,32,2,1,1,1,16,8,8,75,1024,1468006400,4295386726400,559.993,2.44144,7670.43
1,CUTLASS,gemm,cutlass_tensorop_s1688142gemm_f16_32x128_64x2_tn_align4,not_verified,success,universal,1024,2048,1024,f16:row,f16:column,f32:column,1,0,1,1,tensorop,f32,32,128,64,2,1,4,1,16,8,8,75,1024,14680064,4299161600,0.1681,81.3319,25575
1,CUTLASS,gemm,cutlass_tensorop_s1688141gemm_f16_32x128_64x2_tn_align4,not_verified,success,universal,1024,2048,1024,f16:row,f16:column,f32:column,1,0,1,1,tensorop,f32,32,128,64,2,1,4,1,16,8,8,75,1024,14680064,4299161600,0.170894,80.002,25156.9
1,CUTLASS,gemm,cutlass_tensorop_s1688122gemm_f16_32x128_64x2_tn_align4,not_verified,success,universal,1024,2048,1024,f16:row,f16:column,f32:column,1,0,1,1,tensorop,f32,32,128,64,2,1,2,1,16,8,8,75,1024,14680064,4299161600,0.271088,50.4333,15858.9
1,CUTLASS,gemm,cutlass_tensorop_s1688121gemm_f16_32x128_64x2_tn_align4,not_verified,success,universal,1024,2048,1024,f16:row,f16:column,f32:column,1,0,1,1,tensorop,f32,32,128,64,2,1,2,1,16,8,8,75,1024,14680064,4299161600,0.271538,50.3497,15832.6
1,CUTLASS,gemm,cutlass_tensorop_s1688112gemm_f16_32x128_64x2_tn_align4,not_verified,success,universal,1024,2048,1024,f16:row,f16:column,f32:column,1,0,1,1,tensorop,f32,32,128,64,2,1,1,1,16,8,8,75,1024,14680064,4299161600,1.58975,8.60002,2704.3
1,CUTLASS,gemm,cutlass_tensorop_s1688111gemm_f16_32x128_64x2_tn_align4,not_verified,success,universal,1024,2048,1024,f16:row,f16:column,f32:column,1,0,1,1,tensorop,f32,32,128,64,2,1,1,1,16,8,8,75,1024,14680064,4299161600,1.58819,8.60845,2706.95
1,CUTLASS,gemm,cutlass_tensorop_s1688142gemm_f16_32x128_64x2_tn_align4,not_verified,success,universal,2048,4096,2048,f16:row,f16:column,f32:column,1,0,1,1,tensorop,f32,32,128,64,2,1,4,1,16,8,8,75,1024,58720256,34376515584,1.22952,44.4788,27959.3
1,CUTLASS,gemm,cutlass_tensorop_s1688141gemm_f16_32x128_64x2_tn_align4,not_verified,success,universal,2048,4096,2048,f16:row,f16:column,f32:column,1,0,1,1,tensorop,f32,32,128,64,2,1,4,1,16,8,8,75,1024,58720256,34376515584,1.21406,45.0453,28315.4
1,CUTLASS,gemm,cutlass_tensorop_s1688122gemm_f16_32x128_64x2_tn_align4,not_verified,success,universal,2048,4096,2048,f16:row,f16:column,f32:column,1,0,1,1,tensorop,f32,32,128,64,2,1,2,1,16,8,8,75,1024,58720256,34376515584,1.95116,28.0282,17618.5
1,CUTLASS,gemm,cutlass_tensorop_s1688121gemm_f16_32x128_64x2_tn_align4,not_verified,success,universal,2048,4096,2048,f16:row,f16:column,f32:column,1,0,1,1,tensorop,f32,32,128,64,2,1,2,1,16,8,8,75,1024,58720256,34376515584,1.95164,28.0214,17614.2
1,CUTLASS,gemm,cutlass_tensorop_s1688112gemm_f16_32x128_64x2_tn_align4,not_verified,success,universal,2048,4096,2048,f16:row,f16:column,f32:column,1,0,1,1,tensorop,f32,32,128,64,2,1,1,1,16,8,8,75,1024,58720256,34376515584,12.1771,4.49103,2823.06
1,CUTLASS,gemm,cutlass_tensorop_s1688111gemm_f16_32x128_64x2_tn_align4,not_verified,success,universal,2048,4096,2048,f16:row,f16:column,f32:column,1,0,1,1,tensorop,f32,32,128,64,2,1,1,1,16,8,8,75,1024,58720256,34376515584,12.0983,4.52026,2841.43
1,CUTLASS,gemm,cutlass_tensorop_s1688142gemm_f16_32x128_64x2_tn_align4,not_verified,success,universal,3072,6144,3072,f16:row,f16:column,f32:column,1,0,1,1,tensorop,f32,32,128,64,2,1,4,1,16,8,8,75,1024,132120576,116001865728,3.97453,30.9589,29186.3
1,CUTLASS,gemm,cutlass_tensorop_s1688141gemm_f16_32x128_64x2_tn_align4,not_verified,success,universal,3072,6144,3072,f16:row,f16:column,f32:column,1,0,1,1,tensorop,f32,32,128,64,2,1,4,1,16,8,8,75,1024,132120576,116001865728,3.97375,30.9649,29192
1,CUTLASS,gemm,cutlass_tensorop_s1688122gemm_f16_32x128_64x2_tn_align4,not_verified,success,universal,3072,6144,3072,f16:row,f16:column,f32:column,1,0,1,1,tensorop,f32,32,128,64,2,1,2,1,16,8,8,75,1024,132120576,116001865728,6.28466,19.5789,18457.9
1,CUTLASS,gemm,cutlass_tensorop_s1688121gemm_f16_32x128_64x2_tn_align4,not_verified,success,universal,3072,6144,3072,f16:row,f16:column,f32:column,1,0,1,1,tensorop,f32,32,128,64,2,1,2,1,16,8,8,75,1024,132120576,116001865728,6.28733,19.5706,18450.1
1,CUTLASS,gemm,cutlass_tensorop_s1688112gemm_f16_32x128_64x2_tn_align4,not_verified,success,universal,3072,6144,3072,f16:row,f16:column,f32:column,1,0,1,1,tensorop,f32,32,128,64,2,1,1,1,16,8,8,75,1024,132120576,116001865728,39.6463,3.10362,2925.92
1,CUTLASS,gemm,cutlass_tensorop_s1688111gemm_f16_32x128_64x2_tn_align4,not_verified,success,universal,3072,6144,3072,f16:row,f16:column,f32:column,1,0,1,1,tensorop,f32,32,128,64,2,1,1,1,16,8,8,75,1024,132120576,116001865728,39.6732,3.10151,2923.94
1,CUTLASS,gemm,cutlass_tensorop_s1688142gemm_f16_32x128_64x2_tn_align4,not_verified,success,universal,4096,8192,4096,f16:row,f16:column,f32:column,1,0,1,1,tensorop,f32,32,128,64,2,1,4,1,16,8,8,75,1024,234881024,274945015808,9.35215,23.3904,29399.1
1,CUTLASS,gemm,cutlass_tensorop_s1688141gemm_f16_32x128_64x2_tn_align4,not_verified,success,universal,4096,8192,4096,f16:row,f16:column,f32:column,1,0,1,1,tensorop,f32,32,128,64,2,1,4,1,16,8,8,75,1024,234881024,274945015808,9.34295,23.4134,29428.1
1,CUTLASS,gemm,cutlass_tensorop_s1688122gemm_f16_32x128_64x2_tn_align4,not_verified,success,universal,4096,8192,4096,f16:row,f16:column,f32:column,1,0,1,1,tensorop,f32,32,128,64,2,1,2,1,16,8,8,75,1024,234881024,274945015808,14.5901,14.9931,18844.7
1,CUTLASS,gemm,cutlass_tensorop_s1688121gemm_f16_32x128_64x2_tn_align4,not_verified,success,universal,4096,8192,4096,f16:row,f16:column,f32:column,1,0,1,1,tensorop,f32,32,128,64,2,1,2,1,16,8,8,75,1024,234881024,274945015808,14.5965,14.9865,18836.4
1,CUTLASS,gemm,cutlass_tensorop_s1688112gemm_f16_32x128_64x2_tn_align4,not_verified,success,universal,4096,8192,4096,f16:row,f16:column,f32:column,1,0,1,1,tensorop,f32,32,128,64,2,1,1,1,16,8,8,75,1024,234881024,274945015808,94.629,2.31166,2905.51
1,CUTLASS,gemm,cutlass_tensorop_s1688111gemm_f16_32x128_64x2_tn_align4,not_verified,success,universal,4096,8192,4096,f16:row,f16:column,f32:column,1,0,1,1,tensorop,f32,32,128,64,2,1,1,1,16,8,8,75,1024,234881024,274945015808,93.903,2.32953,2927.97
1,CUTLASS,gemm,cutlass_tensorop_s1688142gemm_f16_32x128_64x2_tn_align4,not_verified,success,universal,5120,10240,5120,f16:row,f16:column,f32:column,1,0,1,1,tensorop,f32,32,128,64,2,1,4,1,16,8,8,75,1024,367001600,536975769600,19.1277,17.8692,28073.2
1,CUTLASS,gemm,cutlass_tensorop_s1688141gemm_f16_32x128_64x2_tn_align4,not_verified,success,universal,5120,10240,5120,f16:row,f16:column,f32:column,1,0,1,1,tensorop,f32,32,128,64,2,1,4,1,16,8,8,75,1024,367001600,536975769600,19.1805,17.82,27995.9
1,CUTLASS,gemm,cutlass_tensorop_s1688122gemm_f16_32x128_64x2_tn_align4,not_verified,success,universal,5120,10240,5120,f16:row,f16:column,f32:column,1,0,1,1,tensorop,f32,32,128,64,2,1,2,1,16,8,8,75,1024,367001600,536975769600,28.654,11.9284,18740
1,CUTLASS,gemm,cutlass_tensorop_s1688121gemm_f16_32x128_64x2_tn_align4,not_verified,success,universal,5120,10240,5120,f16:row,f16:column,f32:column,1,0,1,1,tensorop,f32,32,128,64,2,1,2,1,16,8,8,75,1024,367001600,536975769600,28.6701,11.9217,18729.5
1,CUTLASS,gemm,cutlass_tensorop_s1688112gemm_f16_32x128_64x2_tn_align4,not_verified,success,universal,5120,10240,5120,f16:row,f16:column,f32:column,1,0,1,1,tensorop,f32,32,128,64,2,1,1,1,16,8,8,75,1024,367001600,536975769600,182.818,1.86961,2937.22
1,CUTLASS,gemm,cutlass_tensorop_s1688111gemm_f16_32x128_64x2_tn_align4,not_verified,success,universal,5120,10240,5120,f16:row,f16:column,f32:column,1,0,1,1,tensorop,f32,32,128,64,2,1,1,1,16,8,8,75,1024,367001600,536975769600,188.051,1.81758,2855.48
1,CUTLASS,gemm,cutlass_tensorop_s1688142gemm_f16_32x128_64x2_tn_align4,not_verified,success,universal,6144,12288,6144,f16:row,f16:column,f32:column,1,0,1,1,tensorop,f32,32,128,64,2,1,4,1,16,8,8,75,1024,528482304,927863930880,30.9614,15.8968,29968.4
1,CUTLASS,gemm,cutlass_tensorop_s1688141gemm_f16_32x128_64x2_tn_align4,not_verified,success,universal,6144,12288,6144,f16:row,f16:column,f32:column,1,0,1,1,tensorop,f32,32,128,64,2,1,4,1,16,8,8,75,1024,528482304,927863930880,30.9592,15.8979,29970.5
1,CUTLASS,gemm,cutlass_tensorop_s1688122gemm_f16_32x128_64x2_tn_align4,not_verified,success,universal,6144,12288,6144,f16:row,f16:column,f32:column,1,0,1,1,tensorop,f32,32,128,64,2,1,2,1,16,8,8,75,1024,528482304,927863930880,49.0424,10.036,18919.6
1,CUTLASS,gemm,cutlass_tensorop_s1688121gemm_f16_32x128_64x2_tn_align4,not_verified,success,universal,6144,12288,6144,f16:row,f16:column,f32:column,1,0,1,1,tensorop,f32,32,128,64,2,1,2,1,16,8,8,75,1024,528482304,927863930880,49.0817,10.0279,18904.5
1,CUTLASS,gemm,cutlass_tensorop_s1688112gemm_f16_32x128_64x2_tn_align4,not_verified,success,universal,6144,12288,6144,f16:row,f16:column,f32:column,1,0,1,1,tensorop,f32,32,128,64,2,1,1,1,16,8,8,75,1024,528482304,927863930880,315.93,1.5579,2936.93
1,CUTLASS,gemm,cutlass_tensorop_s1688111gemm_f16_32x128_64x2_tn_align4,not_verified,success,universal,6144,12288,6144,f16:row,f16:column,f32:column,1,0,1,1,tensorop,f32,32,128,64,2,1,1,1,16,8,8,75,1024,528482304,927863930880,315.997,1.55757,2936.31
1,CUTLASS,gemm,cutlass_tensorop_s1688142gemm_f16_32x128_64x2_tn_align4,not_verified,success,universal,7168,14336,7168,f16:row,f16:column,f32:column,1,0,1,1,tensorop,f32,32,128,64,2,1,4,1,16,8,8,75,1024,719323136,1473379303424,49.5619,13.5169,29728.1
1,CUTLASS,gemm,cutlass_tensorop_s1688141gemm_f16_32x128_64x2_tn_align4,not_verified,success,universal,7168,14336,7168,f16:row,f16:column,f32:column,1,0,1,1,tensorop,f32,32,128,64,2,1,4,1,16,8,8,75,1024,719323136,1473379303424,49.5444,13.5217,29738.6
1,CUTLASS,gemm,cutlass_tensorop_s1688122gemm_f16_32x128_64x2_tn_align4,not_verified,success,universal,7168,14336,7168,f16:row,f16:column,f32:column,1,0,1,1,tensorop,f32,32,128,64,2,1,2,1,16,8,8,75,1024,719323136,1473379303424,77.69,8.62302,18964.9
1,CUTLASS,gemm,cutlass_tensorop_s1688121gemm_f16_32x128_64x2_tn_align4,not_verified,success,universal,7168,14336,7168,f16:row,f16:column,f32:column,1,0,1,1,tensorop,f32,32,128,64,2,1,2,1,16,8,8,75,1024,719323136,1473379303424,77.7389,8.61759,18952.9
1,CUTLASS,gemm,cutlass_tensorop_s1688112gemm_f16_32x128_64x2_tn_align4,not_verified,success,universal,7168,14336,7168,f16:row,f16:column,f32:column,1,0,1,1,tensorop,f32,32,128,64,2,1,1,1,16,8,8,75,1024,719323136,1473379303424,497.173,1.34746,2963.51
1,CUTLASS,gemm,cutlass_tensorop_s1688111gemm_f16_32x128_64x2_tn_align4,not_verified,success,universal,7168,14336,7168,f16:row,f16:column,f32:column,1,0,1,1,tensorop,f32,32,128,64,2,1,1,1,16,8,8,75,1024,719323136,1473379303424,496.509,1.34926,2967.48
1,CUTLASS,gemm,cutlass_tensorop_s1688142gemm_f16_32x128_64x2_tn_align4,not_verified,success,universal,8192,16384,8192,f16:row,f16:column,f32:column,1,0,1,1,tensorop,f32,32,128,64,2,1,4,1,16,8,8,75,1024,939524096,2199291691008,73.9198,11.8371,29752.4
1,CUTLASS,gemm,cutlass_tensorop_s1688141gemm_f16_32x128_64x2_tn_align4,not_verified,success,universal,8192,16384,8192,f16:row,f16:column,f32:column,1,0,1,1,tensorop,f32,32,128,64,2,1,4,1,16,8,8,75,1024,939524096,2199291691008,73.8743,11.8444,29770.7
1,CUTLASS,gemm,cutlass_tensorop_s1688122gemm_f16_32x128_64x2_tn_align4,not_verified,success,universal,8192,16384,8192,f16:row,f16:column,f32:column,1,0,1,1,tensorop,f32,32,128,64,2,1,2,1,16,8,8,75,1024,939524096,2199291691008,114.818,7.62074,19154.5
1,CUTLASS,gemm,cutlass_tensorop_s1688121gemm_f16_32x128_64x2_tn_align4,not_verified,success,universal,8192,16384,8192,f16:row,f16:column,f32:column,1,0,1,1,tensorop,f32,32,128,64,2,1,2,1,16,8,8,75,1024,939524096,2199291691008,114.846,7.61893,19150
1,CUTLASS,gemm,cutlass_tensorop_s1688112gemm_f16_32x128_64x2_tn_align4,not_verified,success,universal,8192,16384,8192,f16:row,f16:column,f32:column,1,0,1,1,tensorop,f32,32,128,64,2,1,1,1,16,8,8,75,1024,939524096,2199291691008,723.712,1.20904,3038.9
1,CUTLASS,gemm,cutlass_tensorop_s1688111gemm_f16_32x128_64x2_tn_align4,not_verified,success,universal,8192,16384,8192,f16:row,f16:column,f32:column,1,0,1,1,tensorop,f32,32,128,64,2,1,1,1,16,8,8,75,1024,939524096,2199291691008,723.512,1.20938,3039.74
1,CUTLASS,gemm,cutlass_tensorop_s1688142gemm_f16_32x128_64x2_tn_align4,not_verified,success,universal,9216,18432,9216,f16:row,f16:column,f32:column,1,0,1,1,tensorop,f32,32,128,64,2,1,4,1,16,8,8,75,1024,1189085184,3131370897408,105.07,10.5399,29802.8
1,CUTLASS,gemm,cutlass_tensorop_s1688141gemm_f16_32x128_64x2_tn_align4,not_verified,success,universal,9216,18432,9216,f16:row,f16:column,f32:column,1,0,1,1,tensorop,f32,32,128,64,2,1,4,1,16,8,8,75,1024,1189085184,3131370897408,105,10.5469,29822.7
1,CUTLASS,gemm,cutlass_tensorop_s1688122gemm_f16_32x128_64x2_tn_align4,not_verified,success,universal,9216,18432,9216,f16:row,f16:column,f32:column,1,0,1,1,tensorop,f32,32,128,64,2,1,2,1,16,8,8,75,1024,1189085184,3131370897408,164.598,6.72805,19024.4
1,CUTLASS,gemm,cutlass_tensorop_s1688121gemm_f16_32x128_64x2_tn_align4,not_verified,success,universal,9216,18432,9216,f16:row,f16:column,f32:column,1,0,1,1,tensorop,f32,32,128,64,2,1,2,1,16,8,8,75,1024,1189085184,3131370897408,164.772,6.72094,19004.3
1,CUTLASS,gemm,cutlass_tensorop_s1688112gemm_f16_32x128_64x2_tn_align4,not_verified,success,universal,9216,18432,9216,f16:row,f16:column,f32:column,1,0,1,1,tensorop,f32,32,128,64,2,1,1,1,16,8,8,75,1024,1189085184,3131370897408,1045.79,1.05893,2994.26
1,CUTLASS,gemm,cutlass_tensorop_s1688111gemm_f16_32x128_64x2_tn_align4,not_verified,success,universal,9216,18432,9216,f16:row,f16:column,f32:column,1,0,1,1,tensorop,f32,32,128,64,2,1,1,1,16,8,8,75,1024,1189085184,3131370897408,1047.94,1.05676,2988.13
1,CUTLASS,gemm,cutlass_tensorop_s1688142gemm_f16_32x128_64x2_tn_align4,not_verified,success,universal,10240,20480,10240,f16:row,f16:column,f32:column,1,0,1,1,tensorop,f32,32,128,64,2,1,4,1,16,8,8,75,1024,1468006400,4295386726400,227.205,6.01741,18905.3
1,CUTLASS,gemm,cutlass_tensorop_s1688141gemm_f16_32x128_64x2_tn_align4,not_verified,success,universal,10240,20480,10240,f16:row,f16:column,f32:column,1,0,1,1,tensorop,f32,32,128,64,2,1,4,1,16,8,8,75,1024,1468006400,4295386726400,287.192,4.76053,14956.5
1,CUTLASS,gemm,cutlass_tensorop_s1688122gemm_f16_32x128_64x2_tn_align4,not_verified,success,universal,10240,20480,10240,f16:row,f16:column,f32:column,1,0,1,1,tensorop,f32,32,128,64,2,1,2,1,16,8,8,75,1024,1468006400,4295386726400,225.53,6.06212,19045.8
1,CUTLASS,gemm,cutlass_tensorop_s1688121gemm_f16_32x128_64x2_tn_align4,not_verified,success,universal,10240,20480,10240,f16:row,f16:column,f32:column,1,0,1,1,tensorop,f32,32,128,64,2,1,2,1,16,8,8,75,1024,1468006400,4295386726400,225.588,6.06056,19040.9
1,CUTLASS,gemm,cutlass_tensorop_s1688112gemm_f16_32x128_64x2_tn_align4,not_verified,success,universal,10240,20480,10240,f16:row,f16:column,f32:column,1,0,1,1,tensorop,f32,32,128,64,2,1,1,1,16,8,8,75,1024,1468006400,4295386726400,1431.16,0.955299,3001.33
1,CUTLASS,gemm,cutlass_tensorop_s1688111gemm_f16_32x128_64x2_tn_align4,not_verified,success,universal,10240,20480,10240,f16:row,f16:column,f32:column,1,0,1,1,tensorop,f32,32,128,64,2,1,1,1,16,8,8,75,1024,1468006400,4295386726400,1437.99,0.950766,2987.09
1,CUTLASS,gemm,cutlass_tensorop_s1688211gemm_f16_64x32_32x2_tn_align4,not_verified,success,universal,1024,2048,1024,f16:row,f16:column,f32:column,1,0,1,1,tensorop,f32,64,32,32,2,2,1,1,16,8,8,75,1024,14680064,4299161600,0.250527,54.5725,17160.5
1,CUTLASS,gemm,cutlass_tensorop_s1688111gemm_f16_64x32_32x2_tn_align4,not_verified,success,universal,1024,2048,1024,f16:row,f16:column,f32:column,1,0,1,1,tensorop,f32,64,32,32,2,1,1,1,16,8,8,75,1024,14680064,4299161600,0.243213,56.2136,17676.5
1,CUTLASS,gemm,cutlass_tensorop_s1688211gemm_f16_64x32_32x2_tn_align4,not_verified,success,universal,2048,4096,2048,f16:row,f16:column,f32:column,1,0,1,1,tensorop,f32,64,32,32,2,2,1,1,16,8,8,75,1024,58720256,34376515584,1.7244,31.714,19935.4
1,CUTLASS,gemm,cutlass_tensorop_s1688111gemm_f16_64x32_32x2_tn_align4,not_verified,success,universal,2048,4096,2048,f16:row,f16:column,f32:column,1,0,1,1,tensorop,f32,64,32,32,2,1,1,1,16,8,8,75,1024,58720256,34376515584,1.46452,37.3415,23472.8
1,CUTLASS,gemm,cutlass_tensorop_s1688211gemm_f16_64x32_32x2_tn_align4,not_verified,success,universal,3072,6144,3072,f16:row,f16:column,f32:column,1,0,1,1,tensorop,f32,64,32,32,2,2,1,1,16,8,8,75,1024,132120576,116001865728,5.27725,23.3165,21981.5
1,CUTLASS,gemm,cutlass_tensorop_s1688111gemm_f16_64x32_32x2_tn_align4,not_verified,success,universal,3072,6144,3072,f16:row,f16:column,f32:column,1,0,1,1,tensorop,f32,64,32,32,2,1,1,1,16,8,8,75,1024,132120576,116001865728,4.85012,25.3698,23917.3
1,CUTLASS,gemm,cutlass_tensorop_s1688211gemm_f16_64x32_32x2_tn_align4,not_verified,success,universal,4096,8192,4096,f16:row,f16:column,f32:column,1,0,1,1,tensorop,f32,64,32,32,2,2,1,1,16,8,8,75,1024,234881024,274945015808,12.0919,18.0906,22738
1,CUTLASS,gemm,cutlass_tensorop_s1688111gemm_f16_64x32_32x2_tn_align4,not_verified,success,universal,4096,8192,4096,f16:row,f16:column,f32:column,1,0,1,1,tensorop,f32,64,32,32,2,1,1,1,16,8,8,75,1024,234881024,274945015808,11.4406,19.1205,24032.4
1,CUTLASS,gemm,cutlass_tensorop_s1688211gemm_f16_64x32_32x2_tn_align4,not_verified,success,universal,5120,10240,5120,f16:row,f16:column,f32:column,1,0,1,1,tensorop,f32,64,32,32,2,2,1,1,16,8,8,75,1024,367001600,536975769600,25.8021,13.2468,20811.3
1,CUTLASS,gemm,cutlass_tensorop_s1688111gemm_f16_64x32_32x2_tn_align4,not_verified,success,universal,5120,10240,5120,f16:row,f16:column,f32:column,1,0,1,1,tensorop,f32,64,32,32,2,1,1,1,16,8,8,75,1024,367001600,536975769600,22.7997,14.9913,23551.8
1,CUTLASS,gemm,cutlass_tensorop_s1688211gemm_f16_64x32_32x2_tn_align4,not_verified,success,universal,6144,12288,6144,f16:row,f16:column,f32:column,1,0,1,1,tensorop,f32,64,32,32,2,2,1,1,16,8,8,75,1024,528482304,927863930880,43.331,11.3588,21413.4
1,CUTLASS,gemm,cutlass_tensorop_s1688111gemm_f16_64x32_32x2_tn_align4,not_verified,success,universal,6144,12288,6144,f16:row,f16:column,f32:column,1,0,1,1,tensorop,f32,64,32,32,2,1,1,1,16,8,8,75,1024,528482304,927863930880,38.7385,12.7054,23952
1,CUTLASS,gemm,cutlass_tensorop_s1688211gemm_f16_64x32_32x2_tn_align4,not_verified,success,universal,7168,14336,7168,f16:row,f16:column,f32:column,1,0,1,1,tensorop,f32,64,32,32,2,2,1,1,16,8,8,75,1024,719323136,1473379303424,70.2311,9.53882,20979
1,CUTLASS,gemm,cutlass_tensorop_s1688111gemm_f16_64x32_32x2_tn_align4,not_verified,success,universal,7168,14336,7168,f16:row,f16:column,f32:column,1,0,1,1,tensorop,f32,64,32,32,2,1,1,1,16,8,8,75,1024,719323136,1473379303424,62.2107,10.7686,23683.7
1,CUTLASS,gemm,cutlass_tensorop_s1688211gemm_f16_64x32_32x2_tn_align4,not_verified,success,universal,8192,16384,8192,f16:row,f16:column,f32:column,1,0,1,1,tensorop,f32,64,32,32,2,2,1,1,16,8,8,75,1024,939524096,2199291691008,98.18,8.9122,22400.6
1,CUTLASS,gemm,cutlass_tensorop_s1688111gemm_f16_64x32_32x2_tn_align4,not_verified,success,universal,8192,16384,8192,f16:row,f16:column,f32:column,1,0,1,1,tensorop,f32,64,32,32,2,1,1,1,16,8,8,75,1024,939524096,2199291691008,90.7032,9.64685,24247.1
1,CUTLASS,gemm,cutlass_tensorop_s1688211gemm_f16_64x32_32x2_tn_align4,not_verified,success,universal,9216,18432,9216,f16:row,f16:column,f32:column,1,0,1,1,tensorop,f32,64,32,32,2,2,1,1,16,8,8,75,1024,1189085184,3131370897408,265.917,4.16454,11775.8
1,CUTLASS,gemm,cutlass_tensorop_s1688111gemm_f16_64x32_32x2_tn_align4,not_verified,success,universal,9216,18432,9216,f16:row,f16:column,f32:column,1,0,1,1,tensorop,f32,64,32,32,2,1,1,1,16,8,8,75,1024,1189085184,3131370897408,147.142,7.5262,21281.3
1,CUTLASS,gemm,cutlass_tensorop_s1688211gemm_f16_64x32_32x2_tn_align4,not_verified,success,universal,10240,20480,10240,f16:row,f16:column,f32:column,1,0,1,1,tensorop,f32,64,32,32,2,2,1,1,16,8,8,75,1024,1468006400,4295386726400,422.815,3.23354,10159
1,CUTLASS,gemm,cutlass_tensorop_s1688111gemm_f16_64x32_32x2_tn_align4,not_verified,success,universal,10240,20480,10240,f16:row,f16:column,f32:column,1,0,1,1,tensorop,f32,64,32,32,2,1,1,1,16,8,8,75,1024,1468006400,4295386726400,354.958,3.85169,12101.1
1,CUTLASS,gemm,cutlass_tensorop_s1688212gemm_f16_64x32_64x2_tn_align4,not_verified,success,universal,1024,2048,1024,f16:row,f16:column,f32:column,1,0,1,1,tensorop,f32,64,32,64,2,2,1,1,16,8,8,75,1024,14680064,4299161600,0.177676,76.9481,24196.6
1,CUTLASS,gemm,cutlass_tensorop_s1688211gemm_f16_64x32_64x2_tn_align4,not_verified,success,universal,1024,2048,1024,f16:row,f16:column,f32:column,1,0,1,1,tensorop,f32,64,32,64,2,2,1,1,16,8,8,75,1024,14680064,4299161600,0.176665,77.3887,24335.1
1,CUTLASS,gemm,cutlass_tensorop_s1688112gemm_f16_64x32_64x2_tn_align4,not_verified,success,universal,1024,2048,1024,f16:row,f16:column,f32:column,1,0,1,1,tensorop,f32,64,32,64,2,1,1,1,16,8,8,75,1024,14680064,4299161600,0.253201,53.9961,16979.2
1,CUTLASS,gemm,cutlass_tensorop_s1688111gemm_f16_64x32_64x2_tn_align4,not_verified,success,universal,1024,2048,1024,f16:row,f16:column,f32:column,1,0,1,1,tensorop,f32,64,32,64,2,1,1,1,16,8,8,75,1024,14680064,4299161600,0.253332,53.9681,16970.4
1,CUTLASS,gemm,cutlass_tensorop_s1688212gemm_f16_64x32_64x2_tn_align4,not_verified,success,universal,2048,4096,2048,f16:row,f16:column,f32:column,1,0,1,1,tensorop,f32,64,32,64,2,2,1,1,16,8,8,75,1024,58720256,34376515584,1.30134,42.024,26416.2
1,CUTLASS,gemm,cutlass_tensorop_s1688211gemm_f16_64x32_64x2_tn_align4,not_verified,success,universal,2048,4096,2048,f16:row,f16:column,f32:column,1,0,1,1,tensorop,f32,64,32,64,2,2,1,1,16,8,8,75,1024,58720256,34376515584,1.23799,44.1744,27768
1,CUTLASS,gemm,cutlass_tensorop_s1688112gemm_f16_64x32_64x2_tn_align4,not_verified,success,universal,2048,4096,2048,f16:row,f16:column,f32:column,1,0,1,1,tensorop,f32,64,32,64,2,1,1,1,16,8,8,75,1024,58720256,34376515584,1.77214,30.8596,19398.3
1,CUTLASS,gemm,cutlass_tensorop_s1688111gemm_f16_64x32_64x2_tn_align4,not_verified,success,universal,2048,4096,2048,f16:row,f16:column,f32:column,1,0,1,1,tensorop,f32,64,32,64,2,1,1,1,16,8,8,75,1024,58720256,34376515584,1.77211,30.86,19398.6
1,CUTLASS,gemm,cutlass_tensorop_s1688212gemm_f16_64x32_64x2_tn_align4,not_verified,success,universal,3072,6144,3072,f16:row,f16:column,f32:column,1,0,1,1,tensorop,f32,64,32,64,2,2,1,1,16,8,8,75,1024,132120576,116001865728,4.12671,29.8172,28110
1,CUTLASS,gemm,cutlass_tensorop_s1688211gemm_f16_64x32_64x2_tn_align4,not_verified,success,universal,3072,6144,3072,f16:row,f16:column,f32:column,1,0,1,1,tensorop,f32,64,32,64,2,2,1,1,16,8,8,75,1024,132120576,116001865728,4.12848,29.8044,28098
1,CUTLASS,gemm,cutlass_tensorop_s1688112gemm_f16_64x32_64x2_tn_align4,not_verified,success,universal,3072,6144,3072,f16:row,f16:column,f32:column,1,0,1,1,tensorop,f32,64,32,64,2,1,1,1,16,8,8,75,1024,132120576,116001865728,5.70067,21.5846,20348.8
1,CUTLASS,gemm,cutlass_tensorop_s1688111gemm_f16_64x32_64x2_tn_align4,not_verified,success,universal,3072,6144,3072,f16:row,f16:column,f32:column,1,0,1,1,tensorop,f32,64,32,64,2,1,1,1,16,8,8,75,1024,132120576,116001865728,5.70234,21.5783,20342.9
1,CUTLASS,gemm,cutlass_tensorop_s1688212gemm_f16_64x32_64x2_tn_align4,not_verified,success,universal,4096,8192,4096,f16:row,f16:column,f32:column,1,0,1,1,tensorop,f32,64,32,64,2,2,1,1,16,8,8,75,1024,234881024,274945015808,9.53231,22.9483,28843.5
1,CUTLASS,gemm,cutlass_tensorop_s1688211gemm_f16_64x32_64x2_tn_align4,not_verified,success,universal,4096,8192,4096,f16:row,f16:column,f32:column,1,0,1,1,tensorop,f32,64,32,64,2,2,1,1,16,8,8,75,1024,234881024,274945015808,9.62092,22.7369,28577.8
1,CUTLASS,gemm,cutlass_tensorop_s1688112gemm_f16_64x32_64x2_tn_align4,not_verified,success,universal,4096,8192,4096,f16:row,f16:column,f32:column,1,0,1,1,tensorop,f32,64,32,64,2,1,1,1,16,8,8,75,1024,234881024,274945015808,13.3124,16.432,20653.3
1,CUTLASS,gemm,cutlass_tensorop_s1688111gemm_f16_64x32_64x2_tn_align4,not_verified,success,universal,4096,8192,4096,f16:row,f16:column,f32:column,1,0,1,1,tensorop,f32,64,32,64,2,1,1,1,16,8,8,75,1024,234881024,274945015808,13.3132,16.4311,20652.1
1,CUTLASS,gemm,cutlass_tensorop_s1688212gemm_f16_64x32_64x2_tn_align4,not_verified,success,universal,5120,10240,5120,f16:row,f16:column,f32:column,1,0,1,1,tensorop,f32,64,32,64,2,2,1,1,16,8,8,75,1024,367001600,536975769600,18.9208,18.0646,28380.2
1,CUTLASS,gemm,cutlass_tensorop_s1688211gemm_f16_64x32_64x2_tn_align4,not_verified,success,universal,5120,10240,5120,f16:row,f16:column,f32:column,1,0,1,1,tensorop,f32,64,32,64,2,2,1,1,16,8,8,75,1024,367001600,536975769600,18.6514,18.3255,28790
1,CUTLASS,gemm,cutlass_tensorop_s1688112gemm_f16_64x32_64x2_tn_align4,not_verified,success,universal,5120,10240,5120,f16:row,f16:column,f32:column,1,0,1,1,tensorop,f32,64,32,64,2,1,1,1,16,8,8,75,1024,367001600,536975769600,25.7445,13.2765,20857.9
1,CUTLASS,gemm,cutlass_tensorop_s1688111gemm_f16_64x32_64x2_tn_align4,not_verified,success,universal,5120,10240,5120,f16:row,f16:column,f32:column,1,0,1,1,tensorop,f32,64,32,64,2,1,1,1,16,8,8,75,1024,367001600,536975769600,25.7484,13.2745,20854.8
1,CUTLASS,gemm,cutlass_tensorop_s1688212gemm_f16_64x32_64x2_tn_align4,not_verified,success,universal,6144,12288,6144,f16:row,f16:column,f32:column,1,0,1,1,tensorop,f32,64,32,64,2,2,1,1,16,8,8,75,1024,528482304,927863930880,32.6184,15.0892,28446
1,CUTLASS,gemm,cutlass_tensorop_s1688211gemm_f16_64x32_64x2_tn_align4,not_verified,success,universal,6144,12288,6144,f16:row,f16:column,f32:column,1,0,1,1,tensorop,f32,64,32,64,2,2,1,1,16,8,8,75,1024,528482304,927863930880,31.9969,15.3823,28998.5
1,CUTLASS,gemm,cutlass_tensorop_s1688112gemm_f16_64x32_64x2_tn_align4,not_verified,success,universal,6144,12288,6144,f16:row,f16:column,f32:column,1,0,1,1,tensorop,f32,64,32,64,2,1,1,1,16,8,8,75,1024,528482304,927863930880,44.2489,11.1232,20969.2
1,CUTLASS,gemm,cutlass_tensorop_s1688111gemm_f16_64x32_64x2_tn_align4,not_verified,success,universal,6144,12288,6144,f16:row,f16:column,f32:column,1,0,1,1,tensorop,f32,64,32,64,2,1,1,1,16,8,8,75,1024,528482304,927863930880,44.2601,11.1203,20963.9
1,CUTLASS,gemm,cutlass_tensorop_s1688212gemm_f16_64x32_64x2_tn_align4,not_verified,success,universal,7168,14336,7168,f16:row,f16:column,f32:column,1,0,1,1,tensorop,f32,64,32,64,2,2,1,1,16,8,8,75,1024,719323136,1473379303424,52.0368,12.874,28314.2
1,CUTLASS,gemm,cutlass_tensorop_s1688211gemm_f16_64x32_64x2_tn_align4,not_verified,success,universal,7168,14336,7168,f16:row,f16:column,f32:column,1,0,1,1,tensorop,f32,64,32,64,2,2,1,1,16,8,8,75,1024,719323136,1473379303424,52.3433,12.7986,28148.4
1,CUTLASS,gemm,cutlass_tensorop_s1688112gemm_f16_64x32_64x2_tn_align4,not_verified,success,universal,7168,14336,7168,f16:row,f16:column,f32:column,1,0,1,1,tensorop,f32,64,32,64,2,1,1,1,16,8,8,75,1024,719323136,1473379303424,70.0881,9.55828,21021.8
1,CUTLASS,gemm,cutlass_tensorop_s1688111gemm_f16_64x32_64x2_tn_align4,not_verified,success,universal,7168,14336,7168,f16:row,f16:column,f32:column,1,0,1,1,tensorop,f32,64,32,64,2,1,1,1,16,8,8,75,1024,719323136,1473379303424,70.1137,9.55479,21014.1
1,CUTLASS,gemm,cutlass_tensorop_s1688212gemm_f16_64x32_64x2_tn_align4,not_verified,success,universal,8192,16384,8192,f16:row,f16:column,f32:column,1,0,1,1,tensorop,f32,64,32,64,2,2,1,1,16,8,8,75,1024,939524096,2199291691008,77.3252,11.3159,28442.1
1,CUTLASS,gemm,cutlass_tensorop_s1688211gemm_f16_64x32_64x2_tn_align4,not_verified,success,universal,8192,16384,8192,f16:row,f16:column,f32:column,1,0,1,1,tensorop,f32,64,32,64,2,2,1,1,16,8,8,75,1024,939524096,2199291691008,75.8048,11.5428,29012.6
1,CUTLASS,gemm,cutlass_tensorop_s1688112gemm_f16_64x32_64x2_tn_align4,not_verified,success,universal,8192,16384,8192,f16:row,f16:column,f32:column,1,0,1,1,tensorop,f32,64,32,64,2,1,1,1,16,8,8,75,1024,939524096,2199291691008,104.279,8.39094,21090.4
1,CUTLASS,gemm,cutlass_tensorop_s1688111gemm_f16_64x32_64x2_tn_align4,not_verified,success,universal,8192,16384,8192,f16:row,f16:column,f32:column,1,0,1,1,tensorop,f32,64,32,64,2,1,1,1,16,8,8,75,1024,939524096,2199291691008,104.339,8.38611,21078.3
1,CUTLASS,gemm,cutlass_tensorop_s1688212gemm_f16_64x32_64x2_tn_align4,not_verified,success,universal,9216,18432,9216,f16:row,f16:column,f32:column,1,0,1,1,tensorop,f32,64,32,64,2,2,1,1,16,8,8,75,1024,1189085184,3131370897408,112.287,9.86241,27887.2
1,CUTLASS,gemm,cutlass_tensorop_s1688211gemm_f16_64x32_64x2_tn_align4,not_verified,success,universal,9216,18432,9216,f16:row,f16:column,f32:column,1,0,1,1,tensorop,f32,64,32,64,2,2,1,1,16,8,8,75,1024,1189085184,3131370897408,115.127,9.61913,27199.3
1,CUTLASS,gemm,cutlass_tensorop_s1688112gemm_f16_64x32_64x2_tn_align4,not_verified,success,universal,9216,18432,9216,f16:row,f16:column,f32:column,1,0,1,1,tensorop,f32,64,32,64,2,1,1,1,16,8,8,75,1024,1189085184,3131370897408,148.338,7.46554,21109.7
1,CUTLASS,gemm,cutlass_tensorop_s1688111gemm_f16_64x32_64x2_tn_align4,not_verified,success,universal,9216,18432,9216,f16:row,f16:column,f32:column,1,0,1,1,tensorop,f32,64,32,64,2,1,1,1,16,8,8,75,1024,1189085184,3131370897408,148.373,7.46378,21104.8
1,CUTLASS,gemm,cutlass_tensorop_s1688212gemm_f16_64x32_64x2_tn_align4,not_verified,success,universal,10240,20480,10240,f16:row,f16:column,f32:column,1,0,1,1,tensorop,f32,64,32,64,2,2,1,1,16,8,8,75,1024,1468006400,4295386726400,155.938,8.76753,27545.6
1,CUTLASS,gemm,cutlass_tensorop_s1688211gemm_f16_64x32_64x2_tn_align4,not_verified,success,universal,10240,20480,10240,f16:row,f16:column,f32:column,1,0,1,1,tensorop,f32,64,32,64,2,2,1,1,16,8,8,75,1024,1468006400,4295386726400,155.206,8.80883,27675.3
1,CUTLASS,gemm,cutlass_tensorop_s1688112gemm_f16_64x32_64x2_tn_align4,not_verified,success,universal,10240,20480,10240,f16:row,f16:column,f32:column,1,0,1,1,tensorop,f32,64,32,64,2,1,1,1,16,8,8,75,1024,1468006400,4295386726400,202.983,6.73549,21161.3
1,CUTLASS,gemm,cutlass_tensorop_s1688111gemm_f16_64x32_64x2_tn_align4,not_verified,success,universal,10240,20480,10240,f16:row,f16:column,f32:column,1,0,1,1,tensorop,f32,64,32,64,2,1,1,1,16,8,8,75,1024,1468006400,4295386726400,203.142,6.73022,21144.8
1,CUTLASS,gemm,cutlass_tensorop_s1688221gemm_f16_64x64_32x2_tn_align4,not_verified,success,universal,1024,2048,1024,f16:row,f16:column,f32:column,1,0,1,1,tensorop,f32,64,64,32,2,2,2,1,16,8,8,75,1024,14680064,4299161600,0.155548,87.895,27638.8
1,CUTLASS,gemm,cutlass_tensorop_s1688211gemm_f16_64x64_32x2_tn_align4,not_verified,success,universal,1024,2048,1024,f16:row,f16:column,f32:column,1,0,1,1,tensorop,f32,64,64,32,2,2,1,1,16,8,8,75,1024,14680064,4299161600,0.145797,93.7731,29487.2
1,CUTLASS,gemm,cutlass_tensorop_s1688121gemm_f16_64x64_32x2_tn_align4,not_verified,success,universal,1024,2048,1024,f16:row,f16:column,f32:column,1,0,1,1,tensorop,f32,64,64,32,2,1,2,1,16,8,8,75,1024,14680064,4299161600,0.148938,91.7956,28865.4
1,CUTLASS,gemm,cutlass_tensorop_s1688111gemm_f16_64x64_32x2_tn_align4,not_verified,success,universal,1024,2048,1024,f16:row,f16:column,f32:column,1,0,1,1,tensorop,f32,64,64,32,2,1,1,1,16,8,8,75,1024,14680064,4299161600,0.138941,98.4003,30942.3
1,CUTLASS,gemm,cutlass_tensorop_s1688221gemm_f16_64x64_32x2_tn_align4,not_verified,success,universal,2048,4096,2048,f16:row,f16:column,f32:column,1,0,1,1,tensorop,f32,64,64,32,2,2,2,1,16,8,8,75,1024,58720256,34376515584,1.15168,47.4849,29849
1,CUTLASS,gemm,cutlass_tensorop_s1688211gemm_f16_64x64_32x2_tn_align4,not_verified,success,universal,2048,4096,2048,f16:row,f16:column,f32:column,1,0,1,1,tensorop,f32,64,64,32,2,2,1,1,16,8,8,75,1024,58720256,34376515584,1.0733,50.9525,32028.7
1,CUTLASS,gemm,cutlass_tensorop_s1688121gemm_f16_64x64_32x2_tn_align4,not_verified,success,universal,2048,4096,2048,f16:row,f16:column,f32:column,1,0,1,1,tensorop,f32,64,64,32,2,1,2,1,16,8,8,75,1024,58720256,34376515584,1.07536,50.855,31967.4
1,CUTLASS,gemm,cutlass_tensorop_s1688111gemm_f16_64x64_32x2_tn_align4,not_verified,success,universal,2048,4096,2048,f16:row,f16:column,f32:column,1,0,1,1,tensorop,f32,64,64,32,2,1,1,1,16,8,8,75,1024,58720256,34376515584,1.02284,53.4665,33609
1,CUTLASS,gemm,cutlass_tensorop_s1688221gemm_f16_64x64_32x2_tn_align4,not_verified,success,universal,3072,6144,3072,f16:row,f16:column,f32:column,1,0,1,1,tensorop,f32,64,64,32,2,2,2,1,16,8,8,75,1024,132120576,116001865728,3.78419,32.5161,30654.4
1,CUTLASS,gemm,cutlass_tensorop_s1688211gemm_f16_64x64_32x2_tn_align4,not_verified,success,universal,3072,6144,3072,f16:row,f16:column,f32:column,1,0,1,1,tensorop,f32,64,64,32,2,2,1,1,16,8,8,75,1024,132120576,116001865728,3.53352,34.8228,32829
1,CUTLASS,gemm,cutlass_tensorop_s1688121gemm_f16_64x64_32x2_tn_align4,not_verified,success,universal,3072,6144,3072,f16:row,f16:column,f32:column,1,0,1,1,tensorop,f32,64,64,32,2,1,2,1,16,8,8,75,1024,132120576,116001865728,3.51982,34.9583,32956.7
1,CUTLASS,gemm,cutlass_tensorop_s1688111gemm_f16_64x64_32x2_tn_align4,not_verified,success,universal,3072,6144,3072,f16:row,f16:column,f32:column,1,0,1,1,tensorop,f32,64,64,32,2,1,1,1,16,8,8,75,1024,132120576,116001865728,3.2681,37.6509,35495.2
1,CUTLASS,gemm,cutlass_tensorop_s1688221gemm_f16_64x64_32x2_tn_align4,not_verified,success,universal,4096,8192,4096,f16:row,f16:column,f32:column,1,0,1,1,tensorop,f32,64,64,32,2,2,2,1,16,8,8,75,1024,234881024,274945015808,8.80745,24.8369,31217.3
1,CUTLASS,gemm,cutlass_tensorop_s1688211gemm_f16_64x64_32x2_tn_align4,not_verified,success,universal,4096,8192,4096,f16:row,f16:column,f32:column,1,0,1,1,tensorop,f32,64,64,32,2,2,1,1,16,8,8,75,1024,234881024,274945015808,8.25399,26.5023,33310.6
1,CUTLASS,gemm,cutlass_tensorop_s1688121gemm_f16_64x64_32x2_tn_align4,not_verified,success,universal,4096,8192,4096,f16:row,f16:column,f32:column,1,0,1,1,tensorop,f32,64,64,32,2,1,2,1,16,8,8,75,1024,234881024,274945015808,8.25285,26.506,33315.2
1,CUTLASS,gemm,cutlass_tensorop_s1688111gemm_f16_64x64_32x2_tn_align4,not_verified,success,universal,4096,8192,4096,f16:row,f16:column,f32:column,1,0,1,1,tensorop,f32,64,64,32,2,1,1,1,16,8,8,75,1024,234881024,274945015808,7.72344,28.3229,35598.8
1,CUTLASS,gemm,cutlass_tensorop_s1688221gemm_f16_64x64_32x2_tn_align4,not_verified,success,universal,5120,10240,5120,f16:row,f16:column,f32:column,1,0,1,1,tensorop,f32,64,64,32,2,2,2,1,16,8,8,75,1024,367001600,536975769600,17.8031,19.1987,30162
