experiments/w4ww.gemm.csv
Problem,Provider,OperationKind,Operation,Disposition,Status,gemm_kind,m,n,k,A,B,C,alpha,beta,split_k_slices,batch_count,op_class,accum,cta_m,cta_n,cta_k,stages,warps_m,warps_n,warps_k,inst_m,inst_n,inst_k,min_cc,max_cc,Bytes,Flops,Runtime,GB/s,GFLOPs
1,CUTLASS,gemm,cutlass_tensorop_s1688111gemm_f16_32x32_32x2_tn_align4,not_verified,success,universal,1024,4096,1024,f16:row,f16:column,f32:column,1,0,1,1,tensorop,f32,32,32,32,2,1,1,1,16,8,8,75,1024,27262976,8598323200,0.573991,44.2352,14979.9
1,CUTLASS,gemm,cutlass_tensorop_s1688111gemm_f16_32x32_32x2_tn_align4,not_verified,success,universal,2048,8192,2048,f16:row,f16:column,f32:column,1,0,1,1,tensorop,f32,32,32,32,2,1,1,1,16,8,8,75,1024,109051904,68753031168,4.18315,24.2789,16435.7
1,CUTLASS,gemm,cutlass_tensorop_s1688111gemm_f16_32x32_32x2_tn_align4,not_verified,success,universal,3072,12288,3072,f16:row,f16:column,f32:column,1,0,1,1,tensorop,f32,32,32,32,2,1,1,1,16,8,8,75,1024,245366784,232003731456,13.0668,17.4883,17755.2
1,CUTLASS,gemm,cutlass_tensorop_s1688111gemm_f16_32x32_32x2_tn_align4,not_verified,success,universal,4096,16384,4096,f16:row,f16:column,f32:column,1,0,1,1,tensorop,f32,32,32,32,2,1,1,1,16,8,8,75,1024,436207616,549890031616,30.6,13.2762,17970.3
1,CUTLASS,gemm,cutlass_tensorop_s1688111gemm_f16_32x32_32x2_tn_align4,not_verified,success,universal,5120,20480,5120,f16:row,f16:column,f32:column,1,0,1,1,tensorop,f32,32,32,32,2,1,1,1,16,8,8,75,1024,681574400,1073951539200,60.904,10.4224,17633.5
1,CUTLASS,gemm,cutlass_tensorop_s1688111gemm_f16_32x32_32x2_tn_align4,not_verified,success,universal,6144,24576,6144,f16:row,f16:column,f32:column,1,0,1,1,tensorop,f32,32,32,32,2,1,1,1,16,8,8,75,1024,981467136,1855727861760,103.873,8.79978,17865.3
1,CUTLASS,gemm,cutlass_tensorop_s1688111gemm_f16_32x32_32x2_tn_align4,not_verified,success,universal,7168,28672,7168,f16:row,f16:column,f32:column,1,0,1,1,tensorop,f32,32,32,32,2,1,1,1,16,8,8,75,1024,1335885824,2946758606848,164.029,7.58489,17964.9
1,CUTLASS,gemm,cutlass_tensorop_s1688111gemm_f16_32x32_32x2_tn_align4,not_verified,success,universal,8192,32768,8192,f16:row,f16:column,f32:column,1,0,1,1,tensorop,f32,32,32,32,2,1,1,1,16,8,8,75,1024,1744830464,4398583382016,243.623,6.67014,18054.9
1,CUTLASS,gemm,cutlass_tensorop_s1688111gemm_f16_32x32_32x2_tn_align4,not_verified,success,universal,9216,36864,9216,f16:row,f16:column,f32:column,1,0,1,1,tensorop,f32,32,32,32,2,1,1,1,16,8,8,75,1024,2208301056,6262741794816,429.181,4.79202,14592.3
1,CUTLASS,gemm,cutlass_tensorop_s1688111gemm_f16_32x32_32x2_tn_align4,not_verified,success,universal,10240,40960,10240,f16:row,f16:column,f32:column,1,0,1,1,tensorop,f32,32,32,32,2,1,1,1,16,8,8,75,1024,2726297600,8590773452800,741.318,3.42507,11588.5
1,CUTLASS,gemm,cutlass_tensorop_s1688112gemm_f16_32x32_64x2_tn_align4,not_verified,success,universal,1024,4096,1024,f16:row,f16:column,f32:column,1,0,1,1,tensorop,f32,32,32,64,2,1,1,1,16,8,8,75,1024,27262976,8598323200,0.37094,68.4493,23179.8
1,CUTLASS,gemm,cutlass_tensorop_s1688111gemm_f16_32x32_64x2_tn_align4,not_verified,success,universal,1024,4096,1024,f16:row,f16:column,f32:column,1,0,1,1,tensorop,f32,32,32,64,2,1,1,1,16,8,8,75,1024,27262976,8598323200,0.365771,69.4168,23507.4
1,CUTLASS,gemm,cutlass_tensorop_s1688112gemm_f16_32x32_64x2_tn_align4,not_verified,success,universal,2048,8192,2048,f16:row,f16:column,f32:column,1,0,1,1,tensorop,f32,32,32,64,2,1,1,1,16,8,8,75,1024,109051904,68753031168,2.69661,37.6631,25496.1
1,CUTLASS,gemm,cutlass_tensorop_s1688111gemm_f16_32x32_64x2_tn_align4,not_verified,success,universal,2048,8192,2048,f16:row,f16:column,f32:column,1,0,1,1,tensorop,f32,32,32,64,2,1,1,1,16,8,8,75,1024,109051904,68753031168,2.67766,37.9295,25676.5
1,CUTLASS,gemm,cutlass_tensorop_s1688112gemm_f16_32x32_64x2_tn_align4,not_verified,success,universal,3072,12288,3072,f16:row,f16:column,f32:column,1,0,1,1,tensorop,f32,32,32,64,2,1,1,1,16,8,8,75,1024,245366784,232003731456,9.03917,25.2806,25666.5
1,CUTLASS,gemm,cutlass_tensorop_s1688111gemm_f16_32x32_64x2_tn_align4,not_verified,success,universal,3072,12288,3072,f16:row,f16:column,f32:column,1,0,1,1,tensorop,f32,32,32,64,2,1,1,1,16,8,8,75,1024,245366784,232003731456,9.01865,25.3381,25724.9
1,CUTLASS,gemm,cutlass_tensorop_s1688112gemm_f16_32x32_64x2_tn_align4,not_verified,success,universal,4096,16384,4096,f16:row,f16:column,f32:column,1,0,1,1,tensorop,f32,32,32,64,2,1,1,1,16,8,8,75,1024,436207616,549890031616,20.8316,19.5016,26396.9
1,CUTLASS,gemm,cutlass_tensorop_s1688111gemm_f16_32x32_64x2_tn_align4,not_verified,success,universal,4096,16384,4096,f16:row,f16:column,f32:column,1,0,1,1,tensorop,f32,32,32,64,2,1,1,1,16,8,8,75,1024,436207616,549890031616,20.8395,19.4942,26386.9
1,CUTLASS,gemm,cutlass_tensorop_s1688112gemm_f16_32x32_64x2_tn_align4,not_verified,success,universal,5120,20480,5120,f16:row,f16:column,f32:column,1,0,1,1,tensorop,f32,32,32,64,2,1,1,1,16,8,8,75,1024,681574400,1073951539200,41.328,15.3592,25986
1,CUTLASS,gemm,cutlass_tensorop_s1688111gemm_f16_32x32_64x2_tn_align4,not_verified,success,universal,5120,20480,5120,f16:row,f16:column,f32:column,1,0,1,1,tensorop,f32,32,32,64,2,1,1,1,16,8,8,75,1024,681574400,1073951539200,41.383,15.3388,25951.5
1,CUTLASS,gemm,cutlass_tensorop_s1688112gemm_f16_32x32_64x2_tn_align4,not_verified,success,universal,6144,24576,6144,f16:row,f16:column,f32:column,1,0,1,1,tensorop,f32,32,32,64,2,1,1,1,16,8,8,75,1024,981467136,1855727861760,71.6264,12.7615,25908.4
1,CUTLASS,gemm,cutlass_tensorop_s1688111gemm_f16_32x32_64x2_tn_align4,not_verified,success,universal,6144,24576,6144,f16:row,f16:column,f32:column,1,0,1,1,tensorop,f32,32,32,64,2,1,1,1,16,8,8,75,1024,981467136,1855727861760,71.7709,12.7358,25856.3
1,CUTLASS,gemm,cutlass_tensorop_s1688112gemm_f16_32x32_64x2_tn_align4,not_verified,success,universal,7168,28672,7168,f16:row,f16:column,f32:column,1,0,1,1,tensorop,f32,32,32,64,2,1,1,1,16,8,8,75,1024,1335885824,2946758606848,113.106,10.9998,26053.2
1,CUTLASS,gemm,cutlass_tensorop_s1688111gemm_f16_32x32_64x2_tn_align4,not_verified,success,universal,7168,28672,7168,f16:row,f16:column,f32:column,1,0,1,1,tensorop,f32,32,32,64,2,1,1,1,16,8,8,75,1024,1335885824,2946758606848,113.304,10.9806,26007.6
1,CUTLASS,gemm,cutlass_tensorop_s1688112gemm_f16_32x32_64x2_tn_align4,not_verified,success,universal,8192,32768,8192,f16:row,f16:column,f32:column,1,0,1,1,tensorop,f32,32,32,64,2,1,1,1,16,8,8,75,1024,1744830464,4398583382016,165.738,9.80464,26539.4
1,CUTLASS,gemm,cutlass_tensorop_s1688111gemm_f16_32x32_64x2_tn_align4,not_verified,success,universal,8192,32768,8192,f16:row,f16:column,f32:column,1,0,1,1,tensorop,f32,32,32,64,2,1,1,1,16,8,8,75,1024,1744830464,4398583382016,165.863,9.79726,26519.4
1,CUTLASS,gemm,cutlass_tensorop_s1688112gemm_f16_32x32_64x2_tn_align4,not_verified,success,universal,9216,36864,9216,f16:row,f16:column,f32:column,1,0,1,1,tensorop,f32,32,32,64,2,1,1,1,16,8,8,75,1024,2208301056,6262741794816,241.285,8.5237,25955.8
1,CUTLASS,gemm,cutlass_tensorop_s1688111gemm_f16_32x32_64x2_tn_align4,not_verified,success,universal,9216,36864,9216,f16:row,f16:column,f32:column,1,0,1,1,tensorop,f32,32,32,64,2,1,1,1,16,8,8,75,1024,2208301056,6262741794816,240.971,8.53482,25989.7
1,CUTLASS,gemm,cutlass_tensorop_s1688112gemm_f16_32x32_64x2_tn_align4,not_verified,success,universal,10240,40960,10240,f16:row,f16:column,f32:column,1,0,1,1,tensorop,f32,32,32,64,2,1,1,1,16,8,8,75,1024,2726297600,8590773452800,333.154,7.6213,25786.2
1,CUTLASS,gemm,cutlass_tensorop_s1688111gemm_f16_32x32_64x2_tn_align4,not_verified,success,universal,10240,40960,10240,f16:row,f16:column,f32:column,1,0,1,1,tensorop,f32,32,32,64,2,1,1,1,16,8,8,75,1024,2726297600,8590773452800,333.136,7.6217,25787.6
1,CUTLASS,gemm,cutlass_tensorop_s1688121gemm_f16_32x64_32x2_tn_align4,not_verified,success,universal,1024,4096,1024,f16:row,f16:column,f32:column,1,0,1,1,tensorop,f32,32,64,32,2,1,2,1,16,8,8,75,1024,27262976,8598323200,0.400016,63.4741,21495
1,CUTLASS,gemm,cutlass_tensorop_s1688111gemm_f16_32x64_32x2_tn_align4,not_verified,success,universal,1024,4096,1024,f16:row,f16:column,f32:column,1,0,1,1,tensorop,f32,32,64,32,2,1,1,1,16,8,8,75,1024,27262976,8598323200,0.391091,64.9226,21985.5
1,CUTLASS,gemm,cutlass_tensorop_s1688121gemm_f16_32x64_32x2_tn_align4,not_verified,success,universal,2048,8192,2048,f16:row,f16:column,f32:column,1,0,1,1,tensorop,f32,32,64,32,2,1,2,1,16,8,8,75,1024,109051904,68753031168,3.05756,33.2169,22486.3
1,CUTLASS,gemm,cutlass_tensorop_s1688111gemm_f16_32x64_32x2_tn_align4,not_verified,success,universal,2048,8192,2048,f16:row,f16:column,f32:column,1,0,1,1,tensorop,f32,32,64,32,2,1,1,1,16,8,8,75,1024,109051904,68753031168,2.90334,34.9812,23680.6
1,CUTLASS,gemm,cutlass_tensorop_s1688121gemm_f16_32x64_32x2_tn_align4,not_verified,success,universal,3072,12288,3072,f16:row,f16:column,f32:column,1,0,1,1,tensorop,f32,32,64,32,2,1,2,1,16,8,8,75,1024,245366784,232003731456,10.1901,22.4252,22767.5
1,CUTLASS,gemm,cutlass_tensorop_s1688111gemm_f16_32x64_32x2_tn_align4,not_verified,success,universal,3072,12288,3072,f16:row,f16:column,f32:column,1,0,1,1,tensorop,f32,32,64,32,2,1,1,1,16,8,8,75,1024,245366784,232003731456,9.70658,23.5423,23901.7
1,CUTLASS,gemm,cutlass_tensorop_s1688121gemm_f16_32x64_32x2_tn_align4,not_verified,success,universal,4096,16384,4096,f16:row,f16:column,f32:column,1,0,1,1,tensorop,f32,32,64,32,2,1,2,1,16,8,8,75,1024,436207616,549890031616,23.9681,16.9496,22942.6
1,CUTLASS,gemm,cutlass_tensorop_s1688111gemm_f16_32x64_32x2_tn_align4,not_verified,success,universal,4096,16384,4096,f16:row,f16:column,f32:column,1,0,1,1,tensorop,f32,32,64,32,2,1,1,1,16,8,8,75,1024,436207616,549890031616,22.839,17.7876,24076.8
1,CUTLASS,gemm,cutlass_tensorop_s1688121gemm_f16_32x64_32x2_tn_align4,not_verified,success,universal,5120,20480,5120,f16:row,f16:column,f32:column,1,0,1,1,tensorop,f32,32,64,32,2,1,2,1,16,8,8,75,1024,681574400,1073951539200,47.6005,13.3353,22561.8
1,CUTLASS,gemm,cutlass_tensorop_s1688111gemm_f16_32x64_32x2_tn_align4,not_verified,success,universal,5120,20480,5120,f16:row,f16:column,f32:column,1,0,1,1,tensorop,f32,32,64,32,2,1,1,1,16,8,8,75,1024,681574400,1073951539200,46.3315,13.7005,23179.7
1,CUTLASS,gemm,cutlass_tensorop_s1688121gemm_f16_32x64_32x2_tn_align4,not_verified,success,universal,6144,24576,6144,f16:row,f16:column,f32:column,1,0,1,1,tensorop,f32,32,64,32,2,1,2,1,16,8,8,75,1024,981467136,1855727861760,81.0866,11.2727,22885.8
1,CUTLASS,gemm,cutlass_tensorop_s1688111gemm_f16_32x64_32x2_tn_align4,not_verified,success,universal,6144,24576,6144,f16:row,f16:column,f32:column,1,0,1,1,tensorop,f32,32,64,32,2,1,1,1,16,8,8,75,1024,981467136,1855727861760,81.1688,11.2613,22862.6
1,CUTLASS,gemm,cutlass_tensorop_s1688121gemm_f16_32x64_32x2_tn_align4,not_verified,success,universal,7168,28672,7168,f16:row,f16:column,f32:column,1,0,1,1,tensorop,f32,32,64,32,2,1,2,1,16,8,8,75,1024,1335885824,2946758606848,128.331,9.6948,22962.2
1,CUTLASS,gemm,cutlass_tensorop_s1688111gemm_f16_32x64_32x2_tn_align4,not_verified,success,universal,7168,28672,7168,f16:row,f16:column,f32:column,1,0,1,1,tensorop,f32,32,64,32,2,1,1,1,16,8,8,75,1024,1335885824,2946758606848,133.828,9.29657,22019
1,CUTLASS,gemm,cutlass_tensorop_s1688121gemm_f16_32x64_32x2_tn_align4,not_verified,success,universal,8192,32768,8192,f16:row,f16:column,f32:column,1,0,1,1,tensorop,f32,32,64,32,2,1,2,1,16,8,8,75,1024,1744830464,4398583382016,196.03,8.28957,22438.4
1,CUTLASS,gemm,cutlass_tensorop_s1688111gemm_f16_32x64_32x2_tn_align4,not_verified,success,universal,8192,32768,8192,f16:row,f16:column,f32:column,1,0,1,1,tensorop,f32,32,64,32,2,1,1,1,16,8,8,75,1024,1744830464,4398583382016,188.025,8.64248,23393.6
1,CUTLASS,gemm,cutlass_tensorop_s1688121gemm_f16_32x64_32x2_tn_align4,not_verified,success,universal,9216,36864,9216,f16:row,f16:column,f32:column,1,0,1,1,tensorop,f32,32,64,32,2,1,2,1,16,8,8,75,1024,2208301056,6262741794816,363.662,5.65536,17221.3
1,CUTLASS,gemm,cutlass_tensorop_s1688111gemm_f16_32x64_32x2_tn_align4,not_verified,success,universal,9216,36864,9216,f16:row,f16:column,f32:column,1,0,1,1,tensorop,f32,32,64,32,2,1,1,1,16,8,8,75,1024,2208301056,6262741794816,479.903,4.28554,13050
1,CUTLASS,gemm,cutlass_tensorop_s1688121gemm_f16_32x64_32x2_tn_align4,not_verified,success,universal,10240,40960,10240,f16:row,f16:column,f32:column,1,0,1,1,tensorop,f32,32,64,32,2,1,2,1,16,8,8,75,1024,2726297600,8590773452800,872.975,2.90852,9840.8
1,CUTLASS,gemm,cutlass_tensorop_s1688111gemm_f16_32x64_32x2_tn_align4,not_verified,success,universal,10240,40960,10240,f16:row,f16:column,f32:column,1,0,1,1,tensorop,f32,32,64,32,2,1,1,1,16,8,8,75,1024,2726297600,8590773452800,860.214,2.95166,9986.78
1,CUTLASS,gemm,cutlass_tensorop_s1688122gemm_f16_32x64_64x2_tn_align4,not_verified,success,universal,1024,4096,1024,f16:row,f16:column,f32:column,1,0,1,1,tensorop,f32,32,64,64,2,1,2,1,16,8,8,75,1024,27262976,8598323200,0.340064,74.6643,25284.4
1,CUTLASS,gemm,cutlass_tensorop_s1688121gemm_f16_32x64_64x2_tn_align4,not_verified,success,universal,1024,4096,1024,f16:row,f16:column,f32:column,1,0,1,1,tensorop,f32,32,64,64,2,1,2,1,16,8,8,75,1024,27262976,8598323200,0.343987,73.8127,24996.1
1,CUTLASS,gemm,cutlass_tensorop_s1688112gemm_f16_32x64_64x2_tn_align4,not_verified,success,universal,1024,4096,1024,f16:row,f16:column,f32:column,1,0,1,1,tensorop,f32,32,64,64,2,1,1,1,16,8,8,75,1024,27262976,8598323200,0.468983,54.1398,18334
1,CUTLASS,gemm,cutlass_tensorop_s1688111gemm_f16_32x64_64x2_tn_align4,not_verified,success,universal,1024,4096,1024,f16:row,f16:column,f32:column,1,0,1,1,tensorop,f32,32,64,64,2,1,1,1,16,8,8,75,1024,27262976,8598323200,0.468623,54.1813,18348.1
1,CUTLASS,gemm,cutlass_tensorop_s1688122gemm_f16_32x64_64x2_tn_align4,not_verified,success,universal,2048,8192,2048,f16:row,f16:column,f32:column,1,0,1,1,tensorop,f32,32,64,64,2,1,2,1,16,8,8,75,1024,109051904,68753031168,2.43107,41.7769,28281
1,CUTLASS,gemm,cutlass_tensorop_s1688121gemm_f16_32x64_64x2_tn_align4,not_verified,success,universal,2048,8192,2048,f16:row,f16:column,f32:column,1,0,1,1,tensorop,f32,32,64,64,2,1,2,1,16,8,8,75,1024,109051904,68753031168,2.49297,40.7396,27578.8
1,CUTLASS,gemm,cutlass_tensorop_s1688112gemm_f16_32x64_64x2_tn_align4,not_verified,success,universal,2048,8192,2048,f16:row,f16:column,f32:column,1,0,1,1,tensorop,f32,32,64,64,2,1,1,1,16,8,8,75,1024,109051904,68753031168,3.35218,30.2974,20509.9
1,CUTLASS,gemm,cutlass_tensorop_s1688111gemm_f16_32x64_64x2_tn_align4,not_verified,success,universal,2048,8192,2048,f16:row,f16:column,f32:column,1,0,1,1,tensorop,f32,32,64,64,2,1,1,1,16,8,8,75,1024,109051904,68753031168,3.35128,30.3056,20515.5
1,CUTLASS,gemm,cutlass_tensorop_s1688122gemm_f16_32x64_64x2_tn_align4,not_verified,success,universal,3072,12288,3072,f16:row,f16:column,f32:column,1,0,1,1,tensorop,f32,32,64,64,2,1,2,1,16,8,8,75,1024,245366784,232003731456,8.09934,28.2141,28644.8
1,CUTLASS,gemm,cutlass_tensorop_s1688121gemm_f16_32x64_64x2_tn_align4,not_verified,success,universal,3072,12288,3072,f16:row,f16:column,f32:column,1,0,1,1,tensorop,f32,32,64,64,2,1,2,1,16,8,8,75,1024,245366784,232003731456,8.24307,27.7222,28145.3
1,CUTLASS,gemm,cutlass_tensorop_s1688112gemm_f16_32x64_64x2_tn_align4,not_verified,success,universal,3072,12288,3072,f16:row,f16:column,f32:column,1,0,1,1,tensorop,f32,32,64,64,2,1,1,1,16,8,8,75,1024,245366784,232003731456,10.9453,20.8779,21196.6
1,CUTLASS,gemm,cutlass_tensorop_s1688111gemm_f16_32x64_64x2_tn_align4,not_verified,success,universal,3072,12288,3072,f16:row,f16:column,f32:column,1,0,1,1,tensorop,f32,32,64,64,2,1,1,1,16,8,8,75,1024,245366784,232003731456,10.9466,20.8756,21194.2
1,CUTLASS,gemm,cutlass_tensorop_s1688122gemm_f16_32x64_64x2_tn_align4,not_verified,success,universal,4096,16384,4096,f16:row,f16:column,f32:column,1,0,1,1,tensorop,f32,32,64,64,2,1,2,1,16,8,8,75,1024,436207616,549890031616,19.0377,21.3393,28884.3
1,CUTLASS,gemm,cutlass_tensorop_s1688121gemm_f16_32x64_64x2_tn_align4,not_verified,success,universal,4096,16384,4096,f16:row,f16:column,f32:column,1,0,1,1,tensorop,f32,32,64,64,2,1,2,1,16,8,8,75,1024,436207616,549890031616,18.8474,21.5547,29175.9
1,CUTLASS,gemm,cutlass_tensorop_s1688112gemm_f16_32x64_64x2_tn_align4,not_verified,success,universal,4096,16384,4096,f16:row,f16:column,f32:column,1,0,1,1,tensorop,f32,32,64,64,2,1,1,1,16,8,8,75,1024,436207616,549890031616,25.336,16.0345,21703.9
1,CUTLASS,gemm,cutlass_tensorop_s1688111gemm_f16_32x64_64x2_tn_align4,not_verified,success,universal,4096,16384,4096,f16:row,f16:column,f32:column,1,0,1,1,tensorop,f32,32,64,64,2,1,1,1,16,8,8,75,1024,436207616,549890031616,25.338,16.0332,21702.1
1,CUTLASS,gemm,cutlass_tensorop_s1688122gemm_f16_32x64_64x2_tn_align4,not_verified,success,universal,5120,20480,5120,f16:row,f16:column,f32:column,1,0,1,1,tensorop,f32,32,64,64,2,1,2,1,16,8,8,75,1024,681574400,1073951539200,38.1946,16.6193,28117.9
1,CUTLASS,gemm,cutlass_tensorop_s1688121gemm_f16_32x64_64x2_tn_align4,not_verified,success,universal,5120,20480,5120,f16:row,f16:column,f32:column,1,0,1,1,tensorop,f32,32,64,64,2,1,2,1,16,8,8,75,1024,681574400,1073951539200,38.0856,16.6668,28198.3
1,CUTLASS,gemm,cutlass_tensorop_s1688112gemm_f16_32x64_64x2_tn_align4,not_verified,success,universal,5120,20480,5120,f16:row,f16:column,f32:column,1,0,1,1,tensorop,f32,32,64,64,2,1,1,1,16,8,8,75,1024,681574400,1073951539200,49.1703,12.9095,21841.5
1,CUTLASS,gemm,cutlass_tensorop_s1688111gemm_f16_32x64_64x2_tn_align4,not_verified,success,universal,5120,20480,5120,f16:row,f16:column,f32:column,1,0,1,1,tensorop,f32,32,64,64,2,1,1,1,16,8,8,75,1024,681574400,1073951539200,49.1589,12.9125,21846.5
1,CUTLASS,gemm,cutlass_tensorop_s1688122gemm_f16_32x64_64x2_tn_align4,not_verified,success,universal,6144,24576,6144,f16:row,f16:column,f32:column,1,0,1,1,tensorop,f32,32,64,64,2,1,2,1,16,8,8,75,1024,981467136,1855727861760,65.4868,13.958,28337.4
1,CUTLASS,gemm,cutlass_tensorop_s1688121gemm_f16_32x64_64x2_tn_align4,not_verified,success,universal,6144,24576,6144,f16:row,f16:column,f32:column,1,0,1,1,tensorop,f32,32,64,64,2,1,2,1,16,8,8,75,1024,981467136,1855727861760,65.2179,14.0155,28454.3
1,CUTLASS,gemm,cutlass_tensorop_s1688112gemm_f16_32x64_64x2_tn_align4,not_verified,success,universal,6144,24576,6144,f16:row,f16:column,f32:column,1,0,1,1,tensorop,f32,32,64,64,2,1,1,1,16,8,8,75,1024,981467136,1855727861760,85.2783,10.7186,21760.8
1,CUTLASS,gemm,cutlass_tensorop_s1688111gemm_f16_32x64_64x2_tn_align4,not_verified,success,universal,6144,24576,6144,f16:row,f16:column,f32:column,1,0,1,1,tensorop,f32,32,64,64,2,1,1,1,16,8,8,75,1024,981467136,1855727861760,85.3046,10.7153,21754.1
1,CUTLASS,gemm,cutlass_tensorop_s1688122gemm_f16_32x64_64x2_tn_align4,not_verified,success,universal,7168,28672,7168,f16:row,f16:column,f32:column,1,0,1,1,tensorop,f32,32,64,64,2,1,2,1,16,8,8,75,1024,1335885824,2946758606848,107.503,11.5731,27410.9
1,CUTLASS,gemm,cutlass_tensorop_s1688121gemm_f16_32x64_64x2_tn_align4,not_verified,success,universal,7168,28672,7168,f16:row,f16:column,f32:column,1,0,1,1,tensorop,f32,32,64,64,2,1,2,1,16,8,8,75,1024,1335885824,2946758606848,102.586,12.1278,28724.9
1,CUTLASS,gemm,cutlass_tensorop_s1688112gemm_f16_32x64_64x2_tn_align4,not_verified,success,universal,7168,28672,7168,f16:row,f16:column,f32:column,1,0,1,1,tensorop,f32,32,64,64,2,1,1,1,16,8,8,75,1024,1335885824,2946758606848,136.051,9.14468,21659.3
1,CUTLASS,gemm,cutlass_tensorop_s1688111gemm_f16_32x64_64x2_tn_align4,not_verified,success,universal,7168,28672,7168,f16:row,f16:column,f32:column,1,0,1,1,tensorop,f32,32,64,64,2,1,1,1,16,8,8,75,1024,1335885824,2946758606848,136.029,9.14616,21662.8
1,CUTLASS,gemm,cutlass_tensorop_s1688122gemm_f16_32x64_64x2_tn_align4,not_verified,success,universal,8192,32768,8192,f16:row,f16:column,f32:column,1,0,1,1,tensorop,f32,32,64,64,2,1,2,1,16,8,8,75,1024,1744830464,4398583382016,157.732,10.3023,27886.5
1,CUTLASS,gemm,cutlass_tensorop_s1688121gemm_f16_32x64_64x2_tn_align4,not_verified,success,universal,8192,32768,8192,f16:row,f16:column,f32:column,1,0,1,1,tensorop,f32,32,64,64,2,1,2,1,16,8,8,75,1024,1744830464,4398583382016,156.902,10.3568,28033.9
1,CUTLASS,gemm,cutlass_tensorop_s1688112gemm_f16_32x64_64x2_tn_align4,not_verified,success,universal,8192,32768,8192,f16:row,f16:column,f32:column,1,0,1,1,tensorop,f32,32,64,64,2,1,1,1,16,8,8,75,1024,1744830464,4398583382016,204.15,7.95984,21545.9
1,CUTLASS,gemm,cutlass_tensorop_s1688111gemm_f16_32x64_64x2_tn_align4,not_verified,success,universal,8192,32768,8192,f16:row,f16:column,f32:column,1,0,1,1,tensorop,f32,32,64,64,2,1,1,1,16,8,8,75,1024,1744830464,4398583382016,204.301,7.95397,21530
1,CUTLASS,gemm,cutlass_tensorop_s1688122gemm_f16_32x64_64x2_tn_align4,not_verified,success,universal,9216,36864,9216,f16:row,f16:column,f32:column,1,0,1,1,tensorop,f32,32,64,64,2,1,2,1,16,8,8,75,1024,2208301056,6262741794816,226.374,9.08514,27665.4
1,CUTLASS,gemm,cutlass_tensorop_s1688121gemm_f16_32x64_64x2_tn_align4,not_verified,success,universal,9216,36864,9216,f16:row,f16:column,f32:column,1,0,1,1,tensorop,f32,32,64,64,2,1,2,1,16,8,8,75,1024,2208301056,6262741794816,226.883,9.06477,27603.4
1,CUTLASS,gemm,cutlass_tensorop_s1688112gemm_f16_32x64_64x2_tn_align4,not_verified,success,universal,9216,36864,9216,f16:row,f16:column,f32:column,1,0,1,1,tensorop,f32,32,64,64,2,1,1,1,16,8,8,75,1024,2208301056,6262741794816,291.916,7.04532,21453.9
1,CUTLASS,gemm,cutlass_tensorop_s1688111gemm_f16_32x64_64x2_tn_align4,not_verified,success,universal,9216,36864,9216,f16:row,f16:column,f32:column,1,0,1,1,tensorop,f32,32,64,64,2,1,1,1,16,8,8,75,1024,2208301056,6262741794816,291.203,7.06256,21506.4
1,CUTLASS,gemm,cutlass_tensorop_s1688122gemm_f16_32x64_64x2_tn_align4,not_verified,success,universal,10240,40960,10240,f16:row,f16:column,f32:column,1,0,1,1,tensorop,f32,32,64,64,2,1,2,1,16,8,8,75,1024,2726297600,8590773452800,313.077,8.11004,27439.8
1,CUTLASS,gemm,cutlass_tensorop_s1688121gemm_f16_32x64_64x2_tn_align4,not_verified,success,universal,10240,40960,10240,f16:row,f16:column,f32:column,1,0,1,1,tensorop,f32,32,64,64,2,1,2,1,16,8,8,75,1024,2726297600,8590773452800,314.145,8.08246,27346.5
1,CUTLASS,gemm,cutlass_tensorop_s1688112gemm_f16_32x64_64x2_tn_align4,not_verified,success,universal,10240,40960,10240,f16:row,f16:column,f32:column,1,0,1,1,tensorop,f32,32,64,64,2,1,1,1,16,8,8,75,1024,2726297600,8590773452800,403.613,6.29084,21284.7
1,CUTLASS,gemm,cutlass_tensorop_s1688111gemm_f16_32x64_64x2_tn_align4,not_verified,success,universal,10240,40960,10240,f16:row,f16:column,f32:column,1,0,1,1,tensorop,f32,32,64,64,2,1,1,1,16,8,8,75,1024,2726297600,8590773452800,404.353,6.27932,21245.7
1,CUTLASS,gemm,cutlass_tensorop_s1688141gemm_f16_32x128_32x2_tn_align4,not_verified,success,universal,1024,4096,1024,f16:row,f16:column,f32:column,1,0,1,1,tensorop,f32,32,128,32,2,1,4,1,16,8,8,75,1024,27262976,8598323200,0.354166,71.6913,24277.7
1,CUTLASS,gemm,cutlass_tensorop_s1688121gemm_f16_32x128_32x2_tn_align4,not_verified,success,universal,1024,4096,1024,f16:row,f16:column,f32:column,1,0,1,1,tensorop,f32,32,128,32,2,1,2,1,16,8,8,75,1024,27262976,8598323200,0.342735,74.0823,25087.4
1,CUTLASS,gemm,cutlass_tensorop_s1688111gemm_f16_32x128_32x2_tn_align4,not_verified,success,universal,1024,4096,1024,f16:row,f16:column,f32:column,1,0,1,1,tensorop,f32,32,128,32,2,1,1,1,16,8,8,75,1024,27262976,8598323200,1.31559,19.2999,6535.74
1,CUTLASS,gemm,cutlass_tensorop_s1688141gemm_f16_32x128_32x2_tn_align4,not_verified,success,universal,2048,8192,2048,f16:row,f16:column,f32:column,1,0,1,1,tensorop,f32,32,128,32,2,1,4,1,16,8,8,75,1024,109051904,68753031168,2.63947,38.4784,26048.1
1,CUTLASS,gemm,cutlass_tensorop_s1688121gemm_f16_32x128_32x2_tn_align4,not_verified,success,universal,2048,8192,2048,f16:row,f16:column,f32:column,1,0,1,1,tensorop,f32,32,128,32,2,1,2,1,16,8,8,75,1024,109051904,68753031168,2.51507,40.3816,27336.4
1,CUTLASS,gemm,cutlass_tensorop_s1688111gemm_f16_32x128_32x2_tn_align4,not_verified,success,universal,2048,8192,2048,f16:row,f16:column,f32:column,1,0,1,1,tensorop,f32,32,128,32,2,1,1,1,16,8,8,75,1024,109051904,68753031168,8.81579,11.5205,7798.85
1,CUTLASS,gemm,cutlass_tensorop_s1688141gemm_f16_32x128_32x2_tn_align4,not_verified,success,universal,3072,12288,3072,f16:row,f16:column,f32:column,1,0,1,1,tensorop,f32,32,128,32,2,1,4,1,16,8,8,75,1024,245366784,232003731456,8.82726,25.8875,26282.6
1,CUTLASS,gemm,cutlass_tensorop_s1688121gemm_f16_32x128_32x2_tn_align4,not_verified,success,universal,3072,12288,3072,f16:row,f16:column,f32:column,1,0,1,1,tensorop,f32,32,128,32,2,1,2,1,16,8,8,75,1024,245366784,232003731456,8.53078,26.7872,27196.1
1,CUTLASS,gemm,cutlass_tensorop_s1688111gemm_f16_32x128_32x2_tn_align4,not_verified,success,universal,3072,12288,3072,f16:row,f16:column,f32:column,1,0,1,1,tensorop,f32,32,128,32,2,1,1,1,16,8,8,75,1024,245366784,232003731456,30.0765,7.59781,7713.79
1,CUTLASS,gemm,cutlass_tensorop_s1688141gemm_f16_32x128_32x2_tn_align4,not_verified,success,universal,4096,16384,4096,f16:row,f16:column,f32:column,1,0,1,1,tensorop,f32,32,128,32,2,1,4,1,16,8,8,75,1024,436207616,549890031616,20.7312,19.5961,26524.7
1,CUTLASS,gemm,cutlass_tensorop_s1688121gemm_f16_32x128_32x2_tn_align4,not_verified,success,universal,4096,16384,4096,f16:row,f16:column,f32:column,1,0,1,1,tensorop,f32,32,128,32,2,1,2,1,16,8,8,75,1024,436207616,549890031616,20.9702,19.3727,26222.4
1,CUTLASS,gemm,cutlass_tensorop_s1688111gemm_f16_32x128_32x2_tn_align4,not_verified,success,universal,4096,16384,4096,f16:row,f16:column,f32:column,1,0,1,1,tensorop,f32,32,128,32,2,1,1,1,16,8,8,75,1024,436207616,549890031616,68.6669,5.91624,8008.08
1,CUTLASS,gemm,cutlass_tensorop_s1688141gemm_f16_32x128_32x2_tn_align4,not_verified,success,universal,5120,20480,5120,f16:row,f16:column,f32:column,1,0,1,1,tensorop,f32,32,128,32,2,1,4,1,16,8,8,75,1024,681574400,1073951539200,41.4285,15.322,25923
1,CUTLASS,gemm,cutlass_tensorop_s1688121gemm_f16_32x128_32x2_tn_align4,not_verified,success,universal,5120,20480,5120,f16:row,f16:column,f32:column,1,0,1,1,tensorop,f32,32,128,32,2,1,2,1,16,8,8,75,1024,681574400,1073951539200,75.6277,8.39329,14200.5
1,CUTLASS,gemm,cutlass_tensorop_s1688111gemm_f16_32x128_32x2_tn_align4,not_verified,success,universal,5120,20480,5120,f16:row,f16:column,f32:column,1,0,1,1,tensorop,f32,32,128,32,2,1,1,1,16,8,8,75,1024,681574400,1073951539200,136.184,4.66108,7886.02
1,CUTLASS,gemm,cutlass_tensorop_s1688141gemm_f16_32x128_32x2_tn_align4,not_verified,success,universal,6144,24576,6144,f16:row,f16:column,f32:column,1,0,1,1,tensorop,f32,32,128,32,2,1,4,1,16,8,8,75,1024,981467136,1855727861760,80.8331,11.308,22957.5
1,CUTLASS,gemm,cutlass_tensorop_s1688121gemm_f16_32x128_32x2_tn_align4,not_verified,success,universal,6144,24576,6144,f16:row,f16:column,f32:column,1,0,1,1,tensorop,f32,32,128,32,2,1,2,1,16,8,8,75,1024,981467136,1855727861760,157.192,5.81494,11805.5
1,CUTLASS,gemm,cutlass_tensorop_s1688111gemm_f16_32x128_32x2_tn_align4,not_verified,success,universal,6144,24576,6144,f16:row,f16:column,f32:column,1,0,1,1,tensorop,f32,32,128,32,2,1,1,1,16,8,8,75,1024,981467136,1855727861760,439.087,2.08174,4226.34
1,CUTLASS,gemm,cutlass_tensorop_s1688141gemm_f16_32x128_32x2_tn_align4,not_verified,success,universal,7168,28672,7168,f16:row,f16:column,f32:column,1,0,1,1,tensorop,f32,32,128,32,2,1,4,1,16,8,8,75,1024,1335885824,2946758606848,180.547,6.89094,16321.3
1,CUTLASS,gemm,cutlass_tensorop_s1688121gemm_f16_32x128_32x2_tn_align4,not_verified,success,universal,7168,28672,7168,f16:row,f16:column,f32:column,1,0,1,1,tensorop,f32,32,128,32,2,1,2,1,16,8,8,75,1024,1335885824,2946758606848,299.626,4.15231,9834.79
1,CUTLASS,gemm,cutlass_tensorop_s1688111gemm_f16_32x128_32x2_tn_align4,not_verified,success,universal,7168,28672,7168,f16:row,f16:column,f32:column,1,0,1,1,tensorop,f32,32,128,32,2,1,1,1,16,8,8,75,1024,1335885824,2946758606848,465.162,2.67464,6334.91
1,CUTLASS,gemm,cutlass_tensorop_s1688141gemm_f16_32x128_32x2_tn_align4,not_verified,success,universal,8192,32768,8192,f16:row,f16:column,f32:column,1,0,1,1,tensorop,f32,32,128,32,2,1,4,1,16,8,8,75,1024,1744830464,4398583382016,261.822,6.2065,16799.9
1,CUTLASS,gemm,cutlass_tensorop_s1688121gemm_f16_32x128_32x2_tn_align4,not_verified,success,universal,8192,32768,8192,f16:row,f16:column,f32:column,1,0,1,1,tensorop,f32,32,128,32,2,1,2,1,16,8,8,75,1024,1744830464,4398583382016,282.96,5.74285,15544.9
1,CUTLASS,gemm,cutlass_tensorop_s1688111gemm_f16_32x128_32x2_tn_align4,not_verified,success,universal,8192,32768,8192,f16:row,f16:column,f32:column,1,0,1,1,tensorop,f32,32,128,32,2,1,1,1,16,8,8,75,1024,1744830464,4398583382016,713.441,2.27769,6165.31
1,CUTLASS,gemm,cutlass_tensorop_s1688141gemm_f16_32x128_32x2_tn_align4,not_verified,success,universal,9216,36864,9216,f16:row,f16:column,f32:column,1,0,1,1,tensorop,f32,32,128,32,2,1,4,1,16,8,8,75,1024,2208301056,6262741794816,728.209,2.82425,8600.2
1,CUTLASS,gemm,cutlass_tensorop_s1688121gemm_f16_32x128_32x2_tn_align4,not_verified,success,universal,9216,36864,9216,f16:row,f16:column,f32:column,1,0,1,1,tensorop,f32,32,128,32,2,1,2,1,16,8,8,75,1024,2208301056,6262741794816,762.887,2.69587,8209.27
1,CUTLASS,gemm,cutlass_tensorop_s1688111gemm_f16_32x128_32x2_tn_align4,not_verified,success,universal,9216,36864,9216,f16:row,f16:column,f32:column,1,0,1,1,tensorop,f32,32,128,32,2,1,1,1,16,8,8,75,1024,2208301056,6262741794816,1074.71,1.91368,5827.39
1,CUTLASS,gemm,cutlass_tensorop_s1688141gemm_f16_32x128_32x2_tn_align4,not_verified,success,universal,10240,40960,10240,f16:row,f16:column,f32:column,1,0,1,1,tensorop,f32,32,128,32,2,1,4,1,16,8,8,75,1024,2726297600,8590773452800,1047.77,2.4233,8199.09
1,CUTLASS,gemm,cutlass_tensorop_s1688121gemm_f16_32x128_32x2_tn_align4,not_verified,success,universal,10240,40960,10240,f16:row,f16:column,f32:column,1,0,1,1,tensorop,f32,32,128,32,2,1,2,1,16,8,8,75,1024,2726297600,8590773452800,1073.52,2.36517,8002.42
1,CUTLASS,gemm,cutlass_tensorop_s1688111gemm_f16_32x128_32x2_tn_align4,not_verified,success,universal,10240,40960,10240,f16:row,f16:column,f32:column,1,0,1,1,tensorop,f32,32,128,32,2,1,1,1,16,8,8,75,1024,2726297600,8590773452800,1320.85,1.9223,6503.98
1,CUTLASS,gemm,cutlass_tensorop_s1688142gemm_f16_32x128_64x2_tn_align4,not_verified,success,universal,1024,4096,1024,f16:row,f16:column,f32:column,1,0,1,1,tensorop,f32,32,128,64,2,1,4,1,16,8,8,75,1024,27262976,8598323200,0.328689,77.2481,26159.4
1,CUTLASS,gemm,cutlass_tensorop_s1688141gemm_f16_32x128_64x2_tn_align4,not_verified,success,universal,1024,4096,1024,f16:row,f16:column,f32:column,1,0,1,1,tensorop,f32,32,128,64,2,1,4,1,16,8,8,75,1024,27262976,8598323200,0.333497,76.1344,25782.3
1,CUTLASS,gemm,cutlass_tensorop_s1688122gemm_f16_32x128_64x2_tn_align4,not_verified,success,universal,1024,4096,1024,f16:row,f16:column,f32:column,1,0,1,1,tensorop,f32,32,128,64,2,1,2,1,16,8,8,75,1024,27262976,8598323200,0.527916,48.0959,16287.3
1,CUTLASS,gemm,cutlass_tensorop_s1688121gemm_f16_32x128_64x2_tn_align4,not_verified,success,universal,1024,4096,1024,f16:row,f16:column,f32:column,1,0,1,1,tensorop,f32,32,128,64,2,1,2,1,16,8,8,75,1024,27262976,8598323200,0.527699,48.1158,16294
1,CUTLASS,gemm,cutlass_tensorop_s1688112gemm_f16_32x128_64x2_tn_align4,not_verified,success,universal,1024,4096,1024,f16:row,f16:column,f32:column,1,0,1,1,tensorop,f32,32,128,64,2,1,1,1,16,8,8,75,1024,27262976,8598323200,3.139,8.08875,2739.19
1,CUTLASS,gemm,cutlass_tensorop_s1688111gemm_f16_32x128_64x2_tn_align4,not_verified,success,universal,1024,4096,1024,f16:row,f16:column,f32:column,1,0,1,1,tensorop,f32,32,128,64,2,1,1,1,16,8,8,75,1024,27262976,8598323200,3.14462,8.07431,2734.3
1,CUTLASS,gemm,cutlass_tensorop_s1688142gemm_f16_32x128_64x2_tn_align4,not_verified,success,universal,2048,8192,2048,f16:row,f16:column,f32:column,1,0,1,1,tensorop,f32,32,128,64,2,1,4,1,16,8,8,75,1024,109051904,68753031168,2.40529,42.2246,28584.1
1,CUTLASS,gemm,cutlass_tensorop_s1688141gemm_f16_32x128_64x2_tn_align4,not_verified,success,universal,2048,8192,2048,f16:row,f16:column,f32:column,1,0,1,1,tensorop,f32,32,128,64,2,1,4,1,16,8,8,75,1024,109051904,68753031168,2.38976,42.4991,28769.9
1,CUTLASS,gemm,cutlass_tensorop_s1688122gemm_f16_32x128_64x2_tn_align4,not_verified,success,universal,2048,8192,2048,f16:row,f16:column,f32:column,1,0,1,1,tensorop,f32,32,128,64,2,1,2,1,16,8,8,75,1024,109051904,68753031168,3.84104,26.4414,17899.6
1,CUTLASS,gemm,cutlass_tensorop_s1688121gemm_f16_32x128_64x2_tn_align4,not_verified,success,universal,2048,8192,2048,f16:row,f16:column,f32:column,1,0,1,1,tensorop,f32,32,128,64,2,1,2,1,16,8,8,75,1024,109051904,68753031168,3.84291,26.4285,17890.9
1,CUTLASS,gemm,cutlass_tensorop_s1688112gemm_f16_32x128_64x2_tn_align4,not_verified,success,universal,2048,8192,2048,f16:row,f16:column,f32:column,1,0,1,1,tensorop,f32,32,128,64,2,1,1,1,16,8,8,75,1024,109051904,68753031168,24.2232,4.19277,2838.31
1,CUTLASS,gemm,cutlass_tensorop_s1688111gemm_f16_32x128_64x2_tn_align4,not_verified,success,universal,2048,8192,2048,f16:row,f16:column,f32:column,1,0,1,1,tensorop,f32,32,128,64,2,1,1,1,16,8,8,75,1024,109051904,68753031168,24.0409,4.22457,2859.83
1,CUTLASS,gemm,cutlass_tensorop_s1688142gemm_f16_32x128_64x2_tn_align4,not_verified,success,universal,3072,12288,3072,f16:row,f16:column,f32:column,1,0,1,1,tensorop,f32,32,128,64,2,1,4,1,16,8,8,75,1024,245366784,232003731456,7.95047,28.7424,29181.1
1,CUTLASS,gemm,cutlass_tensorop_s1688141gemm_f16_32x128_64x2_tn_align4,not_verified,success,universal,3072,12288,3072,f16:row,f16:column,f32:column,1,0,1,1,tensorop,f32,32,128,64,2,1,4,1,16,8,8,75,1024,245366784,232003731456,7.93065,28.8142,29254.1
1,CUTLASS,gemm,cutlass_tensorop_s1688122gemm_f16_32x128_64x2_tn_align4,not_verified,success,universal,3072,12288,3072,f16:row,f16:column,f32:column,1,0,1,1,tensorop,f32,32,128,64,2,1,2,1,16,8,8,75,1024,245366784,232003731456,12.5568,18.1986,18476.4
1,CUTLASS,gemm,cutlass_tensorop_s1688121gemm_f16_32x128_64x2_tn_align4,not_verified,success,universal,3072,12288,3072,f16:row,f16:column,f32:column,1,0,1,1,tensorop,f32,32,128,64,2,1,2,1,16,8,8,75,1024,245366784,232003731456,12.5578,18.1971,18474.9
1,CUTLASS,gemm,cutlass_tensorop_s1688112gemm_f16_32x128_64x2_tn_align4,not_verified,success,universal,3072,12288,3072,f16:row,f16:column,f32:column,1,0,1,1,tensorop,f32,32,128,64,2,1,1,1,16,8,8,75,1024,245366784,232003731456,79.3194,2.88095,2924.93
1,CUTLASS,gemm,cutlass_tensorop_s1688111gemm_f16_32x128_64x2_tn_align4,not_verified,success,universal,3072,12288,3072,f16:row,f16:column,f32:column,1,0,1,1,tensorop,f32,32,128,64,2,1,1,1,16,8,8,75,1024,245366784,232003731456,79.2812,2.88234,2926.34
1,CUTLASS,gemm,cutlass_tensorop_s1688142gemm_f16_32x128_64x2_tn_align4,not_verified,success,universal,4096,16384,4096,f16:row,f16:column,f32:column,1,0,1,1,tensorop,f32,32,128,64,2,1,4,1,16,8,8,75,1024,436207616,549890031616,18.6578,21.7738,29472.4
1,CUTLASS,gemm,cutlass_tensorop_s1688141gemm_f16_32x128_64x2_tn_align4,not_verified,success,universal,4096,16384,4096,f16:row,f16:column,f32:column,1,0,1,1,tensorop,f32,32,128,64,2,1,4,1,16,8,8,75,1024,436207616,549890031616,18.6523,21.7801,29481.1
1,CUTLASS,gemm,cutlass_tensorop_s1688122gemm_f16_32x128_64x2_tn_align4,not_verified,success,universal,4096,16384,4096,f16:row,f16:column,f32:column,1,0,1,1,tensorop,f32,32,128,64,2,1,2,1,16,8,8,75,1024,436207616,549890031616,29.089,13.9658,18903.7
1,CUTLASS,gemm,cutlass_tensorop_s1688121gemm_f16_32x128_64x2_tn_align4,not_verified,success,universal,4096,16384,4096,f16:row,f16:column,f32:column,1,0,1,1,tensorop,f32,32,128,64,2,1,2,1,16,8,8,75,1024,436207616,549890031616,29.0995,13.9607,18896.9
1,CUTLASS,gemm,cutlass_tensorop_s1688112gemm_f16_32x128_64x2_tn_align4,not_verified,success,universal,4096,16384,4096,f16:row,f16:column,f32:column,1,0,1,1,tensorop,f32,32,128,64,2,1,1,1,16,8,8,75,1024,436207616,549890031616,182.162,2.23016,3018.68
1,CUTLASS,gemm,cutlass_tensorop_s1688111gemm_f16_32x128_64x2_tn_align4,not_verified,success,universal,4096,16384,4096,f16:row,f16:column,f32:column,1,0,1,1,tensorop,f32,32,128,64,2,1,1,1,16,8,8,75,1024,436207616,549890031616,182.181,2.22993,3018.38
1,CUTLASS,gemm,cutlass_tensorop_s1688142gemm_f16_32x128_64x2_tn_align4,not_verified,success,universal,5120,20480,5120,f16:row,f16:column,f32:column,1,0,1,1,tensorop,f32,32,128,64,2,1,4,1,16,8,8,75,1024,681574400,1073951539200,38.278,16.5831,28056.6
1,CUTLASS,gemm,cutlass_tensorop_s1688141gemm_f16_32x128_64x2_tn_align4,not_verified,success,universal,5120,20480,5120,f16:row,f16:column,f32:column,1,0,1,1,tensorop,f32,32,128,64,2,1,4,1,16,8,8,75,1024,681574400,1073951539200,38.1971,16.6182,28116.1
1,CUTLASS,gemm,cutlass_tensorop_s1688122gemm_f16_32x128_64x2_tn_align4,not_verified,success,universal,5120,20480,5120,f16:row,f16:column,f32:column,1,0,1,1,tensorop,f32,32,128,64,2,1,2,1,16,8,8,75,1024,681574400,1073951539200,57.1678,11.1035,18785.9
1,CUTLASS,gemm,cutlass_tensorop_s1688121gemm_f16_32x128_64x2_tn_align4,not_verified,success,universal,5120,20480,5120,f16:row,f16:column,f32:column,1,0,1,1,tensorop,f32,32,128,64,2,1,2,1,16,8,8,75,1024,681574400,1073951539200,57.189,11.0994,18779
1,CUTLASS,gemm,cutlass_tensorop_s1688112gemm_f16_32x128_64x2_tn_align4,not_verified,success,universal,5120,20480,5120,f16:row,f16:column,f32:column,1,0,1,1,tensorop,f32,32,128,64,2,1,1,1,16,8,8,75,1024,681574400,1073951539200,376.268,1.687,2854.22
1,CUTLASS,gemm,cutlass_tensorop_s1688111gemm_f16_32x128_64x2_tn_align4,not_verified,success,universal,5120,20480,5120,f16:row,f16:column,f32:column,1,0,1,1,tensorop,f32,32,128,64,2,1,1,1,16,8,8,75,1024,681574400,1073951539200,369.197,1.71931,2908.89
1,CUTLASS,gemm,cutlass_tensorop_s1688142gemm_f16_32x128_64x2_tn_align4,not_verified,success,universal,6144,24576,6144,f16:row,f16:column,f32:column,1,0,1,1,tensorop,f32,32,128,64,2,1,4,1,16,8,8,75,1024,981467136,1855727861760,61.8018,14.7902,30027.1
1,CUTLASS,gemm,cutlass_tensorop_s1688141gemm_f16_32x128_64x2_tn_align4,not_verified,success,universal,6144,24576,6144,f16:row,f16:column,f32:column,1,0,1,1,tensorop,f32,32,128,64,2,1,4,1,16,8,8,75,1024,981467136,1855727861760,61.8033,14.7899,30026.4
1,CUTLASS,gemm,cutlass_tensorop_s1688122gemm_f16_32x128_64x2_tn_align4,not_verified,success,universal,6144,24576,6144,f16:row,f16:column,f32:column,1,0,1,1,tensorop,f32,32,128,64,2,1,2,1,16,8,8,75,1024,981467136,1855727861760,97.9589,9.33108,18943.9
1,CUTLASS,gemm,cutlass_tensorop_s1688121gemm_f16_32x128_64x2_tn_align4,not_verified,success,universal,6144,24576,6144,f16:row,f16:column,f32:column,1,0,1,1,tensorop,f32,32,128,64,2,1,2,1,16,8,8,75,1024,981467136,1855727861760,97.9965,9.3275,18936.7
1,CUTLASS,gemm,cutlass_tensorop_s1688112gemm_f16_32x128_64x2_tn_align4,not_verified,success,universal,6144,24576,6144,f16:row,f16:column,f32:column,1,0,1,1,tensorop,f32,32,128,64,2,1,1,1,16,8,8,75,1024,981467136,1855727861760,632.628,1.44487,2933.36
1,CUTLASS,gemm,cutlass_tensorop_s1688111gemm_f16_32x128_64x2_tn_align4,not_verified,success,universal,6144,24576,6144,f16:row,f16:column,f32:column,1,0,1,1,tensorop,f32,32,128,64,2,1,1,1,16,8,8,75,1024,981467136,1855727861760,632.717,1.44466,2932.95
1,CUTLASS,gemm,cutlass_tensorop_s1688142gemm_f16_32x128_64x2_tn_align4,not_verified,success,universal,7168,28672,7168,f16:row,f16:column,f32:column,1,0,1,1,tensorop,f32,32,128,64,2,1,4,1,16,8,8,75,1024,1335885824,2946758606848,99.0091,12.5659,29762.5
1,CUTLASS,gemm,cutlass_tensorop_s1688141gemm_f16_32x128_64x2_tn_align4,not_verified,success,universal,7168,28672,7168,f16:row,f16:column,f32:column,1,0,1,1,tensorop,f32,32,128,64,2,1,4,1,16,8,8,75,1024,1335885824,2946758606848,99.0471,12.5611,29751.1
1,CUTLASS,gemm,cutlass_tensorop_s1688122gemm_f16_32x128_64x2_tn_align4,not_verified,success,universal,7168,28672,7168,f16:row,f16:column,f32:column,1,0,1,1,tensorop,f32,32,128,64,2,1,2,1,16,8,8,75,1024,1335885824,2946758606848,155.324,8.00995,18971.7
1,CUTLASS,gemm,cutlass_tensorop_s1688121gemm_f16_32x128_64x2_tn_align4,not_verified,success,universal,7168,28672,7168,f16:row,f16:column,f32:column,1,0,1,1,tensorop,f32,32,128,64,2,1,2,1,16,8,8,75,1024,1335885824,2946758606848,155.414,8.00532,18960.7
1,CUTLASS,gemm,cutlass_tensorop_s1688112gemm_f16_32x128_64x2_tn_align4,not_verified,success,universal,7168,28672,7168,f16:row,f16:column,f32:column,1,0,1,1,tensorop,f32,32,128,64,2,1,1,1,16,8,8,75,1024,1335885824,2946758606848,995.016,1.25037,2961.52
1,CUTLASS,gemm,cutlass_tensorop_s1688111gemm_f16_32x128_64x2_tn_align4,not_verified,success,universal,7168,28672,7168,f16:row,f16:column,f32:column,1,0,1,1,tensorop,f32,32,128,64,2,1,1,1,16,8,8,75,1024,1335885824,2946758606848,998.447,1.24608,2951.34
1,CUTLASS,gemm,cutlass_tensorop_s1688142gemm_f16_32x128_64x2_tn_align4,not_verified,success,universal,8192,32768,8192,f16:row,f16:column,f32:column,1,0,1,1,tensorop,f32,32,128,64,2,1,4,1,16,8,8,75,1024,1744830464,4398583382016,147.604,11.0092,29799.9
1,CUTLASS,gemm,cutlass_tensorop_s1688141gemm_f16_32x128_64x2_tn_align4,not_verified,success,universal,8192,32768,8192,f16:row,f16:column,f32:column,1,0,1,1,tensorop,f32,32,128,64,2,1,4,1,16,8,8,75,1024,1744830464,4398583382016,147.613,11.0085,29798.1
1,CUTLASS,gemm,cutlass_tensorop_s1688122gemm_f16_32x128_64x2_tn_align4,not_verified,success,universal,8192,32768,8192,f16:row,f16:column,f32:column,1,0,1,1,tensorop,f32,32,128,64,2,1,2,1,16,8,8,75,1024,1744830464,4398583382016,229.482,7.08118,19167.5
1,CUTLASS,gemm,cutlass_tensorop_s1688121gemm_f16_32x128_64x2_tn_align4,not_verified,success,universal,8192,32768,8192,f16:row,f16:column,f32:column,1,0,1,1,tensorop,f32,32,128,64,2,1,2,1,16,8,8,75,1024,1744830464,4398583382016,229.546,7.07919,19162.1
1,CUTLASS,gemm,cutlass_tensorop_s1688112gemm_f16_32x128_64x2_tn_align4,not_verified,success,universal,8192,32768,8192,f16:row,f16:column,f32:column,1,0,1,1,tensorop,f32,32,128,64,2,1,1,1,16,8,8,75,1024,1744830464,4398583382016,1446.02,1.12378,3041.87
1,CUTLASS,gemm,cutlass_tensorop_s1688111gemm_f16_32x128_64x2_tn_align4,not_verified,success,universal,8192,32768,8192,f16:row,f16:column,f32:column,1,0,1,1,tensorop,f32,32,128,64,2,1,1,1,16,8,8,75,1024,1744830464,4398583382016,1447.56,1.12258,3038.61
1,CUTLASS,gemm,cutlass_tensorop_s1688142gemm_f16_32x128_64x2_tn_align4,not_verified,success,universal,9216,36864,9216,f16:row,f16:column,f32:column,1,0,1,1,tensorop,f32,32,128,64,2,1,4,1,16,8,8,75,1024,2208301056,6262741794816,209.868,9.79968,29841.3
1,CUTLASS,gemm,cutlass_tensorop_s1688141gemm_f16_32x128_64x2_tn_align4,not_verified,success,universal,9216,36864,9216,f16:row,f16:column,f32:column,1,0,1,1,tensorop,f32,32,128,64,2,1,4,1,16,8,8,75,1024,2208301056,6262741794816,209.884,9.79893,29839
1,CUTLASS,gemm,cutlass_tensorop_s1688122gemm_f16_32x128_64x2_tn_align4,not_verified,success,universal,9216,36864,9216,f16:row,f16:column,f32:column,1,0,1,1,tensorop,f32,32,128,64,2,1,2,1,16,8,8,75,1024,2208301056,6262741794816,329.147,6.2484,19027.2
1,CUTLASS,gemm,cutlass_tensorop_s1688121gemm_f16_32x128_64x2_tn_align4,not_verified,success,universal,9216,36864,9216,f16:row,f16:column,f32:column,1,0,1,1,tensorop,f32,32,128,64,2,1,2,1,16,8,8,75,1024,2208301056,6262741794816,329.272,6.24603,19020
1,CUTLASS,gemm,cutlass_tensorop_s1688112gemm_f16_32x128_64x2_tn_align4,not_verified,success,universal,9216,36864,9216,f16:row,f16:column,f32:column,1,0,1,1,tensorop,f32,32,128,64,2,1,1,1,16,8,8,75,1024,2208301056,6262741794816,2099.6,0.97954,2982.83
1,CUTLASS,gemm,cutlass_tensorop_s1688111gemm_f16_32x128_64x2_tn_align4,not_verified,success,universal,9216,36864,9216,f16:row,f16:column,f32:column,1,0,1,1,tensorop,f32,32,128,64,2,1,1,1,16,8,8,75,1024,2208301056,6262741794816,2094.72,0.981822,2989.78
1,CUTLASS,gemm,cutlass_tensorop_s1688142gemm_f16_32x128_64x2_tn_align4,not_verified,success,universal,10240,40960,10240,f16:row,f16:column,f32:column,1,0,1,1,tensorop,f32,32,128,64,2,1,4,1,16,8,8,75,1024,2726297600,8590773452800,457.937,5.54457,18759.7
1,CUTLASS,gemm,cutlass_tensorop_s1688141gemm_f16_32x128_64x2_tn_align4,not_verified,success,universal,10240,40960,10240,f16:row,f16:column,f32:column,1,0,1,1,tensorop,f32,32,128,64,2,1,4,1,16,8,8,75,1024,2726297600,8590773452800,461.856,5.49752,18600.5
1,CUTLASS,gemm,cutlass_tensorop_s1688122gemm_f16_32x128_64x2_tn_align4,not_verified,success,universal,10240,40960,10240,f16:row,f16:column,f32:column,1,0,1,1,tensorop,f32,32,128,64,2,1,2,1,16,8,8,75,1024,2726297600,8590773452800,451.059,5.62912,19045.8
1,CUTLASS,gemm,cutlass_tensorop_s1688121gemm_f16_32x128_64x2_tn_align4,not_verified,success,universal,10240,40960,10240,f16:row,f16:column,f32:column,1,0,1,1,tensorop,f32,32,128,64,2,1,2,1,16,8,8,75,1024,2726297600,8590773452800,451.004,5.6298,19048.1
1,CUTLASS,gemm,cutlass_tensorop_s1688112gemm_f16_32x128_64x2_tn_align4,not_verified,success,universal,10240,40960,10240,f16:row,f16:column,f32:column,1,0,1,1,tensorop,f32,32,128,64,2,1,1,1,16,8,8,75,1024,2726297600,8590773452800,2871.56,0.884209,2991.67
1,CUTLASS,gemm,cutlass_tensorop_s1688111gemm_f16_32x128_64x2_tn_align4,not_verified,success,universal,10240,40960,10240,f16:row,f16:column,f32:column,1,0,1,1,tensorop,f32,32,128,64,2,1,1,1,16,8,8,75,1024,2726297600,8590773452800,2881.01,0.881309,2981.86
1,CUTLASS,gemm,cutlass_tensorop_s1688211gemm_f16_64x32_32x2_tn_align4,not_verified,success,universal,1024,4096,1024,f16:row,f16:column,f32:column,1,0,1,1,tensorop,f32,64,32,32,2,2,1,1,16,8,8,75,1024,27262976,8598323200,0.48384,52.4773,17771
1,CUTLASS,gemm,cutlass_tensorop_s1688111gemm_f16_64x32_32x2_tn_align4,not_verified,success,universal,1024,4096,1024,f16:row,f16:column,f32:column,1,0,1,1,tensorop,f32,64,32,32,2,1,1,1,16,8,8,75,1024,27262976,8598323200,0.468381,54.2094,18357.5
1,CUTLASS,gemm,cutlass_tensorop_s1688211gemm_f16_64x32_32x2_tn_align4,not_verified,success,universal,2048,8192,2048,f16:row,f16:column,f32:column,1,0,1,1,tensorop,f32,64,32,32,2,2,1,1,16,8,8,75,1024,109051904,68753031168,3.39905,29.8796,20227.1
1,CUTLASS,gemm,cutlass_tensorop_s1688111gemm_f16_64x32_32x2_tn_align4,not_verified,success,universal,2048,8192,2048,f16:row,f16:column,f32:column,1,0,1,1,tensorop,f32,64,32,32,2,1,1,1,16,8,8,75,1024,109051904,68753031168,2.90351,34.9792,23679.3
1,CUTLASS,gemm,cutlass_tensorop_s1688211gemm_f16_64x32_32x2_tn_align4,not_verified,success,universal,3072,12288,3072,f16:row,f16:column,f32:column,1,0,1,1,tensorop,f32,64,32,32,2,2,1,1,16,8,8,75,1024,245366784,232003731456,10.577,21.605,21934.8
1,CUTLASS,gemm,cutlass_tensorop_s1688111gemm_f16_64x32_32x2_tn_align4,not_verified,success,universal,3072,12288,3072,f16:row,f16:column,f32:column,1,0,1,1,tensorop,f32,64,32,32,2,1,1,1,16,8,8,75,1024,245366784,232003731456,9.67484,23.6196,23980.1
1,CUTLASS,gemm,cutlass_tensorop_s1688211gemm_f16_64x32_32x2_tn_align4,not_verified,success,universal,4096,16384,4096,f16:row,f16:column,f32:column,1,0,1,1,tensorop,f32,64,32,32,2,2,1,1,16,8,8,75,1024,436207616,549890031616,24.1056,16.853,22811.8
1,CUTLASS,gemm,cutlass_tensorop_s1688111gemm_f16_64x32_32x2_tn_align4,not_verified,success,universal,4096,16384,4096,f16:row,f16:column,f32:column,1,0,1,1,tensorop,f32,64,32,32,2,1,1,1,16,8,8,75,1024,436207616,549890031616,22.8398,17.7869,24076
1,CUTLASS,gemm,cutlass_tensorop_s1688211gemm_f16_64x32_32x2_tn_align4,not_verified,success,universal,5120,20480,5120,f16:row,f16:column,f32:column,1,0,1,1,tensorop,f32,64,32,32,2,2,1,1,16,8,8,75,1024,681574400,1073951539200,51.2546,12.3846,20953.3
1,CUTLASS,gemm,cutlass_tensorop_s1688111gemm_f16_64x32_32x2_tn_align4,not_verified,success,universal,5120,20480,5120,f16:row,f16:column,f32:column,1,0,1,1,tensorop,f32,64,32,32,2,1,1,1,16,8,8,75,1024,681574400,1073951539200,45.5101,13.9478,23598.1
1,CUTLASS,gemm,cutlass_tensorop_s1688211gemm_f16_64x32_32x2_tn_align4,not_verified,success,universal,6144,24576,6144,f16:row,f16:column,f32:column,1,0,1,1,tensorop,f32,64,32,32,2,2,1,1,16,8,8,75,1024,981467136,1855727861760,86.1277,10.6129,21546.2
1,CUTLASS,gemm,cutlass_tensorop_s1688111gemm_f16_64x32_32x2_tn_align4,not_verified,success,universal,6144,24576,6144,f16:row,f16:column,f32:column,1,0,1,1,tensorop,f32,64,32,32,2,1,1,1,16,8,8,75,1024,981467136,1855727861760,77.3457,11.8179,23992.6
1,CUTLASS,gemm,cutlass_tensorop_s1688211gemm_f16_64x32_32x2_tn_align4,not_verified,success,universal,7168,28672,7168,f16:row,f16:column,f32:column,1,0,1,1,tensorop,f32,64,32,32,2,2,1,1,16,8,8,75,1024,1335885824,2946758606848,137.759,9.03127,21390.6
1,CUTLASS,gemm,cutlass_tensorop_s1688111gemm_f16_64x32_32x2_tn_align4,not_verified,success,universal,7168,28672,7168,f16:row,f16:column,f32:column,1,0,1,1,tensorop,f32,64,32,32,2,1,1,1,16,8,8,75,1024,1335885824,2946758606848,123.783,10.051,23805.9
1,CUTLASS,gemm,cutlass_tensorop_s1688211gemm_f16_64x32_32x2_tn_align4,not_verified,success,universal,8192,32768,8192,f16:row,f16:column,f32:column,1,0,1,1,tensorop,f32,64,32,32,2,2,1,1,16,8,8,75,1024,1744830464,4398583382016,196.348,8.27613,22402
1,CUTLASS,gemm,cutlass_tensorop_s1688111gemm_f16_64x32_32x2_tn_align4,not_verified,success,universal,8192,32768,8192,f16:row,f16:column,f32:column,1,0,1,1,tensorop,f32,64,32,32,2,1,1,1,16,8,8,75,1024,1744830464,4398583382016,181.326,8.96174,24257.8
1,CUTLASS,gemm,cutlass_tensorop_s1688211gemm_f16_64x32_32x2_tn_align4,not_verified,success,universal,9216,36864,9216,f16:row,f16:column,f32:column,1,0,1,1,tensorop,f32,64,32,32,2,2,1,1,16,8,8,75,1024,2208301056,6262741794816,532.648,3.86116,11757.7
1,CUTLASS,gemm,cutlass_tensorop_s1688111gemm_f16_64x32_32x2_tn_align4,not_verified,success,universal,9216,36864,9216,f16:row,f16:column,f32:column,1,0,1,1,tensorop,f32,64,32,32,2,1,1,1,16,8,8,75,1024,2208301056,6262741794816,280.456,7.33319,22330.5
1,CUTLASS,gemm,cutlass_tensorop_s1688211gemm_f16_64x32_32x2_tn_align4,not_verified,success,universal,10240,40960,10240,f16:row,f16:column,f32:column,1,0,1,1,tensorop,f32,64,32,32,2,2,1,1,16,8,8,75,1024,2726297600,8590773452800,842.898,3.0123,10191.9
1,CUTLASS,gemm,cutlass_tensorop_s1688111gemm_f16_64x32_32x2_tn_align4,not_verified,success,universal,10240,40960,10240,f16:row,f16:column,f32:column,1,0,1,1,tensorop,f32,64,32,32,2,1,1,1,16,8,8,75,1024,2726297600,8590773452800,709.119,3.58059,12114.7
1,CUTLASS,gemm,cutlass_tensorop_s1688212gemm_f16_64x32_64x2_tn_align4,not_verified,success,universal,1024,4096,1024,f16:row,f16:column,f32:column,1,0,1,1,tensorop,f32,64,32,64,2,2,1,1,16,8,8,75,1024,27262976,8598323200,0.342095,74.221,25134.3
1,CUTLASS,gemm,cutlass_tensorop_s1688211gemm_f16_64x32_64x2_tn_align4,not_verified,success,universal,1024,4096,1024,f16:row,f16:column,f32:column,1,0,1,1,tensorop,f32,64,32,64,2,2,1,1,16,8,8,75,1024,27262976,8598323200,0.339892,74.7019,25297.2
1,CUTLASS,gemm,cutlass_tensorop_s1688112gemm_f16_64x32_64x2_tn_align4,not_verified,success,universal,1024,4096,1024,f16:row,f16:column,f32:column,1,0,1,1,tensorop,f32,64,32,64,2,1,1,1,16,8,8,75,1024,27262976,8598323200,0.495548,51.2375,17351.1
1,CUTLASS,gemm,cutlass_tensorop_s1688111gemm_f16_64x32_64x2_tn_align4,not_verified,success,universal,1024,4096,1024,f16:row,f16:column,f32:column,1,0,1,1,tensorop,f32,64,32,64,2,1,1,1,16,8,8,75,1024,27262976,8598323200,0.495234,51.2699,17362.1
1,CUTLASS,gemm,cutlass_tensorop_s1688212gemm_f16_64x32_64x2_tn_align4,not_verified,success,universal,2048,8192,2048,f16:row,f16:column,f32:column,1,0,1,1,tensorop,f32,64,32,64,2,2,1,1,16,8,8,75,1024,109051904,68753031168,2.5123,40.4261,27366.6
1,CUTLASS,gemm,cutlass_tensorop_s1688211gemm_f16_64x32_64x2_tn_align4,not_verified,success,universal,2048,8192,2048,f16:row,f16:column,f32:column,1,0,1,1,tensorop,f32,64,32,64,2,2,1,1,16,8,8,75,1024,109051904,68753031168,2.48357,40.8937,27683.1
1,CUTLASS,gemm,cutlass_tensorop_s1688112gemm_f16_64x32_64x2_tn_align4,not_verified,success,universal,2048,8192,2048,f16:row,f16:column,f32:column,1,0,1,1,tensorop,f32,64,32,64,2,1,1,1,16,8,8,75,1024,109051904,68753031168,3.49266,29.0788,19685
1,CUTLASS,gemm,cutlass_tensorop_s1688111gemm_f16_64x32_64x2_tn_align4,not_verified,success,universal,2048,8192,2048,f16:row,f16:column,f32:column,1,0,1,1,tensorop,f32,64,32,64,2,1,1,1,16,8,8,75,1024,109051904,68753031168,3.49262,29.0792,19685.3
1,CUTLASS,gemm,cutlass_tensorop_s1688212gemm_f16_64x32_64x2_tn_align4,not_verified,success,universal,3072,12288,3072,f16:row,f16:column,f32:column,1,0,1,1,tensorop,f32,64,32,64,2,2,1,1,16,8,8,75,1024,245366784,232003731456,8.1599,28.0047,28432.2
1,CUTLASS,gemm,cutlass_tensorop_s1688211gemm_f16_64x32_64x2_tn_align4,not_verified,success,universal,3072,12288,3072,f16:row,f16:column,f32:column,1,0,1,1,tensorop,f32,64,32,64,2,2,1,1,16,8,8,75,1024,245366784,232003731456,8.14156,28.0678,28496.2
1,CUTLASS,gemm,cutlass_tensorop_s1688112gemm_f16_64x32_64x2_tn_align4,not_verified,success,universal,3072,12288,3072,f16:row,f16:column,f32:column,1,0,1,1,tensorop,f32,64,32,64,2,1,1,1,16,8,8,75,1024,245366784,232003731456,11.3813,20.0782,20384.7
1,CUTLASS,gemm,cutlass_tensorop_s1688111gemm_f16_64x32_64x2_tn_align4,not_verified,success,universal,3072,12288,3072,f16:row,f16:column,f32:column,1,0,1,1,tensorop,f32,64,32,64,2,1,1,1,16,8,8,75,1024,245366784,232003731456,11.3792,20.0819,20388.4
1,CUTLASS,gemm,cutlass_tensorop_s1688212gemm_f16_64x32_64x2_tn_align4,not_verified,success,universal,4096,16384,4096,f16:row,f16:column,f32:column,1,0,1,1,tensorop,f32,64,32,64,2,2,1,1,16,8,8,75,1024,436207616,549890031616,18.7031,21.721,29401
1,CUTLASS,gemm,cutlass_tensorop_s1688211gemm_f16_64x32_64x2_tn_align4,not_verified,success,universal,4096,16384,4096,f16:row,f16:column,f32:column,1,0,1,1,tensorop,f32,64,32,64,2,2,1,1,16,8,8,75,1024,436207616,549890031616,18.8332,21.5709,29197.8
1,CUTLASS,gemm,cutlass_tensorop_s1688112gemm_f16_64x32_64x2_tn_align4,not_verified,success,universal,4096,16384,4096,f16:row,f16:column,f32:column,1,0,1,1,tensorop,f32,64,32,64,2,1,1,1,16,8,8,75,1024,436207616,549890031616,26.5898,15.2784,20680.5
1,CUTLASS,gemm,cutlass_tensorop_s1688111gemm_f16_64x32_64x2_tn_align4,not_verified,success,universal,4096,16384,4096,f16:row,f16:column,f32:column,1,0,1,1,tensorop,f32,64,32,64,2,1,1,1,16,8,8,75,1024,436207616,549890031616,26.5945,15.2757,20676.9
1,CUTLASS,gemm,cutlass_tensorop_s1688212gemm_f16_64x32_64x2_tn_align4,not_verified,success,universal,5120,20480,5120,f16:row,f16:column,f32:column,1,0,1,1,tensorop,f32,64,32,64,2,2,1,1,16,8,8,75,1024,681574400,1073951539200,37.169,17.0778,28893.7
1,CUTLASS,gemm,cutlass_tensorop_s1688211gemm_f16_64x32_64x2_tn_align4,not_verified,success,universal,5120,20480,5120,f16:row,f16:column,f32:column,1,0,1,1,tensorop,f32,64,32,64,2,2,1,1,16,8,8,75,1024,681574400,1073951539200,37.714,16.831,28476.2
1,CUTLASS,gemm,cutlass_tensorop_s1688112gemm_f16_64x32_64x2_tn_align4,not_verified,success,universal,5120,20480,5120,f16:row,f16:column,f32:column,1,0,1,1,tensorop,f32,64,32,64,2,1,1,1,16,8,8,75,1024,681574400,1073951539200,51.4286,12.3427,20882.4
1,CUTLASS,gemm,cutlass_tensorop_s1688111gemm_f16_64x32_64x2_tn_align4,not_verified,success,universal,5120,20480,5120,f16:row,f16:column,f32:column,1,0,1,1,tensorop,f32,64,32,64,2,1,1,1,16,8,8,75,1024,681574400,1073951539200,51.4492,12.3377,20874
1,CUTLASS,gemm,cutlass_tensorop_s1688212gemm_f16_64x32_64x2_tn_align4,not_verified,success,universal,6144,24576,6144,f16:row,f16:column,f32:column,1,0,1,1,tensorop,f32,64,32,64,2,2,1,1,16,8,8,75,1024,981467136,1855727861760,64.5273,14.1655,28758.8
1,CUTLASS,gemm,cutlass_tensorop_s1688211gemm_f16_64x32_64x2_tn_align4,not_verified,success,universal,6144,24576,6144,f16:row,f16:column,f32:column,1,0,1,1,tensorop,f32,64,32,64,2,2,1,1,16,8,8,75,1024,981467136,1855727861760,65.1252,14.0355,28494.8
1,CUTLASS,gemm,cutlass_tensorop_s1688112gemm_f16_64x32_64x2_tn_align4,not_verified,success,universal,6144,24576,6144,f16:row,f16:column,f32:column,1,0,1,1,tensorop,f32,64,32,64,2,1,1,1,16,8,8,75,1024,981467136,1855727861760,88.4792,10.3308,20973.6
1,CUTLASS,gemm,cutlass_tensorop_s1688111gemm_f16_64x32_64x2_tn_align4,not_verified,success,universal,6144,24576,6144,f16:row,f16:column,f32:column,1,0,1,1,tensorop,f32,64,32,64,2,1,1,1,16,8,8,75,1024,981467136,1855727861760,88.522,10.3258,20963.5
1,CUTLASS,gemm,cutlass_tensorop_s1688212gemm_f16_64x32_64x2_tn_align4,not_verified,success,universal,7168,28672,7168,f16:row,f16:column,f32:column,1,0,1,1,tensorop,f32,64,32,64,2,2,1,1,16,8,8,75,1024,1335885824,2946758606848,106.083,11.728,27777.8
1,CUTLASS,gemm,cutlass_tensorop_s1688211gemm_f16_64x32_64x2_tn_align4,not_verified,success,universal,7168,28672,7168,f16:row,f16:column,f32:column,1,0,1,1,tensorop,f32,64,32,64,2,2,1,1,16,8,8,75,1024,1335885824,2946758606848,104.392,11.918,28227.9
1,CUTLASS,gemm,cutlass_tensorop_s1688112gemm_f16_64x32_64x2_tn_align4,not_verified,success,universal,7168,28672,7168,f16:row,f16:column,f32:column,1,0,1,1,tensorop,f32,64,32,64,2,1,1,1,16,8,8,75,1024,1335885824,2946758606848,140.168,8.87606,21023
1,CUTLASS,gemm,cutlass_tensorop_s1688111gemm_f16_64x32_64x2_tn_align4,not_verified,success,universal,7168,28672,7168,f16:row,f16:column,f32:column,1,0,1,1,tensorop,f32,64,32,64,2,1,1,1,16,8,8,75,1024,1335885824,2946758606848,140.239,8.87159,21012.4
1,CUTLASS,gemm,cutlass_tensorop_s1688212gemm_f16_64x32_64x2_tn_align4,not_verified,success,universal,8192,32768,8192,f16:row,f16:column,f32:column,1,0,1,1,tensorop,f32,64,32,64,2,2,1,1,16,8,8,75,1024,1744830464,4398583382016,153.134,10.6116,28723.7
1,CUTLASS,gemm,cutlass_tensorop_s1688211gemm_f16_64x32_64x2_tn_align4,not_verified,success,universal,8192,32768,8192,f16:row,f16:column,f32:column,1,0,1,1,tensorop,f32,64,32,64,2,2,1,1,16,8,8,75,1024,1744830464,4398583382016,153.638,10.5768,28629.5
1,CUTLASS,gemm,cutlass_tensorop_s1688112gemm_f16_64x32_64x2_tn_align4,not_verified,success,universal,8192,32768,8192,f16:row,f16:column,f32:column,1,0,1,1,tensorop,f32,64,32,64,2,1,1,1,16,8,8,75,1024,1744830464,4398583382016,208.635,7.78872,21082.7
1,CUTLASS,gemm,cutlass_tensorop_s1688111gemm_f16_64x32_64x2_tn_align4,not_verified,success,universal,8192,32768,8192,f16:row,f16:column,f32:column,1,0,1,1,tensorop,f32,64,32,64,2,1,1,1,16,8,8,75,1024,1744830464,4398583382016,208.645,7.78834,21081.6
1,CUTLASS,gemm,cutlass_tensorop_s1688212gemm_f16_64x32_64x2_tn_align4,not_verified,success,universal,9216,36864,9216,f16:row,f16:column,f32:column,1,0,1,1,tensorop,f32,64,32,64,2,2,1,1,16,8,8,75,1024,2208301056,6262741794816,227.158,9.05378,27570
1,CUTLASS,gemm,cutlass_tensorop_s1688211gemm_f16_64x32_64x2_tn_align4,not_verified,success,universal,9216,36864,9216,f16:row,f16:column,f32:column,1,0,1,1,tensorop,f32,64,32,64,2,2,1,1,16,8,8,75,1024,2208301056,6262741794816,229.971,8.94303,27232.7
1,CUTLASS,gemm,cutlass_tensorop_s1688112gemm_f16_64x32_64x2_tn_align4,not_verified,success,universal,9216,36864,9216,f16:row,f16:column,f32:column,1,0,1,1,tensorop,f32,64,32,64,2,1,1,1,16,8,8,75,1024,2208301056,6262741794816,296.93,6.92636,21091.7
1,CUTLASS,gemm,cutlass_tensorop_s1688111gemm_f16_64x32_64x2_tn_align4,not_verified,success,universal,9216,36864,9216,f16:row,f16:column,f32:column,1,0,1,1,tensorop,f32,64,32,64,2,1,1,1,16,8,8,75,1024,2208301056,6262741794816,296.966,6.92551,21089.1
1,CUTLASS,gemm,cutlass_tensorop_s1688212gemm_f16_64x32_64x2_tn_align4,not_verified,success,universal,10240,40960,10240,f16:row,f16:column,f32:column,1,0,1,1,tensorop,f32,64,32,64,2,2,1,1,16,8,8,75,1024,2726297600,8590773452800,311.963,8.139,27537.8
1,CUTLASS,gemm,cutlass_tensorop_s1688211gemm_f16_64x32_64x2_tn_align4,not_verified,success,universal,10240,40960,10240,f16:row,f16:column,f32:column,1,0,1,1,tensorop,f32,64,32,64,2,2,1,1,16,8,8,75,1024,2726297600,8590773452800,312.104,8.1353,27525.3
1,CUTLASS,gemm,cutlass_tensorop_s1688112gemm_f16_64x32_64x2_tn_align4,not_verified,success,universal,10240,40960,10240,f16:row,f16:column,f32:column,1,0,1,1,tensorop,f32,64,32,64,2,1,1,1,16,8,8,75,1024,2726297600,8590773452800,406.071,6.25275,21155.8
1,CUTLASS,gemm,cutlass_tensorop_s1688111gemm_f16_64x32_64x2_tn_align4,not_verified,success,universal,10240,40960,10240,f16:row,f16:column,f32:column,1,0,1,1,tensorop,f32,64,32,64,2,1,1,1,16,8,8,75,1024,2726297600,8590773452800,406.177,6.25112,21150.3
1,CUTLASS,gemm,cutlass_tensorop_s1688221gemm_f16_64x64_32x2_tn_align4,not_verified,success,universal,1024,4096,1024,f16:row,f16:column,f32:column,1,0,1,1,tensorop,f32,64,64,32,2,2,2,1,16,8,8,75,1024,27262976,8598323200,0.300143,84.5951,28647.4
1,CUTLASS,gemm,cutlass_tensorop_s1688211gemm_f16_64x64_32x2_tn_align4,not_verified,success,universal,1024,4096,1024,f16:row,f16:column,f32:column,1,0,1,1,tensorop,f32,64,64,32,2,2,1,1,16,8,8,75,1024,27262976,8598323200,0.290879,87.2893,29559.8
1,CUTLASS,gemm,cutlass_tensorop_s1688121gemm_f16_64x64_32x2_tn_align4,not_verified,success,universal,1024,4096,1024,f16:row,f16:column,f32:column,1,0,1,1,tensorop,f32,64,64,32,2,1,2,1,16,8,8,75,1024,27262976,8598323200,0.28695,88.4844,29964.5
1,CUTLASS,gemm,cutlass_tensorop_s1688111gemm_f16_64x64_32x2_tn_align4,not_verified,success,universal,1024,4096,1024,f16:row,f16:column,f32:column,1,0,1,1,tensorop,f32,64,64,32,2,1,1,1,16,8,8,75,1024,27262976,8598323200,0.270283,93.9408,31812.3
1,CUTLASS,gemm,cutlass_tensorop_s1688221gemm_f16_64x64_32x2_tn_align4,not_verified,success,universal,2048,8192,2048,f16:row,f16:column,f32:column,1,0,1,1,tensorop,f32,64,64,32,2,2,2,1,16,8,8,75,1024,109051904,68753031168,2.26357,44.8683,30373.7
1,CUTLASS,gemm,cutlass_tensorop_s1688211gemm_f16_64x64_32x2_tn_align4,not_verified,success,universal,2048,8192,2048,f16:row,f16:column,f32:column,1,0,1,1,tensorop,f32,64,64,32,2,2,1,1,16,8,8,75,1024,109051904,68753031168,2.11858,47.939,32452.4
1,CUTLASS,gemm,cutlass_tensorop_s1688121gemm_f16_64x64_32x2_tn_align4,not_verified,success,universal,2048,8192,2048,f16:row,f16:column,f32:column,1,0,1,1,tensorop,f32,64,64,32,2,1,2,1,16,8,8,75,1024,109051904,68753031168,2.10632,48.2179,32641.3
1,CUTLASS,gemm,cutlass_tensorop_s1688111gemm_f16_64x64_32x2_tn_align4,not_verified,success,universal,2048,8192,2048,f16:row,f16:column,f32:column,1,0,1,1,tensorop,f32,64,64,32,2,1,1,1,16,8,8,75,1024,109051904,68753031168,1.98513,51.1616,34634
1,CUTLASS,gemm,cutlass_tensorop_s1688221gemm_f16_64x64_32x2_tn_align4,not_verified,success,universal,3072,12288,3072,f16:row,f16:column,f32:column,1,0,1,1,tensorop,f32,64,64,32,2,2,2,1,16,8,8,75,1024,245366784,232003731456,7.52365,30.373,30836.6
1,CUTLASS,gemm,cutlass_tensorop_s1688211gemm_f16_64x64_32x2_tn_align4,not_verified,success,universal,3072,12288,3072,f16:row,f16:column,f32:column,1,0,1,1,tensorop,f32,64,64,32,2,2,1,1,16,8,8,75,1024,245366784,232003731456,7.03787,32.4694,32965.1
1,CUTLASS,gemm,cutlass_tensorop_s1688121gemm_f16_64x64_32x2_tn_align4,not_verified,success,universal,3072,12288,3072,f16:row,f16:column,f32:column,1,0,1,1,tensorop,f32,64,64,32,2,1,2,1,16,8,8,75,1024,245366784,232003731456,7.01311,32.5841,33081.4
1,CUTLASS,gemm,cutlass_tensorop_s1688111gemm_f16_64x64_32x2_tn_align4,not_verified,success,universal,3072,12288,3072,f16:row,f16:column,f32:column,1,0,1,1,tensorop,f32,64,64,32,2,1,1,1,16,8,8,75,1024,245366784,232003731456,6.49044,35.208,35745.4
1,CUTLASS,gemm,cutlass_tensorop_s1688221gemm_f16_64x64_32x2_tn_align4,not_verified,success,universal,4096,16384,4096,f16:row,f16:column,f32:column,1,0,1,1,tensorop,f32,64,64,32,2,2,2,1,16,8,8,75,1024,436207616,549890031616,17.5941,23.0902,31254.3
1,CUTLASS,gemm,cutlass_tensorop_s1688211gemm_f16_64x64_32x2_tn_align4,not_verified,success,universal,4096,16384,4096,f16:row,f16:column,f32:column,1,0,1,1,tensorop,f32,64,64,32,2,2,1,1,16,8,8,75,1024,436207616,549890031616,16.4682,24.6688,33391
1,CUTLASS,gemm,cutlass_tensorop_s1688121gemm_f16_64x64_32x2_tn_align4,not_verified,success,universal,4096,16384,4096,f16:row,f16:column,f32:column,1,0,1,1,tensorop,f32,64,64,32,2,1,2,1,16,8,8,75,1024,436207616,549890031616,16.4338,24.7205,33461
1,CUTLASS,gemm,cutlass_tensorop_s1688111gemm_f16_64x64_32x2_tn_align4,not_verified,success,universal,4096,16384,4096,f16:row,f16:column,f32:column,1,0,1,1,tensorop,f32,64,64,32,2,1,1,1,16,8,8,75,1024,436207616,549890031616,15.2941,26.5626,35954.5
1,CUTLASS,gemm,cutlass_tensorop_s1688221gemm_f16_64x64_32x2_tn_align4,not_verified,success,universal,5120,20480,5120,f16:row,f16:column,f32:column,1,0,1,1,tensorop,f32,64,64,32,2,2,2,1,16,8,8,75,1024,681574400,1073951539200,35.4701,17.8958,30277.6
