experiments/ww2w.gemm.csv
Problem,Provider,OperationKind,Operation,Disposition,Status,gemm_kind,m,n,k,A,B,C,alpha,beta,split_k_slices,batch_count,op_class,accum,cta_m,cta_n,cta_k,stages,warps_m,warps_n,warps_k,inst_m,inst_n,inst_k,min_cc,max_cc,Bytes,Flops,Runtime,GB/s,GFLOPs
1,CUTLASS,gemm,cutlass_tensorop_s1688111gemm_f16_32x32_32x2_tn_align4,not_verified,success,universal,1024,1024,2048,f16:row,f16:column,f32:column,1,0,1,1,tensorop,f32,32,32,32,2,1,1,1,16,8,8,75,1024,12582912,4297064448,0.293889,39.8748,14621.4
1,CUTLASS,gemm,cutlass_tensorop_s1688111gemm_f16_32x32_32x2_tn_align4,not_verified,success,universal,2048,2048,4096,f16:row,f16:column,f32:column,1,0,1,1,tensorop,f32,32,32,32,2,1,1,1,16,8,8,75,1024,50331648,34368126976,2.36764,19.7982,14515.8
1,CUTLASS,gemm,cutlass_tensorop_s1688111gemm_f16_32x32_32x2_tn_align4,not_verified,success,universal,3072,3072,6144,f16:row,f16:column,f32:column,1,0,1,1,tensorop,f32,32,32,32,2,1,1,1,16,8,8,75,1024,113246208,115982991360,6.50145,16.2223,17839.6
1,CUTLASS,gemm,cutlass_tensorop_s1688111gemm_f16_32x32_32x2_tn_align4,not_verified,success,universal,4096,4096,8192,f16:row,f16:column,f32:column,1,0,1,1,tensorop,f32,32,32,32,2,1,1,1,16,8,8,75,1024,201326592,274911461376,15.3145,12.2433,17951
1,CUTLASS,gemm,cutlass_tensorop_s1688111gemm_f16_32x32_32x2_tn_align4,not_verified,success,universal,5120,5120,10240,f16:row,f16:column,f32:column,1,0,1,1,tensorop,f32,32,32,32,2,1,1,1,16,8,8,75,1024,314572800,536923340800,39.1437,7.48444,13716.7
1,CUTLASS,gemm,cutlass_tensorop_s1688111gemm_f16_32x32_32x2_tn_align4,not_verified,success,universal,6144,6144,12288,f16:row,f16:column,f32:column,1,0,1,1,tensorop,f32,32,32,32,2,1,1,1,16,8,8,75,1024,452984832,927788433408,91.175,4.62709,10175.9
1,CUTLASS,gemm,cutlass_tensorop_s1688111gemm_f16_32x32_32x2_tn_align4,not_verified,success,universal,7168,7168,14336,f16:row,f16:column,f32:column,1,0,1,1,tensorop,f32,32,32,32,2,1,1,1,16,8,8,75,1024,616562688,1473276542976,176.12,3.26038,8365.17
1,CUTLASS,gemm,cutlass_tensorop_s1688111gemm_f16_32x32_32x2_tn_align4,not_verified,success,universal,8192,8192,16384,f16:row,f16:column,f32:column,1,0,1,1,tensorop,f32,32,32,32,2,1,1,1,16,8,8,75,1024,805306368,2199157473280,295.106,2.54146,7452.09
1,CUTLASS,gemm,cutlass_tensorop_s1688111gemm_f16_32x32_32x2_tn_align4,not_verified,success,universal,9216,9216,18432,f16:row,f16:column,f32:column,1,0,1,1,tensorop,f32,32,32,32,2,1,1,1,16,8,8,75,1024,1019215872,3131201028096,482.576,1.96698,6488.51
1,CUTLASS,gemm,cutlass_tensorop_s1688111gemm_f16_32x32_32x2_tn_align4,not_verified,success,universal,10240,10240,20480,f16:row,f16:column,f32:column,1,0,1,1,tensorop,f32,32,32,32,2,1,1,1,16,8,8,75,1024,1258291200,4295177011200,731.727,1.60152,5869.92
1,CUTLASS,gemm,cutlass_tensorop_s1688112gemm_f16_32x32_64x2_tn_align4,not_verified,success,universal,1024,1024,2048,f16:row,f16:column,f32:column,1,0,1,1,tensorop,f32,32,32,64,2,1,1,1,16,8,8,75,1024,12582912,4297064448,0.180539,64.9097,23801.3
1,CUTLASS,gemm,cutlass_tensorop_s1688111gemm_f16_32x32_64x2_tn_align4,not_verified,success,universal,1024,1024,2048,f16:row,f16:column,f32:column,1,0,1,1,tensorop,f32,32,32,64,2,1,1,1,16,8,8,75,1024,12582912,4297064448,0.183568,63.8387,23408.6
1,CUTLASS,gemm,cutlass_tensorop_s1688112gemm_f16_32x32_64x2_tn_align4,not_verified,success,universal,2048,2048,4096,f16:row,f16:column,f32:column,1,0,1,1,tensorop,f32,32,32,64,2,1,1,1,16,8,8,75,1024,50331648,34368126976,1.37165,34.1743,25056.1
1,CUTLASS,gemm,cutlass_tensorop_s1688111gemm_f16_32x32_64x2_tn_align4,not_verified,success,universal,2048,2048,4096,f16:row,f16:column,f32:column,1,0,1,1,tensorop,f32,32,32,64,2,1,1,1,16,8,8,75,1024,50331648,34368126976,1.35221,34.6655,25416.3
1,CUTLASS,gemm,cutlass_tensorop_s1688112gemm_f16_32x32_64x2_tn_align4,not_verified,success,universal,3072,3072,6144,f16:row,f16:column,f32:column,1,0,1,1,tensorop,f32,32,32,64,2,1,1,1,16,8,8,75,1024,113246208,115982991360,4.49399,23.4688,25808.4
1,CUTLASS,gemm,cutlass_tensorop_s1688111gemm_f16_32x32_64x2_tn_align4,not_verified,success,universal,3072,3072,6144,f16:row,f16:column,f32:column,1,0,1,1,tensorop,f32,32,32,64,2,1,1,1,16,8,8,75,1024,113246208,115982991360,4.47949,23.5448,25892
1,CUTLASS,gemm,cutlass_tensorop_s1688112gemm_f16_32x32_64x2_tn_align4,not_verified,success,universal,4096,4096,8192,f16:row,f16:column,f32:column,1,0,1,1,tensorop,f32,32,32,64,2,1,1,1,16,8,8,75,1024,201326592,274911461376,10.3677,18.085,26516.1
1,CUTLASS,gemm,cutlass_tensorop_s1688111gemm_f16_32x32_64x2_tn_align4,not_verified,success,universal,4096,4096,8192,f16:row,f16:column,f32:column,1,0,1,1,tensorop,f32,32,32,64,2,1,1,1,16,8,8,75,1024,201326592,274911461376,10.3654,18.0891,26522.1
1,CUTLASS,gemm,cutlass_tensorop_s1688112gemm_f16_32x32_64x2_tn_align4,not_verified,success,universal,5120,5120,10240,f16:row,f16:column,f32:column,1,0,1,1,tensorop,f32,32,32,64,2,1,1,1,16,8,8,75,1024,314572800,536923340800,20.8438,14.0554,25759.3
1,CUTLASS,gemm,cutlass_tensorop_s1688111gemm_f16_32x32_64x2_tn_align4,not_verified,success,universal,5120,5120,10240,f16:row,f16:column,f32:column,1,0,1,1,tensorop,f32,32,32,64,2,1,1,1,16,8,8,75,1024,314572800,536923340800,20.8502,14.0511,25751.4
1,CUTLASS,gemm,cutlass_tensorop_s1688112gemm_f16_32x32_64x2_tn_align4,not_verified,success,universal,6144,6144,12288,f16:row,f16:column,f32:column,1,0,1,1,tensorop,f32,32,32,64,2,1,1,1,16,8,8,75,1024,452984832,927788433408,36.2986,11.6223,25559.9
1,CUTLASS,gemm,cutlass_tensorop_s1688111gemm_f16_32x32_64x2_tn_align4,not_verified,success,universal,6144,6144,12288,f16:row,f16:column,f32:column,1,0,1,1,tensorop,f32,32,32,64,2,1,1,1,16,8,8,75,1024,452984832,927788433408,36.2759,11.6296,25575.9
1,CUTLASS,gemm,cutlass_tensorop_s1688112gemm_f16_32x32_64x2_tn_align4,not_verified,success,universal,7168,7168,14336,f16:row,f16:column,f32:column,1,0,1,1,tensorop,f32,32,32,64,2,1,1,1,16,8,8,75,1024,616562688,1473276542976,57.7706,9.93964,25502.2
1,CUTLASS,gemm,cutlass_tensorop_s1688111gemm_f16_32x32_64x2_tn_align4,not_verified,success,universal,7168,7168,14336,f16:row,f16:column,f32:column,1,0,1,1,tensorop,f32,32,32,64,2,1,1,1,16,8,8,75,1024,616562688,1473276542976,57.7948,9.93548,25491.5
1,CUTLASS,gemm,cutlass_tensorop_s1688112gemm_f16_32x32_64x2_tn_align4,not_verified,success,universal,8192,8192,16384,f16:row,f16:column,f32:column,1,0,1,1,tensorop,f32,32,32,64,2,1,1,1,16,8,8,75,1024,805306368,2199157473280,83.7991,8.94998,26243.2
1,CUTLASS,gemm,cutlass_tensorop_s1688111gemm_f16_32x32_64x2_tn_align4,not_verified,success,universal,8192,8192,16384,f16:row,f16:column,f32:column,1,0,1,1,tensorop,f32,32,32,64,2,1,1,1,16,8,8,75,1024,805306368,2199157473280,83.8423,8.94537,26229.7
1,CUTLASS,gemm,cutlass_tensorop_s1688112gemm_f16_32x32_64x2_tn_align4,not_verified,success,universal,9216,9216,18432,f16:row,f16:column,f32:column,1,0,1,1,tensorop,f32,32,32,64,2,1,1,1,16,8,8,75,1024,1019215872,3131201028096,123.326,7.69685,25389.7
1,CUTLASS,gemm,cutlass_tensorop_s1688111gemm_f16_32x32_64x2_tn_align4,not_verified,success,universal,9216,9216,18432,f16:row,f16:column,f32:column,1,0,1,1,tensorop,f32,32,32,64,2,1,1,1,16,8,8,75,1024,1019215872,3131201028096,123.115,7.71001,25433.1
1,CUTLASS,gemm,cutlass_tensorop_s1688112gemm_f16_32x32_64x2_tn_align4,not_verified,success,universal,10240,10240,20480,f16:row,f16:column,f32:column,1,0,1,1,tensorop,f32,32,32,64,2,1,1,1,16,8,8,75,1024,1258291200,4295177011200,169.799,6.90152,25295.6
1,CUTLASS,gemm,cutlass_tensorop_s1688111gemm_f16_32x32_64x2_tn_align4,not_verified,success,universal,10240,10240,20480,f16:row,f16:column,f32:column,1,0,1,1,tensorop,f32,32,32,64,2,1,1,1,16,8,8,75,1024,1258291200,4295177011200,169.886,6.89802,25282.7
1,CUTLASS,gemm,cutlass_tensorop_s1688121gemm_f16_32x64_32x2_tn_align4,not_verified,success,universal,1024,1024,2048,f16:row,f16:column,f32:column,1,0,1,1,tensorop,f32,32,64,32,2,1,2,1,16,8,8,75,1024,12582912,4297064448,0.213853,54.7982,20093.6
1,CUTLASS,gemm,cutlass_tensorop_s1688111gemm_f16_32x64_32x2_tn_align4,not_verified,success,universal,1024,1024,2048,f16:row,f16:column,f32:column,1,0,1,1,tensorop,f32,32,64,32,2,1,1,1,16,8,8,75,1024,12582912,4297064448,0.221356,52.9409,19412.5
1,CUTLASS,gemm,cutlass_tensorop_s1688121gemm_f16_32x64_32x2_tn_align4,not_verified,success,universal,2048,2048,4096,f16:row,f16:column,f32:column,1,0,1,1,tensorop,f32,32,64,32,2,1,2,1,16,8,8,75,1024,50331648,34368126976,1.54997,30.2424,22173.4
1,CUTLASS,gemm,cutlass_tensorop_s1688111gemm_f16_32x64_32x2_tn_align4,not_verified,success,universal,2048,2048,4096,f16:row,f16:column,f32:column,1,0,1,1,tensorop,f32,32,64,32,2,1,1,1,16,8,8,75,1024,50331648,34368126976,1.49224,31.4126,23031.3
1,CUTLASS,gemm,cutlass_tensorop_s1688121gemm_f16_32x64_32x2_tn_align4,not_verified,success,universal,3072,3072,6144,f16:row,f16:column,f32:column,1,0,1,1,tensorop,f32,32,64,32,2,1,2,1,16,8,8,75,1024,113246208,115982991360,5.11613,20.6149,22670.1
1,CUTLASS,gemm,cutlass_tensorop_s1688111gemm_f16_32x64_32x2_tn_align4,not_verified,success,universal,3072,3072,6144,f16:row,f16:column,f32:column,1,0,1,1,tensorop,f32,32,64,32,2,1,1,1,16,8,8,75,1024,113246208,115982991360,5.42393,19.4451,21383.6
1,CUTLASS,gemm,cutlass_tensorop_s1688121gemm_f16_32x64_32x2_tn_align4,not_verified,success,universal,4096,4096,8192,f16:row,f16:column,f32:column,1,0,1,1,tensorop,f32,32,64,32,2,1,2,1,16,8,8,75,1024,201326592,274911461376,12.1724,15.4037,22584.8
1,CUTLASS,gemm,cutlass_tensorop_s1688111gemm_f16_32x64_32x2_tn_align4,not_verified,success,universal,4096,4096,8192,f16:row,f16:column,f32:column,1,0,1,1,tensorop,f32,32,64,32,2,1,1,1,16,8,8,75,1024,201326592,274911461376,12.0401,15.5729,22833
1,CUTLASS,gemm,cutlass_tensorop_s1688121gemm_f16_32x64_32x2_tn_align4,not_verified,success,universal,5120,5120,10240,f16:row,f16:column,f32:column,1,0,1,1,tensorop,f32,32,64,32,2,1,2,1,16,8,8,75,1024,314572800,536923340800,54.8173,5.34446,9794.77
1,CUTLASS,gemm,cutlass_tensorop_s1688111gemm_f16_32x64_32x2_tn_align4,not_verified,success,universal,5120,5120,10240,f16:row,f16:column,f32:column,1,0,1,1,tensorop,f32,32,64,32,2,1,1,1,16,8,8,75,1024,314572800,536923340800,54.3062,5.39476,9886.96
1,CUTLASS,gemm,cutlass_tensorop_s1688121gemm_f16_32x64_32x2_tn_align4,not_verified,success,universal,6144,6144,12288,f16:row,f16:column,f32:column,1,0,1,1,tensorop,f32,32,64,32,2,1,2,1,16,8,8,75,1024,452984832,927788433408,108.687,3.88157,8536.35
1,CUTLASS,gemm,cutlass_tensorop_s1688111gemm_f16_32x64_32x2_tn_align4,not_verified,success,universal,6144,6144,12288,f16:row,f16:column,f32:column,1,0,1,1,tensorop,f32,32,64,32,2,1,1,1,16,8,8,75,1024,452984832,927788433408,107.158,3.93696,8658.17
1,CUTLASS,gemm,cutlass_tensorop_s1688121gemm_f16_32x64_32x2_tn_align4,not_verified,success,universal,7168,7168,14336,f16:row,f16:column,f32:column,1,0,1,1,tensorop,f32,32,64,32,2,1,2,1,16,8,8,75,1024,616562688,1473276542976,190.656,3.01181,7727.42
1,CUTLASS,gemm,cutlass_tensorop_s1688111gemm_f16_32x64_32x2_tn_align4,not_verified,success,universal,7168,7168,14336,f16:row,f16:column,f32:column,1,0,1,1,tensorop,f32,32,64,32,2,1,1,1,16,8,8,75,1024,616562688,1473276542976,188.671,3.0435,7808.72
1,CUTLASS,gemm,cutlass_tensorop_s1688121gemm_f16_32x64_32x2_tn_align4,not_verified,success,universal,8192,8192,16384,f16:row,f16:column,f32:column,1,0,1,1,tensorop,f32,32,64,32,2,1,2,1,16,8,8,75,1024,805306368,2199157473280,302.753,2.47727,7263.87
1,CUTLASS,gemm,cutlass_tensorop_s1688111gemm_f16_32x64_32x2_tn_align4,not_verified,success,universal,8192,8192,16384,f16:row,f16:column,f32:column,1,0,1,1,tensorop,f32,32,64,32,2,1,1,1,16,8,8,75,1024,805306368,2199157473280,303.587,2.47047,7243.92
1,CUTLASS,gemm,cutlass_tensorop_s1688121gemm_f16_32x64_32x2_tn_align4,not_verified,success,universal,9216,9216,18432,f16:row,f16:column,f32:column,1,0,1,1,tensorop,f32,32,64,32,2,1,2,1,16,8,8,75,1024,1019215872,3131201028096,474.219,2.00165,6602.86
1,CUTLASS,gemm,cutlass_tensorop_s1688111gemm_f16_32x64_32x2_tn_align4,not_verified,success,universal,9216,9216,18432,f16:row,f16:column,f32:column,1,0,1,1,tensorop,f32,32,64,32,2,1,1,1,16,8,8,75,1024,1019215872,3131201028096,464.503,2.04351,6740.97
1,CUTLASS,gemm,cutlass_tensorop_s1688121gemm_f16_32x64_32x2_tn_align4,not_verified,success,universal,10240,10240,20480,f16:row,f16:column,f32:column,1,0,1,1,tensorop,f32,32,64,32,2,1,2,1,16,8,8,75,1024,1258291200,4295177011200,690.432,1.69731,6221
1,CUTLASS,gemm,cutlass_tensorop_s1688111gemm_f16_32x64_32x2_tn_align4,not_verified,success,universal,10240,10240,20480,f16:row,f16:column,f32:column,1,0,1,1,tensorop,f32,32,64,32,2,1,1,1,16,8,8,75,1024,1258291200,4295177011200,679.882,1.72364,6317.53
1,CUTLASS,gemm,cutlass_tensorop_s1688122gemm_f16_32x64_64x2_tn_align4,not_verified,success,universal,1024,1024,2048,f16:row,f16:column,f32:column,1,0,1,1,tensorop,f32,32,64,64,2,1,2,1,16,8,8,75,1024,12582912,4297064448,0.176804,66.2811,24304.1
1,CUTLASS,gemm,cutlass_tensorop_s1688121gemm_f16_32x64_64x2_tn_align4,not_verified,success,universal,1024,1024,2048,f16:row,f16:column,f32:column,1,0,1,1,tensorop,f32,32,64,64,2,1,2,1,16,8,8,75,1024,12582912,4297064448,0.174114,67.3051,24679.6
1,CUTLASS,gemm,cutlass_tensorop_s1688112gemm_f16_32x64_64x2_tn_align4,not_verified,success,universal,1024,1024,2048,f16:row,f16:column,f32:column,1,0,1,1,tensorop,f32,32,64,64,2,1,1,1,16,8,8,75,1024,12582912,4297064448,0.228328,51.3243,18819.7
1,CUTLASS,gemm,cutlass_tensorop_s1688111gemm_f16_32x64_64x2_tn_align4,not_verified,success,universal,1024,1024,2048,f16:row,f16:column,f32:column,1,0,1,1,tensorop,f32,32,64,64,2,1,1,1,16,8,8,75,1024,12582912,4297064448,0.227941,51.4112,18851.6
1,CUTLASS,gemm,cutlass_tensorop_s1688122gemm_f16_32x64_64x2_tn_align4,not_verified,success,universal,2048,2048,4096,f16:row,f16:column,f32:column,1,0,1,1,tensorop,f32,32,64,64,2,1,2,1,16,8,8,75,1024,50331648,34368126976,1.23949,37.8179,27727.6
1,CUTLASS,gemm,cutlass_tensorop_s1688121gemm_f16_32x64_64x2_tn_align4,not_verified,success,universal,2048,2048,4096,f16:row,f16:column,f32:column,1,0,1,1,tensorop,f32,32,64,64,2,1,2,1,16,8,8,75,1024,50331648,34368126976,1.22076,38.3981,28153
1,CUTLASS,gemm,cutlass_tensorop_s1688112gemm_f16_32x64_64x2_tn_align4,not_verified,success,universal,2048,2048,4096,f16:row,f16:column,f32:column,1,0,1,1,tensorop,f32,32,64,64,2,1,1,1,16,8,8,75,1024,50331648,34368126976,1.68132,27.8799,20441.1
1,CUTLASS,gemm,cutlass_tensorop_s1688111gemm_f16_32x64_64x2_tn_align4,not_verified,success,universal,2048,2048,4096,f16:row,f16:column,f32:column,1,0,1,1,tensorop,f32,32,64,64,2,1,1,1,16,8,8,75,1024,50331648,34368126976,1.68154,27.8762,20438.4
1,CUTLASS,gemm,cutlass_tensorop_s1688122gemm_f16_32x64_64x2_tn_align4,not_verified,success,universal,3072,3072,6144,f16:row,f16:column,f32:column,1,0,1,1,tensorop,f32,32,64,64,2,1,2,1,16,8,8,75,1024,113246208,115982991360,4.16046,25.3503,27877.5
1,CUTLASS,gemm,cutlass_tensorop_s1688121gemm_f16_32x64_64x2_tn_align4,not_verified,success,universal,3072,3072,6144,f16:row,f16:column,f32:column,1,0,1,1,tensorop,f32,32,64,64,2,1,2,1,16,8,8,75,1024,113246208,115982991360,4.05817,25.9892,28580.1
1,CUTLASS,gemm,cutlass_tensorop_s1688112gemm_f16_32x64_64x2_tn_align4,not_verified,success,universal,3072,3072,6144,f16:row,f16:column,f32:column,1,0,1,1,tensorop,f32,32,64,64,2,1,1,1,16,8,8,75,1024,113246208,115982991360,5.29134,19.9323,21919.4
1,CUTLASS,gemm,cutlass_tensorop_s1688111gemm_f16_32x64_64x2_tn_align4,not_verified,success,universal,3072,3072,6144,f16:row,f16:column,f32:column,1,0,1,1,tensorop,f32,32,64,64,2,1,1,1,16,8,8,75,1024,113246208,115982991360,5.28846,19.9432,21931.4
1,CUTLASS,gemm,cutlass_tensorop_s1688122gemm_f16_32x64_64x2_tn_align4,not_verified,success,universal,4096,4096,8192,f16:row,f16:column,f32:column,1,0,1,1,tensorop,f32,32,64,64,2,1,2,1,16,8,8,75,1024,201326592,274911461376,9.70362,19.3227,28330.8
1,CUTLASS,gemm,cutlass_tensorop_s1688121gemm_f16_32x64_64x2_tn_align4,not_verified,success,universal,4096,4096,8192,f16:row,f16:column,f32:column,1,0,1,1,tensorop,f32,32,64,64,2,1,2,1,16,8,8,75,1024,201326592,274911461376,9.68802,19.3538,28376.4
1,CUTLASS,gemm,cutlass_tensorop_s1688112gemm_f16_32x64_64x2_tn_align4,not_verified,success,universal,4096,4096,8192,f16:row,f16:column,f32:column,1,0,1,1,tensorop,f32,32,64,64,2,1,1,1,16,8,8,75,1024,201326592,274911461376,12.5054,14.9935,21983.4
1,CUTLASS,gemm,cutlass_tensorop_s1688111gemm_f16_32x64_64x2_tn_align4,not_verified,success,universal,4096,4096,8192,f16:row,f16:column,f32:column,1,0,1,1,tensorop,f32,32,64,64,2,1,1,1,16,8,8,75,1024,201326592,274911461376,12.5043,14.9949,21985.4
1,CUTLASS,gemm,cutlass_tensorop_s1688122gemm_f16_32x64_64x2_tn_align4,not_verified,success,universal,5120,5120,10240,f16:row,f16:column,f32:column,1,0,1,1,tensorop,f32,32,64,64,2,1,2,1,16,8,8,75,1024,314572800,536923340800,19.6545,14.9059,27318.1
1,CUTLASS,gemm,cutlass_tensorop_s1688121gemm_f16_32x64_64x2_tn_align4,not_verified,success,universal,5120,5120,10240,f16:row,f16:column,f32:column,1,0,1,1,tensorop,f32,32,64,64,2,1,2,1,16,8,8,75,1024,314572800,536923340800,19.6128,14.9377,27376.2
1,CUTLASS,gemm,cutlass_tensorop_s1688112gemm_f16_32x64_64x2_tn_align4,not_verified,success,universal,5120,5120,10240,f16:row,f16:column,f32:column,1,0,1,1,tensorop,f32,32,64,64,2,1,1,1,16,8,8,75,1024,314572800,536923340800,24.2345,12.0889,22155.3
1,CUTLASS,gemm,cutlass_tensorop_s1688111gemm_f16_32x64_64x2_tn_align4,not_verified,success,universal,5120,5120,10240,f16:row,f16:column,f32:column,1,0,1,1,tensorop,f32,32,64,64,2,1,1,1,16,8,8,75,1024,314572800,536923340800,24.2359,12.0882,22154.1
1,CUTLASS,gemm,cutlass_tensorop_s1688122gemm_f16_32x64_64x2_tn_align4,not_verified,success,universal,6144,6144,12288,f16:row,f16:column,f32:column,1,0,1,1,tensorop,f32,32,64,64,2,1,2,1,16,8,8,75,1024,452984832,927788433408,35.18,11.9919,26372.6
1,CUTLASS,gemm,cutlass_tensorop_s1688121gemm_f16_32x64_64x2_tn_align4,not_verified,success,universal,6144,6144,12288,f16:row,f16:column,f32:column,1,0,1,1,tensorop,f32,32,64,64,2,1,2,1,16,8,8,75,1024,452984832,927788433408,34.9837,12.0592,26520.6
1,CUTLASS,gemm,cutlass_tensorop_s1688112gemm_f16_32x64_64x2_tn_align4,not_verified,success,universal,6144,6144,12288,f16:row,f16:column,f32:column,1,0,1,1,tensorop,f32,32,64,64,2,1,1,1,16,8,8,75,1024,452984832,927788433408,42.3447,9.96287,21910.4
1,CUTLASS,gemm,cutlass_tensorop_s1688111gemm_f16_32x64_64x2_tn_align4,not_verified,success,universal,6144,6144,12288,f16:row,f16:column,f32:column,1,0,1,1,tensorop,f32,32,64,64,2,1,1,1,16,8,8,75,1024,452984832,927788433408,42.3654,9.95801,21899.7
1,CUTLASS,gemm,cutlass_tensorop_s1688122gemm_f16_32x64_64x2_tn_align4,not_verified,success,universal,7168,7168,14336,f16:row,f16:column,f32:column,1,0,1,1,tensorop,f32,32,64,64,2,1,2,1,16,8,8,75,1024,616562688,1473276542976,59.9877,9.57228,24559.6
1,CUTLASS,gemm,cutlass_tensorop_s1688121gemm_f16_32x64_64x2_tn_align4,not_verified,success,universal,7168,7168,14336,f16:row,f16:column,f32:column,1,0,1,1,tensorop,f32,32,64,64,2,1,2,1,16,8,8,75,1024,616562688,1473276542976,60.8566,9.4356,24209
1,CUTLASS,gemm,cutlass_tensorop_s1688112gemm_f16_32x64_64x2_tn_align4,not_verified,success,universal,7168,7168,14336,f16:row,f16:column,f32:column,1,0,1,1,tensorop,f32,32,64,64,2,1,1,1,16,8,8,75,1024,616562688,1473276542976,68.559,8.37554,21489.2
1,CUTLASS,gemm,cutlass_tensorop_s1688111gemm_f16_32x64_64x2_tn_align4,not_verified,success,universal,7168,7168,14336,f16:row,f16:column,f32:column,1,0,1,1,tensorop,f32,32,64,64,2,1,1,1,16,8,8,75,1024,616562688,1473276542976,68.691,8.35945,21447.9
1,CUTLASS,gemm,cutlass_tensorop_s1688122gemm_f16_32x64_64x2_tn_align4,not_verified,success,universal,8192,8192,16384,f16:row,f16:column,f32:column,1,0,1,1,tensorop,f32,32,64,64,2,1,2,1,16,8,8,75,1024,805306368,2199157473280,134.843,5.56201,16309
1,CUTLASS,gemm,cutlass_tensorop_s1688121gemm_f16_32x64_64x2_tn_align4,not_verified,success,universal,8192,8192,16384,f16:row,f16:column,f32:column,1,0,1,1,tensorop,f32,32,64,64,2,1,2,1,16,8,8,75,1024,805306368,2199157473280,140.714,5.32997,15628.6
1,CUTLASS,gemm,cutlass_tensorop_s1688112gemm_f16_32x64_64x2_tn_align4,not_verified,success,universal,8192,8192,16384,f16:row,f16:column,f32:column,1,0,1,1,tensorop,f32,32,64,64,2,1,1,1,16,8,8,75,1024,805306368,2199157473280,102.656,7.30599,21422.7
1,CUTLASS,gemm,cutlass_tensorop_s1688111gemm_f16_32x64_64x2_tn_align4,not_verified,success,universal,8192,8192,16384,f16:row,f16:column,f32:column,1,0,1,1,tensorop,f32,32,64,64,2,1,1,1,16,8,8,75,1024,805306368,2199157473280,102.601,7.30986,21434
1,CUTLASS,gemm,cutlass_tensorop_s1688122gemm_f16_32x64_64x2_tn_align4,not_verified,success,universal,9216,9216,18432,f16:row,f16:column,f32:column,1,0,1,1,tensorop,f32,32,64,64,2,1,2,1,16,8,8,75,1024,1019215872,3131201028096,194.237,4.88692,16120.5
1,CUTLASS,gemm,cutlass_tensorop_s1688121gemm_f16_32x64_64x2_tn_align4,not_verified,success,universal,9216,9216,18432,f16:row,f16:column,f32:column,1,0,1,1,tensorop,f32,32,64,64,2,1,2,1,16,8,8,75,1024,1019215872,3131201028096,215.199,4.41089,14550.3
1,CUTLASS,gemm,cutlass_tensorop_s1688112gemm_f16_32x64_64x2_tn_align4,not_verified,success,universal,9216,9216,18432,f16:row,f16:column,f32:column,1,0,1,1,tensorop,f32,32,64,64,2,1,1,1,16,8,8,75,1024,1019215872,3131201028096,146.319,6.48733,21399.9
1,CUTLASS,gemm,cutlass_tensorop_s1688111gemm_f16_32x64_64x2_tn_align4,not_verified,success,universal,9216,9216,18432,f16:row,f16:column,f32:column,1,0,1,1,tensorop,f32,32,64,64,2,1,1,1,16,8,8,75,1024,1019215872,3131201028096,145.649,6.51718,21498.3
1,CUTLASS,gemm,cutlass_tensorop_s1688122gemm_f16_32x64_64x2_tn_align4,not_verified,success,universal,10240,10240,20480,f16:row,f16:column,f32:column,1,0,1,1,tensorop,f32,32,64,64,2,1,2,1,16,8,8,75,1024,1258291200,4295177011200,271.45,4.31709,15823.1
1,CUTLASS,gemm,cutlass_tensorop_s1688121gemm_f16_32x64_64x2_tn_align4,not_verified,success,universal,10240,10240,20480,f16:row,f16:column,f32:column,1,0,1,1,tensorop,f32,32,64,64,2,1,2,1,16,8,8,75,1024,1258291200,4295177011200,207.328,5.65228,20716.8
1,CUTLASS,gemm,cutlass_tensorop_s1688112gemm_f16_32x64_64x2_tn_align4,not_verified,success,universal,10240,10240,20480,f16:row,f16:column,f32:column,1,0,1,1,tensorop,f32,32,64,64,2,1,1,1,16,8,8,75,1024,1258291200,4295177011200,196.883,5.95214,21815.9
1,CUTLASS,gemm,cutlass_tensorop_s1688111gemm_f16_32x64_64x2_tn_align4,not_verified,success,universal,10240,10240,20480,f16:row,f16:column,f32:column,1,0,1,1,tensorop,f32,32,64,64,2,1,1,1,16,8,8,75,1024,1258291200,4295177011200,196.328,5.96895,21877.5
1,CUTLASS,gemm,cutlass_tensorop_s1688141gemm_f16_32x128_32x2_tn_align4,not_verified,success,universal,1024,1024,2048,f16:row,f16:column,f32:column,1,0,1,1,tensorop,f32,32,128,32,2,1,4,1,16,8,8,75,1024,12582912,4297064448,0.180672,64.862,23783.8
1,CUTLASS,gemm,cutlass_tensorop_s1688121gemm_f16_32x128_32x2_tn_align4,not_verified,success,universal,1024,1024,2048,f16:row,f16:column,f32:column,1,0,1,1,tensorop,f32,32,128,32,2,1,2,1,16,8,8,75,1024,12582912,4297064448,0.217658,53.8403,19742.3
1,CUTLASS,gemm,cutlass_tensorop_s1688111gemm_f16_32x128_32x2_tn_align4,not_verified,success,universal,1024,1024,2048,f16:row,f16:column,f32:column,1,0,1,1,tensorop,f32,32,128,32,2,1,1,1,16,8,8,75,1024,12582912,4297064448,0.771103,15.1974,5572.62
1,CUTLASS,gemm,cutlass_tensorop_s1688141gemm_f16_32x128_32x2_tn_align4,not_verified,success,universal,2048,2048,4096,f16:row,f16:column,f32:column,1,0,1,1,tensorop,f32,32,128,32,2,1,4,1,16,8,8,75,1024,50331648,34368126976,1.37075,34.1967,25072.6
1,CUTLASS,gemm,cutlass_tensorop_s1688121gemm_f16_32x128_32x2_tn_align4,not_verified,success,universal,2048,2048,4096,f16:row,f16:column,f32:column,1,0,1,1,tensorop,f32,32,128,32,2,1,2,1,16,8,8,75,1024,50331648,34368126976,1.31009,35.7801,26233.5
1,CUTLASS,gemm,cutlass_tensorop_s1688111gemm_f16_32x128_32x2_tn_align4,not_verified,success,universal,2048,2048,4096,f16:row,f16:column,f32:column,1,0,1,1,tensorop,f32,32,128,32,2,1,1,1,16,8,8,75,1024,50331648,34368126976,4.92488,9.518,6978.47
1,CUTLASS,gemm,cutlass_tensorop_s1688141gemm_f16_32x128_32x2_tn_align4,not_verified,success,universal,3072,3072,6144,f16:row,f16:column,f32:column,1,0,1,1,tensorop,f32,32,128,32,2,1,4,1,16,8,8,75,1024,113246208,115982991360,5.43464,19.4068,21341.4
1,CUTLASS,gemm,cutlass_tensorop_s1688121gemm_f16_32x128_32x2_tn_align4,not_verified,success,universal,3072,3072,6144,f16:row,f16:column,f32:column,1,0,1,1,tensorop,f32,32,128,32,2,1,2,1,16,8,8,75,1024,113246208,115982991360,8.79212,11.9958,13191.7
1,CUTLASS,gemm,cutlass_tensorop_s1688111gemm_f16_32x128_32x2_tn_align4,not_verified,success,universal,3072,3072,6144,f16:row,f16:column,f32:column,1,0,1,1,tensorop,f32,32,128,32,2,1,1,1,16,8,8,75,1024,113246208,115982991360,14.9944,7.03386,7735.07
1,CUTLASS,gemm,cutlass_tensorop_s1688141gemm_f16_32x128_32x2_tn_align4,not_verified,success,universal,4096,4096,8192,f16:row,f16:column,f32:column,1,0,1,1,tensorop,f32,32,128,32,2,1,4,1,16,8,8,75,1024,201326592,274911461376,13.0035,14.4192,21141.4
1,CUTLASS,gemm,cutlass_tensorop_s1688121gemm_f16_32x128_32x2_tn_align4,not_verified,success,universal,4096,4096,8192,f16:row,f16:column,f32:column,1,0,1,1,tensorop,f32,32,128,32,2,1,2,1,16,8,8,75,1024,201326592,274911461376,14.733,12.7265,18659.5
1,CUTLASS,gemm,cutlass_tensorop_s1688111gemm_f16_32x128_32x2_tn_align4,not_verified,success,universal,4096,4096,8192,f16:row,f16:column,f32:column,1,0,1,1,tensorop,f32,32,128,32,2,1,1,1,16,8,8,75,1024,201326592,274911461376,45.754,4.09801,6008.47
1,CUTLASS,gemm,cutlass_tensorop_s1688141gemm_f16_32x128_32x2_tn_align4,not_verified,success,universal,5120,5120,10240,f16:row,f16:column,f32:column,1,0,1,1,tensorop,f32,32,128,32,2,1,4,1,16,8,8,75,1024,314572800,536923340800,63.4299,4.61878,8464.83
1,CUTLASS,gemm,cutlass_tensorop_s1688121gemm_f16_32x128_32x2_tn_align4,not_verified,success,universal,5120,5120,10240,f16:row,f16:column,f32:column,1,0,1,1,tensorop,f32,32,128,32,2,1,2,1,16,8,8,75,1024,314572800,536923340800,66.0394,4.43627,8130.34
1,CUTLASS,gemm,cutlass_tensorop_s1688111gemm_f16_32x128_32x2_tn_align4,not_verified,success,universal,5120,5120,10240,f16:row,f16:column,f32:column,1,0,1,1,tensorop,f32,32,128,32,2,1,1,1,16,8,8,75,1024,314572800,536923340800,73.8689,3.96606,7268.6
1,CUTLASS,gemm,cutlass_tensorop_s1688141gemm_f16_32x128_32x2_tn_align4,not_verified,success,universal,6144,6144,12288,f16:row,f16:column,f32:column,1,0,1,1,tensorop,f32,32,128,32,2,1,4,1,16,8,8,75,1024,452984832,927788433408,121.214,3.48042,7654.15
1,CUTLASS,gemm,cutlass_tensorop_s1688121gemm_f16_32x128_32x2_tn_align4,not_verified,success,universal,6144,6144,12288,f16:row,f16:column,f32:column,1,0,1,1,tensorop,f32,32,128,32,2,1,2,1,16,8,8,75,1024,452984832,927788433408,123.485,3.4164,7513.36
1,CUTLASS,gemm,cutlass_tensorop_s1688111gemm_f16_32x128_32x2_tn_align4,not_verified,success,universal,6144,6144,12288,f16:row,f16:column,f32:column,1,0,1,1,tensorop,f32,32,128,32,2,1,1,1,16,8,8,75,1024,452984832,927788433408,176.983,2.38371,5242.25
1,CUTLASS,gemm,cutlass_tensorop_s1688141gemm_f16_32x128_32x2_tn_align4,not_verified,success,universal,7168,7168,14336,f16:row,f16:column,f32:column,1,0,1,1,tensorop,f32,32,128,32,2,1,4,1,16,8,8,75,1024,616562688,1473276542976,209.897,2.73571,7019.03
1,CUTLASS,gemm,cutlass_tensorop_s1688121gemm_f16_32x128_32x2_tn_align4,not_verified,success,universal,7168,7168,14336,f16:row,f16:column,f32:column,1,0,1,1,tensorop,f32,32,128,32,2,1,2,1,16,8,8,75,1024,616562688,1473276542976,208.22,2.75775,7075.57
1,CUTLASS,gemm,cutlass_tensorop_s1688111gemm_f16_32x128_32x2_tn_align4,not_verified,success,universal,7168,7168,14336,f16:row,f16:column,f32:column,1,0,1,1,tensorop,f32,32,128,32,2,1,1,1,16,8,8,75,1024,616562688,1473276542976,357.74,1.60513,4118.29
1,CUTLASS,gemm,cutlass_tensorop_s1688141gemm_f16_32x128_32x2_tn_align4,not_verified,success,universal,8192,8192,16384,f16:row,f16:column,f32:column,1,0,1,1,tensorop,f32,32,128,32,2,1,4,1,16,8,8,75,1024,805306368,2199157473280,323.933,2.31529,6788.93
1,CUTLASS,gemm,cutlass_tensorop_s1688121gemm_f16_32x128_32x2_tn_align4,not_verified,success,universal,8192,8192,16384,f16:row,f16:column,f32:column,1,0,1,1,tensorop,f32,32,128,32,2,1,2,1,16,8,8,75,1024,805306368,2199157473280,319.46,2.34771,6883.97
1,CUTLASS,gemm,cutlass_tensorop_s1688111gemm_f16_32x128_32x2_tn_align4,not_verified,success,universal,8192,8192,16384,f16:row,f16:column,f32:column,1,0,1,1,tensorop,f32,32,128,32,2,1,1,1,16,8,8,75,1024,805306368,2199157473280,331.599,2.26177,6631.98
1,CUTLASS,gemm,cutlass_tensorop_s1688141gemm_f16_32x128_32x2_tn_align4,not_verified,success,universal,9216,9216,18432,f16:row,f16:column,f32:column,1,0,1,1,tensorop,f32,32,128,32,2,1,4,1,16,8,8,75,1024,1019215872,3131201028096,482.993,1.96528,6482.91
1,CUTLASS,gemm,cutlass_tensorop_s1688121gemm_f16_32x128_32x2_tn_align4,not_verified,success,universal,9216,9216,18432,f16:row,f16:column,f32:column,1,0,1,1,tensorop,f32,32,128,32,2,1,2,1,16,8,8,75,1024,1019215872,3131201028096,482.692,1.96651,6486.95
1,CUTLASS,gemm,cutlass_tensorop_s1688111gemm_f16_32x128_32x2_tn_align4,not_verified,success,universal,9216,9216,18432,f16:row,f16:column,f32:column,1,0,1,1,tensorop,f32,32,128,32,2,1,1,1,16,8,8,75,1024,1019215872,3131201028096,522.136,1.81795,5996.91
1,CUTLASS,gemm,cutlass_tensorop_s1688141gemm_f16_32x128_32x2_tn_align4,not_verified,success,universal,10240,10240,20480,f16:row,f16:column,f32:column,1,0,1,1,tensorop,f32,32,128,32,2,1,4,1,16,8,8,75,1024,1258291200,4295177011200,668.55,1.75286,6424.62
1,CUTLASS,gemm,cutlass_tensorop_s1688121gemm_f16_32x128_32x2_tn_align4,not_verified,success,universal,10240,10240,20480,f16:row,f16:column,f32:column,1,0,1,1,tensorop,f32,32,128,32,2,1,2,1,16,8,8,75,1024,1258291200,4295177011200,673.384,1.74028,6378.49
1,CUTLASS,gemm,cutlass_tensorop_s1688111gemm_f16_32x128_32x2_tn_align4,not_verified,success,universal,10240,10240,20480,f16:row,f16:column,f32:column,1,0,1,1,tensorop,f32,32,128,32,2,1,1,1,16,8,8,75,1024,1258291200,4295177011200,1178.32,0.994532,3645.18
1,CUTLASS,gemm,cutlass_tensorop_s1688142gemm_f16_32x128_64x2_tn_align4,not_verified,success,universal,1024,1024,2048,f16:row,f16:column,f32:column,1,0,1,1,tensorop,f32,32,128,64,2,1,4,1,16,8,8,75,1024,12582912,4297064448,0.160412,73.0543,26787.8
1,CUTLASS,gemm,cutlass_tensorop_s1688141gemm_f16_32x128_64x2_tn_align4,not_verified,success,universal,1024,1024,2048,f16:row,f16:column,f32:column,1,0,1,1,tensorop,f32,32,128,64,2,1,4,1,16,8,8,75,1024,12582912,4297064448,0.160169,73.1649,26828.3
1,CUTLASS,gemm,cutlass_tensorop_s1688122gemm_f16_32x128_64x2_tn_align4,not_verified,success,universal,1024,1024,2048,f16:row,f16:column,f32:column,1,0,1,1,tensorop,f32,32,128,64,2,1,2,1,16,8,8,75,1024,12582912,4297064448,0.259191,45.2127,16578.7
1,CUTLASS,gemm,cutlass_tensorop_s1688121gemm_f16_32x128_64x2_tn_align4,not_verified,success,universal,1024,1024,2048,f16:row,f16:column,f32:column,1,0,1,1,tensorop,f32,32,128,64,2,1,2,1,16,8,8,75,1024,12582912,4297064448,0.256083,45.7616,16780
1,CUTLASS,gemm,cutlass_tensorop_s1688112gemm_f16_32x128_64x2_tn_align4,not_verified,success,universal,1024,1024,2048,f16:row,f16:column,f32:column,1,0,1,1,tensorop,f32,32,128,64,2,1,1,1,16,8,8,75,1024,12582912,4297064448,1.55963,7.51378,2755.18
1,CUTLASS,gemm,cutlass_tensorop_s1688111gemm_f16_32x128_64x2_tn_align4,not_verified,success,universal,1024,1024,2048,f16:row,f16:column,f32:column,1,0,1,1,tensorop,f32,32,128,64,2,1,1,1,16,8,8,75,1024,12582912,4297064448,1.55547,7.53388,2762.54
1,CUTLASS,gemm,cutlass_tensorop_s1688142gemm_f16_32x128_64x2_tn_align4,not_verified,success,universal,2048,2048,4096,f16:row,f16:column,f32:column,1,0,1,1,tensorop,f32,32,128,64,2,1,4,1,16,8,8,75,1024,50331648,34368126976,1.246,37.6202,27582.7
1,CUTLASS,gemm,cutlass_tensorop_s1688141gemm_f16_32x128_64x2_tn_align4,not_verified,success,universal,2048,2048,4096,f16:row,f16:column,f32:column,1,0,1,1,tensorop,f32,32,128,64,2,1,4,1,16,8,8,75,1024,50331648,34368126976,1.22955,38.1238,27951.9
1,CUTLASS,gemm,cutlass_tensorop_s1688122gemm_f16_32x128_64x2_tn_align4,not_verified,success,universal,2048,2048,4096,f16:row,f16:column,f32:column,1,0,1,1,tensorop,f32,32,128,64,2,1,2,1,16,8,8,75,1024,50331648,34368126976,1.92261,24.3809,17875.8
1,CUTLASS,gemm,cutlass_tensorop_s1688121gemm_f16_32x128_64x2_tn_align4,not_verified,success,universal,2048,2048,4096,f16:row,f16:column,f32:column,1,0,1,1,tensorop,f32,32,128,64,2,1,2,1,16,8,8,75,1024,50331648,34368126976,1.92365,24.3677,17866.1
1,CUTLASS,gemm,cutlass_tensorop_s1688112gemm_f16_32x128_64x2_tn_align4,not_verified,success,universal,2048,2048,4096,f16:row,f16:column,f32:column,1,0,1,1,tensorop,f32,32,128,64,2,1,1,1,16,8,8,75,1024,50331648,34368126976,12.1131,3.86978,2837.27
1,CUTLASS,gemm,cutlass_tensorop_s1688111gemm_f16_32x128_64x2_tn_align4,not_verified,success,universal,2048,2048,4096,f16:row,f16:column,f32:column,1,0,1,1,tensorop,f32,32,128,64,2,1,1,1,16,8,8,75,1024,50331648,34368126976,12.1478,3.85873,2829.17
1,CUTLASS,gemm,cutlass_tensorop_s1688142gemm_f16_32x128_64x2_tn_align4,not_verified,success,universal,3072,3072,6144,f16:row,f16:column,f32:column,1,0,1,1,tensorop,f32,32,128,64,2,1,4,1,16,8,8,75,1024,113246208,115982991360,3.88258,27.1646,29872.6
1,CUTLASS,gemm,cutlass_tensorop_s1688141gemm_f16_32x128_64x2_tn_align4,not_verified,success,universal,3072,3072,6144,f16:row,f16:column,f32:column,1,0,1,1,tensorop,f32,32,128,64,2,1,4,1,16,8,8,75,1024,113246208,115982991360,3.87788,27.1975,29908.8
1,CUTLASS,gemm,cutlass_tensorop_s1688122gemm_f16_32x128_64x2_tn_align4,not_verified,success,universal,3072,3072,6144,f16:row,f16:column,f32:column,1,0,1,1,tensorop,f32,32,128,64,2,1,2,1,16,8,8,75,1024,113246208,115982991360,6.14722,17.1571,18867.6
1,CUTLASS,gemm,cutlass_tensorop_s1688121gemm_f16_32x128_64x2_tn_align4,not_verified,success,universal,3072,3072,6144,f16:row,f16:column,f32:column,1,0,1,1,tensorop,f32,32,128,64,2,1,2,1,16,8,8,75,1024,113246208,115982991360,6.14855,17.1534,18863.5
1,CUTLASS,gemm,cutlass_tensorop_s1688112gemm_f16_32x128_64x2_tn_align4,not_verified,success,universal,3072,3072,6144,f16:row,f16:column,f32:column,1,0,1,1,tensorop,f32,32,128,64,2,1,1,1,16,8,8,75,1024,113246208,115982991360,39.1525,2.6938,2962.34
1,CUTLASS,gemm,cutlass_tensorop_s1688111gemm_f16_32x128_64x2_tn_align4,not_verified,success,universal,3072,3072,6144,f16:row,f16:column,f32:column,1,0,1,1,tensorop,f32,32,128,64,2,1,1,1,16,8,8,75,1024,113246208,115982991360,39.0219,2.70281,2972.26
1,CUTLASS,gemm,cutlass_tensorop_s1688142gemm_f16_32x128_64x2_tn_align4,not_verified,success,universal,4096,4096,8192,f16:row,f16:column,f32:column,1,0,1,1,tensorop,f32,32,128,64,2,1,4,1,16,8,8,75,1024,201326592,274911461376,9.32871,20.0992,29469.4
1,CUTLASS,gemm,cutlass_tensorop_s1688141gemm_f16_32x128_64x2_tn_align4,not_verified,success,universal,4096,4096,8192,f16:row,f16:column,f32:column,1,0,1,1,tensorop,f32,32,128,64,2,1,4,1,16,8,8,75,1024,201326592,274911461376,9.31247,20.1343,29520.8
1,CUTLASS,gemm,cutlass_tensorop_s1688122gemm_f16_32x128_64x2_tn_align4,not_verified,success,universal,4096,4096,8192,f16:row,f16:column,f32:column,1,0,1,1,tensorop,f32,32,128,64,2,1,2,1,16,8,8,75,1024,201326592,274911461376,14.4597,12.9671,19012.3
1,CUTLASS,gemm,cutlass_tensorop_s1688121gemm_f16_32x128_64x2_tn_align4,not_verified,success,universal,4096,4096,8192,f16:row,f16:column,f32:column,1,0,1,1,tensorop,f32,32,128,64,2,1,2,1,16,8,8,75,1024,201326592,274911461376,14.4661,12.9613,19003.8
1,CUTLASS,gemm,cutlass_tensorop_s1688112gemm_f16_32x128_64x2_tn_align4,not_verified,success,universal,4096,4096,8192,f16:row,f16:column,f32:column,1,0,1,1,tensorop,f32,32,128,64,2,1,1,1,16,8,8,75,1024,201326592,274911461376,92.3202,2.03097,2977.8
1,CUTLASS,gemm,cutlass_tensorop_s1688111gemm_f16_32x128_64x2_tn_align4,not_verified,success,universal,4096,4096,8192,f16:row,f16:column,f32:column,1,0,1,1,tensorop,f32,32,128,64,2,1,1,1,16,8,8,75,1024,201326592,274911461376,91.9963,2.03812,2988.29
1,CUTLASS,gemm,cutlass_tensorop_s1688142gemm_f16_32x128_64x2_tn_align4,not_verified,success,universal,5120,5120,10240,f16:row,f16:column,f32:column,1,0,1,1,tensorop,f32,32,128,64,2,1,4,1,16,8,8,75,1024,314572800,536923340800,19.6025,14.9455,27390.5
1,CUTLASS,gemm,cutlass_tensorop_s1688141gemm_f16_32x128_64x2_tn_align4,not_verified,success,universal,5120,5120,10240,f16:row,f16:column,f32:column,1,0,1,1,tensorop,f32,32,128,64,2,1,4,1,16,8,8,75,1024,314572800,536923340800,20.1608,14.5316,26632
1,CUTLASS,gemm,cutlass_tensorop_s1688122gemm_f16_32x128_64x2_tn_align4,not_verified,success,universal,5120,5120,10240,f16:row,f16:column,f32:column,1,0,1,1,tensorop,f32,32,128,64,2,1,2,1,16,8,8,75,1024,314572800,536923340800,28.4098,10.3123,18899.3
1,CUTLASS,gemm,cutlass_tensorop_s1688121gemm_f16_32x128_64x2_tn_align4,not_verified,success,universal,5120,5120,10240,f16:row,f16:column,f32:column,1,0,1,1,tensorop,f32,32,128,64,2,1,2,1,16,8,8,75,1024,314572800,536923340800,28.4267,10.3061,18888
1,CUTLASS,gemm,cutlass_tensorop_s1688112gemm_f16_32x128_64x2_tn_align4,not_verified,success,universal,5120,5120,10240,f16:row,f16:column,f32:column,1,0,1,1,tensorop,f32,32,128,64,2,1,1,1,16,8,8,75,1024,314572800,536923340800,183.725,1.59461,2922.43
1,CUTLASS,gemm,cutlass_tensorop_s1688111gemm_f16_32x128_64x2_tn_align4,not_verified,success,universal,5120,5120,10240,f16:row,f16:column,f32:column,1,0,1,1,tensorop,f32,32,128,64,2,1,1,1,16,8,8,75,1024,314572800,536923340800,184.186,1.59061,2915.11
1,CUTLASS,gemm,cutlass_tensorop_s1688142gemm_f16_32x128_64x2_tn_align4,not_verified,success,universal,6144,6144,12288,f16:row,f16:column,f32:column,1,0,1,1,tensorop,f32,32,128,64,2,1,4,1,16,8,8,75,1024,452984832,927788433408,30.8447,13.6774,30079.4
1,CUTLASS,gemm,cutlass_tensorop_s1688141gemm_f16_32x128_64x2_tn_align4,not_verified,success,universal,6144,6144,12288,f16:row,f16:column,f32:column,1,0,1,1,tensorop,f32,32,128,64,2,1,4,1,16,8,8,75,1024,452984832,927788433408,30.7827,13.7049,30139.9
1,CUTLASS,gemm,cutlass_tensorop_s1688122gemm_f16_32x128_64x2_tn_align4,not_verified,success,universal,6144,6144,12288,f16:row,f16:column,f32:column,1,0,1,1,tensorop,f32,32,128,64,2,1,2,1,16,8,8,75,1024,452984832,927788433408,48.5602,8.68767,19106
1,CUTLASS,gemm,cutlass_tensorop_s1688121gemm_f16_32x128_64x2_tn_align4,not_verified,success,universal,6144,6144,12288,f16:row,f16:column,f32:column,1,0,1,1,tensorop,f32,32,128,64,2,1,2,1,16,8,8,75,1024,452984832,927788433408,48.6064,8.67941,19087.8
1,CUTLASS,gemm,cutlass_tensorop_s1688112gemm_f16_32x128_64x2_tn_align4,not_verified,success,universal,6144,6144,12288,f16:row,f16:column,f32:column,1,0,1,1,tensorop,f32,32,128,64,2,1,1,1,16,8,8,75,1024,452984832,927788433408,319.132,1.32195,2907.23
1,CUTLASS,gemm,cutlass_tensorop_s1688111gemm_f16_32x128_64x2_tn_align4,not_verified,success,universal,6144,6144,12288,f16:row,f16:column,f32:column,1,0,1,1,tensorop,f32,32,128,64,2,1,1,1,16,8,8,75,1024,452984832,927788433408,319.082,1.32215,2907.68
1,CUTLASS,gemm,cutlass_tensorop_s1688142gemm_f16_32x128_64x2_tn_align4,not_verified,success,universal,7168,7168,14336,f16:row,f16:column,f32:column,1,0,1,1,tensorop,f32,32,128,64,2,1,4,1,16,8,8,75,1024,616562688,1473276542976,49.277,11.6529,29897.8
1,CUTLASS,gemm,cutlass_tensorop_s1688141gemm_f16_32x128_64x2_tn_align4,not_verified,success,universal,7168,7168,14336,f16:row,f16:column,f32:column,1,0,1,1,tensorop,f32,32,128,64,2,1,4,1,16,8,8,75,1024,616562688,1473276542976,49.1464,11.6838,29977.3
1,CUTLASS,gemm,cutlass_tensorop_s1688122gemm_f16_32x128_64x2_tn_align4,not_verified,success,universal,7168,7168,14336,f16:row,f16:column,f32:column,1,0,1,1,tensorop,f32,32,128,64,2,1,2,1,16,8,8,75,1024,616562688,1473276542976,77.105,7.44724,19107.4
1,CUTLASS,gemm,cutlass_tensorop_s1688121gemm_f16_32x128_64x2_tn_align4,not_verified,success,universal,7168,7168,14336,f16:row,f16:column,f32:column,1,0,1,1,tensorop,f32,32,128,64,2,1,2,1,16,8,8,75,1024,616562688,1473276542976,77.2219,7.43596,19078.5
1,CUTLASS,gemm,cutlass_tensorop_s1688112gemm_f16_32x128_64x2_tn_align4,not_verified,success,universal,7168,7168,14336,f16:row,f16:column,f32:column,1,0,1,1,tensorop,f32,32,128,64,2,1,1,1,16,8,8,75,1024,616562688,1473276542976,496.254,1.15711,2968.79
1,CUTLASS,gemm,cutlass_tensorop_s1688111gemm_f16_32x128_64x2_tn_align4,not_verified,success,universal,7168,7168,14336,f16:row,f16:column,f32:column,1,0,1,1,tensorop,f32,32,128,64,2,1,1,1,16,8,8,75,1024,616562688,1473276542976,497.229,1.15484,2962.97
1,CUTLASS,gemm,cutlass_tensorop_s1688142gemm_f16_32x128_64x2_tn_align4,not_verified,success,universal,8192,8192,16384,f16:row,f16:column,f32:column,1,0,1,1,tensorop,f32,32,128,64,2,1,4,1,16,8,8,75,1024,805306368,2199157473280,74.4675,10.0715,29531.8
1,CUTLASS,gemm,cutlass_tensorop_s1688141gemm_f16_32x128_64x2_tn_align4,not_verified,success,universal,8192,8192,16384,f16:row,f16:column,f32:column,1,0,1,1,tensorop,f32,32,128,64,2,1,4,1,16,8,8,75,1024,805306368,2199157473280,74.3655,10.0853,29572.3
1,CUTLASS,gemm,cutlass_tensorop_s1688122gemm_f16_32x128_64x2_tn_align4,not_verified,success,universal,8192,8192,16384,f16:row,f16:column,f32:column,1,0,1,1,tensorop,f32,32,128,64,2,1,2,1,16,8,8,75,1024,805306368,2199157473280,115.104,6.51587,19105.9
1,CUTLASS,gemm,cutlass_tensorop_s1688121gemm_f16_32x128_64x2_tn_align4,not_verified,success,universal,8192,8192,16384,f16:row,f16:column,f32:column,1,0,1,1,tensorop,f32,32,128,64,2,1,2,1,16,8,8,75,1024,805306368,2199157473280,115.16,6.51271,19096.6
1,CUTLASS,gemm,cutlass_tensorop_s1688112gemm_f16_32x128_64x2_tn_align4,not_verified,success,universal,8192,8192,16384,f16:row,f16:column,f32:column,1,0,1,1,tensorop,f32,32,128,64,2,1,1,1,16,8,8,75,1024,805306368,2199157473280,733.69,1.02223,2997.39
1,CUTLASS,gemm,cutlass_tensorop_s1688111gemm_f16_32x128_64x2_tn_align4,not_verified,success,universal,8192,8192,16384,f16:row,f16:column,f32:column,1,0,1,1,tensorop,f32,32,128,64,2,1,1,1,16,8,8,75,1024,805306368,2199157473280,728.68,1.02926,3018
1,CUTLASS,gemm,cutlass_tensorop_s1688142gemm_f16_32x128_64x2_tn_align4,not_verified,success,universal,9216,9216,18432,f16:row,f16:column,f32:column,1,0,1,1,tensorop,f32,32,128,64,2,1,4,1,16,8,8,75,1024,1019215872,3131201028096,105.263,9.01757,29746.4
1,CUTLASS,gemm,cutlass_tensorop_s1688141gemm_f16_32x128_64x2_tn_align4,not_verified,success,universal,9216,9216,18432,f16:row,f16:column,f32:column,1,0,1,1,tensorop,f32,32,128,64,2,1,4,1,16,8,8,75,1024,1019215872,3131201028096,105.238,9.01976,29753.6
1,CUTLASS,gemm,cutlass_tensorop_s1688122gemm_f16_32x128_64x2_tn_align4,not_verified,success,universal,9216,9216,18432,f16:row,f16:column,f32:column,1,0,1,1,tensorop,f32,32,128,64,2,1,2,1,16,8,8,75,1024,1019215872,3131201028096,163.781,5.79567,19118.2
1,CUTLASS,gemm,cutlass_tensorop_s1688121gemm_f16_32x128_64x2_tn_align4,not_verified,success,universal,9216,9216,18432,f16:row,f16:column,f32:column,1,0,1,1,tensorop,f32,32,128,64,2,1,2,1,16,8,8,75,1024,1019215872,3131201028096,163.508,5.80532,19150.1
1,CUTLASS,gemm,cutlass_tensorop_s1688112gemm_f16_32x128_64x2_tn_align4,not_verified,success,universal,9216,9216,18432,f16:row,f16:column,f32:column,1,0,1,1,tensorop,f32,32,128,64,2,1,1,1,16,8,8,75,1024,1019215872,3131201028096,1048.92,0.904947,2985.16
1,CUTLASS,gemm,cutlass_tensorop_s1688111gemm_f16_32x128_64x2_tn_align4,not_verified,success,universal,9216,9216,18432,f16:row,f16:column,f32:column,1,0,1,1,tensorop,f32,32,128,64,2,1,1,1,16,8,8,75,1024,1019215872,3131201028096,1050.6,0.903502,2980.4
1,CUTLASS,gemm,cutlass_tensorop_s1688142gemm_f16_32x128_64x2_tn_align4,not_verified,success,universal,10240,10240,20480,f16:row,f16:column,f32:column,1,0,1,1,tensorop,f32,32,128,64,2,1,4,1,16,8,8,75,1024,1258291200,4295177011200,372.187,3.14862,11540.4
1,CUTLASS,gemm,cutlass_tensorop_s1688141gemm_f16_32x128_64x2_tn_align4,not_verified,success,universal,10240,10240,20480,f16:row,f16:column,f32:column,1,0,1,1,tensorop,f32,32,128,64,2,1,4,1,16,8,8,75,1024,1258291200,4295177011200,373.002,3.14174,11515.2
1,CUTLASS,gemm,cutlass_tensorop_s1688122gemm_f16_32x128_64x2_tn_align4,not_verified,success,universal,10240,10240,20480,f16:row,f16:column,f32:column,1,0,1,1,tensorop,f32,32,128,64,2,1,2,1,16,8,8,75,1024,1258291200,4295177011200,224.091,5.22947,19167.1
1,CUTLASS,gemm,cutlass_tensorop_s1688121gemm_f16_32x128_64x2_tn_align4,not_verified,success,universal,10240,10240,20480,f16:row,f16:column,f32:column,1,0,1,1,tensorop,f32,32,128,64,2,1,2,1,16,8,8,75,1024,1258291200,4295177011200,224.207,5.22675,19157.2
1,CUTLASS,gemm,cutlass_tensorop_s1688112gemm_f16_32x128_64x2_tn_align4,not_verified,success,universal,10240,10240,20480,f16:row,f16:column,f32:column,1,0,1,1,tensorop,f32,32,128,64,2,1,1,1,16,8,8,75,1024,1258291200,4295177011200,1438.97,0.814387,2984.9
1,CUTLASS,gemm,cutlass_tensorop_s1688111gemm_f16_32x128_64x2_tn_align4,not_verified,success,universal,10240,10240,20480,f16:row,f16:column,f32:column,1,0,1,1,tensorop,f32,32,128,64,2,1,1,1,16,8,8,75,1024,1258291200,4295177011200,1437.7,0.815102,2987.53
1,CUTLASS,gemm,cutlass_tensorop_s1688211gemm_f16_64x32_32x2_tn_align4,not_verified,success,universal,1024,1024,2048,f16:row,f16:column,f32:column,1,0,1,1,tensorop,f32,64,32,32,2,2,1,1,16,8,8,75,1024,12582912,4297064448,0.266552,43.9643,16120.9
1,CUTLASS,gemm,cutlass_tensorop_s1688111gemm_f16_64x32_32x2_tn_align4,not_verified,success,universal,1024,1024,2048,f16:row,f16:column,f32:column,1,0,1,1,tensorop,f32,64,32,32,2,1,1,1,16,8,8,75,1024,12582912,4297064448,0.242994,48.2265,17683.8
1,CUTLASS,gemm,cutlass_tensorop_s1688211gemm_f16_64x32_32x2_tn_align4,not_verified,success,universal,2048,2048,4096,f16:row,f16:column,f32:column,1,0,1,1,tensorop,f32,64,32,32,2,2,1,1,16,8,8,75,1024,50331648,34368126976,1.87478,25.0029,18331.8
1,CUTLASS,gemm,cutlass_tensorop_s1688111gemm_f16_64x32_32x2_tn_align4,not_verified,success,universal,2048,2048,4096,f16:row,f16:column,f32:column,1,0,1,1,tensorop,f32,64,32,32,2,1,1,1,16,8,8,75,1024,50331648,34368126976,1.49387,31.3782,23006.1
1,CUTLASS,gemm,cutlass_tensorop_s1688211gemm_f16_64x32_32x2_tn_align4,not_verified,success,universal,3072,3072,6144,f16:row,f16:column,f32:column,1,0,1,1,tensorop,f32,64,32,32,2,2,1,1,16,8,8,75,1024,113246208,115982991360,6.01011,17.5486,19298
1,CUTLASS,gemm,cutlass_tensorop_s1688111gemm_f16_64x32_32x2_tn_align4,not_verified,success,universal,3072,3072,6144,f16:row,f16:column,f32:column,1,0,1,1,tensorop,f32,64,32,32,2,1,1,1,16,8,8,75,1024,113246208,115982991360,4.95344,21.292,23414.6
1,CUTLASS,gemm,cutlass_tensorop_s1688211gemm_f16_64x32_32x2_tn_align4,not_verified,success,universal,4096,4096,8192,f16:row,f16:column,f32:column,1,0,1,1,tensorop,f32,64,32,32,2,2,1,1,16,8,8,75,1024,201326592,274911461376,12.2573,15.297,22428.4
1,CUTLASS,gemm,cutlass_tensorop_s1688111gemm_f16_64x32_32x2_tn_align4,not_verified,success,universal,4096,4096,8192,f16:row,f16:column,f32:column,1,0,1,1,tensorop,f32,64,32,32,2,1,1,1,16,8,8,75,1024,201326592,274911461376,11.4249,16.4116,24062.6
1,CUTLASS,gemm,cutlass_tensorop_s1688211gemm_f16_64x32_32x2_tn_align4,not_verified,success,universal,5120,5120,10240,f16:row,f16:column,f32:column,1,0,1,1,tensorop,f32,64,32,32,2,2,1,1,16,8,8,75,1024,314572800,536923340800,54.9325,5.33325,9774.24
1,CUTLASS,gemm,cutlass_tensorop_s1688111gemm_f16_64x32_32x2_tn_align4,not_verified,success,universal,5120,5120,10240,f16:row,f16:column,f32:column,1,0,1,1,tensorop,f32,64,32,32,2,1,1,1,16,8,8,75,1024,314572800,536923340800,46.6585,6.27901,11507.5
1,CUTLASS,gemm,cutlass_tensorop_s1688211gemm_f16_64x32_32x2_tn_align4,not_verified,success,universal,6144,6144,12288,f16:row,f16:column,f32:column,1,0,1,1,tensorop,f32,64,32,32,2,2,1,1,16,8,8,75,1024,452984832,927788433408,104.935,4.02035,8841.56
1,CUTLASS,gemm,cutlass_tensorop_s1688111gemm_f16_64x32_32x2_tn_align4,not_verified,success,universal,6144,6144,12288,f16:row,f16:column,f32:column,1,0,1,1,tensorop,f32,64,32,32,2,1,1,1,16,8,8,75,1024,452984832,927788433408,90.6588,4.65344,10233.9
1,CUTLASS,gemm,cutlass_tensorop_s1688211gemm_f16_64x32_32x2_tn_align4,not_verified,success,universal,7168,7168,14336,f16:row,f16:column,f32:column,1,0,1,1,tensorop,f32,64,32,32,2,2,1,1,16,8,8,75,1024,616562688,1473276542976,178.388,3.21893,8258.84
1,CUTLASS,gemm,cutlass_tensorop_s1688111gemm_f16_64x32_32x2_tn_align4,not_verified,success,universal,7168,7168,14336,f16:row,f16:column,f32:column,1,0,1,1,tensorop,f32,64,32,32,2,1,1,1,16,8,8,75,1024,616562688,1473276542976,165.097,3.47808,8923.73
1,CUTLASS,gemm,cutlass_tensorop_s1688211gemm_f16_64x32_32x2_tn_align4,not_verified,success,universal,8192,8192,16384,f16:row,f16:column,f32:column,1,0,1,1,tensorop,f32,64,32,32,2,2,1,1,16,8,8,75,1024,805306368,2199157473280,280.108,2.67754,7851.11
1,CUTLASS,gemm,cutlass_tensorop_s1688111gemm_f16_64x32_32x2_tn_align4,not_verified,success,universal,8192,8192,16384,f16:row,f16:column,f32:column,1,0,1,1,tensorop,f32,64,32,32,2,1,1,1,16,8,8,75,1024,805306368,2199157473280,259.669,2.88829,8469.09
1,CUTLASS,gemm,cutlass_tensorop_s1688211gemm_f16_64x32_32x2_tn_align4,not_verified,success,universal,9216,9216,18432,f16:row,f16:column,f32:column,1,0,1,1,tensorop,f32,64,32,32,2,2,1,1,16,8,8,75,1024,1019215872,3131201028096,448.413,2.11684,6982.86
1,CUTLASS,gemm,cutlass_tensorop_s1688111gemm_f16_64x32_32x2_tn_align4,not_verified,success,universal,9216,9216,18432,f16:row,f16:column,f32:column,1,0,1,1,tensorop,f32,64,32,32,2,1,1,1,16,8,8,75,1024,1019215872,3131201028096,411.365,2.30748,7611.73
1,CUTLASS,gemm,cutlass_tensorop_s1688211gemm_f16_64x32_32x2_tn_align4,not_verified,success,universal,10240,10240,20480,f16:row,f16:column,f32:column,1,0,1,1,tensorop,f32,64,32,32,2,2,1,1,16,8,8,75,1024,1258291200,4295177011200,660.095,1.77531,6506.91
1,CUTLASS,gemm,cutlass_tensorop_s1688111gemm_f16_64x32_32x2_tn_align4,not_verified,success,universal,10240,10240,20480,f16:row,f16:column,f32:column,1,0,1,1,tensorop,f32,64,32,32,2,1,1,1,16,8,8,75,1024,1258291200,4295177011200,599.113,1.95602,7169.22
1,CUTLASS,gemm,cutlass_tensorop_s1688212gemm_f16_64x32_64x2_tn_align4,not_verified,success,universal,1024,1024,2048,f16:row,f16:column,f32:column,1,0,1,1,tensorop,f32,64,32,64,2,2,1,1,16,8,8,75,1024,12582912,4297064448,0.17689,66.2487,24292.3
1,CUTLASS,gemm,cutlass_tensorop_s1688211gemm_f16_64x32_64x2_tn_align4,not_verified,success,universal,1024,1024,2048,f16:row,f16:column,f32:column,1,0,1,1,tensorop,f32,64,32,64,2,2,1,1,16,8,8,75,1024,12582912,4297064448,0.1701,68.8935,25262.1
1,CUTLASS,gemm,cutlass_tensorop_s1688112gemm_f16_64x32_64x2_tn_align4,not_verified,success,universal,1024,1024,2048,f16:row,f16:column,f32:column,1,0,1,1,tensorop,f32,64,32,64,2,1,1,1,16,8,8,75,1024,12582912,4297064448,0.237396,49.3638,18100.9
1,CUTLASS,gemm,cutlass_tensorop_s1688111gemm_f16_64x32_64x2_tn_align4,not_verified,success,universal,1024,1024,2048,f16:row,f16:column,f32:column,1,0,1,1,tensorop,f32,64,32,64,2,1,1,1,16,8,8,75,1024,12582912,4297064448,0.23415,50.048,18351.8
1,CUTLASS,gemm,cutlass_tensorop_s1688212gemm_f16_64x32_64x2_tn_align4,not_verified,success,universal,2048,2048,4096,f16:row,f16:column,f32:column,1,0,1,1,tensorop,f32,64,32,64,2,2,1,1,16,8,8,75,1024,50331648,34368126976,1.2782,36.6727,26887.9
1,CUTLASS,gemm,cutlass_tensorop_s1688211gemm_f16_64x32_64x2_tn_align4,not_verified,success,universal,2048,2048,4096,f16:row,f16:column,f32:column,1,0,1,1,tensorop,f32,64,32,64,2,2,1,1,16,8,8,75,1024,50331648,34368126976,1.2385,37.8483,27749.8
1,CUTLASS,gemm,cutlass_tensorop_s1688112gemm_f16_64x32_64x2_tn_align4,not_verified,success,universal,2048,2048,4096,f16:row,f16:column,f32:column,1,0,1,1,tensorop,f32,64,32,64,2,1,1,1,16,8,8,75,1024,50331648,34368126976,1.75146,26.7634,19622.6
1,CUTLASS,gemm,cutlass_tensorop_s1688111gemm_f16_64x32_64x2_tn_align4,not_verified,success,universal,2048,2048,4096,f16:row,f16:column,f32:column,1,0,1,1,tensorop,f32,64,32,64,2,1,1,1,16,8,8,75,1024,50331648,34368126976,1.75123,26.7669,19625.1
1,CUTLASS,gemm,cutlass_tensorop_s1688212gemm_f16_64x32_64x2_tn_align4,not_verified,success,universal,3072,3072,6144,f16:row,f16:column,f32:column,1,0,1,1,tensorop,f32,64,32,64,2,2,1,1,16,8,8,75,1024,113246208,115982991360,4.05095,26.0355,28631
1,CUTLASS,gemm,cutlass_tensorop_s1688211gemm_f16_64x32_64x2_tn_align4,not_verified,success,universal,3072,3072,6144,f16:row,f16:column,f32:column,1,0,1,1,tensorop,f32,64,32,64,2,2,1,1,16,8,8,75,1024,113246208,115982991360,4.17949,25.2348,27750.5
1,CUTLASS,gemm,cutlass_tensorop_s1688112gemm_f16_64x32_64x2_tn_align4,not_verified,success,universal,3072,3072,6144,f16:row,f16:column,f32:column,1,0,1,1,tensorop,f32,64,32,64,2,1,1,1,16,8,8,75,1024,113246208,115982991360,5.58808,18.8739,20755.4
1,CUTLASS,gemm,cutlass_tensorop_s1688111gemm_f16_64x32_64x2_tn_align4,not_verified,success,universal,3072,3072,6144,f16:row,f16:column,f32:column,1,0,1,1,tensorop,f32,64,32,64,2,1,1,1,16,8,8,75,1024,113246208,115982991360,5.58435,18.8865,20769.3
1,CUTLASS,gemm,cutlass_tensorop_s1688212gemm_f16_64x32_64x2_tn_align4,not_verified,success,universal,4096,4096,8192,f16:row,f16:column,f32:column,1,0,1,1,tensorop,f32,64,32,64,2,2,1,1,16,8,8,75,1024,201326592,274911461376,9.72726,19.2757,28262
1,CUTLASS,gemm,cutlass_tensorop_s1688211gemm_f16_64x32_64x2_tn_align4,not_verified,success,universal,4096,4096,8192,f16:row,f16:column,f32:column,1,0,1,1,tensorop,f32,64,32,64,2,2,1,1,16,8,8,75,1024,201326592,274911461376,9.48072,19.777,28996.9
1,CUTLASS,gemm,cutlass_tensorop_s1688112gemm_f16_64x32_64x2_tn_align4,not_verified,success,universal,4096,4096,8192,f16:row,f16:column,f32:column,1,0,1,1,tensorop,f32,64,32,64,2,1,1,1,16,8,8,75,1024,201326592,274911461376,13.1117,14.3002,20966.8
1,CUTLASS,gemm,cutlass_tensorop_s1688111gemm_f16_64x32_64x2_tn_align4,not_verified,success,universal,4096,4096,8192,f16:row,f16:column,f32:column,1,0,1,1,tensorop,f32,64,32,64,2,1,1,1,16,8,8,75,1024,201326592,274911461376,13.1133,14.2985,20964.4
1,CUTLASS,gemm,cutlass_tensorop_s1688212gemm_f16_64x32_64x2_tn_align4,not_verified,success,universal,5120,5120,10240,f16:row,f16:column,f32:column,1,0,1,1,tensorop,f32,64,32,64,2,2,1,1,16,8,8,75,1024,314572800,536923340800,19.3677,15.1267,27722.6
1,CUTLASS,gemm,cutlass_tensorop_s1688211gemm_f16_64x32_64x2_tn_align4,not_verified,success,universal,5120,5120,10240,f16:row,f16:column,f32:column,1,0,1,1,tensorop,f32,64,32,64,2,2,1,1,16,8,8,75,1024,314572800,536923340800,19.0494,15.3794,28185.8
1,CUTLASS,gemm,cutlass_tensorop_s1688112gemm_f16_64x32_64x2_tn_align4,not_verified,success,universal,5120,5120,10240,f16:row,f16:column,f32:column,1,0,1,1,tensorop,f32,64,32,64,2,1,1,1,16,8,8,75,1024,314572800,536923340800,25.4553,11.5092,21092.8
1,CUTLASS,gemm,cutlass_tensorop_s1688111gemm_f16_64x32_64x2_tn_align4,not_verified,success,universal,5120,5120,10240,f16:row,f16:column,f32:column,1,0,1,1,tensorop,f32,64,32,64,2,1,1,1,16,8,8,75,1024,314572800,536923340800,25.4553,11.5092,21092.8
1,CUTLASS,gemm,cutlass_tensorop_s1688212gemm_f16_64x32_64x2_tn_align4,not_verified,success,universal,6144,6144,12288,f16:row,f16:column,f32:column,1,0,1,1,tensorop,f32,64,32,64,2,2,1,1,16,8,8,75,1024,452984832,927788433408,34.0681,12.3833,27233.4
1,CUTLASS,gemm,cutlass_tensorop_s1688211gemm_f16_64x32_64x2_tn_align4,not_verified,success,universal,6144,6144,12288,f16:row,f16:column,f32:column,1,0,1,1,tensorop,f32,64,32,64,2,2,1,1,16,8,8,75,1024,452984832,927788433408,34.2412,12.3207,27095.7
1,CUTLASS,gemm,cutlass_tensorop_s1688112gemm_f16_64x32_64x2_tn_align4,not_verified,success,universal,6144,6144,12288,f16:row,f16:column,f32:column,1,0,1,1,tensorop,f32,64,32,64,2,1,1,1,16,8,8,75,1024,452984832,927788433408,43.9406,9.60103,21114.6
1,CUTLASS,gemm,cutlass_tensorop_s1688111gemm_f16_64x32_64x2_tn_align4,not_verified,success,universal,6144,6144,12288,f16:row,f16:column,f32:column,1,0,1,1,tensorop,f32,64,32,64,2,1,1,1,16,8,8,75,1024,452984832,927788433408,43.9263,9.60415,21121.5
1,CUTLASS,gemm,cutlass_tensorop_s1688212gemm_f16_64x32_64x2_tn_align4,not_verified,success,universal,7168,7168,14336,f16:row,f16:column,f32:column,1,0,1,1,tensorop,f32,64,32,64,2,2,1,1,16,8,8,75,1024,616562688,1473276542976,56.4889,10.1652,26080.8
1,CUTLASS,gemm,cutlass_tensorop_s1688211gemm_f16_64x32_64x2_tn_align4,not_verified,success,universal,7168,7168,14336,f16:row,f16:column,f32:column,1,0,1,1,tensorop,f32,64,32,64,2,2,1,1,16,8,8,75,1024,616562688,1473276542976,56.004,10.2532,26306.6
1,CUTLASS,gemm,cutlass_tensorop_s1688112gemm_f16_64x32_64x2_tn_align4,not_verified,success,universal,7168,7168,14336,f16:row,f16:column,f32:column,1,0,1,1,tensorop,f32,64,32,64,2,1,1,1,16,8,8,75,1024,616562688,1473276542976,69.956,8.20828,21060
1,CUTLASS,gemm,cutlass_tensorop_s1688111gemm_f16_64x32_64x2_tn_align4,not_verified,success,universal,7168,7168,14336,f16:row,f16:column,f32:column,1,0,1,1,tensorop,f32,64,32,64,2,1,1,1,16,8,8,75,1024,616562688,1473276542976,70.0199,8.20079,21040.8
1,CUTLASS,gemm,cutlass_tensorop_s1688212gemm_f16_64x32_64x2_tn_align4,not_verified,success,universal,8192,8192,16384,f16:row,f16:column,f32:column,1,0,1,1,tensorop,f32,64,32,64,2,2,1,1,16,8,8,75,1024,805306368,2199157473280,95.8513,7.82462,22943.4
1,CUTLASS,gemm,cutlass_tensorop_s1688211gemm_f16_64x32_64x2_tn_align4,not_verified,success,universal,8192,8192,16384,f16:row,f16:column,f32:column,1,0,1,1,tensorop,f32,64,32,64,2,2,1,1,16,8,8,75,1024,805306368,2199157473280,97.5081,7.69167,22553.6
1,CUTLASS,gemm,cutlass_tensorop_s1688112gemm_f16_64x32_64x2_tn_align4,not_verified,success,universal,8192,8192,16384,f16:row,f16:column,f32:column,1,0,1,1,tensorop,f32,64,32,64,2,1,1,1,16,8,8,75,1024,805306368,2199157473280,104.374,7.18573,21070.1
1,CUTLASS,gemm,cutlass_tensorop_s1688111gemm_f16_64x32_64x2_tn_align4,not_verified,success,universal,8192,8192,16384,f16:row,f16:column,f32:column,1,0,1,1,tensorop,f32,64,32,64,2,1,1,1,16,8,8,75,1024,805306368,2199157473280,104.596,7.17042,21025.2
1,CUTLASS,gemm,cutlass_tensorop_s1688212gemm_f16_64x32_64x2_tn_align4,not_verified,success,universal,9216,9216,18432,f16:row,f16:column,f32:column,1,0,1,1,tensorop,f32,64,32,64,2,2,1,1,16,8,8,75,1024,1019215872,3131201028096,138.308,6.8631,22639.4
1,CUTLASS,gemm,cutlass_tensorop_s1688211gemm_f16_64x32_64x2_tn_align4,not_verified,success,universal,9216,9216,18432,f16:row,f16:column,f32:column,1,0,1,1,tensorop,f32,64,32,64,2,2,1,1,16,8,8,75,1024,1019215872,3131201028096,138.6,6.84863,22591.7
1,CUTLASS,gemm,cutlass_tensorop_s1688112gemm_f16_64x32_64x2_tn_align4,not_verified,success,universal,9216,9216,18432,f16:row,f16:column,f32:column,1,0,1,1,tensorop,f32,64,32,64,2,1,1,1,16,8,8,75,1024,1019215872,3131201028096,149.18,6.36291,20989.4
1,CUTLASS,gemm,cutlass_tensorop_s1688111gemm_f16_64x32_64x2_tn_align4,not_verified,success,universal,9216,9216,18432,f16:row,f16:column,f32:column,1,0,1,1,tensorop,f32,64,32,64,2,1,1,1,16,8,8,75,1024,1019215872,3131201028096,148.766,6.38061,21047.8
1,CUTLASS,gemm,cutlass_tensorop_s1688212gemm_f16_64x32_64x2_tn_align4,not_verified,success,universal,10240,10240,20480,f16:row,f16:column,f32:column,1,0,1,1,tensorop,f32,64,32,64,2,2,1,1,16,8,8,75,1024,1258291200,4295177011200,207.176,5.65642,20732
1,CUTLASS,gemm,cutlass_tensorop_s1688211gemm_f16_64x32_64x2_tn_align4,not_verified,success,universal,10240,10240,20480,f16:row,f16:column,f32:column,1,0,1,1,tensorop,f32,64,32,64,2,2,1,1,16,8,8,75,1024,1258291200,4295177011200,210.004,5.58025,20452.8
1,CUTLASS,gemm,cutlass_tensorop_s1688112gemm_f16_64x32_64x2_tn_align4,not_verified,success,universal,10240,10240,20480,f16:row,f16:column,f32:column,1,0,1,1,tensorop,f32,64,32,64,2,1,1,1,16,8,8,75,1024,1258291200,4295177011200,203.631,5.7549,21093
1,CUTLASS,gemm,cutlass_tensorop_s1688111gemm_f16_64x32_64x2_tn_align4,not_verified,success,universal,10240,10240,20480,f16:row,f16:column,f32:column,1,0,1,1,tensorop,f32,64,32,64,2,1,1,1,16,8,8,75,1024,1258291200,4295177011200,203.831,5.74925,21072.3
1,CUTLASS,gemm,cutlass_tensorop_s1688221gemm_f16_64x64_32x2_tn_align4,not_verified,success,universal,1024,1024,2048,f16:row,f16:column,f32:column,1,0,1,1,tensorop,f32,64,64,32,2,2,2,1,16,8,8,75,1024,12582912,4297064448,0.153172,76.507,28053.8
1,CUTLASS,gemm,cutlass_tensorop_s1688211gemm_f16_64x64_32x2_tn_align4,not_verified,success,universal,1024,1024,2048,f16:row,f16:column,f32:column,1,0,1,1,tensorop,f32,64,64,32,2,2,1,1,16,8,8,75,1024,12582912,4297064448,0.149567,78.351,28730
1,CUTLASS,gemm,cutlass_tensorop_s1688121gemm_f16_64x64_32x2_tn_align4,not_verified,success,universal,1024,1024,2048,f16:row,f16:column,f32:column,1,0,1,1,tensorop,f32,64,64,32,2,1,2,1,16,8,8,75,1024,12582912,4297064448,0.145492,80.5459,29534.8
1,CUTLASS,gemm,cutlass_tensorop_s1688111gemm_f16_64x64_32x2_tn_align4,not_verified,success,universal,1024,1024,2048,f16:row,f16:column,f32:column,1,0,1,1,tensorop,f32,64,64,32,2,1,1,1,16,8,8,75,1024,12582912,4297064448,0.139251,84.1559,30858.5
1,CUTLASS,gemm,cutlass_tensorop_s1688221gemm_f16_64x64_32x2_tn_align4,not_verified,success,universal,2048,2048,4096,f16:row,f16:column,f32:column,1,0,1,1,tensorop,f32,64,64,32,2,2,2,1,16,8,8,75,1024,50331648,34368126976,1.16595,40.2032,29476.5
1,CUTLASS,gemm,cutlass_tensorop_s1688211gemm_f16_64x64_32x2_tn_align4,not_verified,success,universal,2048,2048,4096,f16:row,f16:column,f32:column,1,0,1,1,tensorop,f32,64,64,32,2,2,1,1,16,8,8,75,1024,50331648,34368126976,1.09527,42.7978,31378.8
1,CUTLASS,gemm,cutlass_tensorop_s1688121gemm_f16_64x64_32x2_tn_align4,not_verified,success,universal,2048,2048,4096,f16:row,f16:column,f32:column,1,0,1,1,tensorop,f32,64,64,32,2,1,2,1,16,8,8,75,1024,50331648,34368126976,1.09598,42.7699,31358.3
1,CUTLASS,gemm,cutlass_tensorop_s1688111gemm_f16_64x64_32x2_tn_align4,not_verified,success,universal,2048,2048,4096,f16:row,f16:column,f32:column,1,0,1,1,tensorop,f32,64,64,32,2,1,1,1,16,8,8,75,1024,50331648,34368126976,1.03087,45.4713,33339
1,CUTLASS,gemm,cutlass_tensorop_s1688221gemm_f16_64x64_32x2_tn_align4,not_verified,success,universal,3072,3072,6144,f16:row,f16:column,f32:column,1,0,1,1,tensorop,f32,64,64,32,2,2,2,1,16,8,8,75,1024,113246208,115982991360,3.81652,27.6348,30389.7
1,CUTLASS,gemm,cutlass_tensorop_s1688211gemm_f16_64x64_32x2_tn_align4,not_verified,success,universal,3072,3072,6144,f16:row,f16:column,f32:column,1,0,1,1,tensorop,f32,64,64,32,2,2,1,1,16,8,8,75,1024,113246208,115982991360,4.21126,25.0445,27541.2
1,CUTLASS,gemm,cutlass_tensorop_s1688121gemm_f16_64x64_32x2_tn_align4,not_verified,success,universal,3072,3072,6144,f16:row,f16:column,f32:column,1,0,1,1,tensorop,f32,64,64,32,2,1,2,1,16,8,8,75,1024,113246208,115982991360,3.99534,26.3979,29029.6
1,CUTLASS,gemm,cutlass_tensorop_s1688111gemm_f16_64x64_32x2_tn_align4,not_verified,success,universal,3072,3072,6144,f16:row,f16:column,f32:column,1,0,1,1,tensorop,f32,64,64,32,2,1,1,1,16,8,8,75,1024,113246208,115982991360,3.38614,31.1472,34252.3
1,CUTLASS,gemm,cutlass_tensorop_s1688221gemm_f16_64x64_32x2_tn_align4,not_verified,success,universal,4096,4096,8192,f16:row,f16:column,f32:column,1,0,1,1,tensorop,f32,64,64,32,2,2,2,1,16,8,8,75,1024,201326592,274911461376,8.81856,21.262,31174.2
1,CUTLASS,gemm,cutlass_tensorop_s1688211gemm_f16_64x64_32x2_tn_align4,not_verified,success,universal,4096,4096,8192,f16:row,f16:column,f32:column,1,0,1,1,tensorop,f32,64,64,32,2,2,1,1,16,8,8,75,1024,201326592,274911461376,8.40905,22.2974,32692.3
1,CUTLASS,gemm,cutlass_tensorop_s1688121gemm_f16_64x64_32x2_tn_align4,not_verified,success,universal,4096,4096,8192,f16:row,f16:column,f32:column,1,0,1,1,tensorop,f32,64,64,32,2,1,2,1,16,8,8,75,1024,201326592,274911461376,8.37479,22.3886,32826.1
1,CUTLASS,gemm,cutlass_tensorop_s1688111gemm_f16_64x64_32x2_tn_align4,not_verified,success,universal,4096,4096,8192,f16:row,f16:column,f32:column,1,0,1,1,tensorop,f32,64,64,32,2,1,1,1,16,8,8,75,1024,201326592,274911461376,7.87883,23.7979,34892.4
1,CUTLASS,gemm,cutlass_tensorop_s1688221gemm_f16_64x64_32x2_tn_align4,not_verified,success,universal,5120,5120,10240,f16:row,f16:column,f32:column,1,0,1,1,tensorop,f32,64,64,32,2,2,2,1,16,8,8,75,1024,314572800,536923340800,40.6233,7.21184,13217.1
