experiments/ww4w.gemm.csv
Problem,Provider,OperationKind,Operation,Disposition,Status,gemm_kind,m,n,k,A,B,C,alpha,beta,split_k_slices,batch_count,op_class,accum,cta_m,cta_n,cta_k,stages,warps_m,warps_n,warps_k,inst_m,inst_n,inst_k,min_cc,max_cc,Bytes,Flops,Runtime,GB/s,GFLOPs
1,CUTLASS,gemm,cutlass_tensorop_s1688111gemm_f16_32x32_32x2_tn_align4,passed,success,universal,1024,1024,4096,f16:row,f16:column,f32:column,1,0,1,1,tensorop,f32,32,32,32,2,1,1,1,16,8,8,75,1024,20971520,8592031744,0.617437,31.6328,13915.6
1,CUTLASS,gemm,cutlass_tensorop_s1688111gemm_f16_32x32_32x2_tn_align4,passed,success,universal,2048,2048,8192,f16:row,f16:column,f32:column,1,0,1,1,tensorop,f32,32,32,32,2,1,1,1,16,8,8,75,1024,83886080,68727865344,4.23431,18.4505,16231.2
1,CUTLASS,gemm,cutlass_tensorop_s1688111gemm_f16_32x32_32x2_tn_align4,passed,success,universal,3072,3072,12288,f16:row,f16:column,f32:column,1,0,1,1,tensorop,f32,32,32,32,2,1,1,1,16,8,8,75,1024,188743680,231947108352,14.6629,11.9881,15818.6
1,CUTLASS,gemm,cutlass_tensorop_s1688111gemm_f16_32x32_32x2_tn_align4,passed,success,universal,4096,4096,16384,f16:row,f16:column,f32:column,1,0,1,1,tensorop,f32,32,32,32,2,1,1,1,16,8,8,75,1024,335544320,549789368320,62.111,5.03131,8851.72
1,CUTLASS,gemm,cutlass_tensorop_s1688111gemm_f16_32x32_32x2_tn_align4,passed,success,universal,5120,5120,20480,f16:row,f16:column,f32:column,1,0,1,1,tensorop,f32,32,32,32,2,1,1,1,16,8,8,75,1024,524288000,1073794252800,177.261,2.75459,6057.7
1,CUTLASS,gemm,cutlass_tensorop_s1688111gemm_f16_32x32_32x2_tn_align4,passed,success,universal,6144,6144,24576,f16:row,f16:column,f32:column,1,0,1,1,tensorop,f32,32,32,32,2,1,1,1,16,8,8,75,1024,754974720,1855501369344,337.157,2.08545,5503.37
1,CUTLASS,gemm,cutlass_tensorop_s1688111gemm_f16_32x32_32x2_tn_align4,passed,success,universal,7168,7168,28672,f16:row,f16:column,f32:column,1,0,1,1,tensorop,f32,32,32,32,2,1,1,1,16,8,8,75,1024,1027604480,2946450325504,577.357,1.65761,5103.34
1,CUTLASS,gemm,cutlass_tensorop_s1688111gemm_f16_32x32_32x2_tn_align4,passed,success,universal,8192,8192,32768,f16:row,f16:column,f32:column,1,0,1,1,tensorop,f32,32,32,32,2,1,1,1,16,8,8,75,1024,1342177280,4398180728832,911.399,1.37152,4825.74
1,CUTLASS,gemm,cutlass_tensorop_s1688111gemm_f16_32x32_32x2_tn_align4,passed,success,universal,9216,9216,36864,f16:row,f16:column,f32:column,1,0,1,1,tensorop,f32,32,32,32,2,1,1,1,16,8,8,75,1024,1698693120,6262232186880,1374.63,1.15088,4555.59
1,CUTLASS,gemm,cutlass_tensorop_s1688111gemm_f16_32x32_32x2_tn_align4,passed,success,universal,10240,10240,40960,f16:row,f16:column,f32:column,1,0,1,1,tensorop,f32,32,32,32,2,1,1,1,16,8,8,75,1024,2097152000,8590144307200,1969.47,0.9917,4361.65
1,CUTLASS,gemm,cutlass_tensorop_s1688112gemm_f16_32x32_64x2_tn_align4,passed,success,universal,1024,1024,4096,f16:row,f16:column,f32:column,1,0,1,1,tensorop,f32,32,32,64,2,1,1,1,16,8,8,75,1024,20971520,8592031744,0.352552,55.3996,24371
1,CUTLASS,gemm,cutlass_tensorop_s1688111gemm_f16_32x32_64x2_tn_align4,passed,success,universal,1024,1024,4096,f16:row,f16:column,f32:column,1,0,1,1,tensorop,f32,32,32,64,2,1,1,1,16,8,8,75,1024,20971520,8592031744,0.353956,55.1799,24274.3
1,CUTLASS,gemm,cutlass_tensorop_s1688112gemm_f16_32x32_64x2_tn_align4,passed,success,universal,2048,2048,8192,f16:row,f16:column,f32:column,1,0,1,1,tensorop,f32,32,32,64,2,1,1,1,16,8,8,75,1024,83886080,68727865344,2.98234,26.1959,23045
1,CUTLASS,gemm,cutlass_tensorop_s1688111gemm_f16_32x32_64x2_tn_align4,passed,success,universal,2048,2048,8192,f16:row,f16:column,f32:column,1,0,1,1,tensorop,f32,32,32,64,2,1,1,1,16,8,8,75,1024,83886080,68727865344,2.67913,29.1606,25653.1
1,CUTLASS,gemm,cutlass_tensorop_s1688112gemm_f16_32x32_64x2_tn_align4,passed,success,universal,3072,3072,12288,f16:row,f16:column,f32:column,1,0,1,1,tensorop,f32,32,32,64,2,1,1,1,16,8,8,75,1024,188743680,231947108352,9.07601,19.3677,25556.1
1,CUTLASS,gemm,cutlass_tensorop_s1688111gemm_f16_32x32_64x2_tn_align4,passed,success,universal,3072,3072,12288,f16:row,f16:column,f32:column,1,0,1,1,tensorop,f32,32,32,64,2,1,1,1,16,8,8,75,1024,188743680,231947108352,9.03229,19.4614,25679.8
1,CUTLASS,gemm,cutlass_tensorop_s1688112gemm_f16_32x32_64x2_tn_align4,passed,success,universal,4096,4096,16384,f16:row,f16:column,f32:column,1,0,1,1,tensorop,f32,32,32,64,2,1,1,1,16,8,8,75,1024,335544320,549789368320,20.9229,14.9358,26276.9
1,CUTLASS,gemm,cutlass_tensorop_s1688111gemm_f16_32x32_64x2_tn_align4,passed,success,universal,4096,4096,16384,f16:row,f16:column,f32:column,1,0,1,1,tensorop,f32,32,32,64,2,1,1,1,16,8,8,75,1024,335544320,549789368320,20.8999,14.9522,26305.9
1,CUTLASS,gemm,cutlass_tensorop_s1688112gemm_f16_32x32_64x2_tn_align4,passed,success,universal,5120,5120,20480,f16:row,f16:column,f32:column,1,0,1,1,tensorop,f32,32,32,64,2,1,1,1,16,8,8,75,1024,524288000,1073794252800,42.3985,11.5165,25326.2
1,CUTLASS,gemm,cutlass_tensorop_s1688111gemm_f16_32x32_64x2_tn_align4,passed,success,universal,5120,5120,20480,f16:row,f16:column,f32:column,1,0,1,1,tensorop,f32,32,32,64,2,1,1,1,16,8,8,75,1024,524288000,1073794252800,42.4179,11.5112,25314.7
1,CUTLASS,gemm,cutlass_tensorop_s1688112gemm_f16_32x32_64x2_tn_align4,passed,success,universal,6144,6144,24576,f16:row,f16:column,f32:column,1,0,1,1,tensorop,f32,32,32,64,2,1,1,1,16,8,8,75,1024,754974720,1855501369344,73.6314,9.54926,25199.9
1,CUTLASS,gemm,cutlass_tensorop_s1688111gemm_f16_32x32_64x2_tn_align4,passed,success,universal,6144,6144,24576,f16:row,f16:column,f32:column,1,0,1,1,tensorop,f32,32,32,64,2,1,1,1,16,8,8,75,1024,754974720,1855501369344,73.6408,9.54803,25196.6
1,CUTLASS,gemm,cutlass_tensorop_s1688112gemm_f16_32x32_64x2_tn_align4,passed,success,universal,7168,7168,28672,f16:row,f16:column,f32:column,1,0,1,1,tensorop,f32,32,32,64,2,1,1,1,16,8,8,75,1024,1027604480,2946450325504,117.488,8.14581,25078.8
1,CUTLASS,gemm,cutlass_tensorop_s1688111gemm_f16_32x32_64x2_tn_align4,passed,success,universal,7168,7168,28672,f16:row,f16:column,f32:column,1,0,1,1,tensorop,f32,32,32,64,2,1,1,1,16,8,8,75,1024,1027604480,2946450325504,117.39,8.15259,25099.7
1,CUTLASS,gemm,cutlass_tensorop_s1688112gemm_f16_32x32_64x2_tn_align4,passed,success,universal,8192,8192,32768,f16:row,f16:column,f32:column,1,0,1,1,tensorop,f32,32,32,64,2,1,1,1,16,8,8,75,1024,1342177280,4398180728832,169.657,7.36781,25924
1,CUTLASS,gemm,cutlass_tensorop_s1688111gemm_f16_32x32_64x2_tn_align4,passed,success,universal,8192,8192,32768,f16:row,f16:column,f32:column,1,0,1,1,tensorop,f32,32,32,64,2,1,1,1,16,8,8,75,1024,1342177280,4398180728832,169.627,7.36912,25928.6
1,CUTLASS,gemm,cutlass_tensorop_s1688112gemm_f16_32x32_64x2_tn_align4,passed,success,universal,9216,9216,36864,f16:row,f16:column,f32:column,1,0,1,1,tensorop,f32,32,32,64,2,1,1,1,16,8,8,75,1024,1698693120,6262232186880,250.386,6.31836,25010.3
1,CUTLASS,gemm,cutlass_tensorop_s1688111gemm_f16_32x32_64x2_tn_align4,passed,success,universal,9216,9216,36864,f16:row,f16:column,f32:column,1,0,1,1,tensorop,f32,32,32,64,2,1,1,1,16,8,8,75,1024,1698693120,6262232186880,250.371,6.31875,25011.8
1,CUTLASS,gemm,cutlass_tensorop_s1688112gemm_f16_32x32_64x2_tn_align4,passed,success,universal,10240,10240,40960,f16:row,f16:column,f32:column,1,0,1,1,tensorop,f32,32,32,64,2,1,1,1,16,8,8,75,1024,2097152000,8590144307200,346.625,5.63469,24782.2
1,CUTLASS,gemm,cutlass_tensorop_s1688111gemm_f16_32x32_64x2_tn_align4,passed,success,universal,10240,10240,40960,f16:row,f16:column,f32:column,1,0,1,1,tensorop,f32,32,32,64,2,1,1,1,16,8,8,75,1024,2097152000,8590144307200,346.249,5.64082,24809.2
1,CUTLASS,gemm,cutlass_tensorop_s1688121gemm_f16_32x64_32x2_tn_align4,passed,success,universal,1024,1024,4096,f16:row,f16:column,f32:column,1,0,1,1,tensorop,f32,32,64,32,2,1,2,1,16,8,8,75,1024,20971520,8592031744,0.42163,46.3232,20378.1
1,CUTLASS,gemm,cutlass_tensorop_s1688111gemm_f16_32x64_32x2_tn_align4,passed,success,universal,1024,1024,4096,f16:row,f16:column,f32:column,1,0,1,1,tensorop,f32,32,64,32,2,1,1,1,16,8,8,75,1024,20971520,8592031744,0.432435,45.1658,19869
1,CUTLASS,gemm,cutlass_tensorop_s1688121gemm_f16_32x64_32x2_tn_align4,passed,success,universal,2048,2048,8192,f16:row,f16:column,f32:column,1,0,1,1,tensorop,f32,32,64,32,2,1,2,1,16,8,8,75,1024,83886080,68727865344,3.07147,25.4357,22376.2
1,CUTLASS,gemm,cutlass_tensorop_s1688111gemm_f16_32x64_32x2_tn_align4,passed,success,universal,2048,2048,8192,f16:row,f16:column,f32:column,1,0,1,1,tensorop,f32,32,64,32,2,1,1,1,16,8,8,75,1024,83886080,68727865344,2.97295,26.2786,23117.7
1,CUTLASS,gemm,cutlass_tensorop_s1688121gemm_f16_32x64_32x2_tn_align4,passed,success,universal,3072,3072,12288,f16:row,f16:column,f32:column,1,0,1,1,tensorop,f32,32,64,32,2,1,2,1,16,8,8,75,1024,188743680,231947108352,26.6839,6.58755,8692.41
1,CUTLASS,gemm,cutlass_tensorop_s1688111gemm_f16_32x64_32x2_tn_align4,passed,success,universal,3072,3072,12288,f16:row,f16:column,f32:column,1,0,1,1,tensorop,f32,32,64,32,2,1,1,1,16,8,8,75,1024,188743680,231947108352,24.19,7.2667,9588.57
1,CUTLASS,gemm,cutlass_tensorop_s1688121gemm_f16_32x64_32x2_tn_align4,passed,success,universal,4096,4096,16384,f16:row,f16:column,f32:column,1,0,1,1,tensorop,f32,32,64,32,2,1,2,1,16,8,8,75,1024,335544320,549789368320,73.3425,4.26083,7496.19
1,CUTLASS,gemm,cutlass_tensorop_s1688111gemm_f16_32x64_32x2_tn_align4,passed,success,universal,4096,4096,16384,f16:row,f16:column,f32:column,1,0,1,1,tensorop,f32,32,64,32,2,1,1,1,16,8,8,75,1024,335544320,549789368320,70.6786,4.42142,7778.72
1,CUTLASS,gemm,cutlass_tensorop_s1688121gemm_f16_32x64_32x2_tn_align4,passed,success,universal,5120,5120,20480,f16:row,f16:column,f32:column,1,0,1,1,tensorop,f32,32,64,32,2,1,2,1,16,8,8,75,1024,524288000,1073794252800,171.451,2.84793,6262.96
1,CUTLASS,gemm,cutlass_tensorop_s1688111gemm_f16_32x64_32x2_tn_align4,passed,success,universal,5120,5120,20480,f16:row,f16:column,f32:column,1,0,1,1,tensorop,f32,32,64,32,2,1,1,1,16,8,8,75,1024,524288000,1073794252800,166.956,2.92461,6431.61
1,CUTLASS,gemm,cutlass_tensorop_s1688121gemm_f16_32x64_32x2_tn_align4,passed,success,universal,6144,6144,24576,f16:row,f16:column,f32:column,1,0,1,1,tensorop,f32,32,64,32,2,1,2,1,16,8,8,75,1024,754974720,1855501369344,310.73,2.26282,5971.43
1,CUTLASS,gemm,cutlass_tensorop_s1688111gemm_f16_32x64_32x2_tn_align4,passed,success,universal,6144,6144,24576,f16:row,f16:column,f32:column,1,0,1,1,tensorop,f32,32,64,32,2,1,1,1,16,8,8,75,1024,754974720,1855501369344,304.395,2.30991,6095.7
1,CUTLASS,gemm,cutlass_tensorop_s1688121gemm_f16_32x64_32x2_tn_align4,passed,success,universal,7168,7168,28672,f16:row,f16:column,f32:column,1,0,1,1,tensorop,f32,32,64,32,2,1,2,1,16,8,8,75,1024,1027604480,2946450325504,522.79,1.83062,5636.02
1,CUTLASS,gemm,cutlass_tensorop_s1688111gemm_f16_32x64_32x2_tn_align4,passed,success,universal,7168,7168,28672,f16:row,f16:column,f32:column,1,0,1,1,tensorop,f32,32,64,32,2,1,1,1,16,8,8,75,1024,1027604480,2946450325504,516.349,1.85346,5706.31
1,CUTLASS,gemm,cutlass_tensorop_s1688121gemm_f16_32x64_32x2_tn_align4,passed,success,universal,8192,8192,32768,f16:row,f16:column,f32:column,1,0,1,1,tensorop,f32,32,64,32,2,1,2,1,16,8,8,75,1024,1342177280,4398180728832,802.245,1.55813,5482.34
1,CUTLASS,gemm,cutlass_tensorop_s1688111gemm_f16_32x64_32x2_tn_align4,passed,success,universal,8192,8192,32768,f16:row,f16:column,f32:column,1,0,1,1,tensorop,f32,32,64,32,2,1,1,1,16,8,8,75,1024,1342177280,4398180728832,797.338,1.56772,5516.08
1,CUTLASS,gemm,cutlass_tensorop_s1688121gemm_f16_32x64_32x2_tn_align4,passed,success,universal,9216,9216,36864,f16:row,f16:column,f32:column,1,0,1,1,tensorop,f32,32,64,32,2,1,2,1,16,8,8,75,1024,1698693120,6262232186880,1188.43,1.3312,5269.35
1,CUTLASS,gemm,cutlass_tensorop_s1688111gemm_f16_32x64_32x2_tn_align4,passed,success,universal,9216,9216,36864,f16:row,f16:column,f32:column,1,0,1,1,tensorop,f32,32,64,32,2,1,1,1,16,8,8,75,1024,1698693120,6262232186880,1174.56,1.34692,5331.57
1,CUTLASS,gemm,cutlass_tensorop_s1688121gemm_f16_32x64_32x2_tn_align4,passed,success,universal,10240,10240,40960,f16:row,f16:column,f32:column,1,0,1,1,tensorop,f32,32,64,32,2,1,2,1,16,8,8,75,1024,2097152000,8590144307200,1673.31,1.16722,5133.62
1,CUTLASS,gemm,cutlass_tensorop_s1688111gemm_f16_32x64_32x2_tn_align4,passed,success,universal,10240,10240,40960,f16:row,f16:column,f32:column,1,0,1,1,tensorop,f32,32,64,32,2,1,1,1,16,8,8,75,1024,2097152000,8590144307200,1652.27,1.18208,5198.98
1,CUTLASS,gemm,cutlass_tensorop_s1688122gemm_f16_32x64_64x2_tn_align4,passed,success,universal,1024,1024,4096,f16:row,f16:column,f32:column,1,0,1,1,tensorop,f32,32,64,64,2,1,2,1,16,8,8,75,1024,20971520,8592031744,0.374108,52.2075,22966.7
1,CUTLASS,gemm,cutlass_tensorop_s1688121gemm_f16_32x64_64x2_tn_align4,passed,success,universal,1024,1024,4096,f16:row,f16:column,f32:column,1,0,1,1,tensorop,f32,32,64,64,2,1,2,1,16,8,8,75,1024,20971520,8592031744,0.337099,57.9392,25488.1
1,CUTLASS,gemm,cutlass_tensorop_s1688112gemm_f16_32x64_64x2_tn_align4,passed,success,universal,1024,1024,4096,f16:row,f16:column,f32:column,1,0,1,1,tensorop,f32,32,64,64,2,1,1,1,16,8,8,75,1024,20971520,8592031744,0.435205,44.8783,19742.5
1,CUTLASS,gemm,cutlass_tensorop_s1688111gemm_f16_32x64_64x2_tn_align4,passed,success,universal,1024,1024,4096,f16:row,f16:column,f32:column,1,0,1,1,tensorop,f32,32,64,64,2,1,1,1,16,8,8,75,1024,20971520,8592031744,0.434908,44.9089,19756
1,CUTLASS,gemm,cutlass_tensorop_s1688122gemm_f16_32x64_64x2_tn_align4,passed,success,universal,2048,2048,8192,f16:row,f16:column,f32:column,1,0,1,1,tensorop,f32,32,64,64,2,1,2,1,16,8,8,75,1024,83886080,68727865344,2.42665,32.1946,28322.1
1,CUTLASS,gemm,cutlass_tensorop_s1688121gemm_f16_32x64_64x2_tn_align4,passed,success,universal,2048,2048,8192,f16:row,f16:column,f32:column,1,0,1,1,tensorop,f32,32,64,64,2,1,2,1,16,8,8,75,1024,83886080,68727865344,2.43542,32.0787,28220.2
1,CUTLASS,gemm,cutlass_tensorop_s1688112gemm_f16_32x64_64x2_tn_align4,passed,success,universal,2048,2048,8192,f16:row,f16:column,f32:column,1,0,1,1,tensorop,f32,32,64,64,2,1,1,1,16,8,8,75,1024,83886080,68727865344,3.27693,23.8409,20973.3
1,CUTLASS,gemm,cutlass_tensorop_s1688111gemm_f16_32x64_64x2_tn_align4,passed,success,universal,2048,2048,8192,f16:row,f16:column,f32:column,1,0,1,1,tensorop,f32,32,64,64,2,1,1,1,16,8,8,75,1024,83886080,68727865344,3.27666,23.8429,20975
1,CUTLASS,gemm,cutlass_tensorop_s1688122gemm_f16_32x64_64x2_tn_align4,passed,success,universal,3072,3072,12288,f16:row,f16:column,f32:column,1,0,1,1,tensorop,f32,32,64,64,2,1,2,1,16,8,8,75,1024,188743680,231947108352,8.71842,20.1621,26604.3
1,CUTLASS,gemm,cutlass_tensorop_s1688121gemm_f16_32x64_64x2_tn_align4,passed,success,universal,3072,3072,12288,f16:row,f16:column,f32:column,1,0,1,1,tensorop,f32,32,64,64,2,1,2,1,16,8,8,75,1024,188743680,231947108352,8.67007,20.2745,26752.6
1,CUTLASS,gemm,cutlass_tensorop_s1688112gemm_f16_32x64_64x2_tn_align4,passed,success,universal,3072,3072,12288,f16:row,f16:column,f32:column,1,0,1,1,tensorop,f32,32,64,64,2,1,1,1,16,8,8,75,1024,188743680,231947108352,10.4252,16.8612,22248.7
1,CUTLASS,gemm,cutlass_tensorop_s1688111gemm_f16_32x64_64x2_tn_align4,passed,success,universal,3072,3072,12288,f16:row,f16:column,f32:column,1,0,1,1,tensorop,f32,32,64,64,2,1,1,1,16,8,8,75,1024,188743680,231947108352,10.4226,16.8654,22254.3
1,CUTLASS,gemm,cutlass_tensorop_s1688122gemm_f16_32x64_64x2_tn_align4,passed,success,universal,4096,4096,16384,f16:row,f16:column,f32:column,1,0,1,1,tensorop,f32,32,64,64,2,1,2,1,16,8,8,75,1024,335544320,549789368320,25.5919,12.2109,21483
1,CUTLASS,gemm,cutlass_tensorop_s1688121gemm_f16_32x64_64x2_tn_align4,passed,success,universal,4096,4096,16384,f16:row,f16:column,f32:column,1,0,1,1,tensorop,f32,32,64,64,2,1,2,1,16,8,8,75,1024,335544320,549789368320,24.1138,12.9594,22799.8
1,CUTLASS,gemm,cutlass_tensorop_s1688112gemm_f16_32x64_64x2_tn_align4,passed,success,universal,4096,4096,16384,f16:row,f16:column,f32:column,1,0,1,1,tensorop,f32,32,64,64,2,1,1,1,16,8,8,75,1024,335544320,549789368320,25.4673,12.2707,21588.1
1,CUTLASS,gemm,cutlass_tensorop_s1688111gemm_f16_32x64_64x2_tn_align4,passed,success,universal,4096,4096,16384,f16:row,f16:column,f32:column,1,0,1,1,tensorop,f32,32,64,64,2,1,1,1,16,8,8,75,1024,335544320,549789368320,25.5114,12.2494,21550.8
1,CUTLASS,gemm,cutlass_tensorop_s1688122gemm_f16_32x64_64x2_tn_align4,passed,success,universal,5120,5120,20480,f16:row,f16:column,f32:column,1,0,1,1,tensorop,f32,32,64,64,2,1,2,1,16,8,8,75,1024,524288000,1073794252800,55.4745,8.80191,19356.6
1,CUTLASS,gemm,cutlass_tensorop_s1688121gemm_f16_32x64_64x2_tn_align4,passed,success,universal,5120,5120,20480,f16:row,f16:column,f32:column,1,0,1,1,tensorop,f32,32,64,64,2,1,2,1,16,8,8,75,1024,524288000,1073794252800,50.6145,9.64706,21215.2
1,CUTLASS,gemm,cutlass_tensorop_s1688112gemm_f16_32x64_64x2_tn_align4,passed,success,universal,5120,5120,20480,f16:row,f16:column,f32:column,1,0,1,1,tensorop,f32,32,64,64,2,1,1,1,16,8,8,75,1024,524288000,1073794252800,48.5295,10.0615,22126.6
1,CUTLASS,gemm,cutlass_tensorop_s1688111gemm_f16_32x64_64x2_tn_align4,passed,success,universal,5120,5120,20480,f16:row,f16:column,f32:column,1,0,1,1,tensorop,f32,32,64,64,2,1,1,1,16,8,8,75,1024,524288000,1073794252800,48.5823,10.0506,22102.6
1,CUTLASS,gemm,cutlass_tensorop_s1688122gemm_f16_32x64_64x2_tn_align4,passed,success,universal,6144,6144,24576,f16:row,f16:column,f32:column,1,0,1,1,tensorop,f32,32,64,64,2,1,2,1,16,8,8,75,1024,754974720,1855501369344,145.615,4.82867,12742.6
1,CUTLASS,gemm,cutlass_tensorop_s1688121gemm_f16_32x64_64x2_tn_align4,passed,success,universal,6144,6144,24576,f16:row,f16:column,f32:column,1,0,1,1,tensorop,f32,32,64,64,2,1,2,1,16,8,8,75,1024,754974720,1855501369344,143.326,4.90578,12946
1,CUTLASS,gemm,cutlass_tensorop_s1688112gemm_f16_32x64_64x2_tn_align4,passed,success,universal,6144,6144,24576,f16:row,f16:column,f32:column,1,0,1,1,tensorop,f32,32,64,64,2,1,1,1,16,8,8,75,1024,754974720,1855501369344,85.0346,8.26869,21820.5
1,CUTLASS,gemm,cutlass_tensorop_s1688111gemm_f16_32x64_64x2_tn_align4,passed,success,universal,6144,6144,24576,f16:row,f16:column,f32:column,1,0,1,1,tensorop,f32,32,64,64,2,1,1,1,16,8,8,75,1024,754974720,1855501369344,85.0652,8.26572,21812.7
1,CUTLASS,gemm,cutlass_tensorop_s1688122gemm_f16_32x64_64x2_tn_align4,passed,success,universal,7168,7168,28672,f16:row,f16:column,f32:column,1,0,1,1,tensorop,f32,32,64,64,2,1,2,1,16,8,8,75,1024,1027604480,2946450325504,252.382,3.792,11674.6
1,CUTLASS,gemm,cutlass_tensorop_s1688121gemm_f16_32x64_64x2_tn_align4,passed,success,universal,7168,7168,28672,f16:row,f16:column,f32:column,1,0,1,1,tensorop,f32,32,64,64,2,1,2,1,16,8,8,75,1024,1027604480,2946450325504,253.662,3.77287,11615.7
1,CUTLASS,gemm,cutlass_tensorop_s1688112gemm_f16_32x64_64x2_tn_align4,passed,success,universal,7168,7168,28672,f16:row,f16:column,f32:column,1,0,1,1,tensorop,f32,32,64,64,2,1,1,1,16,8,8,75,1024,1027604480,2946450325504,136.292,7.02191,21618.6
1,CUTLASS,gemm,cutlass_tensorop_s1688111gemm_f16_32x64_64x2_tn_align4,passed,success,universal,7168,7168,28672,f16:row,f16:column,f32:column,1,0,1,1,tensorop,f32,32,64,64,2,1,1,1,16,8,8,75,1024,1027604480,2946450325504,136.603,7.00592,21569.4
1,CUTLASS,gemm,cutlass_tensorop_s1688122gemm_f16_32x64_64x2_tn_align4,passed,success,universal,8192,8192,32768,f16:row,f16:column,f32:column,1,0,1,1,tensorop,f32,32,64,64,2,1,2,1,16,8,8,75,1024,1342177280,4398180728832,394.254,3.17055,11155.7
1,CUTLASS,gemm,cutlass_tensorop_s1688121gemm_f16_32x64_64x2_tn_align4,passed,success,universal,8192,8192,32768,f16:row,f16:column,f32:column,1,0,1,1,tensorop,f32,32,64,64,2,1,2,1,16,8,8,75,1024,1342177280,4398180728832,390.374,3.20206,11266.6
1,CUTLASS,gemm,cutlass_tensorop_s1688112gemm_f16_32x64_64x2_tn_align4,passed,success,universal,8192,8192,32768,f16:row,f16:column,f32:column,1,0,1,1,tensorop,f32,32,64,64,2,1,1,1,16,8,8,75,1024,1342177280,4398180728832,210.661,5.93371,20878
1,CUTLASS,gemm,cutlass_tensorop_s1688111gemm_f16_32x64_64x2_tn_align4,passed,success,universal,8192,8192,32768,f16:row,f16:column,f32:column,1,0,1,1,tensorop,f32,32,64,64,2,1,1,1,16,8,8,75,1024,1342177280,4398180728832,210.681,5.93313,20876
1,CUTLASS,gemm,cutlass_tensorop_s1688122gemm_f16_32x64_64x2_tn_align4,passed,success,universal,9216,9216,36864,f16:row,f16:column,f32:column,1,0,1,1,tensorop,f32,32,64,64,2,1,2,1,16,8,8,75,1024,1698693120,6262232186880,581.611,2.72009,10767.1
1,CUTLASS,gemm,cutlass_tensorop_s1688121gemm_f16_32x64_64x2_tn_align4,passed,success,universal,9216,9216,36864,f16:row,f16:column,f32:column,1,0,1,1,tensorop,f32,32,64,64,2,1,2,1,16,8,8,75,1024,1698693120,6262232186880,576.696,2.74327,10858.8
1,CUTLASS,gemm,cutlass_tensorop_s1688112gemm_f16_32x64_64x2_tn_align4,passed,success,universal,9216,9216,36864,f16:row,f16:column,f32:column,1,0,1,1,tensorop,f32,32,64,64,2,1,1,1,16,8,8,75,1024,1698693120,6262232186880,290.866,5.43904,21529.6
1,CUTLASS,gemm,cutlass_tensorop_s1688111gemm_f16_32x64_64x2_tn_align4,passed,success,universal,9216,9216,36864,f16:row,f16:column,f32:column,1,0,1,1,tensorop,f32,32,64,64,2,1,1,1,16,8,8,75,1024,1698693120,6262232186880,291.237,5.43211,21502.2
1,CUTLASS,gemm,cutlass_tensorop_s1688122gemm_f16_32x64_64x2_tn_align4,passed,success,universal,10240,10240,40960,f16:row,f16:column,f32:column,1,0,1,1,tensorop,f32,32,64,64,2,1,2,1,16,8,8,75,1024,2097152000,8590144307200,794.052,2.45969,10818.1
1,CUTLASS,gemm,cutlass_tensorop_s1688121gemm_f16_32x64_64x2_tn_align4,passed,success,universal,10240,10240,40960,f16:row,f16:column,f32:column,1,0,1,1,tensorop,f32,32,64,64,2,1,2,1,16,8,8,75,1024,2097152000,8590144307200,797.88,2.44789,10766.2
1,CUTLASS,gemm,cutlass_tensorop_s1688112gemm_f16_32x64_64x2_tn_align4,passed,success,universal,10240,10240,40960,f16:row,f16:column,f32:column,1,0,1,1,tensorop,f32,32,64,64,2,1,1,1,16,8,8,75,1024,2097152000,8590144307200,388.429,5.02827,22115.1
1,CUTLASS,gemm,cutlass_tensorop_s1688111gemm_f16_32x64_64x2_tn_align4,passed,success,universal,10240,10240,40960,f16:row,f16:column,f32:column,1,0,1,1,tensorop,f32,32,64,64,2,1,1,1,16,8,8,75,1024,2097152000,8590144307200,388.648,5.02544,22102.6
1,CUTLASS,gemm,cutlass_tensorop_s1688141gemm_f16_32x128_32x2_tn_align4,passed,success,universal,1024,1024,4096,f16:row,f16:column,f32:column,1,0,1,1,tensorop,f32,32,128,32,2,1,4,1,16,8,8,75,1024,20971520,8592031744,0.353867,55.1938,24280.4
1,CUTLASS,gemm,cutlass_tensorop_s1688121gemm_f16_32x128_32x2_tn_align4,passed,success,universal,1024,1024,4096,f16:row,f16:column,f32:column,1,0,1,1,tensorop,f32,32,128,32,2,1,2,1,16,8,8,75,1024,20971520,8592031744,0.430885,45.3282,19940.4
1,CUTLASS,gemm,cutlass_tensorop_s1688111gemm_f16_32x128_32x2_tn_align4,passed,success,universal,1024,1024,4096,f16:row,f16:column,f32:column,1,0,1,1,tensorop,f32,32,128,32,2,1,1,1,16,8,8,75,1024,20971520,8592031744,1.52436,12.8128,5636.49
1,CUTLASS,gemm,cutlass_tensorop_s1688141gemm_f16_32x128_32x2_tn_align4,passed,success,universal,2048,2048,8192,f16:row,f16:column,f32:column,1,0,1,1,tensorop,f32,32,128,32,2,1,4,1,16,8,8,75,1024,83886080,68727865344,2.70245,28.909,25431.7
1,CUTLASS,gemm,cutlass_tensorop_s1688121gemm_f16_32x128_32x2_tn_align4,passed,success,universal,2048,2048,8192,f16:row,f16:column,f32:column,1,0,1,1,tensorop,f32,32,128,32,2,1,2,1,16,8,8,75,1024,83886080,68727865344,2.63948,29.5987,26038.5
1,CUTLASS,gemm,cutlass_tensorop_s1688111gemm_f16_32x128_32x2_tn_align4,passed,success,universal,2048,2048,8192,f16:row,f16:column,f32:column,1,0,1,1,tensorop,f32,32,128,32,2,1,1,1,16,8,8,75,1024,83886080,68727865344,9.67536,8.07464,7103.39
1,CUTLASS,gemm,cutlass_tensorop_s1688141gemm_f16_32x128_32x2_tn_align4,passed,success,universal,3072,3072,12288,f16:row,f16:column,f32:column,1,0,1,1,tensorop,f32,32,128,32,2,1,4,1,16,8,8,75,1024,188743680,231947108352,27.0936,6.48794,8560.97
1,CUTLASS,gemm,cutlass_tensorop_s1688121gemm_f16_32x128_32x2_tn_align4,passed,success,universal,3072,3072,12288,f16:row,f16:column,f32:column,1,0,1,1,tensorop,f32,32,128,32,2,1,2,1,16,8,8,75,1024,188743680,231947108352,27.9725,6.28406,8291.96
1,CUTLASS,gemm,cutlass_tensorop_s1688111gemm_f16_32x128_32x2_tn_align4,passed,success,universal,3072,3072,12288,f16:row,f16:column,f32:column,1,0,1,1,tensorop,f32,32,128,32,2,1,1,1,16,8,8,75,1024,188743680,231947108352,34.4425,5.10361,6734.33
1,CUTLASS,gemm,cutlass_tensorop_s1688141gemm_f16_32x128_32x2_tn_align4,passed,success,universal,4096,4096,16384,f16:row,f16:column,f32:column,1,0,1,1,tensorop,f32,32,128,32,2,1,4,1,16,8,8,75,1024,335544320,549789368320,74.9373,4.17015,7336.66
1,CUTLASS,gemm,cutlass_tensorop_s1688121gemm_f16_32x128_32x2_tn_align4,passed,success,universal,4096,4096,16384,f16:row,f16:column,f32:column,1,0,1,1,tensorop,f32,32,128,32,2,1,2,1,16,8,8,75,1024,335544320,549789368320,72.1175,4.33321,7623.52
1,CUTLASS,gemm,cutlass_tensorop_s1688111gemm_f16_32x128_32x2_tn_align4,passed,success,universal,4096,4096,16384,f16:row,f16:column,f32:column,1,0,1,1,tensorop,f32,32,128,32,2,1,1,1,16,8,8,75,1024,335544320,549789368320,74.2561,4.20841,7403.96
1,CUTLASS,gemm,cutlass_tensorop_s1688141gemm_f16_32x128_32x2_tn_align4,passed,success,universal,5120,5120,20480,f16:row,f16:column,f32:column,1,0,1,1,tensorop,f32,32,128,32,2,1,4,1,16,8,8,75,1024,524288000,1073794252800,164.184,2.97398,6540.18
1,CUTLASS,gemm,cutlass_tensorop_s1688121gemm_f16_32x128_32x2_tn_align4,passed,success,universal,5120,5120,20480,f16:row,f16:column,f32:column,1,0,1,1,tensorop,f32,32,128,32,2,1,2,1,16,8,8,75,1024,524288000,1073794252800,165.269,2.95446,6497.24
1,CUTLASS,gemm,cutlass_tensorop_s1688111gemm_f16_32x128_32x2_tn_align4,passed,success,universal,5120,5120,20480,f16:row,f16:column,f32:column,1,0,1,1,tensorop,f32,32,128,32,2,1,1,1,16,8,8,75,1024,524288000,1073794252800,135.842,3.59447,7904.71
1,CUTLASS,gemm,cutlass_tensorop_s1688141gemm_f16_32x128_32x2_tn_align4,passed,success,universal,6144,6144,24576,f16:row,f16:column,f32:column,1,0,1,1,tensorop,f32,32,128,32,2,1,4,1,16,8,8,75,1024,754974720,1855501369344,297.278,2.36521,6241.65
1,CUTLASS,gemm,cutlass_tensorop_s1688121gemm_f16_32x128_32x2_tn_align4,passed,success,universal,6144,6144,24576,f16:row,f16:column,f32:column,1,0,1,1,tensorop,f32,32,128,32,2,1,2,1,16,8,8,75,1024,754974720,1855501369344,298.35,2.35671,6219.22
1,CUTLASS,gemm,cutlass_tensorop_s1688111gemm_f16_32x128_32x2_tn_align4,passed,success,universal,6144,6144,24576,f16:row,f16:column,f32:column,1,0,1,1,tensorop,f32,32,128,32,2,1,1,1,16,8,8,75,1024,754974720,1855501369344,323.144,2.17589,5742.03
1,CUTLASS,gemm,cutlass_tensorop_s1688141gemm_f16_32x128_32x2_tn_align4,passed,success,universal,7168,7168,28672,f16:row,f16:column,f32:column,1,0,1,1,tensorop,f32,32,128,32,2,1,4,1,16,8,8,75,1024,1027604480,2946450325504,496.459,1.92772,5934.93
1,CUTLASS,gemm,cutlass_tensorop_s1688121gemm_f16_32x128_32x2_tn_align4,passed,success,universal,7168,7168,28672,f16:row,f16:column,f32:column,1,0,1,1,tensorop,f32,32,128,32,2,1,2,1,16,8,8,75,1024,1027604480,2946450325504,487.823,1.96184,6040
1,CUTLASS,gemm,cutlass_tensorop_s1688111gemm_f16_32x128_32x2_tn_align4,passed,success,universal,7168,7168,28672,f16:row,f16:column,f32:column,1,0,1,1,tensorop,f32,32,128,32,2,1,1,1,16,8,8,75,1024,1027604480,2946450325504,398.233,2.40319,7398.8
1,CUTLASS,gemm,cutlass_tensorop_s1688141gemm_f16_32x128_32x2_tn_align4,passed,success,universal,8192,8192,32768,f16:row,f16:column,f32:column,1,0,1,1,tensorop,f32,32,128,32,2,1,4,1,16,8,8,75,1024,1342177280,4398180728832,742.759,1.68291,5921.41
1,CUTLASS,gemm,cutlass_tensorop_s1688121gemm_f16_32x128_32x2_tn_align4,passed,success,universal,8192,8192,32768,f16:row,f16:column,f32:column,1,0,1,1,tensorop,f32,32,128,32,2,1,2,1,16,8,8,75,1024,1342177280,4398180728832,733.784,1.7035,5993.83
1,CUTLASS,gemm,cutlass_tensorop_s1688111gemm_f16_32x128_32x2_tn_align4,passed,success,universal,8192,8192,32768,f16:row,f16:column,f32:column,1,0,1,1,tensorop,f32,32,128,32,2,1,1,1,16,8,8,75,1024,1342177280,4398180728832,868.56,1.43916,5063.76
1,CUTLASS,gemm,cutlass_tensorop_s1688141gemm_f16_32x128_32x2_tn_align4,passed,success,universal,9216,9216,36864,f16:row,f16:column,f32:column,1,0,1,1,tensorop,f32,32,128,32,2,1,4,1,16,8,8,75,1024,1698693120,6262232186880,1087.85,1.45428,5756.55
1,CUTLASS,gemm,cutlass_tensorop_s1688121gemm_f16_32x128_32x2_tn_align4,passed,success,universal,9216,9216,36864,f16:row,f16:column,f32:column,1,0,1,1,tensorop,f32,32,128,32,2,1,2,1,16,8,8,75,1024,1698693120,6262232186880,1086.79,1.45569,5762.11
1,CUTLASS,gemm,cutlass_tensorop_s1688111gemm_f16_32x128_32x2_tn_align4,passed,success,universal,9216,9216,36864,f16:row,f16:column,f32:column,1,0,1,1,tensorop,f32,32,128,32,2,1,1,1,16,8,8,75,1024,1698693120,6262232186880,1267.42,1.24823,4940.92
1,CUTLASS,gemm,cutlass_tensorop_s1688141gemm_f16_32x128_32x2_tn_align4,passed,success,universal,10240,10240,40960,f16:row,f16:column,f32:column,1,0,1,1,tensorop,f32,32,128,32,2,1,4,1,16,8,8,75,1024,2097152000,8590144307200,1497.19,1.30452,5737.5
1,CUTLASS,gemm,cutlass_tensorop_s1688121gemm_f16_32x128_32x2_tn_align4,passed,success,universal,10240,10240,40960,f16:row,f16:column,f32:column,1,0,1,1,tensorop,f32,32,128,32,2,1,2,1,16,8,8,75,1024,2097152000,8590144307200,1501.5,1.30078,5721.03
1,CUTLASS,gemm,cutlass_tensorop_s1688111gemm_f16_32x128_32x2_tn_align4,passed,success,universal,10240,10240,40960,f16:row,f16:column,f32:column,1,0,1,1,tensorop,f32,32,128,32,2,1,1,1,16,8,8,75,1024,2097152000,8590144307200,1797.21,1.08675,4779.7
1,CUTLASS,gemm,cutlass_tensorop_s1688142gemm_f16_32x128_64x2_tn_align4,passed,success,universal,1024,1024,4096,f16:row,f16:column,f32:column,1,0,1,1,tensorop,f32,32,128,64,2,1,4,1,16,8,8,75,1024,20971520,8592031744,0.310224,62.9586,27696.2
1,CUTLASS,gemm,cutlass_tensorop_s1688141gemm_f16_32x128_64x2_tn_align4,passed,success,universal,1024,1024,4096,f16:row,f16:column,f32:column,1,0,1,1,tensorop,f32,32,128,64,2,1,4,1,16,8,8,75,1024,20971520,8592031744,0.310199,62.9635,27698.4
1,CUTLASS,gemm,cutlass_tensorop_s1688122gemm_f16_32x128_64x2_tn_align4,passed,success,universal,1024,1024,4096,f16:row,f16:column,f32:column,1,0,1,1,tensorop,f32,32,128,64,2,1,2,1,16,8,8,75,1024,20971520,8592031744,0.485832,40.2017,17685.2
1,CUTLASS,gemm,cutlass_tensorop_s1688121gemm_f16_32x128_64x2_tn_align4,passed,success,universal,1024,1024,4096,f16:row,f16:column,f32:column,1,0,1,1,tensorop,f32,32,128,64,2,1,2,1,16,8,8,75,1024,20971520,8592031744,0.485859,40.1994,17684.2
1,CUTLASS,gemm,cutlass_tensorop_s1688112gemm_f16_32x128_64x2_tn_align4,passed,success,universal,1024,1024,4096,f16:row,f16:column,f32:column,1,0,1,1,tensorop,f32,32,128,64,2,1,1,1,16,8,8,75,1024,20971520,8592031744,3.01629,6.47526,2848.54
1,CUTLASS,gemm,cutlass_tensorop_s1688111gemm_f16_32x128_64x2_tn_align4,passed,success,universal,1024,1024,4096,f16:row,f16:column,f32:column,1,0,1,1,tensorop,f32,32,128,64,2,1,1,1,16,8,8,75,1024,20971520,8592031744,3.01407,6.48003,2850.64
1,CUTLASS,gemm,cutlass_tensorop_s1688142gemm_f16_32x128_64x2_tn_align4,passed,success,universal,2048,2048,8192,f16:row,f16:column,f32:column,1,0,1,1,tensorop,f32,32,128,64,2,1,4,1,16,8,8,75,1024,83886080,68727865344,2.44201,31.9921,28144
1,CUTLASS,gemm,cutlass_tensorop_s1688141gemm_f16_32x128_64x2_tn_align4,passed,success,universal,2048,2048,8192,f16:row,f16:column,f32:column,1,0,1,1,tensorop,f32,32,128,64,2,1,4,1,16,8,8,75,1024,83886080,68727865344,2.44075,32.0087,28158.6
1,CUTLASS,gemm,cutlass_tensorop_s1688122gemm_f16_32x128_64x2_tn_align4,passed,success,universal,2048,2048,8192,f16:row,f16:column,f32:column,1,0,1,1,tensorop,f32,32,128,64,2,1,2,1,16,8,8,75,1024,83886080,68727865344,3.78082,20.6635,18178
1,CUTLASS,gemm,cutlass_tensorop_s1688121gemm_f16_32x128_64x2_tn_align4,passed,success,universal,2048,2048,8192,f16:row,f16:column,f32:column,1,0,1,1,tensorop,f32,32,128,64,2,1,2,1,16,8,8,75,1024,83886080,68727865344,3.78009,20.6675,18181.5
1,CUTLASS,gemm,cutlass_tensorop_s1688112gemm_f16_32x128_64x2_tn_align4,passed,success,universal,2048,2048,8192,f16:row,f16:column,f32:column,1,0,1,1,tensorop,f32,32,128,64,2,1,1,1,16,8,8,75,1024,83886080,68727865344,24.0156,3.25309,2861.8
1,CUTLASS,gemm,cutlass_tensorop_s1688111gemm_f16_32x128_64x2_tn_align4,passed,success,universal,2048,2048,8192,f16:row,f16:column,f32:column,1,0,1,1,tensorop,f32,32,128,64,2,1,1,1,16,8,8,75,1024,83886080,68727865344,24.0955,3.2423,2852.31
1,CUTLASS,gemm,cutlass_tensorop_s1688142gemm_f16_32x128_64x2_tn_align4,passed,success,universal,3072,3072,12288,f16:row,f16:column,f32:column,1,0,1,1,tensorop,f32,32,128,64,2,1,4,1,16,8,8,75,1024,188743680,231947108352,7.73466,22.7264,29988
1,CUTLASS,gemm,cutlass_tensorop_s1688141gemm_f16_32x128_64x2_tn_align4,passed,success,universal,3072,3072,12288,f16:row,f16:column,f32:column,1,0,1,1,tensorop,f32,32,128,64,2,1,4,1,16,8,8,75,1024,188743680,231947108352,7.72821,22.7454,30013
1,CUTLASS,gemm,cutlass_tensorop_s1688122gemm_f16_32x128_64x2_tn_align4,passed,success,universal,3072,3072,12288,f16:row,f16:column,f32:column,1,0,1,1,tensorop,f32,32,128,64,2,1,2,1,16,8,8,75,1024,188743680,231947108352,12.1443,14.4744,19099.3
1,CUTLASS,gemm,cutlass_tensorop_s1688121gemm_f16_32x128_64x2_tn_align4,passed,success,universal,3072,3072,12288,f16:row,f16:column,f32:column,1,0,1,1,tensorop,f32,32,128,64,2,1,2,1,16,8,8,75,1024,188743680,231947108352,12.1472,14.4709,19094.7
1,CUTLASS,gemm,cutlass_tensorop_s1688112gemm_f16_32x128_64x2_tn_align4,passed,success,universal,3072,3072,12288,f16:row,f16:column,f32:column,1,0,1,1,tensorop,f32,32,128,64,2,1,1,1,16,8,8,75,1024,188743680,231947108352,78.5278,2.23846,2953.69
1,CUTLASS,gemm,cutlass_tensorop_s1688111gemm_f16_32x128_64x2_tn_align4,passed,success,universal,3072,3072,12288,f16:row,f16:column,f32:column,1,0,1,1,tensorop,f32,32,128,64,2,1,1,1,16,8,8,75,1024,188743680,231947108352,78.6066,2.23621,2950.73
1,CUTLASS,gemm,cutlass_tensorop_s1688142gemm_f16_32x128_64x2_tn_align4,passed,success,universal,4096,4096,16384,f16:row,f16:column,f32:column,1,0,1,1,tensorop,f32,32,128,64,2,1,4,1,16,8,8,75,1024,335544320,549789368320,18.7361,16.679,29343.8
1,CUTLASS,gemm,cutlass_tensorop_s1688141gemm_f16_32x128_64x2_tn_align4,passed,success,universal,4096,4096,16384,f16:row,f16:column,f32:column,1,0,1,1,tensorop,f32,32,128,64,2,1,4,1,16,8,8,75,1024,335544320,549789368320,18.7378,16.6775,29341.2
1,CUTLASS,gemm,cutlass_tensorop_s1688122gemm_f16_32x128_64x2_tn_align4,passed,success,universal,4096,4096,16384,f16:row,f16:column,f32:column,1,0,1,1,tensorop,f32,32,128,64,2,1,2,1,16,8,8,75,1024,335544320,549789368320,28.9581,10.7915,18985.7
1,CUTLASS,gemm,cutlass_tensorop_s1688121gemm_f16_32x128_64x2_tn_align4,passed,success,universal,4096,4096,16384,f16:row,f16:column,f32:column,1,0,1,1,tensorop,f32,32,128,64,2,1,2,1,16,8,8,75,1024,335544320,549789368320,28.9555,10.7924,18987.4
1,CUTLASS,gemm,cutlass_tensorop_s1688112gemm_f16_32x128_64x2_tn_align4,passed,success,universal,4096,4096,16384,f16:row,f16:column,f32:column,1,0,1,1,tensorop,f32,32,128,64,2,1,1,1,16,8,8,75,1024,335544320,549789368320,187.045,1.67072,2939.34
1,CUTLASS,gemm,cutlass_tensorop_s1688111gemm_f16_32x128_64x2_tn_align4,passed,success,universal,4096,4096,16384,f16:row,f16:column,f32:column,1,0,1,1,tensorop,f32,32,128,64,2,1,1,1,16,8,8,75,1024,335544320,549789368320,187.06,1.67059,2939.1
1,CUTLASS,gemm,cutlass_tensorop_s1688142gemm_f16_32x128_64x2_tn_align4,passed,success,universal,5120,5120,20480,f16:row,f16:column,f32:column,1,0,1,1,tensorop,f32,32,128,64,2,1,4,1,16,8,8,75,1024,524288000,1073794252800,86.2849,5.65894,12444.8
1,CUTLASS,gemm,cutlass_tensorop_s1688141gemm_f16_32x128_64x2_tn_align4,passed,success,universal,5120,5120,20480,f16:row,f16:column,f32:column,1,0,1,1,tensorop,f32,32,128,64,2,1,4,1,16,8,8,75,1024,524288000,1073794252800,88.9134,5.49165,12076.9
1,CUTLASS,gemm,cutlass_tensorop_s1688122gemm_f16_32x128_64x2_tn_align4,passed,success,universal,5120,5120,20480,f16:row,f16:column,f32:column,1,0,1,1,tensorop,f32,32,128,64,2,1,2,1,16,8,8,75,1024,524288000,1073794252800,56.2748,8.67673,19081.3
1,CUTLASS,gemm,cutlass_tensorop_s1688121gemm_f16_32x128_64x2_tn_align4,passed,success,universal,5120,5120,20480,f16:row,f16:column,f32:column,1,0,1,1,tensorop,f32,32,128,64,2,1,2,1,16,8,8,75,1024,524288000,1073794252800,56.2757,8.67659,19081
1,CUTLASS,gemm,cutlass_tensorop_s1688112gemm_f16_32x128_64x2_tn_align4,passed,success,universal,5120,5120,20480,f16:row,f16:column,f32:column,1,0,1,1,tensorop,f32,32,128,64,2,1,1,1,16,8,8,75,1024,524288000,1073794252800,362.686,1.34629,2960.68
1,CUTLASS,gemm,cutlass_tensorop_s1688111gemm_f16_32x128_64x2_tn_align4,passed,success,universal,5120,5120,20480,f16:row,f16:column,f32:column,1,0,1,1,tensorop,f32,32,128,64,2,1,1,1,16,8,8,75,1024,524288000,1073794252800,361.918,1.34915,2966.96
1,CUTLASS,gemm,cutlass_tensorop_s1688142gemm_f16_32x128_64x2_tn_align4,passed,success,universal,6144,6144,24576,f16:row,f16:column,f32:column,1,0,1,1,tensorop,f32,32,128,64,2,1,4,1,16,8,8,75,1024,754974720,1855501369344,73.3981,9.57961,25280
1,CUTLASS,gemm,cutlass_tensorop_s1688141gemm_f16_32x128_64x2_tn_align4,passed,success,universal,6144,6144,24576,f16:row,f16:column,f32:column,1,0,1,1,tensorop,f32,32,128,64,2,1,4,1,16,8,8,75,1024,754974720,1855501369344,74.0364,9.49701,25062
1,CUTLASS,gemm,cutlass_tensorop_s1688122gemm_f16_32x128_64x2_tn_align4,passed,success,universal,6144,6144,24576,f16:row,f16:column,f32:column,1,0,1,1,tensorop,f32,32,128,64,2,1,2,1,16,8,8,75,1024,754974720,1855501369344,96.4884,7.28714,19230.3
1,CUTLASS,gemm,cutlass_tensorop_s1688121gemm_f16_32x128_64x2_tn_align4,passed,success,universal,6144,6144,24576,f16:row,f16:column,f32:column,1,0,1,1,tensorop,f32,32,128,64,2,1,2,1,16,8,8,75,1024,754974720,1855501369344,96.5991,7.2788,19208.3
1,CUTLASS,gemm,cutlass_tensorop_s1688112gemm_f16_32x128_64x2_tn_align4,passed,success,universal,6144,6144,24576,f16:row,f16:column,f32:column,1,0,1,1,tensorop,f32,32,128,64,2,1,1,1,16,8,8,75,1024,754974720,1855501369344,623.576,1.12757,2975.58
1,CUTLASS,gemm,cutlass_tensorop_s1688111gemm_f16_32x128_64x2_tn_align4,passed,success,universal,6144,6144,24576,f16:row,f16:column,f32:column,1,0,1,1,tensorop,f32,32,128,64,2,1,1,1,16,8,8,75,1024,754974720,1855501369344,622.953,1.1287,2978.56
1,CUTLASS,gemm,cutlass_tensorop_s1688142gemm_f16_32x128_64x2_tn_align4,passed,success,universal,7168,7168,28672,f16:row,f16:column,f32:column,1,0,1,1,tensorop,f32,32,128,64,2,1,4,1,16,8,8,75,1024,1027604480,2946450325504,163.039,5.86994,18072
1,CUTLASS,gemm,cutlass_tensorop_s1688141gemm_f16_32x128_64x2_tn_align4,passed,success,universal,7168,7168,28672,f16:row,f16:column,f32:column,1,0,1,1,tensorop,f32,32,128,64,2,1,4,1,16,8,8,75,1024,1027604480,2946450325504,135.377,7.0694,21764.8
1,CUTLASS,gemm,cutlass_tensorop_s1688122gemm_f16_32x128_64x2_tn_align4,passed,success,universal,7168,7168,28672,f16:row,f16:column,f32:column,1,0,1,1,tensorop,f32,32,128,64,2,1,2,1,16,8,8,75,1024,1027604480,2946450325504,153.085,6.25164,19247.2
1,CUTLASS,gemm,cutlass_tensorop_s1688121gemm_f16_32x128_64x2_tn_align4,passed,success,universal,7168,7168,28672,f16:row,f16:column,f32:column,1,0,1,1,tensorop,f32,32,128,64,2,1,2,1,16,8,8,75,1024,1027604480,2946450325504,153.115,6.25042,19243.4
1,CUTLASS,gemm,cutlass_tensorop_s1688112gemm_f16_32x128_64x2_tn_align4,passed,success,universal,7168,7168,28672,f16:row,f16:column,f32:column,1,0,1,1,tensorop,f32,32,128,64,2,1,1,1,16,8,8,75,1024,1027604480,2946450325504,986.046,0.970574,2988.15
1,CUTLASS,gemm,cutlass_tensorop_s1688111gemm_f16_32x128_64x2_tn_align4,passed,success,universal,7168,7168,28672,f16:row,f16:column,f32:column,1,0,1,1,tensorop,f32,32,128,64,2,1,1,1,16,8,8,75,1024,1027604480,2946450325504,985.458,0.971153,2989.93
1,CUTLASS,gemm,cutlass_tensorop_s1688142gemm_f16_32x128_64x2_tn_align4,passed,success,universal,8192,8192,32768,f16:row,f16:column,f32:column,1,0,1,1,tensorop,f32,32,128,64,2,1,4,1,16,8,8,75,1024,1342177280,4398180728832,275.074,4.54424,15989.1
1,CUTLASS,gemm,cutlass_tensorop_s1688141gemm_f16_32x128_64x2_tn_align4,passed,success,universal,8192,8192,32768,f16:row,f16:column,f32:column,1,0,1,1,tensorop,f32,32,128,64,2,1,4,1,16,8,8,75,1024,1342177280,4398180728832,176.152,7.09615,24968.1
1,CUTLASS,gemm,cutlass_tensorop_s1688122gemm_f16_32x128_64x2_tn_align4,passed,success,universal,8192,8192,32768,f16:row,f16:column,f32:column,1,0,1,1,tensorop,f32,32,128,64,2,1,2,1,16,8,8,75,1024,1342177280,4398180728832,229.473,5.44727,19166.5
1,CUTLASS,gemm,cutlass_tensorop_s1688121gemm_f16_32x128_64x2_tn_align4,passed,success,universal,8192,8192,32768,f16:row,f16:column,f32:column,1,0,1,1,tensorop,f32,32,128,64,2,1,2,1,16,8,8,75,1024,1342177280,4398180728832,229.619,5.44379,19154.2
1,CUTLASS,gemm,cutlass_tensorop_s1688112gemm_f16_32x128_64x2_tn_align4,passed,success,universal,8192,8192,32768,f16:row,f16:column,f32:column,1,0,1,1,tensorop,f32,32,128,64,2,1,1,1,16,8,8,75,1024,1342177280,4398180728832,1479.41,0.844932,2972.93
1,CUTLASS,gemm,cutlass_tensorop_s1688111gemm_f16_32x128_64x2_tn_align4,passed,success,universal,8192,8192,32768,f16:row,f16:column,f32:column,1,0,1,1,tensorop,f32,32,128,64,2,1,1,1,16,8,8,75,1024,1342177280,4398180728832,1486.53,0.840882,2958.68
1,CUTLASS,gemm,cutlass_tensorop_s1688142gemm_f16_32x128_64x2_tn_align4,passed,success,universal,9216,9216,36864,f16:row,f16:column,f32:column,1,0,1,1,tensorop,f32,32,128,64,2,1,4,1,16,8,8,75,1024,1698693120,6262232186880,276.126,5.72938,22678.9
1,CUTLASS,gemm,cutlass_tensorop_s1688141gemm_f16_32x128_64x2_tn_align4,passed,success,universal,9216,9216,36864,f16:row,f16:column,f32:column,1,0,1,1,tensorop,f32,32,128,64,2,1,4,1,16,8,8,75,1024,1698693120,6262232186880,228.854,6.91284,27363.4
1,CUTLASS,gemm,cutlass_tensorop_s1688122gemm_f16_32x128_64x2_tn_align4,passed,success,universal,9216,9216,36864,f16:row,f16:column,f32:column,1,0,1,1,tensorop,f32,32,128,64,2,1,2,1,16,8,8,75,1024,1698693120,6262232186880,325.681,4.85761,19228.1
1,CUTLASS,gemm,cutlass_tensorop_s1688121gemm_f16_32x128_64x2_tn_align4,passed,success,universal,9216,9216,36864,f16:row,f16:column,f32:column,1,0,1,1,tensorop,f32,32,128,64,2,1,2,1,16,8,8,75,1024,1698693120,6262232186880,326.286,4.84861,19192.5
1,CUTLASS,gemm,cutlass_tensorop_s1688112gemm_f16_32x128_64x2_tn_align4,passed,success,universal,9216,9216,36864,f16:row,f16:column,f32:column,1,0,1,1,tensorop,f32,32,128,64,2,1,1,1,16,8,8,75,1024,1698693120,6262232186880,2101.71,0.752737,2979.59
1,CUTLASS,gemm,cutlass_tensorop_s1688111gemm_f16_32x128_64x2_tn_align4,passed,success,universal,9216,9216,36864,f16:row,f16:column,f32:column,1,0,1,1,tensorop,f32,32,128,64,2,1,1,1,16,8,8,75,1024,1698693120,6262232186880,2106,0.751202,2973.52
1,CUTLASS,gemm,cutlass_tensorop_s1688142gemm_f16_32x128_64x2_tn_align4,passed,success,universal,10240,10240,40960,f16:row,f16:column,f32:column,1,0,1,1,tensorop,f32,32,128,64,2,1,4,1,16,8,8,75,1024,2097152000,8590144307200,812.501,2.40384,10572.5
1,CUTLASS,gemm,cutlass_tensorop_s1688141gemm_f16_32x128_64x2_tn_align4,passed,success,universal,10240,10240,40960,f16:row,f16:column,f32:column,1,0,1,1,tensorop,f32,32,128,64,2,1,4,1,16,8,8,75,1024,2097152000,8590144307200,809.119,2.41389,10616.7
1,CUTLASS,gemm,cutlass_tensorop_s1688122gemm_f16_32x128_64x2_tn_align4,passed,success,universal,10240,10240,40960,f16:row,f16:column,f32:column,1,0,1,1,tensorop,f32,32,128,64,2,1,2,1,16,8,8,75,1024,2097152000,8590144307200,447.267,4.3668,19205.9
1,CUTLASS,gemm,cutlass_tensorop_s1688121gemm_f16_32x128_64x2_tn_align4,passed,success,universal,10240,10240,40960,f16:row,f16:column,f32:column,1,0,1,1,tensorop,f32,32,128,64,2,1,2,1,16,8,8,75,1024,2097152000,8590144307200,447.246,4.36701,19206.8
1,CUTLASS,gemm,cutlass_tensorop_s1688112gemm_f16_32x128_64x2_tn_align4,passed,success,universal,10240,10240,40960,f16:row,f16:column,f32:column,1,0,1,1,tensorop,f32,32,128,64,2,1,1,1,16,8,8,75,1024,2097152000,8590144307200,2874.31,0.679511,2988.59
1,CUTLASS,gemm,cutlass_tensorop_s1688111gemm_f16_32x128_64x2_tn_align4,passed,success,universal,10240,10240,40960,f16:row,f16:column,f32:column,1,0,1,1,tensorop,f32,32,128,64,2,1,1,1,16,8,8,75,1024,2097152000,8590144307200,2873.99,0.679586,2988.92
1,CUTLASS,gemm,cutlass_tensorop_s1688211gemm_f16_64x32_32x2_tn_align4,passed,success,universal,1024,1024,4096,f16:row,f16:column,f32:column,1,0,1,1,tensorop,f32,64,32,32,2,2,1,1,16,8,8,75,1024,20971520,8592031744,0.521643,37.4418,16471.1
1,CUTLASS,gemm,cutlass_tensorop_s1688111gemm_f16_64x32_32x2_tn_align4,passed,success,universal,1024,1024,4096,f16:row,f16:column,f32:column,1,0,1,1,tensorop,f32,64,32,32,2,1,1,1,16,8,8,75,1024,20971520,8592031744,0.470036,41.5526,18279.5
1,CUTLASS,gemm,cutlass_tensorop_s1688211gemm_f16_64x32_32x2_tn_align4,passed,success,universal,2048,2048,8192,f16:row,f16:column,f32:column,1,0,1,1,tensorop,f32,64,32,32,2,2,1,1,16,8,8,75,1024,83886080,68727865344,3.34693,23.3423,20534.6
1,CUTLASS,gemm,cutlass_tensorop_s1688111gemm_f16_64x32_32x2_tn_align4,passed,success,universal,2048,2048,8192,f16:row,f16:column,f32:column,1,0,1,1,tensorop,f32,64,32,32,2,1,1,1,16,8,8,75,1024,83886080,68727865344,2.9533,26.4535,23271.6
1,CUTLASS,gemm,cutlass_tensorop_s1688211gemm_f16_64x32_32x2_tn_align4,passed,success,universal,3072,3072,12288,f16:row,f16:column,f32:column,1,0,1,1,tensorop,f32,64,32,32,2,2,1,1,16,8,8,75,1024,188743680,231947108352,26.6056,6.60694,8717.99
1,CUTLASS,gemm,cutlass_tensorop_s1688111gemm_f16_64x32_32x2_tn_align4,passed,success,universal,3072,3072,12288,f16:row,f16:column,f32:column,1,0,1,1,tensorop,f32,64,32,32,2,1,1,1,16,8,8,75,1024,188743680,231947108352,22.435,7.83514,10338.6
1,CUTLASS,gemm,cutlass_tensorop_s1688211gemm_f16_64x32_32x2_tn_align4,passed,success,universal,4096,4096,16384,f16:row,f16:column,f32:column,1,0,1,1,tensorop,f32,64,32,32,2,2,1,1,16,8,8,75,1024,335544320,549789368320,70.5648,4.42855,7791.27
1,CUTLASS,gemm,cutlass_tensorop_s1688111gemm_f16_64x32_32x2_tn_align4,passed,success,universal,4096,4096,16384,f16:row,f16:column,f32:column,1,0,1,1,tensorop,f32,64,32,32,2,1,1,1,16,8,8,75,1024,335544320,549789368320,66.7891,4.67891,8231.72
1,CUTLASS,gemm,cutlass_tensorop_s1688211gemm_f16_64x32_32x2_tn_align4,passed,success,universal,5120,5120,20480,f16:row,f16:column,f32:column,1,0,1,1,tensorop,f32,64,32,32,2,2,1,1,16,8,8,75,1024,524288000,1073794252800,165.288,2.95412,6496.49
1,CUTLASS,gemm,cutlass_tensorop_s1688111gemm_f16_64x32_32x2_tn_align4,passed,success,universal,5120,5120,20480,f16:row,f16:column,f32:column,1,0,1,1,tensorop,f32,64,32,32,2,1,1,1,16,8,8,75,1024,524288000,1073794252800,150.216,3.25054,7148.36
1,CUTLASS,gemm,cutlass_tensorop_s1688211gemm_f16_64x32_32x2_tn_align4,passed,success,universal,6144,6144,24576,f16:row,f16:column,f32:column,1,0,1,1,tensorop,f32,64,32,32,2,2,1,1,16,8,8,75,1024,754974720,1855501369344,300.026,2.34355,6184.47
1,CUTLASS,gemm,cutlass_tensorop_s1688111gemm_f16_64x32_32x2_tn_align4,passed,success,universal,6144,6144,24576,f16:row,f16:column,f32:column,1,0,1,1,tensorop,f32,64,32,32,2,1,1,1,16,8,8,75,1024,754974720,1855501369344,276.01,2.54746,6722.59
1,CUTLASS,gemm,cutlass_tensorop_s1688211gemm_f16_64x32_32x2_tn_align4,passed,success,universal,7168,7168,28672,f16:row,f16:column,f32:column,1,0,1,1,tensorop,f32,64,32,32,2,2,1,1,16,8,8,75,1024,1027604480,2946450325504,497.015,1.92556,5928.29
1,CUTLASS,gemm,cutlass_tensorop_s1688111gemm_f16_64x32_32x2_tn_align4,passed,success,universal,7168,7168,28672,f16:row,f16:column,f32:column,1,0,1,1,tensorop,f32,64,32,32,2,1,1,1,16,8,8,75,1024,1027604480,2946450325504,477.581,2.00391,6169.53
1,CUTLASS,gemm,cutlass_tensorop_s1688211gemm_f16_64x32_32x2_tn_align4,passed,success,universal,8192,8192,32768,f16:row,f16:column,f32:column,1,0,1,1,tensorop,f32,64,32,32,2,2,1,1,16,8,8,75,1024,1342177280,4398180728832,737.573,1.69475,5963.05
1,CUTLASS,gemm,cutlass_tensorop_s1688111gemm_f16_64x32_32x2_tn_align4,passed,success,universal,8192,8192,32768,f16:row,f16:column,f32:column,1,0,1,1,tensorop,f32,64,32,32,2,1,1,1,16,8,8,75,1024,1342177280,4398180728832,717.218,1.74285,6132.28
1,CUTLASS,gemm,cutlass_tensorop_s1688211gemm_f16_64x32_32x2_tn_align4,passed,success,universal,9216,9216,36864,f16:row,f16:column,f32:column,1,0,1,1,tensorop,f32,64,32,32,2,2,1,1,16,8,8,75,1024,1698693120,6262232186880,1133.08,1.39622,5526.74
1,CUTLASS,gemm,cutlass_tensorop_s1688111gemm_f16_64x32_32x2_tn_align4,passed,success,universal,9216,9216,36864,f16:row,f16:column,f32:column,1,0,1,1,tensorop,f32,64,32,32,2,1,1,1,16,8,8,75,1024,1698693120,6262232186880,1070.28,1.47815,5851.04
1,CUTLASS,gemm,cutlass_tensorop_s1688211gemm_f16_64x32_32x2_tn_align4,passed,success,universal,10240,10240,40960,f16:row,f16:column,f32:column,1,0,1,1,tensorop,f32,64,32,32,2,2,1,1,16,8,8,75,1024,2097152000,8590144307200,1619.57,1.20595,5303.96
1,CUTLASS,gemm,cutlass_tensorop_s1688111gemm_f16_64x32_32x2_tn_align4,passed,success,universal,10240,10240,40960,f16:row,f16:column,f32:column,1,0,1,1,tensorop,f32,64,32,32,2,1,1,1,16,8,8,75,1024,2097152000,8590144307200,1526.75,1.27927,5626.43
1,CUTLASS,gemm,cutlass_tensorop_s1688212gemm_f16_64x32_64x2_tn_align4,passed,success,universal,1024,1024,4096,f16:row,f16:column,f32:column,1,0,1,1,tensorop,f32,64,32,64,2,2,1,1,16,8,8,75,1024,20971520,8592031744,0.362664,53.855,23691.5
1,CUTLASS,gemm,cutlass_tensorop_s1688211gemm_f16_64x32_64x2_tn_align4,passed,success,universal,1024,1024,4096,f16:row,f16:column,f32:column,1,0,1,1,tensorop,f32,64,32,64,2,2,1,1,16,8,8,75,1024,20971520,8592031744,0.330536,59.0896,25994.2
1,CUTLASS,gemm,cutlass_tensorop_s1688112gemm_f16_64x32_64x2_tn_align4,passed,success,universal,1024,1024,4096,f16:row,f16:column,f32:column,1,0,1,1,tensorop,f32,64,32,64,2,1,1,1,16,8,8,75,1024,20971520,8592031744,0.444225,43.967,19341.6
1,CUTLASS,gemm,cutlass_tensorop_s1688111gemm_f16_64x32_64x2_tn_align4,passed,success,universal,1024,1024,4096,f16:row,f16:column,f32:column,1,0,1,1,tensorop,f32,64,32,64,2,1,1,1,16,8,8,75,1024,20971520,8592031744,0.444152,43.9743,19344.8
1,CUTLASS,gemm,cutlass_tensorop_s1688212gemm_f16_64x32_64x2_tn_align4,passed,success,universal,2048,2048,8192,f16:row,f16:column,f32:column,1,0,1,1,tensorop,f32,64,32,64,2,2,1,1,16,8,8,75,1024,83886080,68727865344,2.46521,31.691,27879.1
1,CUTLASS,gemm,cutlass_tensorop_s1688211gemm_f16_64x32_64x2_tn_align4,passed,success,universal,2048,2048,8192,f16:row,f16:column,f32:column,1,0,1,1,tensorop,f32,64,32,64,2,2,1,1,16,8,8,75,1024,83886080,68727865344,2.45111,31.8733,28039.5
1,CUTLASS,gemm,cutlass_tensorop_s1688112gemm_f16_64x32_64x2_tn_align4,passed,success,universal,2048,2048,8192,f16:row,f16:column,f32:column,1,0,1,1,tensorop,f32,64,32,64,2,1,1,1,16,8,8,75,1024,83886080,68727865344,3.43661,22.7332,19998.8
1,CUTLASS,gemm,cutlass_tensorop_s1688111gemm_f16_64x32_64x2_tn_align4,passed,success,universal,2048,2048,8192,f16:row,f16:column,f32:column,1,0,1,1,tensorop,f32,64,32,64,2,1,1,1,16,8,8,75,1024,83886080,68727865344,3.43655,22.7336,19999.1
1,CUTLASS,gemm,cutlass_tensorop_s1688212gemm_f16_64x32_64x2_tn_align4,passed,success,universal,3072,3072,12288,f16:row,f16:column,f32:column,1,0,1,1,tensorop,f32,64,32,64,2,2,1,1,16,8,8,75,1024,188743680,231947108352,8.58091,20.4851,27030.6
1,CUTLASS,gemm,cutlass_tensorop_s1688211gemm_f16_64x32_64x2_tn_align4,passed,success,universal,3072,3072,12288,f16:row,f16:column,f32:column,1,0,1,1,tensorop,f32,64,32,64,2,2,1,1,16,8,8,75,1024,188743680,231947108352,8.41447,20.8903,27565.3
1,CUTLASS,gemm,cutlass_tensorop_s1688112gemm_f16_64x32_64x2_tn_align4,passed,success,universal,3072,3072,12288,f16:row,f16:column,f32:column,1,0,1,1,tensorop,f32,64,32,64,2,1,1,1,16,8,8,75,1024,188743680,231947108352,10.9516,16.0507,21179.2
1,CUTLASS,gemm,cutlass_tensorop_s1688111gemm_f16_64x32_64x2_tn_align4,passed,success,universal,3072,3072,12288,f16:row,f16:column,f32:column,1,0,1,1,tensorop,f32,64,32,64,2,1,1,1,16,8,8,75,1024,188743680,231947108352,10.9538,16.0475,21175
1,CUTLASS,gemm,cutlass_tensorop_s1688212gemm_f16_64x32_64x2_tn_align4,passed,success,universal,4096,4096,16384,f16:row,f16:column,f32:column,1,0,1,1,tensorop,f32,64,32,64,2,2,1,1,16,8,8,75,1024,335544320,549789368320,21.5676,14.4893,25491.4
1,CUTLASS,gemm,cutlass_tensorop_s1688211gemm_f16_64x32_64x2_tn_align4,passed,success,universal,4096,4096,16384,f16:row,f16:column,f32:column,1,0,1,1,tensorop,f32,64,32,64,2,2,1,1,16,8,8,75,1024,335544320,549789368320,20.812,15.0154,26416.9
1,CUTLASS,gemm,cutlass_tensorop_s1688112gemm_f16_64x32_64x2_tn_align4,passed,success,universal,4096,4096,16384,f16:row,f16:column,f32:column,1,0,1,1,tensorop,f32,64,32,64,2,1,1,1,16,8,8,75,1024,335544320,549789368320,26.0488,11.9967,21106.1
1,CUTLASS,gemm,cutlass_tensorop_s1688111gemm_f16_64x32_64x2_tn_align4,passed,success,universal,4096,4096,16384,f16:row,f16:column,f32:column,1,0,1,1,tensorop,f32,64,32,64,2,1,1,1,16,8,8,75,1024,335544320,549789368320,26.0801,11.9823,21080.8
1,CUTLASS,gemm,cutlass_tensorop_s1688212gemm_f16_64x32_64x2_tn_align4,passed,success,universal,5120,5120,20480,f16:row,f16:column,f32:column,1,0,1,1,tensorop,f32,64,32,64,2,2,1,1,16,8,8,75,1024,524288000,1073794252800,48.9293,9.97933,21945.8
1,CUTLASS,gemm,cutlass_tensorop_s1688211gemm_f16_64x32_64x2_tn_align4,passed,success,universal,5120,5120,20480,f16:row,f16:column,f32:column,1,0,1,1,tensorop,f32,64,32,64,2,2,1,1,16,8,8,75,1024,524288000,1073794252800,49.2208,9.92023,21815.9
1,CUTLASS,gemm,cutlass_tensorop_s1688112gemm_f16_64x32_64x2_tn_align4,passed,success,universal,5120,5120,20480,f16:row,f16:column,f32:column,1,0,1,1,tensorop,f32,64,32,64,2,1,1,1,16,8,8,75,1024,524288000,1073794252800,50.7947,9.61284,21139.9
1,CUTLASS,gemm,cutlass_tensorop_s1688111gemm_f16_64x32_64x2_tn_align4,passed,success,universal,5120,5120,20480,f16:row,f16:column,f32:column,1,0,1,1,tensorop,f32,64,32,64,2,1,1,1,16,8,8,75,1024,524288000,1073794252800,50.77,9.61751,21150.2
1,CUTLASS,gemm,cutlass_tensorop_s1688212gemm_f16_64x32_64x2_tn_align4,passed,success,universal,6144,6144,24576,f16:row,f16:column,f32:column,1,0,1,1,tensorop,f32,64,32,64,2,2,1,1,16,8,8,75,1024,754974720,1855501369344,90.009,7.81172,20614.6
1,CUTLASS,gemm,cutlass_tensorop_s1688211gemm_f16_64x32_64x2_tn_align4,passed,success,universal,6144,6144,24576,f16:row,f16:column,f32:column,1,0,1,1,tensorop,f32,64,32,64,2,2,1,1,16,8,8,75,1024,754974720,1855501369344,88.8153,7.91671,20891.7
1,CUTLASS,gemm,cutlass_tensorop_s1688112gemm_f16_64x32_64x2_tn_align4,passed,success,universal,6144,6144,24576,f16:row,f16:column,f32:column,1,0,1,1,tensorop,f32,64,32,64,2,1,1,1,16,8,8,75,1024,754974720,1855501369344,88.7284,7.92446,20912.1
1,CUTLASS,gemm,cutlass_tensorop_s1688111gemm_f16_64x32_64x2_tn_align4,passed,success,universal,6144,6144,24576,f16:row,f16:column,f32:column,1,0,1,1,tensorop,f32,64,32,64,2,1,1,1,16,8,8,75,1024,754974720,1855501369344,89.0636,7.89464,20833.4
1,CUTLASS,gemm,cutlass_tensorop_s1688212gemm_f16_64x32_64x2_tn_align4,passed,success,universal,7168,7168,28672,f16:row,f16:column,f32:column,1,0,1,1,tensorop,f32,64,32,64,2,2,1,1,16,8,8,75,1024,1027604480,2946450325504,174.235,5.49277,16910.8
1,CUTLASS,gemm,cutlass_tensorop_s1688211gemm_f16_64x32_64x2_tn_align4,passed,success,universal,7168,7168,28672,f16:row,f16:column,f32:column,1,0,1,1,tensorop,f32,64,32,64,2,2,1,1,16,8,8,75,1024,1027604480,2946450325504,171.439,5.58236,17186.6
1,CUTLASS,gemm,cutlass_tensorop_s1688112gemm_f16_64x32_64x2_tn_align4,passed,success,universal,7168,7168,28672,f16:row,f16:column,f32:column,1,0,1,1,tensorop,f32,64,32,64,2,1,1,1,16,8,8,75,1024,1027604480,2946450325504,144.423,6.62659,20401.6
1,CUTLASS,gemm,cutlass_tensorop_s1688111gemm_f16_64x32_64x2_tn_align4,passed,success,universal,7168,7168,28672,f16:row,f16:column,f32:column,1,0,1,1,tensorop,f32,64,32,64,2,1,1,1,16,8,8,75,1024,1027604480,2946450325504,143.494,6.66947,20533.6
1,CUTLASS,gemm,cutlass_tensorop_s1688212gemm_f16_64x32_64x2_tn_align4,passed,success,universal,8192,8192,32768,f16:row,f16:column,f32:column,1,0,1,1,tensorop,f32,64,32,64,2,2,1,1,16,8,8,75,1024,1342177280,4398180728832,272.129,4.59341,16162.1
1,CUTLASS,gemm,cutlass_tensorop_s1688211gemm_f16_64x32_64x2_tn_align4,passed,success,universal,8192,8192,32768,f16:row,f16:column,f32:column,1,0,1,1,tensorop,f32,64,32,64,2,2,1,1,16,8,8,75,1024,1342177280,4398180728832,273.88,4.56405,16058.8
1,CUTLASS,gemm,cutlass_tensorop_s1688112gemm_f16_64x32_64x2_tn_align4,passed,success,universal,8192,8192,32768,f16:row,f16:column,f32:column,1,0,1,1,tensorop,f32,64,32,64,2,1,1,1,16,8,8,75,1024,1342177280,4398180728832,215.485,5.80086,20410.6
1,CUTLASS,gemm,cutlass_tensorop_s1688111gemm_f16_64x32_64x2_tn_align4,passed,success,universal,8192,8192,32768,f16:row,f16:column,f32:column,1,0,1,1,tensorop,f32,64,32,64,2,1,1,1,16,8,8,75,1024,1342177280,4398180728832,215.95,5.78838,20366.7
1,CUTLASS,gemm,cutlass_tensorop_s1688212gemm_f16_64x32_64x2_tn_align4,passed,success,universal,9216,9216,36864,f16:row,f16:column,f32:column,1,0,1,1,tensorop,f32,64,32,64,2,2,1,1,16,8,8,75,1024,1698693120,6262232186880,433.515,3.64932,14445.3
1,CUTLASS,gemm,cutlass_tensorop_s1688211gemm_f16_64x32_64x2_tn_align4,passed,success,universal,9216,9216,36864,f16:row,f16:column,f32:column,1,0,1,1,tensorop,f32,64,32,64,2,2,1,1,16,8,8,75,1024,1698693120,6262232186880,424.782,3.72433,14742.2
1,CUTLASS,gemm,cutlass_tensorop_s1688112gemm_f16_64x32_64x2_tn_align4,passed,success,universal,9216,9216,36864,f16:row,f16:column,f32:column,1,0,1,1,tensorop,f32,64,32,64,2,1,1,1,16,8,8,75,1024,1698693120,6262232186880,309.671,5.10875,20222.2
1,CUTLASS,gemm,cutlass_tensorop_s1688111gemm_f16_64x32_64x2_tn_align4,passed,success,universal,9216,9216,36864,f16:row,f16:column,f32:column,1,0,1,1,tensorop,f32,64,32,64,2,1,1,1,16,8,8,75,1024,1698693120,6262232186880,311.912,5.07204,20076.9
1,CUTLASS,gemm,cutlass_tensorop_s1688212gemm_f16_64x32_64x2_tn_align4,passed,success,universal,10240,10240,40960,f16:row,f16:column,f32:column,1,0,1,1,tensorop,f32,64,32,64,2,2,1,1,16,8,8,75,1024,2097152000,8590144307200,592.894,3.29422,14488.5
1,CUTLASS,gemm,cutlass_tensorop_s1688211gemm_f16_64x32_64x2_tn_align4,passed,success,universal,10240,10240,40960,f16:row,f16:column,f32:column,1,0,1,1,tensorop,f32,64,32,64,2,2,1,1,16,8,8,75,1024,2097152000,8590144307200,619.56,3.15244,13864.9
1,CUTLASS,gemm,cutlass_tensorop_s1688112gemm_f16_64x32_64x2_tn_align4,passed,success,universal,10240,10240,40960,f16:row,f16:column,f32:column,1,0,1,1,tensorop,f32,64,32,64,2,1,1,1,16,8,8,75,1024,2097152000,8590144307200,423.754,4.6091,20271.5
1,CUTLASS,gemm,cutlass_tensorop_s1688111gemm_f16_64x32_64x2_tn_align4,passed,success,universal,10240,10240,40960,f16:row,f16:column,f32:column,1,0,1,1,tensorop,f32,64,32,64,2,1,1,1,16,8,8,75,1024,2097152000,8590144307200,419.569,4.65507,20473.7
1,CUTLASS,gemm,cutlass_tensorop_s1688221gemm_f16_64x64_32x2_tn_align4,passed,success,universal,1024,1024,4096,f16:row,f16:column,f32:column,1,0,1,1,tensorop,f32,64,64,32,2,2,2,1,16,8,8,75,1024,20971520,8592031744,0.30091,64.9073,28553.5
1,CUTLASS,gemm,cutlass_tensorop_s1688211gemm_f16_64x64_32x2_tn_align4,passed,success,universal,1024,1024,4096,f16:row,f16:column,f32:column,1,0,1,1,tensorop,f32,64,64,32,2,2,1,1,16,8,8,75,1024,20971520,8592031744,0.28898,67.5868,29732.3
1,CUTLASS,gemm,cutlass_tensorop_s1688121gemm_f16_64x64_32x2_tn_align4,passed,success,universal,1024,1024,4096,f16:row,f16:column,f32:column,1,0,1,1,tensorop,f32,64,64,32,2,1,2,1,16,8,8,75,1024,20971520,8592031744,0.283765,68.829,30278.7
1,CUTLASS,gemm,cutlass_tensorop_s1688111gemm_f16_64x64_32x2_tn_align4,passed,success,universal,1024,1024,4096,f16:row,f16:column,f32:column,1,0,1,1,tensorop,f32,64,64,32,2,1,1,1,16,8,8,75,1024,20971520,8592031744,0.273482,71.4171,31417.2
1,CUTLASS,gemm,cutlass_tensorop_s1688221gemm_f16_64x64_32x2_tn_align4,passed,success,universal,2048,2048,8192,f16:row,f16:column,f32:column,1,0,1,1,tensorop,f32,64,64,32,2,2,2,1,16,8,8,75,1024,83886080,68727865344,2.31029,33.816,29748.5
1,CUTLASS,gemm,cutlass_tensorop_s1688211gemm_f16_64x64_32x2_tn_align4,passed,success,universal,2048,2048,8192,f16:row,f16:column,f32:column,1,0,1,1,tensorop,f32,64,64,32,2,2,1,1,16,8,8,75,1024,83886080,68727865344,2.16838,36.0292,31695.5
1,CUTLASS,gemm,cutlass_tensorop_s1688121gemm_f16_64x64_32x2_tn_align4,passed,success,universal,2048,2048,8192,f16:row,f16:column,f32:column,1,0,1,1,tensorop,f32,64,64,32,2,1,2,1,16,8,8,75,1024,83886080,68727865344,2.16878,36.0225,31689.6
1,CUTLASS,gemm,cutlass_tensorop_s1688111gemm_f16_64x64_32x2_tn_align4,passed,success,universal,2048,2048,8192,f16:row,f16:column,f32:column,1,0,1,1,tensorop,f32,64,64,32,2,1,1,1,16,8,8,75,1024,83886080,68727865344,2.03456,38.399,33780.2
1,CUTLASS,gemm,cutlass_tensorop_s1688221gemm_f16_64x64_32x2_tn_align4,passed,success,universal,3072,3072,12288,f16:row,f16:column,f32:column,1,0,1,1,tensorop,f32,64,64,32,2,2,2,1,16,8,8,75,1024,188743680,231947108352,18.3717,9.56802,12625.2
1,CUTLASS,gemm,cutlass_tensorop_s1688211gemm_f16_64x64_32x2_tn_align4,passed,success,universal,3072,3072,12288,f16:row,f16:column,f32:column,1,0,1,1,tensorop,f32,64,64,32,2,2,1,1,16,8,8,75,1024,188743680,231947108352,17.2559,10.1867,13441.6
1,CUTLASS,gemm,cutlass_tensorop_s1688121gemm_f16_64x64_32x2_tn_align4,passed,success,universal,3072,3072,12288,f16:row,f16:column,f32:column,1,0,1,1,tensorop,f32,64,64,32,2,1,2,1,16,8,8,75,1024,188743680,231947108352,16.8867,10.4094,13735.5
1,CUTLASS,gemm,cutlass_tensorop_s1688111gemm_f16_64x64_32x2_tn_align4,passed,success,universal,3072,3072,12288,f16:row,f16:column,f32:column,1,0,1,1,tensorop,f32,64,64,32,2,1,1,1,16,8,8,75,1024,188743680,231947108352,6.74759,26.051,34374.8
1,CUTLASS,gemm,cutlass_tensorop_s1688221gemm_f16_64x64_32x2_tn_align4,passed,success,universal,4096,4096,16384,f16:row,f16:column,f32:column,1,0,1,1,tensorop,f32,64,64,32,2,2,2,1,16,8,8,75,1024,335544320,549789368320,48.3285,6.46616,11376.1
1,CUTLASS,gemm,cutlass_tensorop_s1688211gemm_f16_64x64_32x2_tn_align4,passed,success,universal,4096,4096,16384,f16:row,f16:column,f32:column,1,0,1,1,tensorop,f32,64,64,32,2,2,1,1,16,8,8,75,1024,335544320,549789368320,45.8074,6.82205,12002.2
1,CUTLASS,gemm,cutlass_tensorop_s1688121gemm_f16_64x64_32x2_tn_align4,passed,success,universal,4096,4096,16384,f16:row,f16:column,f32:column,1,0,1,1,tensorop,f32,64,64,32,2,1,2,1,16,8,8,75,1024,335544320,549789368320,46.2036,6.76354,11899.3
1,CUTLASS,gemm,cutlass_tensorop_s1688111gemm_f16_64x64_32x2_tn_align4,passed,success,universal,4096,4096,16384,f16:row,f16:column,f32:column,1,0,1,1,tensorop,f32,64,64,32,2,1,1,1,16,8,8,75,1024,335544320,549789368320,16.3681,19.092,33589
1,CUTLASS,gemm,cutlass_tensorop_s1688221gemm_f16_64x64_32x2_tn_align4,passed,success,universal,5120,5120,20480,f16:row,f16:column,f32:column,1,0,1,1,tensorop,f32,64,64,32,2,2,2,1,16,8,8,75,1024,524288000,1073794252800,117.282,4.1633,9155.64
1,CUTLASS,gemm,cutlass_tensorop_s1688211gemm_f16_64x64_32x2_tn_align4,passed,success,universal,5120,5120,20480,f16:row,f16:column,f32:column,1,0,1,1,tensorop,f32,64,64,32,2,2,1,1,16,8,8,75,1024,524288000,1073794252800,114.408,4.26791,9385.69
1,CUTLASS,gemm,cutlass_tensorop_s1688121gemm_f16_64x64_32x2_tn_align4,passed,success,universal,5120,5120,20480,f16:row,f16:column,f32:column,1,0,1,1,tensorop,f32,64,64,32,2,1,2,1,16,8,8,75,1024,524288000,1073794252800,115.035,4.24462,9334.46
1,CUTLASS,gemm,cutlass_tensorop_s1688111gemm_f16_64x64_32x2_tn_align4,passed,success,universal,5120,5120,20480,f16:row,f16:column,f32:column,1,0,1,1,tensorop,f32,64,64,32,2,1,1,1,16,8,8,75,1024,524288000,1073794252800,57.9622,8.42413,18525.8
1,CUTLASS,gemm,cutlass_tensorop_s1688221gemm_f16_64x64_32x2_tn_align4,passed,success,universal,6144,6144,24576,f16:row,f16:column,f32:column,1,0,1,1,tensorop,f32,64,64,32,2,2,2,1,16,8,8,75,1024,754974720,1855501369344,210.294,3.34353,8823.35
1,CUTLASS,gemm,cutlass_tensorop_s1688211gemm_f16_64x64_32x2_tn_align4,passed,success,universal,6144,6144,24576,f16:row,f16:column,f32:column,1,0,1,1,tensorop,f32,64,64,32,2,2,1,1,16,8,8,75,1024,754974720,1855501369344,204.516,3.438,9072.66
1,CUTLASS,gemm,cutlass_tensorop_s1688121gemm_f16_64x64_32x2_tn_align4,passed,success,universal,6144,6144,24576,f16:row,f16:column,f32:column,1,0,1,1,tensorop,f32,64,64,32,2,1,2,1,16,8,8,75,1024,754974720,1855501369344,206.884,3.39864,8968.8
