experiments/ww4w_splitk.gemm.csv
Problem,Provider,OperationKind,Operation,Disposition,Status,gemm_kind,m,n,k,A,B,C,alpha,beta,split_k_slices,batch_count,op_class,accum,cta_m,cta_n,cta_k,stages,warps_m,warps_n,warps_k,inst_m,inst_n,inst_k,min_cc,max_cc,Bytes,Flops,Runtime,GB/s,GFLOPs
1,CUTLASS,gemm,cutlass_tensorop_s1688111gemm_f16_32x32_32x2_tn_align4,not_verified,success,universal,1024,1024,4096,f16:row,f16:column,f32:column,1,0,4,1,tensorop,f32,32,32,32,2,1,1,1,16,8,8,75,1024,20971520,8592031744,0.618233,31.5921,13897.7
1,CUTLASS,gemm,cutlass_tensorop_s1688111gemm_f16_32x32_32x2_tn_align4,not_verified,success,universal,2048,2048,8192,f16:row,f16:column,f32:column,1,0,4,1,tensorop,f32,32,32,32,2,1,1,1,16,8,8,75,1024,83886080,68727865344,4.04451,19.3163,16992.9
1,CUTLASS,gemm,cutlass_tensorop_s1688111gemm_f16_32x32_32x2_tn_align4,not_verified,success,universal,3072,3072,12288,f16:row,f16:column,f32:column,1,0,4,1,tensorop,f32,32,32,32,2,1,1,1,16,8,8,75,1024,188743680,231947108352,13.1336,13.3841,17660.6
1,CUTLASS,gemm,cutlass_tensorop_s1688111gemm_f16_32x32_32x2_tn_align4,not_verified,success,universal,4096,4096,16384,f16:row,f16:column,f32:column,1,0,4,1,tensorop,f32,32,32,32,2,1,1,1,16,8,8,75,1024,335544320,549789368320,30.6653,10.1907,17928.7
1,CUTLASS,gemm,cutlass_tensorop_s1688111gemm_f16_32x32_32x2_tn_align4,not_verified,success,universal,5120,5120,20480,f16:row,f16:column,f32:column,1,0,4,1,tensorop,f32,32,32,32,2,1,1,1,16,8,8,75,1024,524288000,1073794252800,61.3217,7.96262,17510.8
1,CUTLASS,gemm,cutlass_tensorop_s1688111gemm_f16_32x32_32x2_tn_align4,not_verified,success,universal,6144,6144,24576,f16:row,f16:column,f32:column,1,0,4,1,tensorop,f32,32,32,32,2,1,1,1,16,8,8,75,1024,754974720,1855501369344,104.538,6.72601,17749.5
1,CUTLASS,gemm,cutlass_tensorop_s1688111gemm_f16_32x32_32x2_tn_align4,not_verified,success,universal,7168,7168,28672,f16:row,f16:column,f32:column,1,0,4,1,tensorop,f32,32,32,32,2,1,1,1,16,8,8,75,1024,1027604480,2946450325504,167.558,5.71163,17584.6
1,CUTLASS,gemm,cutlass_tensorop_s1688111gemm_f16_32x32_32x2_tn_align4,not_verified,success,universal,8192,8192,32768,f16:row,f16:column,f32:column,1,0,4,1,tensorop,f32,32,32,32,2,1,1,1,16,8,8,75,1024,1342177280,4398180728832,291.989,4.28098,15062.8
1,CUTLASS,gemm,cutlass_tensorop_s1688111gemm_f16_32x32_32x2_tn_align4,not_verified,success,universal,9216,9216,36864,f16:row,f16:column,f32:column,1,0,4,1,tensorop,f32,32,32,32,2,1,1,1,16,8,8,75,1024,1698693120,6262232186880,634.416,2.49368,9870.86
1,CUTLASS,gemm,cutlass_tensorop_s1688111gemm_f16_32x32_32x2_tn_align4,not_verified,success,universal,10240,10240,40960,f16:row,f16:column,f32:column,1,0,4,1,tensorop,f32,32,32,32,2,1,1,1,16,8,8,75,1024,2097152000,8590144307200,976.379,2.00038,8797.96
1,CUTLASS,gemm,cutlass_tensorop_s1688112gemm_f16_32x32_64x2_tn_align4,not_verified,success,universal,1024,1024,4096,f16:row,f16:column,f32:column,1,0,4,1,tensorop,f32,32,32,64,2,1,1,1,16,8,8,75,1024,20971520,8592031744,0.388035,50.3337,22142.4
1,CUTLASS,gemm,cutlass_tensorop_s1688111gemm_f16_32x32_64x2_tn_align4,not_verified,success,universal,1024,1024,4096,f16:row,f16:column,f32:column,1,0,4,1,tensorop,f32,32,32,64,2,1,1,1,16,8,8,75,1024,20971520,8592031744,0.389168,50.1872,22077.9
1,CUTLASS,gemm,cutlass_tensorop_s1688112gemm_f16_32x32_64x2_tn_align4,not_verified,success,universal,2048,2048,8192,f16:row,f16:column,f32:column,1,0,4,1,tensorop,f32,32,32,64,2,1,1,1,16,8,8,75,1024,83886080,68727865344,2.75455,28.3622,24950.7
1,CUTLASS,gemm,cutlass_tensorop_s1688111gemm_f16_32x32_64x2_tn_align4,not_verified,success,universal,2048,2048,8192,f16:row,f16:column,f32:column,1,0,4,1,tensorop,f32,32,32,64,2,1,1,1,16,8,8,75,1024,83886080,68727865344,2.75632,28.344,24934.7
1,CUTLASS,gemm,cutlass_tensorop_s1688112gemm_f16_32x32_64x2_tn_align4,not_verified,success,universal,3072,3072,12288,f16:row,f16:column,f32:column,1,0,4,1,tensorop,f32,32,32,64,2,1,1,1,16,8,8,75,1024,188743680,231947108352,9.12527,19.2631,25418.1
1,CUTLASS,gemm,cutlass_tensorop_s1688111gemm_f16_32x32_64x2_tn_align4,not_verified,success,universal,3072,3072,12288,f16:row,f16:column,f32:column,1,0,4,1,tensorop,f32,32,32,64,2,1,1,1,16,8,8,75,1024,188743680,231947108352,9.11572,19.2833,25444.7
1,CUTLASS,gemm,cutlass_tensorop_s1688112gemm_f16_32x32_64x2_tn_align4,not_verified,success,universal,4096,4096,16384,f16:row,f16:column,f32:column,1,0,4,1,tensorop,f32,32,32,64,2,1,1,1,16,8,8,75,1024,335544320,549789368320,21.1881,14.7488,25948
1,CUTLASS,gemm,cutlass_tensorop_s1688111gemm_f16_32x32_64x2_tn_align4,not_verified,success,universal,4096,4096,16384,f16:row,f16:column,f32:column,1,0,4,1,tensorop,f32,32,32,64,2,1,1,1,16,8,8,75,1024,335544320,549789368320,21.2163,14.7293,25913.6
1,CUTLASS,gemm,cutlass_tensorop_s1688112gemm_f16_32x32_64x2_tn_align4,not_verified,success,universal,5120,5120,20480,f16:row,f16:column,f32:column,1,0,4,1,tensorop,f32,32,32,64,2,1,1,1,16,8,8,75,1024,524288000,1073794252800,41.5698,11.7461,25831.1
1,CUTLASS,gemm,cutlass_tensorop_s1688111gemm_f16_32x32_64x2_tn_align4,not_verified,success,universal,5120,5120,20480,f16:row,f16:column,f32:column,1,0,4,1,tensorop,f32,32,32,64,2,1,1,1,16,8,8,75,1024,524288000,1073794252800,41.5573,11.7496,25838.9
1,CUTLASS,gemm,cutlass_tensorop_s1688112gemm_f16_32x32_64x2_tn_align4,not_verified,success,universal,6144,6144,24576,f16:row,f16:column,f32:column,1,0,4,1,tensorop,f32,32,32,64,2,1,1,1,16,8,8,75,1024,754974720,1855501369344,71.8276,9.78907,25832.7
1,CUTLASS,gemm,cutlass_tensorop_s1688111gemm_f16_32x32_64x2_tn_align4,not_verified,success,universal,6144,6144,24576,f16:row,f16:column,f32:column,1,0,4,1,tensorop,f32,32,32,64,2,1,1,1,16,8,8,75,1024,754974720,1855501369344,71.8173,9.79047,25836.4
1,CUTLASS,gemm,cutlass_tensorop_s1688112gemm_f16_32x32_64x2_tn_align4,not_verified,success,universal,7168,7168,28672,f16:row,f16:column,f32:column,1,0,4,1,tensorop,f32,32,32,64,2,1,1,1,16,8,8,75,1024,1027604480,2946450325504,113.846,8.40639,25881.1
1,CUTLASS,gemm,cutlass_tensorop_s1688111gemm_f16_32x32_64x2_tn_align4,not_verified,success,universal,7168,7168,28672,f16:row,f16:column,f32:column,1,0,4,1,tensorop,f32,32,32,64,2,1,1,1,16,8,8,75,1024,1027604480,2946450325504,113.874,8.40429,25874.6
1,CUTLASS,gemm,cutlass_tensorop_s1688112gemm_f16_32x32_64x2_tn_align4,not_verified,success,universal,8192,8192,32768,f16:row,f16:column,f32:column,1,0,4,1,tensorop,f32,32,32,64,2,1,1,1,16,8,8,75,1024,1342177280,4398180728832,168.821,7.40431,26052.4
1,CUTLASS,gemm,cutlass_tensorop_s1688111gemm_f16_32x32_64x2_tn_align4,not_verified,success,universal,8192,8192,32768,f16:row,f16:column,f32:column,1,0,4,1,tensorop,f32,32,32,64,2,1,1,1,16,8,8,75,1024,1342177280,4398180728832,168.851,7.40299,26047.8
1,CUTLASS,gemm,cutlass_tensorop_s1688112gemm_f16_32x32_64x2_tn_align4,not_verified,success,universal,9216,9216,36864,f16:row,f16:column,f32:column,1,0,4,1,tensorop,f32,32,32,64,2,1,1,1,16,8,8,75,1024,1698693120,6262232186880,246.364,6.42152,25418.6
1,CUTLASS,gemm,cutlass_tensorop_s1688111gemm_f16_32x32_64x2_tn_align4,not_verified,success,universal,9216,9216,36864,f16:row,f16:column,f32:column,1,0,4,1,tensorop,f32,32,32,64,2,1,1,1,16,8,8,75,1024,1698693120,6262232186880,246.048,6.42978,25451.3
1,CUTLASS,gemm,cutlass_tensorop_s1688112gemm_f16_32x32_64x2_tn_align4,not_verified,success,universal,10240,10240,40960,f16:row,f16:column,f32:column,1,0,4,1,tensorop,f32,32,32,64,2,1,1,1,16,8,8,75,1024,2097152000,8590144307200,340.097,5.74284,25257.9
1,CUTLASS,gemm,cutlass_tensorop_s1688111gemm_f16_32x32_64x2_tn_align4,not_verified,success,universal,10240,10240,40960,f16:row,f16:column,f32:column,1,0,4,1,tensorop,f32,32,32,64,2,1,1,1,16,8,8,75,1024,2097152000,8590144307200,340.421,5.73738,25233.9
1,CUTLASS,gemm,cutlass_tensorop_s1688121gemm_f16_32x64_32x2_tn_align4,not_verified,success,universal,1024,1024,4096,f16:row,f16:column,f32:column,1,0,4,1,tensorop,f32,32,64,32,2,1,2,1,16,8,8,75,1024,20971520,8592031744,0.403848,48.3629,21275.4
1,CUTLASS,gemm,cutlass_tensorop_s1688111gemm_f16_32x64_32x2_tn_align4,not_verified,success,universal,1024,1024,4096,f16:row,f16:column,f32:column,1,0,4,1,tensorop,f32,32,64,32,2,1,1,1,16,8,8,75,1024,20971520,8592031744,0.398125,49.0581,21581.2
1,CUTLASS,gemm,cutlass_tensorop_s1688121gemm_f16_32x64_32x2_tn_align4,not_verified,success,universal,2048,2048,8192,f16:row,f16:column,f32:column,1,0,4,1,tensorop,f32,32,64,32,2,1,2,1,16,8,8,75,1024,83886080,68727865344,3.07178,25.4331,22374
1,CUTLASS,gemm,cutlass_tensorop_s1688111gemm_f16_32x64_32x2_tn_align4,not_verified,success,universal,2048,2048,8192,f16:row,f16:column,f32:column,1,0,4,1,tensorop,f32,32,64,32,2,1,1,1,16,8,8,75,1024,83886080,68727865344,2.91747,26.7783,23557.3
1,CUTLASS,gemm,cutlass_tensorop_s1688121gemm_f16_32x64_32x2_tn_align4,not_verified,success,universal,3072,3072,12288,f16:row,f16:column,f32:column,1,0,4,1,tensorop,f32,32,64,32,2,1,2,1,16,8,8,75,1024,188743680,231947108352,10.2251,17.1911,22684.1
1,CUTLASS,gemm,cutlass_tensorop_s1688111gemm_f16_32x64_32x2_tn_align4,not_verified,success,universal,3072,3072,12288,f16:row,f16:column,f32:column,1,0,4,1,tensorop,f32,32,64,32,2,1,1,1,16,8,8,75,1024,188743680,231947108352,9.74665,18.035,23797.6
1,CUTLASS,gemm,cutlass_tensorop_s1688121gemm_f16_32x64_32x2_tn_align4,not_verified,success,universal,4096,4096,16384,f16:row,f16:column,f32:column,1,0,4,1,tensorop,f32,32,64,32,2,1,2,1,16,8,8,75,1024,335544320,549789368320,24.0299,13.0046,22879.4
1,CUTLASS,gemm,cutlass_tensorop_s1688111gemm_f16_32x64_32x2_tn_align4,not_verified,success,universal,4096,4096,16384,f16:row,f16:column,f32:column,1,0,4,1,tensorop,f32,32,64,32,2,1,1,1,16,8,8,75,1024,335544320,549789368320,22.8931,13.6504,24015.5
1,CUTLASS,gemm,cutlass_tensorop_s1688121gemm_f16_32x64_32x2_tn_align4,not_verified,success,universal,5120,5120,20480,f16:row,f16:column,f32:column,1,0,4,1,tensorop,f32,32,64,32,2,1,2,1,16,8,8,75,1024,524288000,1073794252800,48.0931,10.1528,22327.4
1,CUTLASS,gemm,cutlass_tensorop_s1688111gemm_f16_32x64_32x2_tn_align4,not_verified,success,universal,5120,5120,20480,f16:row,f16:column,f32:column,1,0,4,1,tensorop,f32,32,64,32,2,1,1,1,16,8,8,75,1024,524288000,1073794252800,48.6436,10.0379,22074.7
1,CUTLASS,gemm,cutlass_tensorop_s1688121gemm_f16_32x64_32x2_tn_align4,not_verified,success,universal,6144,6144,24576,f16:row,f16:column,f32:column,1,0,4,1,tensorop,f32,32,64,32,2,1,2,1,16,8,8,75,1024,754974720,1855501369344,82.1966,8.55419,22574
1,CUTLASS,gemm,cutlass_tensorop_s1688111gemm_f16_32x64_32x2_tn_align4,not_verified,success,universal,6144,6144,24576,f16:row,f16:column,f32:column,1,0,4,1,tensorop,f32,32,64,32,2,1,1,1,16,8,8,75,1024,754974720,1855501369344,87.9798,7.99189,21090.1
1,CUTLASS,gemm,cutlass_tensorop_s1688121gemm_f16_32x64_32x2_tn_align4,not_verified,success,universal,7168,7168,28672,f16:row,f16:column,f32:column,1,0,4,1,tensorop,f32,32,64,32,2,1,2,1,16,8,8,75,1024,1027604480,2946450325504,134.463,7.11741,21912.7
1,CUTLASS,gemm,cutlass_tensorop_s1688111gemm_f16_32x64_32x2_tn_align4,not_verified,success,universal,7168,7168,28672,f16:row,f16:column,f32:column,1,0,4,1,tensorop,f32,32,64,32,2,1,1,1,16,8,8,75,1024,1027604480,2946450325504,155.16,6.16802,18989.7
1,CUTLASS,gemm,cutlass_tensorop_s1688121gemm_f16_32x64_32x2_tn_align4,not_verified,success,universal,8192,8192,32768,f16:row,f16:column,f32:column,1,0,4,1,tensorop,f32,32,64,32,2,1,2,1,16,8,8,75,1024,1342177280,4398180728832,204.081,6.12502,21551.2
1,CUTLASS,gemm,cutlass_tensorop_s1688111gemm_f16_32x64_32x2_tn_align4,not_verified,success,universal,8192,8192,32768,f16:row,f16:column,f32:column,1,0,4,1,tensorop,f32,32,64,32,2,1,1,1,16,8,8,75,1024,1342177280,4398180728832,234.904,5.32132,18723.3
1,CUTLASS,gemm,cutlass_tensorop_s1688121gemm_f16_32x64_32x2_tn_align4,not_verified,success,universal,9216,9216,36864,f16:row,f16:column,f32:column,1,0,4,1,tensorop,f32,32,64,32,2,1,2,1,16,8,8,75,1024,1698693120,6262232186880,577.667,2.73866,10840.6
1,CUTLASS,gemm,cutlass_tensorop_s1688111gemm_f16_32x64_32x2_tn_align4,not_verified,success,universal,9216,9216,36864,f16:row,f16:column,f32:column,1,0,4,1,tensorop,f32,32,64,32,2,1,1,1,16,8,8,75,1024,1698693120,6262232186880,646.243,2.44804,9690.21
1,CUTLASS,gemm,cutlass_tensorop_s1688121gemm_f16_32x64_32x2_tn_align4,not_verified,success,universal,10240,10240,40960,f16:row,f16:column,f32:column,1,0,4,1,tensorop,f32,32,64,32,2,1,2,1,16,8,8,75,1024,2097152000,8590144307200,1083.02,1.8034,7931.64
1,CUTLASS,gemm,cutlass_tensorop_s1688111gemm_f16_32x64_32x2_tn_align4,not_verified,success,universal,10240,10240,40960,f16:row,f16:column,f32:column,1,0,4,1,tensorop,f32,32,64,32,2,1,1,1,16,8,8,75,1024,2097152000,8590144307200,1062.2,1.83875,8087.1
1,CUTLASS,gemm,cutlass_tensorop_s1688122gemm_f16_32x64_64x2_tn_align4,not_verified,success,universal,1024,1024,4096,f16:row,f16:column,f32:column,1,0,4,1,tensorop,f32,32,64,64,2,1,2,1,16,8,8,75,1024,20971520,8592031744,0.372858,52.3826,23043.7
1,CUTLASS,gemm,cutlass_tensorop_s1688121gemm_f16_32x64_64x2_tn_align4,not_verified,success,universal,1024,1024,4096,f16:row,f16:column,f32:column,1,0,4,1,tensorop,f32,32,64,64,2,1,2,1,16,8,8,75,1024,20971520,8592031744,0.350046,55.7962,24545.4
1,CUTLASS,gemm,cutlass_tensorop_s1688112gemm_f16_32x64_64x2_tn_align4,not_verified,success,universal,1024,1024,4096,f16:row,f16:column,f32:column,1,0,4,1,tensorop,f32,32,64,64,2,1,1,1,16,8,8,75,1024,20971520,8592031744,0.496552,39.3337,17303.4
1,CUTLASS,gemm,cutlass_tensorop_s1688111gemm_f16_32x64_64x2_tn_align4,not_verified,success,universal,1024,1024,4096,f16:row,f16:column,f32:column,1,0,4,1,tensorop,f32,32,64,64,2,1,1,1,16,8,8,75,1024,20971520,8592031744,0.496737,39.3191,17296.9
1,CUTLASS,gemm,cutlass_tensorop_s1688122gemm_f16_32x64_64x2_tn_align4,not_verified,success,universal,2048,2048,8192,f16:row,f16:column,f32:column,1,0,4,1,tensorop,f32,32,64,64,2,1,2,1,16,8,8,75,1024,83886080,68727865344,2.63458,29.6537,26086.8
1,CUTLASS,gemm,cutlass_tensorop_s1688121gemm_f16_32x64_64x2_tn_align4,not_verified,success,universal,2048,2048,8192,f16:row,f16:column,f32:column,1,0,4,1,tensorop,f32,32,64,64,2,1,2,1,16,8,8,75,1024,83886080,68727865344,2.55933,30.5256,26853.8
1,CUTLASS,gemm,cutlass_tensorop_s1688112gemm_f16_32x64_64x2_tn_align4,not_verified,success,universal,2048,2048,8192,f16:row,f16:column,f32:column,1,0,4,1,tensorop,f32,32,64,64,2,1,1,1,16,8,8,75,1024,83886080,68727865344,3.46151,22.5696,19854.9
1,CUTLASS,gemm,cutlass_tensorop_s1688111gemm_f16_32x64_64x2_tn_align4,not_verified,success,universal,2048,2048,8192,f16:row,f16:column,f32:column,1,0,4,1,tensorop,f32,32,64,64,2,1,1,1,16,8,8,75,1024,83886080,68727865344,3.45945,22.5831,19866.7
1,CUTLASS,gemm,cutlass_tensorop_s1688122gemm_f16_32x64_64x2_tn_align4,not_verified,success,universal,3072,3072,12288,f16:row,f16:column,f32:column,1,0,4,1,tensorop,f32,32,64,64,2,1,2,1,16,8,8,75,1024,188743680,231947108352,8.28499,21.2168,27996.1
1,CUTLASS,gemm,cutlass_tensorop_s1688121gemm_f16_32x64_64x2_tn_align4,not_verified,success,universal,3072,3072,12288,f16:row,f16:column,f32:column,1,0,4,1,tensorop,f32,32,64,64,2,1,2,1,16,8,8,75,1024,188743680,231947108352,8.40654,20.9101,27591.3
1,CUTLASS,gemm,cutlass_tensorop_s1688112gemm_f16_32x64_64x2_tn_align4,not_verified,success,universal,3072,3072,12288,f16:row,f16:column,f32:column,1,0,4,1,tensorop,f32,32,64,64,2,1,1,1,16,8,8,75,1024,188743680,231947108352,11.1328,15.7895,20834.6
1,CUTLASS,gemm,cutlass_tensorop_s1688111gemm_f16_32x64_64x2_tn_align4,not_verified,success,universal,3072,3072,12288,f16:row,f16:column,f32:column,1,0,4,1,tensorop,f32,32,64,64,2,1,1,1,16,8,8,75,1024,188743680,231947108352,11.1297,15.7939,20840.3
1,CUTLASS,gemm,cutlass_tensorop_s1688122gemm_f16_32x64_64x2_tn_align4,not_verified,success,universal,4096,4096,16384,f16:row,f16:column,f32:column,1,0,4,1,tensorop,f32,32,64,64,2,1,2,1,16,8,8,75,1024,335544320,549789368320,19.7374,15.8329,27855.3
1,CUTLASS,gemm,cutlass_tensorop_s1688121gemm_f16_32x64_64x2_tn_align4,not_verified,success,universal,4096,4096,16384,f16:row,f16:column,f32:column,1,0,4,1,tensorop,f32,32,64,64,2,1,2,1,16,8,8,75,1024,335544320,549789368320,19.8166,15.7696,27743.9
1,CUTLASS,gemm,cutlass_tensorop_s1688112gemm_f16_32x64_64x2_tn_align4,not_verified,success,universal,4096,4096,16384,f16:row,f16:column,f32:column,1,0,4,1,tensorop,f32,32,64,64,2,1,1,1,16,8,8,75,1024,335544320,549789368320,26.0487,11.9968,21106.2
1,CUTLASS,gemm,cutlass_tensorop_s1688111gemm_f16_32x64_64x2_tn_align4,not_verified,success,universal,4096,4096,16384,f16:row,f16:column,f32:column,1,0,4,1,tensorop,f32,32,64,64,2,1,1,1,16,8,8,75,1024,335544320,549789368320,26.0455,11.9982,21108.8
1,CUTLASS,gemm,cutlass_tensorop_s1688122gemm_f16_32x64_64x2_tn_align4,not_verified,success,universal,5120,5120,20480,f16:row,f16:column,f32:column,1,0,4,1,tensorop,f32,32,64,64,2,1,2,1,16,8,8,75,1024,524288000,1073794252800,39.0011,12.5197,27532.4
1,CUTLASS,gemm,cutlass_tensorop_s1688121gemm_f16_32x64_64x2_tn_align4,not_verified,success,universal,5120,5120,20480,f16:row,f16:column,f32:column,1,0,4,1,tensorop,f32,32,64,64,2,1,2,1,16,8,8,75,1024,524288000,1073794252800,38.7794,12.5913,27689.8
1,CUTLASS,gemm,cutlass_tensorop_s1688112gemm_f16_32x64_64x2_tn_align4,not_verified,success,universal,5120,5120,20480,f16:row,f16:column,f32:column,1,0,4,1,tensorop,f32,32,64,64,2,1,1,1,16,8,8,75,1024,524288000,1073794252800,50.2155,9.72371,21383.7
1,CUTLASS,gemm,cutlass_tensorop_s1688111gemm_f16_32x64_64x2_tn_align4,not_verified,success,universal,5120,5120,20480,f16:row,f16:column,f32:column,1,0,4,1,tensorop,f32,32,64,64,2,1,1,1,16,8,8,75,1024,524288000,1073794252800,50.1984,9.72703,21391
1,CUTLASS,gemm,cutlass_tensorop_s1688122gemm_f16_32x64_64x2_tn_align4,not_verified,success,universal,6144,6144,24576,f16:row,f16:column,f32:column,1,0,4,1,tensorop,f32,32,64,64,2,1,2,1,16,8,8,75,1024,754974720,1855501369344,67.4569,10.4233,27506.5
1,CUTLASS,gemm,cutlass_tensorop_s1688121gemm_f16_32x64_64x2_tn_align4,not_verified,success,universal,6144,6144,24576,f16:row,f16:column,f32:column,1,0,4,1,tensorop,f32,32,64,64,2,1,2,1,16,8,8,75,1024,754974720,1855501369344,69.2579,10.1523,26791.2
1,CUTLASS,gemm,cutlass_tensorop_s1688112gemm_f16_32x64_64x2_tn_align4,not_verified,success,universal,6144,6144,24576,f16:row,f16:column,f32:column,1,0,4,1,tensorop,f32,32,64,64,2,1,1,1,16,8,8,75,1024,754974720,1855501369344,87.4748,8.03803,21211.8
1,CUTLASS,gemm,cutlass_tensorop_s1688111gemm_f16_32x64_64x2_tn_align4,not_verified,success,universal,6144,6144,24576,f16:row,f16:column,f32:column,1,0,4,1,tensorop,f32,32,64,64,2,1,1,1,16,8,8,75,1024,754974720,1855501369344,87.4193,8.04313,21225.3
1,CUTLASS,gemm,cutlass_tensorop_s1688122gemm_f16_32x64_64x2_tn_align4,not_verified,success,universal,7168,7168,28672,f16:row,f16:column,f32:column,1,0,4,1,tensorop,f32,32,64,64,2,1,2,1,16,8,8,75,1024,1027604480,2946450325504,109.662,8.72707,26868.4
1,CUTLASS,gemm,cutlass_tensorop_s1688121gemm_f16_32x64_64x2_tn_align4,not_verified,success,universal,7168,7168,28672,f16:row,f16:column,f32:column,1,0,4,1,tensorop,f32,32,64,64,2,1,2,1,16,8,8,75,1024,1027604480,2946450325504,110.98,8.62342,26549.3
1,CUTLASS,gemm,cutlass_tensorop_s1688112gemm_f16_32x64_64x2_tn_align4,not_verified,success,universal,7168,7168,28672,f16:row,f16:column,f32:column,1,0,4,1,tensorop,f32,32,64,64,2,1,1,1,16,8,8,75,1024,1027604480,2946450325504,140.31,6.82082,20999.5
1,CUTLASS,gemm,cutlass_tensorop_s1688111gemm_f16_32x64_64x2_tn_align4,not_verified,success,universal,7168,7168,28672,f16:row,f16:column,f32:column,1,0,4,1,tensorop,f32,32,64,64,2,1,1,1,16,8,8,75,1024,1027604480,2946450325504,140.239,6.8243,21010.3
1,CUTLASS,gemm,cutlass_tensorop_s1688122gemm_f16_32x64_64x2_tn_align4,not_verified,success,universal,8192,8192,32768,f16:row,f16:column,f32:column,1,0,4,1,tensorop,f32,32,64,64,2,1,2,1,16,8,8,75,1024,1342177280,4398180728832,166.173,7.52228,26467.5
1,CUTLASS,gemm,cutlass_tensorop_s1688121gemm_f16_32x64_64x2_tn_align4,not_verified,success,universal,8192,8192,32768,f16:row,f16:column,f32:column,1,0,4,1,tensorop,f32,32,64,64,2,1,2,1,16,8,8,75,1024,1342177280,4398180728832,169.606,7.37001,25931.7
1,CUTLASS,gemm,cutlass_tensorop_s1688112gemm_f16_32x64_64x2_tn_align4,not_verified,success,universal,8192,8192,32768,f16:row,f16:column,f32:column,1,0,4,1,tensorop,f32,32,64,64,2,1,1,1,16,8,8,75,1024,1342177280,4398180728832,210.582,5.93593,20885.8
1,CUTLASS,gemm,cutlass_tensorop_s1688111gemm_f16_32x64_64x2_tn_align4,not_verified,success,universal,8192,8192,32768,f16:row,f16:column,f32:column,1,0,4,1,tensorop,f32,32,64,64,2,1,1,1,16,8,8,75,1024,1342177280,4398180728832,210.286,5.94428,20915.2
1,CUTLASS,gemm,cutlass_tensorop_s1688122gemm_f16_32x64_64x2_tn_align4,not_verified,success,universal,9216,9216,36864,f16:row,f16:column,f32:column,1,0,4,1,tensorop,f32,32,64,64,2,1,2,1,16,8,8,75,1024,1698693120,6262232186880,246.466,6.41887,25408.1
1,CUTLASS,gemm,cutlass_tensorop_s1688121gemm_f16_32x64_64x2_tn_align4,not_verified,success,universal,9216,9216,36864,f16:row,f16:column,f32:column,1,0,4,1,tensorop,f32,32,64,64,2,1,2,1,16,8,8,75,1024,1698693120,6262232186880,251.912,6.28009,24858.8
1,CUTLASS,gemm,cutlass_tensorop_s1688112gemm_f16_32x64_64x2_tn_align4,not_verified,success,universal,9216,9216,36864,f16:row,f16:column,f32:column,1,0,4,1,tensorop,f32,32,64,64,2,1,1,1,16,8,8,75,1024,1698693120,6262232186880,300.876,5.25808,20813.3
1,CUTLASS,gemm,cutlass_tensorop_s1688111gemm_f16_32x64_64x2_tn_align4,not_verified,success,universal,9216,9216,36864,f16:row,f16:column,f32:column,1,0,4,1,tensorop,f32,32,64,64,2,1,1,1,16,8,8,75,1024,1698693120,6262232186880,300.896,5.25774,20812
1,CUTLASS,gemm,cutlass_tensorop_s1688122gemm_f16_32x64_64x2_tn_align4,not_verified,success,universal,10240,10240,40960,f16:row,f16:column,f32:column,1,0,4,1,tensorop,f32,32,64,64,2,1,2,1,16,8,8,75,1024,2097152000,8590144307200,357.447,5.4641,24031.9
1,CUTLASS,gemm,cutlass_tensorop_s1688121gemm_f16_32x64_64x2_tn_align4,not_verified,success,universal,10240,10240,40960,f16:row,f16:column,f32:column,1,0,4,1,tensorop,f32,32,64,64,2,1,2,1,16,8,8,75,1024,2097152000,8590144307200,350.821,5.5673,24485.8
1,CUTLASS,gemm,cutlass_tensorop_s1688112gemm_f16_32x64_64x2_tn_align4,not_verified,success,universal,10240,10240,40960,f16:row,f16:column,f32:column,1,0,4,1,tensorop,f32,32,64,64,2,1,1,1,16,8,8,75,1024,2097152000,8590144307200,422.373,4.62417,20337.8
1,CUTLASS,gemm,cutlass_tensorop_s1688111gemm_f16_32x64_64x2_tn_align4,not_verified,success,universal,10240,10240,40960,f16:row,f16:column,f32:column,1,0,4,1,tensorop,f32,32,64,64,2,1,1,1,16,8,8,75,1024,2097152000,8590144307200,422.027,4.62796,20354.5
1,CUTLASS,gemm,cutlass_tensorop_s1688141gemm_f16_32x128_32x2_tn_align4,not_verified,success,universal,1024,1024,4096,f16:row,f16:column,f32:column,1,0,4,1,tensorop,f32,32,128,32,2,1,4,1,16,8,8,75,1024,20971520,8592031744,0.354735,55.0587,24221
1,CUTLASS,gemm,cutlass_tensorop_s1688121gemm_f16_32x128_32x2_tn_align4,not_verified,success,universal,1024,1024,4096,f16:row,f16:column,f32:column,1,0,4,1,tensorop,f32,32,128,32,2,1,2,1,16,8,8,75,1024,20971520,8592031744,0.348155,56.0993,24678.7
1,CUTLASS,gemm,cutlass_tensorop_s1688111gemm_f16_32x128_32x2_tn_align4,not_verified,success,universal,1024,1024,4096,f16:row,f16:column,f32:column,1,0,4,1,tensorop,f32,32,128,32,2,1,1,1,16,8,8,75,1024,20971520,8592031744,1.31996,14.7969,6509.34
1,CUTLASS,gemm,cutlass_tensorop_s1688141gemm_f16_32x128_32x2_tn_align4,not_verified,success,universal,2048,2048,8192,f16:row,f16:column,f32:column,1,0,4,1,tensorop,f32,32,128,32,2,1,4,1,16,8,8,75,1024,83886080,68727865344,2.66967,29.264,25744
1,CUTLASS,gemm,cutlass_tensorop_s1688121gemm_f16_32x128_32x2_tn_align4,not_verified,success,universal,2048,2048,8192,f16:row,f16:column,f32:column,1,0,4,1,tensorop,f32,32,128,32,2,1,2,1,16,8,8,75,1024,83886080,68727865344,2.52845,30.8984,27181.9
1,CUTLASS,gemm,cutlass_tensorop_s1688111gemm_f16_32x128_32x2_tn_align4,not_verified,success,universal,2048,2048,8192,f16:row,f16:column,f32:column,1,0,4,1,tensorop,f32,32,128,32,2,1,1,1,16,8,8,75,1024,83886080,68727865344,9.03551,8.64644,7606.41
1,CUTLASS,gemm,cutlass_tensorop_s1688141gemm_f16_32x128_32x2_tn_align4,not_verified,success,universal,3072,3072,12288,f16:row,f16:column,f32:column,1,0,4,1,tensorop,f32,32,128,32,2,1,4,1,16,8,8,75,1024,188743680,231947108352,9.00852,19.5128,25747.5
1,CUTLASS,gemm,cutlass_tensorop_s1688121gemm_f16_32x128_32x2_tn_align4,not_verified,success,universal,3072,3072,12288,f16:row,f16:column,f32:column,1,0,4,1,tensorop,f32,32,128,32,2,1,2,1,16,8,8,75,1024,188743680,231947108352,9.31918,18.8623,24889.2
1,CUTLASS,gemm,cutlass_tensorop_s1688111gemm_f16_32x128_32x2_tn_align4,not_verified,success,universal,3072,3072,12288,f16:row,f16:column,f32:column,1,0,4,1,tensorop,f32,32,128,32,2,1,1,1,16,8,8,75,1024,188743680,231947108352,37.4769,4.69039,6189.07
1,CUTLASS,gemm,cutlass_tensorop_s1688141gemm_f16_32x128_32x2_tn_align4,not_verified,success,universal,4096,4096,16384,f16:row,f16:column,f32:column,1,0,4,1,tensorop,f32,32,128,32,2,1,4,1,16,8,8,75,1024,335544320,549789368320,21.2119,14.7323,25918.9
1,CUTLASS,gemm,cutlass_tensorop_s1688121gemm_f16_32x128_32x2_tn_align4,not_verified,success,universal,4096,4096,16384,f16:row,f16:column,f32:column,1,0,4,1,tensorop,f32,32,128,32,2,1,2,1,16,8,8,75,1024,335544320,549789368320,31.9488,9.78128,17208.5
1,CUTLASS,gemm,cutlass_tensorop_s1688111gemm_f16_32x128_32x2_tn_align4,not_verified,success,universal,4096,4096,16384,f16:row,f16:column,f32:column,1,0,4,1,tensorop,f32,32,128,32,2,1,1,1,16,8,8,75,1024,335544320,549789368320,71.2262,4.38743,7718.93
1,CUTLASS,gemm,cutlass_tensorop_s1688141gemm_f16_32x128_32x2_tn_align4,not_verified,success,universal,5120,5120,20480,f16:row,f16:column,f32:column,1,0,4,1,tensorop,f32,32,128,32,2,1,4,1,16,8,8,75,1024,524288000,1073794252800,47.2239,10.3397,22738.4
1,CUTLASS,gemm,cutlass_tensorop_s1688121gemm_f16_32x128_32x2_tn_align4,not_verified,success,universal,5120,5120,20480,f16:row,f16:column,f32:column,1,0,4,1,tensorop,f32,32,128,32,2,1,2,1,16,8,8,75,1024,524288000,1073794252800,98.7247,4.94589,10876.7
1,CUTLASS,gemm,cutlass_tensorop_s1688111gemm_f16_32x128_32x2_tn_align4,not_verified,success,universal,5120,5120,20480,f16:row,f16:column,f32:column,1,0,4,1,tensorop,f32,32,128,32,2,1,1,1,16,8,8,75,1024,524288000,1073794252800,137.192,3.5591,7826.92
1,CUTLASS,gemm,cutlass_tensorop_s1688141gemm_f16_32x128_32x2_tn_align4,not_verified,success,universal,6144,6144,24576,f16:row,f16:column,f32:column,1,0,4,1,tensorop,f32,32,128,32,2,1,4,1,16,8,8,75,1024,754974720,1855501369344,92.6593,7.58828,20025
1,CUTLASS,gemm,cutlass_tensorop_s1688121gemm_f16_32x128_32x2_tn_align4,not_verified,success,universal,6144,6144,24576,f16:row,f16:column,f32:column,1,0,4,1,tensorop,f32,32,128,32,2,1,2,1,16,8,8,75,1024,754974720,1855501369344,200.438,3.50795,9257.24
1,CUTLASS,gemm,cutlass_tensorop_s1688111gemm_f16_32x128_32x2_tn_align4,not_verified,success,universal,6144,6144,24576,f16:row,f16:column,f32:column,1,0,4,1,tensorop,f32,32,128,32,2,1,1,1,16,8,8,75,1024,754974720,1855501369344,383.816,1.83193,4834.35
1,CUTLASS,gemm,cutlass_tensorop_s1688141gemm_f16_32x128_32x2_tn_align4,not_verified,success,universal,7168,7168,28672,f16:row,f16:column,f32:column,1,0,4,1,tensorop,f32,32,128,32,2,1,4,1,16,8,8,75,1024,1027604480,2946450325504,132.477,7.22414,22241.3
1,CUTLASS,gemm,cutlass_tensorop_s1688121gemm_f16_32x128_32x2_tn_align4,not_verified,success,universal,7168,7168,28672,f16:row,f16:column,f32:column,1,0,4,1,tensorop,f32,32,128,32,2,1,2,1,16,8,8,75,1024,1027604480,2946450325504,374.283,2.55698,7872.26
1,CUTLASS,gemm,cutlass_tensorop_s1688111gemm_f16_32x128_32x2_tn_align4,not_verified,success,universal,7168,7168,28672,f16:row,f16:column,f32:column,1,0,4,1,tensorop,f32,32,128,32,2,1,1,1,16,8,8,75,1024,1027604480,2946450325504,451.69,2.11878,6523.17
1,CUTLASS,gemm,cutlass_tensorop_s1688141gemm_f16_32x128_32x2_tn_align4,not_verified,success,universal,8192,8192,32768,f16:row,f16:column,f32:column,1,0,4,1,tensorop,f32,32,128,32,2,1,4,1,16,8,8,75,1024,1342177280,4398180728832,530.723,2.35528,8287.15
1,CUTLASS,gemm,cutlass_tensorop_s1688121gemm_f16_32x128_32x2_tn_align4,not_verified,success,universal,8192,8192,32768,f16:row,f16:column,f32:column,1,0,4,1,tensorop,f32,32,128,32,2,1,2,1,16,8,8,75,1024,1342177280,4398180728832,587.323,2.1283,7488.52
1,CUTLASS,gemm,cutlass_tensorop_s1688111gemm_f16_32x128_32x2_tn_align4,not_verified,success,universal,8192,8192,32768,f16:row,f16:column,f32:column,1,0,4,1,tensorop,f32,32,128,32,2,1,1,1,16,8,8,75,1024,1342177280,4398180728832,916.089,1.3645,4801.04
1,CUTLASS,gemm,cutlass_tensorop_s1688141gemm_f16_32x128_32x2_tn_align4,not_verified,success,universal,9216,9216,36864,f16:row,f16:column,f32:column,1,0,4,1,tensorop,f32,32,128,32,2,1,4,1,16,8,8,75,1024,1698693120,6262232186880,862.152,1.83498,7263.49
1,CUTLASS,gemm,cutlass_tensorop_s1688121gemm_f16_32x128_32x2_tn_align4,not_verified,success,universal,9216,9216,36864,f16:row,f16:column,f32:column,1,0,4,1,tensorop,f32,32,128,32,2,1,2,1,16,8,8,75,1024,1698693120,6262232186880,876.538,1.80486,7144.28
1,CUTLASS,gemm,cutlass_tensorop_s1688111gemm_f16_32x128_32x2_tn_align4,not_verified,success,universal,9216,9216,36864,f16:row,f16:column,f32:column,1,0,4,1,tensorop,f32,32,128,32,2,1,1,1,16,8,8,75,1024,1698693120,6262232186880,1490.12,1.06168,4202.51
1,CUTLASS,gemm,cutlass_tensorop_s1688141gemm_f16_32x128_32x2_tn_align4,not_verified,success,universal,10240,10240,40960,f16:row,f16:column,f32:column,1,0,4,1,tensorop,f32,32,128,32,2,1,4,1,16,8,8,75,1024,2097152000,8590144307200,1208.74,1.61583,7106.69
1,CUTLASS,gemm,cutlass_tensorop_s1688121gemm_f16_32x128_32x2_tn_align4,not_verified,success,universal,10240,10240,40960,f16:row,f16:column,f32:column,1,0,4,1,tensorop,f32,32,128,32,2,1,2,1,16,8,8,75,1024,2097152000,8590144307200,1236.49,1.57958,6947.22
1,CUTLASS,gemm,cutlass_tensorop_s1688111gemm_f16_32x128_32x2_tn_align4,not_verified,success,universal,10240,10240,40960,f16:row,f16:column,f32:column,1,0,4,1,tensorop,f32,32,128,32,2,1,1,1,16,8,8,75,1024,2097152000,8590144307200,2039.06,0.957856,4212.8
1,CUTLASS,gemm,cutlass_tensorop_s1688142gemm_f16_32x128_64x2_tn_align4,not_verified,success,universal,1024,1024,4096,f16:row,f16:column,f32:column,1,0,4,1,tensorop,f32,32,128,64,2,1,4,1,16,8,8,75,1024,20971520,8592031744,0.353105,55.3129,24332.8
1,CUTLASS,gemm,cutlass_tensorop_s1688141gemm_f16_32x128_64x2_tn_align4,not_verified,success,universal,1024,1024,4096,f16:row,f16:column,f32:column,1,0,4,1,tensorop,f32,32,128,64,2,1,4,1,16,8,8,75,1024,20971520,8592031744,0.359088,54.3913,23927.4
1,CUTLASS,gemm,cutlass_tensorop_s1688122gemm_f16_32x128_64x2_tn_align4,not_verified,success,universal,1024,1024,4096,f16:row,f16:column,f32:column,1,0,4,1,tensorop,f32,32,128,64,2,1,2,1,16,8,8,75,1024,20971520,8592031744,0.550461,35.4816,15608.8
1,CUTLASS,gemm,cutlass_tensorop_s1688121gemm_f16_32x128_64x2_tn_align4,not_verified,success,universal,1024,1024,4096,f16:row,f16:column,f32:column,1,0,4,1,tensorop,f32,32,128,64,2,1,2,1,16,8,8,75,1024,20971520,8592031744,0.550148,35.5018,15617.7
1,CUTLASS,gemm,cutlass_tensorop_s1688112gemm_f16_32x128_64x2_tn_align4,not_verified,success,universal,1024,1024,4096,f16:row,f16:column,f32:column,1,0,4,1,tensorop,f32,32,128,64,2,1,1,1,16,8,8,75,1024,20971520,8592031744,3.18809,6.12632,2695.04
1,CUTLASS,gemm,cutlass_tensorop_s1688111gemm_f16_32x128_64x2_tn_align4,not_verified,success,universal,1024,1024,4096,f16:row,f16:column,f32:column,1,0,4,1,tensorop,f32,32,128,64,2,1,1,1,16,8,8,75,1024,20971520,8592031744,3.20331,6.09722,2682.24
1,CUTLASS,gemm,cutlass_tensorop_s1688142gemm_f16_32x128_64x2_tn_align4,not_verified,success,universal,2048,2048,8192,f16:row,f16:column,f32:column,1,0,4,1,tensorop,f32,32,128,64,2,1,4,1,16,8,8,75,1024,83886080,68727865344,2.50024,31.247,27488.5
1,CUTLASS,gemm,cutlass_tensorop_s1688141gemm_f16_32x128_64x2_tn_align4,not_verified,success,universal,2048,2048,8192,f16:row,f16:column,f32:column,1,0,4,1,tensorop,f32,32,128,64,2,1,4,1,16,8,8,75,1024,83886080,68727865344,2.50076,31.2405,27482.8
1,CUTLASS,gemm,cutlass_tensorop_s1688122gemm_f16_32x128_64x2_tn_align4,not_verified,success,universal,2048,2048,8192,f16:row,f16:column,f32:column,1,0,4,1,tensorop,f32,32,128,64,2,1,2,1,16,8,8,75,1024,83886080,68727865344,3.89573,20.054,17641.9
1,CUTLASS,gemm,cutlass_tensorop_s1688121gemm_f16_32x128_64x2_tn_align4,not_verified,success,universal,2048,2048,8192,f16:row,f16:column,f32:column,1,0,4,1,tensorop,f32,32,128,64,2,1,2,1,16,8,8,75,1024,83886080,68727865344,3.89674,20.0488,17637.3
1,CUTLASS,gemm,cutlass_tensorop_s1688112gemm_f16_32x128_64x2_tn_align4,not_verified,success,universal,2048,2048,8192,f16:row,f16:column,f32:column,1,0,4,1,tensorop,f32,32,128,64,2,1,1,1,16,8,8,75,1024,83886080,68727865344,24.8834,3.13964,2762
1,CUTLASS,gemm,cutlass_tensorop_s1688111gemm_f16_32x128_64x2_tn_align4,not_verified,success,universal,2048,2048,8192,f16:row,f16:column,f32:column,1,0,4,1,tensorop,f32,32,128,64,2,1,1,1,16,8,8,75,1024,83886080,68727865344,23.6096,3.30903,2911.01
1,CUTLASS,gemm,cutlass_tensorop_s1688142gemm_f16_32x128_64x2_tn_align4,not_verified,success,universal,3072,3072,12288,f16:row,f16:column,f32:column,1,0,4,1,tensorop,f32,32,128,64,2,1,4,1,16,8,8,75,1024,188743680,231947108352,8.1922,21.4572,28313.2
1,CUTLASS,gemm,cutlass_tensorop_s1688141gemm_f16_32x128_64x2_tn_align4,not_verified,success,universal,3072,3072,12288,f16:row,f16:column,f32:column,1,0,4,1,tensorop,f32,32,128,64,2,1,4,1,16,8,8,75,1024,188743680,231947108352,8.15741,21.5487,28433.9
1,CUTLASS,gemm,cutlass_tensorop_s1688122gemm_f16_32x128_64x2_tn_align4,not_verified,success,universal,3072,3072,12288,f16:row,f16:column,f32:column,1,0,4,1,tensorop,f32,32,128,64,2,1,2,1,16,8,8,75,1024,188743680,231947108352,12.7627,13.773,18173.8
1,CUTLASS,gemm,cutlass_tensorop_s1688121gemm_f16_32x128_64x2_tn_align4,not_verified,success,universal,3072,3072,12288,f16:row,f16:column,f32:column,1,0,4,1,tensorop,f32,32,128,64,2,1,2,1,16,8,8,75,1024,188743680,231947108352,12.7654,13.7701,18170
1,CUTLASS,gemm,cutlass_tensorop_s1688112gemm_f16_32x128_64x2_tn_align4,not_verified,success,universal,3072,3072,12288,f16:row,f16:column,f32:column,1,0,4,1,tensorop,f32,32,128,64,2,1,1,1,16,8,8,75,1024,188743680,231947108352,80.3201,2.18851,2887.78
1,CUTLASS,gemm,cutlass_tensorop_s1688111gemm_f16_32x128_64x2_tn_align4,not_verified,success,universal,3072,3072,12288,f16:row,f16:column,f32:column,1,0,4,1,tensorop,f32,32,128,64,2,1,1,1,16,8,8,75,1024,188743680,231947108352,80.1934,2.19197,2892.35
1,CUTLASS,gemm,cutlass_tensorop_s1688142gemm_f16_32x128_64x2_tn_align4,not_verified,success,universal,4096,4096,16384,f16:row,f16:column,f32:column,1,0,4,1,tensorop,f32,32,128,64,2,1,4,1,16,8,8,75,1024,335544320,549789368320,19.4428,16.0728,28277.3
1,CUTLASS,gemm,cutlass_tensorop_s1688141gemm_f16_32x128_64x2_tn_align4,not_verified,success,universal,4096,4096,16384,f16:row,f16:column,f32:column,1,0,4,1,tensorop,f32,32,128,64,2,1,4,1,16,8,8,75,1024,335544320,549789368320,19.4465,16.0697,28271.9
1,CUTLASS,gemm,cutlass_tensorop_s1688122gemm_f16_32x128_64x2_tn_align4,not_verified,success,universal,4096,4096,16384,f16:row,f16:column,f32:column,1,0,4,1,tensorop,f32,32,128,64,2,1,2,1,16,8,8,75,1024,335544320,549789368320,29.784,10.4922,18459.2
1,CUTLASS,gemm,cutlass_tensorop_s1688121gemm_f16_32x128_64x2_tn_align4,not_verified,success,universal,4096,4096,16384,f16:row,f16:column,f32:column,1,0,4,1,tensorop,f32,32,128,64,2,1,2,1,16,8,8,75,1024,335544320,549789368320,29.7965,10.4878,18451.5
1,CUTLASS,gemm,cutlass_tensorop_s1688112gemm_f16_32x128_64x2_tn_align4,not_verified,success,universal,4096,4096,16384,f16:row,f16:column,f32:column,1,0,4,1,tensorop,f32,32,128,64,2,1,1,1,16,8,8,75,1024,335544320,549789368320,188.168,1.66075,2921.81
1,CUTLASS,gemm,cutlass_tensorop_s1688111gemm_f16_32x128_64x2_tn_align4,not_verified,success,universal,4096,4096,16384,f16:row,f16:column,f32:column,1,0,4,1,tensorop,f32,32,128,64,2,1,1,1,16,8,8,75,1024,335544320,549789368320,187.07,1.6705,2938.96
1,CUTLASS,gemm,cutlass_tensorop_s1688142gemm_f16_32x128_64x2_tn_align4,not_verified,success,universal,5120,5120,20480,f16:row,f16:column,f32:column,1,0,4,1,tensorop,f32,32,128,64,2,1,4,1,16,8,8,75,1024,524288000,1073794252800,51.2593,9.52572,20948.3
1,CUTLASS,gemm,cutlass_tensorop_s1688141gemm_f16_32x128_64x2_tn_align4,not_verified,success,universal,5120,5120,20480,f16:row,f16:column,f32:column,1,0,4,1,tensorop,f32,32,128,64,2,1,4,1,16,8,8,75,1024,524288000,1073794252800,52.4032,9.31778,20491
1,CUTLASS,gemm,cutlass_tensorop_s1688122gemm_f16_32x128_64x2_tn_align4,not_verified,success,universal,5120,5120,20480,f16:row,f16:column,f32:column,1,0,4,1,tensorop,f32,32,128,64,2,1,2,1,16,8,8,75,1024,524288000,1073794252800,57.8044,8.44713,18576.3
1,CUTLASS,gemm,cutlass_tensorop_s1688121gemm_f16_32x128_64x2_tn_align4,not_verified,success,universal,5120,5120,20480,f16:row,f16:column,f32:column,1,0,4,1,tensorop,f32,32,128,64,2,1,2,1,16,8,8,75,1024,524288000,1073794252800,57.8394,8.44202,18565.1
1,CUTLASS,gemm,cutlass_tensorop_s1688112gemm_f16_32x128_64x2_tn_align4,not_verified,success,universal,5120,5120,20480,f16:row,f16:column,f32:column,1,0,4,1,tensorop,f32,32,128,64,2,1,1,1,16,8,8,75,1024,524288000,1073794252800,362.886,1.34555,2959.04
1,CUTLASS,gemm,cutlass_tensorop_s1688111gemm_f16_32x128_64x2_tn_align4,not_verified,success,universal,5120,5120,20480,f16:row,f16:column,f32:column,1,0,4,1,tensorop,f32,32,128,64,2,1,1,1,16,8,8,75,1024,524288000,1073794252800,362.375,1.34745,2963.21
1,CUTLASS,gemm,cutlass_tensorop_s1688142gemm_f16_32x128_64x2_tn_align4,not_verified,success,universal,6144,6144,24576,f16:row,f16:column,f32:column,1,0,4,1,tensorop,f32,32,128,64,2,1,4,1,16,8,8,75,1024,754974720,1855501369344,63.4906,11.0745,29224.8
1,CUTLASS,gemm,cutlass_tensorop_s1688141gemm_f16_32x128_64x2_tn_align4,not_verified,success,universal,6144,6144,24576,f16:row,f16:column,f32:column,1,0,4,1,tensorop,f32,32,128,64,2,1,4,1,16,8,8,75,1024,754974720,1855501369344,63.4903,11.0745,29224.9
1,CUTLASS,gemm,cutlass_tensorop_s1688122gemm_f16_32x128_64x2_tn_align4,not_verified,success,universal,6144,6144,24576,f16:row,f16:column,f32:column,1,0,4,1,tensorop,f32,32,128,64,2,1,2,1,16,8,8,75,1024,754974720,1855501369344,99.1304,7.09293,18717.8
1,CUTLASS,gemm,cutlass_tensorop_s1688121gemm_f16_32x128_64x2_tn_align4,not_verified,success,universal,6144,6144,24576,f16:row,f16:column,f32:column,1,0,4,1,tensorop,f32,32,128,64,2,1,2,1,16,8,8,75,1024,754974720,1855501369344,99.1552,7.09116,18713.1
1,CUTLASS,gemm,cutlass_tensorop_s1688112gemm_f16_32x128_64x2_tn_align4,not_verified,success,universal,6144,6144,24576,f16:row,f16:column,f32:column,1,0,4,1,tensorop,f32,32,128,64,2,1,1,1,16,8,8,75,1024,754974720,1855501369344,630.743,1.11476,2941.77
1,CUTLASS,gemm,cutlass_tensorop_s1688111gemm_f16_32x128_64x2_tn_align4,not_verified,success,universal,6144,6144,24576,f16:row,f16:column,f32:column,1,0,4,1,tensorop,f32,32,128,64,2,1,1,1,16,8,8,75,1024,754974720,1855501369344,628.031,1.11957,2954.48
1,CUTLASS,gemm,cutlass_tensorop_s1688142gemm_f16_32x128_64x2_tn_align4,not_verified,success,universal,7168,7168,28672,f16:row,f16:column,f32:column,1,0,4,1,tensorop,f32,32,128,64,2,1,4,1,16,8,8,75,1024,1027604480,2946450325504,101.324,9.44522,29079.4
1,CUTLASS,gemm,cutlass_tensorop_s1688141gemm_f16_32x128_64x2_tn_align4,not_verified,success,universal,7168,7168,28672,f16:row,f16:column,f32:column,1,0,4,1,tensorop,f32,32,128,64,2,1,4,1,16,8,8,75,1024,1027604480,2946450325504,101.626,9.41719,28993.1
1,CUTLASS,gemm,cutlass_tensorop_s1688122gemm_f16_32x128_64x2_tn_align4,not_verified,success,universal,7168,7168,28672,f16:row,f16:column,f32:column,1,0,4,1,tensorop,f32,32,128,64,2,1,2,1,16,8,8,75,1024,1027604480,2946450325504,157.025,6.09478,18764.2
1,CUTLASS,gemm,cutlass_tensorop_s1688121gemm_f16_32x128_64x2_tn_align4,not_verified,success,universal,7168,7168,28672,f16:row,f16:column,f32:column,1,0,4,1,tensorop,f32,32,128,64,2,1,2,1,16,8,8,75,1024,1027604480,2946450325504,157.237,6.08655,18738.9
1,CUTLASS,gemm,cutlass_tensorop_s1688112gemm_f16_32x128_64x2_tn_align4,not_verified,success,universal,7168,7168,28672,f16:row,f16:column,f32:column,1,0,4,1,tensorop,f32,32,128,64,2,1,1,1,16,8,8,75,1024,1027604480,2946450325504,991.866,0.964879,2970.61
1,CUTLASS,gemm,cutlass_tensorop_s1688111gemm_f16_32x128_64x2_tn_align4,not_verified,success,universal,7168,7168,28672,f16:row,f16:column,f32:column,1,0,4,1,tensorop,f32,32,128,64,2,1,1,1,16,8,8,75,1024,1027604480,2946450325504,996.454,0.960437,2956.93
1,CUTLASS,gemm,cutlass_tensorop_s1688142gemm_f16_32x128_64x2_tn_align4,not_verified,success,universal,8192,8192,32768,f16:row,f16:column,f32:column,1,0,4,1,tensorop,f32,32,128,64,2,1,4,1,16,8,8,75,1024,1342177280,4398180728832,151.851,8.23173,28963.7
1,CUTLASS,gemm,cutlass_tensorop_s1688141gemm_f16_32x128_64x2_tn_align4,not_verified,success,universal,8192,8192,32768,f16:row,f16:column,f32:column,1,0,4,1,tensorop,f32,32,128,64,2,1,4,1,16,8,8,75,1024,1342177280,4398180728832,151.841,8.2323,28965.7
1,CUTLASS,gemm,cutlass_tensorop_s1688122gemm_f16_32x128_64x2_tn_align4,not_verified,success,universal,8192,8192,32768,f16:row,f16:column,f32:column,1,0,4,1,tensorop,f32,32,128,64,2,1,2,1,16,8,8,75,1024,1342177280,4398180728832,234.082,5.34001,18789.1
1,CUTLASS,gemm,cutlass_tensorop_s1688121gemm_f16_32x128_64x2_tn_align4,not_verified,success,universal,8192,8192,32768,f16:row,f16:column,f32:column,1,0,4,1,tensorop,f32,32,128,64,2,1,2,1,16,8,8,75,1024,1342177280,4398180728832,234.046,5.34083,18791.9
1,CUTLASS,gemm,cutlass_tensorop_s1688112gemm_f16_32x128_64x2_tn_align4,not_verified,success,universal,8192,8192,32768,f16:row,f16:column,f32:column,1,0,4,1,tensorop,f32,32,128,64,2,1,1,1,16,8,8,75,1024,1342177280,4398180728832,1489.4,0.839264,2952.99
1,CUTLASS,gemm,cutlass_tensorop_s1688111gemm_f16_32x128_64x2_tn_align4,not_verified,success,universal,8192,8192,32768,f16:row,f16:column,f32:column,1,0,4,1,tensorop,f32,32,128,64,2,1,1,1,16,8,8,75,1024,1342177280,4398180728832,1497.56,0.83469,2936.89
1,CUTLASS,gemm,cutlass_tensorop_s1688142gemm_f16_32x128_64x2_tn_align4,not_verified,success,universal,9216,9216,36864,f16:row,f16:column,f32:column,1,0,4,1,tensorop,f32,32,128,64,2,1,4,1,16,8,8,75,1024,1698693120,6262232186880,213.899,7.39617,29276.6
1,CUTLASS,gemm,cutlass_tensorop_s1688141gemm_f16_32x128_64x2_tn_align4,not_verified,success,universal,9216,9216,36864,f16:row,f16:column,f32:column,1,0,4,1,tensorop,f32,32,128,64,2,1,4,1,16,8,8,75,1024,1698693120,6262232186880,213.161,7.42178,29378
1,CUTLASS,gemm,cutlass_tensorop_s1688122gemm_f16_32x128_64x2_tn_align4,not_verified,success,universal,9216,9216,36864,f16:row,f16:column,f32:column,1,0,4,1,tensorop,f32,32,128,64,2,1,2,1,16,8,8,75,1024,1698693120,6262232186880,332.593,4.75666,18828.5
1,CUTLASS,gemm,cutlass_tensorop_s1688121gemm_f16_32x128_64x2_tn_align4,not_verified,success,universal,9216,9216,36864,f16:row,f16:column,f32:column,1,0,4,1,tensorop,f32,32,128,64,2,1,2,1,16,8,8,75,1024,1698693120,6262232186880,332.679,4.75544,18823.7
1,CUTLASS,gemm,cutlass_tensorop_s1688112gemm_f16_32x128_64x2_tn_align4,not_verified,success,universal,9216,9216,36864,f16:row,f16:column,f32:column,1,0,4,1,tensorop,f32,32,128,64,2,1,1,1,16,8,8,75,1024,1698693120,6262232186880,2116.34,0.747531,2958.99
1,CUTLASS,gemm,cutlass_tensorop_s1688111gemm_f16_32x128_64x2_tn_align4,not_verified,success,universal,9216,9216,36864,f16:row,f16:column,f32:column,1,0,4,1,tensorop,f32,32,128,64,2,1,1,1,16,8,8,75,1024,1698693120,6262232186880,2117.75,0.747035,2957.02
1,CUTLASS,gemm,cutlass_tensorop_s1688142gemm_f16_32x128_64x2_tn_align4,not_verified,success,universal,10240,10240,40960,f16:row,f16:column,f32:column,1,0,4,1,tensorop,f32,32,128,64,2,1,4,1,16,8,8,75,1024,2097152000,8590144307200,733.924,2.66121,11704.4
1,CUTLASS,gemm,cutlass_tensorop_s1688141gemm_f16_32x128_64x2_tn_align4,not_verified,success,universal,10240,10240,40960,f16:row,f16:column,f32:column,1,0,4,1,tensorop,f32,32,128,64,2,1,4,1,16,8,8,75,1024,2097152000,8590144307200,732.946,2.66476,11720
1,CUTLASS,gemm,cutlass_tensorop_s1688122gemm_f16_32x128_64x2_tn_align4,not_verified,success,universal,10240,10240,40960,f16:row,f16:column,f32:column,1,0,4,1,tensorop,f32,32,128,64,2,1,2,1,16,8,8,75,1024,2097152000,8590144307200,454.188,4.30026,18913.2
1,CUTLASS,gemm,cutlass_tensorop_s1688121gemm_f16_32x128_64x2_tn_align4,not_verified,success,universal,10240,10240,40960,f16:row,f16:column,f32:column,1,0,4,1,tensorop,f32,32,128,64,2,1,2,1,16,8,8,75,1024,2097152000,8590144307200,454.181,4.30032,18913.5
1,CUTLASS,gemm,cutlass_tensorop_s1688112gemm_f16_32x128_64x2_tn_align4,not_verified,success,universal,10240,10240,40960,f16:row,f16:column,f32:column,1,0,4,1,tensorop,f32,32,128,64,2,1,1,1,16,8,8,75,1024,2097152000,8590144307200,2881.48,0.67782,2981.15
1,CUTLASS,gemm,cutlass_tensorop_s1688111gemm_f16_32x128_64x2_tn_align4,not_verified,success,universal,10240,10240,40960,f16:row,f16:column,f32:column,1,0,4,1,tensorop,f32,32,128,64,2,1,1,1,16,8,8,75,1024,2097152000,8590144307200,2882.14,0.677666,2980.48
1,CUTLASS,gemm,cutlass_tensorop_s1688211gemm_f16_64x32_32x2_tn_align4,not_verified,success,universal,1024,1024,4096,f16:row,f16:column,f32:column,1,0,4,1,tensorop,f32,64,32,32,2,2,1,1,16,8,8,75,1024,20971520,8592031744,0.492567,39.652,17443.4
1,CUTLASS,gemm,cutlass_tensorop_s1688111gemm_f16_64x32_32x2_tn_align4,not_verified,success,universal,1024,1024,4096,f16:row,f16:column,f32:column,1,0,4,1,tensorop,f32,64,32,32,2,1,1,1,16,8,8,75,1024,20971520,8592031744,0.474652,41.1486,18101.8
1,CUTLASS,gemm,cutlass_tensorop_s1688211gemm_f16_64x32_32x2_tn_align4,not_verified,success,universal,2048,2048,8192,f16:row,f16:column,f32:column,1,0,4,1,tensorop,f32,64,32,32,2,2,1,1,16,8,8,75,1024,83886080,68727865344,3.25496,24.0019,21114.8
1,CUTLASS,gemm,cutlass_tensorop_s1688111gemm_f16_64x32_32x2_tn_align4,not_verified,success,universal,2048,2048,8192,f16:row,f16:column,f32:column,1,0,4,1,tensorop,f32,64,32,32,2,1,1,1,16,8,8,75,1024,83886080,68727865344,2.92717,26.6896,23479.3
1,CUTLASS,gemm,cutlass_tensorop_s1688211gemm_f16_64x32_32x2_tn_align4,not_verified,success,universal,3072,3072,12288,f16:row,f16:column,f32:column,1,0,4,1,tensorop,f32,64,32,32,2,2,1,1,16,8,8,75,1024,188743680,231947108352,10.7511,16.35,21574.2
1,CUTLASS,gemm,cutlass_tensorop_s1688111gemm_f16_64x32_32x2_tn_align4,not_verified,success,universal,3072,3072,12288,f16:row,f16:column,f32:column,1,0,4,1,tensorop,f32,64,32,32,2,1,1,1,16,8,8,75,1024,188743680,231947108352,9.72768,18.0702,23844
1,CUTLASS,gemm,cutlass_tensorop_s1688211gemm_f16_64x32_32x2_tn_align4,not_verified,success,universal,4096,4096,16384,f16:row,f16:column,f32:column,1,0,4,1,tensorop,f32,64,32,32,2,2,1,1,16,8,8,75,1024,335544320,549789368320,24.5237,12.7428,22418.7
1,CUTLASS,gemm,cutlass_tensorop_s1688111gemm_f16_64x32_32x2_tn_align4,not_verified,success,universal,4096,4096,16384,f16:row,f16:column,f32:column,1,0,4,1,tensorop,f32,64,32,32,2,1,1,1,16,8,8,75,1024,335544320,549789368320,22.9141,13.6379,23993.5
1,CUTLASS,gemm,cutlass_tensorop_s1688211gemm_f16_64x32_32x2_tn_align4,not_verified,success,universal,5120,5120,20480,f16:row,f16:column,f32:column,1,0,4,1,tensorop,f32,64,32,32,2,2,1,1,16,8,8,75,1024,524288000,1073794252800,53.0809,9.19881,20229.4
1,CUTLASS,gemm,cutlass_tensorop_s1688111gemm_f16_64x32_32x2_tn_align4,not_verified,success,universal,5120,5120,20480,f16:row,f16:column,f32:column,1,0,4,1,tensorop,f32,64,32,32,2,1,1,1,16,8,8,75,1024,524288000,1073794252800,46.2247,10.5632,23229.9
1,CUTLASS,gemm,cutlass_tensorop_s1688211gemm_f16_64x32_32x2_tn_align4,not_verified,success,universal,6144,6144,24576,f16:row,f16:column,f32:column,1,0,4,1,tensorop,f32,64,32,32,2,2,1,1,16,8,8,75,1024,754974720,1855501369344,90.4985,7.76947,20503.1
1,CUTLASS,gemm,cutlass_tensorop_s1688111gemm_f16_64x32_32x2_tn_align4,not_verified,success,universal,6144,6144,24576,f16:row,f16:column,f32:column,1,0,4,1,tensorop,f32,64,32,32,2,1,1,1,16,8,8,75,1024,754974720,1855501369344,79.734,8.81839,23271.2
1,CUTLASS,gemm,cutlass_tensorop_s1688211gemm_f16_64x32_32x2_tn_align4,not_verified,success,universal,7168,7168,28672,f16:row,f16:column,f32:column,1,0,4,1,tensorop,f32,64,32,32,2,2,1,1,16,8,8,75,1024,1027604480,2946450325504,144.695,6.61413,20363.2
1,CUTLASS,gemm,cutlass_tensorop_s1688111gemm_f16_64x32_32x2_tn_align4,not_verified,success,universal,7168,7168,28672,f16:row,f16:column,f32:column,1,0,4,1,tensorop,f32,64,32,32,2,1,1,1,16,8,8,75,1024,1027604480,2946450325504,129.024,7.41748,22836.5
1,CUTLASS,gemm,cutlass_tensorop_s1688211gemm_f16_64x32_32x2_tn_align4,not_verified,success,universal,8192,8192,32768,f16:row,f16:column,f32:column,1,0,4,1,tensorop,f32,64,32,32,2,2,1,1,16,8,8,75,1024,1342177280,4398180728832,248.903,5.02204,17670.3
1,CUTLASS,gemm,cutlass_tensorop_s1688111gemm_f16_64x32_32x2_tn_align4,not_verified,success,universal,8192,8192,32768,f16:row,f16:column,f32:column,1,0,4,1,tensorop,f32,64,32,32,2,1,1,1,16,8,8,75,1024,1342177280,4398180728832,199.122,6.27756,22087.9
1,CUTLASS,gemm,cutlass_tensorop_s1688211gemm_f16_64x32_32x2_tn_align4,not_verified,success,universal,9216,9216,36864,f16:row,f16:column,f32:column,1,0,4,1,tensorop,f32,64,32,32,2,2,1,1,16,8,8,75,1024,1698693120,6262232186880,653.992,2.41904,9575.4
1,CUTLASS,gemm,cutlass_tensorop_s1688111gemm_f16_64x32_32x2_tn_align4,not_verified,success,universal,9216,9216,36864,f16:row,f16:column,f32:column,1,0,4,1,tensorop,f32,64,32,32,2,1,1,1,16,8,8,75,1024,1698693120,6262232186880,311.641,5.07646,20094.4
1,CUTLASS,gemm,cutlass_tensorop_s1688211gemm_f16_64x32_32x2_tn_align4,not_verified,success,universal,10240,10240,40960,f16:row,f16:column,f32:column,1,0,4,1,tensorop,f32,64,32,32,2,2,1,1,16,8,8,75,1024,2097152000,8590144307200,979.614,1.99377,8768.91
1,CUTLASS,gemm,cutlass_tensorop_s1688111gemm_f16_64x32_32x2_tn_align4,not_verified,success,universal,10240,10240,40960,f16:row,f16:column,f32:column,1,0,4,1,tensorop,f32,64,32,32,2,1,1,1,16,8,8,75,1024,2097152000,8590144307200,828.943,2.35616,10362.8
1,CUTLASS,gemm,cutlass_tensorop_s1688212gemm_f16_64x32_64x2_tn_align4,not_verified,success,universal,1024,1024,4096,f16:row,f16:column,f32:column,1,0,4,1,tensorop,f32,64,32,64,2,2,1,1,16,8,8,75,1024,20971520,8592031744,0.366272,53.3244,23458.1
1,CUTLASS,gemm,cutlass_tensorop_s1688211gemm_f16_64x32_64x2_tn_align4,not_verified,success,universal,1024,1024,4096,f16:row,f16:column,f32:column,1,0,4,1,tensorop,f32,64,32,64,2,2,1,1,16,8,8,75,1024,20971520,8592031744,0.349763,55.8414,24565.3
1,CUTLASS,gemm,cutlass_tensorop_s1688112gemm_f16_64x32_64x2_tn_align4,not_verified,success,universal,1024,1024,4096,f16:row,f16:column,f32:column,1,0,4,1,tensorop,f32,64,32,64,2,1,1,1,16,8,8,75,1024,20971520,8592031744,0.534896,36.5141,16063
1,CUTLASS,gemm,cutlass_tensorop_s1688111gemm_f16_64x32_64x2_tn_align4,not_verified,success,universal,1024,1024,4096,f16:row,f16:column,f32:column,1,0,4,1,tensorop,f32,64,32,64,2,1,1,1,16,8,8,75,1024,20971520,8592031744,0.535,36.507,16059.9
1,CUTLASS,gemm,cutlass_tensorop_s1688212gemm_f16_64x32_64x2_tn_align4,not_verified,success,universal,2048,2048,8192,f16:row,f16:column,f32:column,1,0,4,1,tensorop,f32,64,32,64,2,2,1,1,16,8,8,75,1024,83886080,68727865344,2.59166,30.1447,26518.8
1,CUTLASS,gemm,cutlass_tensorop_s1688211gemm_f16_64x32_64x2_tn_align4,not_verified,success,universal,2048,2048,8192,f16:row,f16:column,f32:column,1,0,4,1,tensorop,f32,64,32,64,2,2,1,1,16,8,8,75,1024,83886080,68727865344,2.56042,30.5126,26842.5
1,CUTLASS,gemm,cutlass_tensorop_s1688112gemm_f16_64x32_64x2_tn_align4,not_verified,success,universal,2048,2048,8192,f16:row,f16:column,f32:column,1,0,4,1,tensorop,f32,64,32,64,2,1,1,1,16,8,8,75,1024,83886080,68727865344,3.65065,21.4003,18826.2
1,CUTLASS,gemm,cutlass_tensorop_s1688111gemm_f16_64x32_64x2_tn_align4,not_verified,success,universal,2048,2048,8192,f16:row,f16:column,f32:column,1,0,4,1,tensorop,f32,64,32,64,2,1,1,1,16,8,8,75,1024,83886080,68727865344,3.65085,21.3991,18825.2
1,CUTLASS,gemm,cutlass_tensorop_s1688212gemm_f16_64x32_64x2_tn_align4,not_verified,success,universal,3072,3072,12288,f16:row,f16:column,f32:column,1,0,4,1,tensorop,f32,64,32,64,2,2,1,1,16,8,8,75,1024,188743680,231947108352,8.29771,21.1843,27953.2
1,CUTLASS,gemm,cutlass_tensorop_s1688211gemm_f16_64x32_64x2_tn_align4,not_verified,success,universal,3072,3072,12288,f16:row,f16:column,f32:column,1,0,4,1,tensorop,f32,64,32,64,2,2,1,1,16,8,8,75,1024,188743680,231947108352,8.33059,21.1007,27842.8
1,CUTLASS,gemm,cutlass_tensorop_s1688112gemm_f16_64x32_64x2_tn_align4,not_verified,success,universal,3072,3072,12288,f16:row,f16:column,f32:column,1,0,4,1,tensorop,f32,64,32,64,2,1,1,1,16,8,8,75,1024,188743680,231947108352,11.7503,14.9598,19739.8
1,CUTLASS,gemm,cutlass_tensorop_s1688111gemm_f16_64x32_64x2_tn_align4,not_verified,success,universal,3072,3072,12288,f16:row,f16:column,f32:column,1,0,4,1,tensorop,f32,64,32,64,2,1,1,1,16,8,8,75,1024,188743680,231947108352,11.7515,14.9582,19737.7
1,CUTLASS,gemm,cutlass_tensorop_s1688212gemm_f16_64x32_64x2_tn_align4,not_verified,success,universal,4096,4096,16384,f16:row,f16:column,f32:column,1,0,4,1,tensorop,f32,64,32,64,2,2,1,1,16,8,8,75,1024,335544320,549789368320,19.8694,15.7277,27670.1
1,CUTLASS,gemm,cutlass_tensorop_s1688211gemm_f16_64x32_64x2_tn_align4,not_verified,success,universal,4096,4096,16384,f16:row,f16:column,f32:column,1,0,4,1,tensorop,f32,64,32,64,2,2,1,1,16,8,8,75,1024,335544320,549789368320,19.9638,15.6533,27539.3
1,CUTLASS,gemm,cutlass_tensorop_s1688112gemm_f16_64x32_64x2_tn_align4,not_verified,success,universal,4096,4096,16384,f16:row,f16:column,f32:column,1,0,4,1,tensorop,f32,64,32,64,2,1,1,1,16,8,8,75,1024,335544320,549789368320,27.2668,11.4608,20163.3
1,CUTLASS,gemm,cutlass_tensorop_s1688111gemm_f16_64x32_64x2_tn_align4,not_verified,success,universal,4096,4096,16384,f16:row,f16:column,f32:column,1,0,4,1,tensorop,f32,64,32,64,2,1,1,1,16,8,8,75,1024,335544320,549789368320,27.2794,11.4555,20154
1,CUTLASS,gemm,cutlass_tensorop_s1688212gemm_f16_64x32_64x2_tn_align4,not_verified,success,universal,5120,5120,20480,f16:row,f16:column,f32:column,1,0,4,1,tensorop,f32,64,32,64,2,2,1,1,16,8,8,75,1024,524288000,1073794252800,39.1202,12.4815,27448.6
1,CUTLASS,gemm,cutlass_tensorop_s1688211gemm_f16_64x32_64x2_tn_align4,not_verified,success,universal,5120,5120,20480,f16:row,f16:column,f32:column,1,0,4,1,tensorop,f32,64,32,64,2,2,1,1,16,8,8,75,1024,524288000,1073794252800,38.1809,12.7886,28123.9
1,CUTLASS,gemm,cutlass_tensorop_s1688112gemm_f16_64x32_64x2_tn_align4,not_verified,success,universal,5120,5120,20480,f16:row,f16:column,f32:column,1,0,4,1,tensorop,f32,64,32,64,2,1,1,1,16,8,8,75,1024,524288000,1073794252800,52.4474,9.30992,20473.7
1,CUTLASS,gemm,cutlass_tensorop_s1688111gemm_f16_64x32_64x2_tn_align4,not_verified,success,universal,5120,5120,20480,f16:row,f16:column,f32:column,1,0,4,1,tensorop,f32,64,32,64,2,1,1,1,16,8,8,75,1024,524288000,1073794252800,52.4778,9.30453,20461.9
1,CUTLASS,gemm,cutlass_tensorop_s1688212gemm_f16_64x32_64x2_tn_align4,not_verified,success,universal,6144,6144,24576,f16:row,f16:column,f32:column,1,0,4,1,tensorop,f32,64,32,64,2,2,1,1,16,8,8,75,1024,754974720,1855501369344,65.7009,10.7019,28241.6
1,CUTLASS,gemm,cutlass_tensorop_s1688211gemm_f16_64x32_64x2_tn_align4,not_verified,success,universal,6144,6144,24576,f16:row,f16:column,f32:column,1,0,4,1,tensorop,f32,64,32,64,2,2,1,1,16,8,8,75,1024,754974720,1855501369344,64.3893,10.9199,28816.9
1,CUTLASS,gemm,cutlass_tensorop_s1688112gemm_f16_64x32_64x2_tn_align4,not_verified,success,universal,6144,6144,24576,f16:row,f16:column,f32:column,1,0,4,1,tensorop,f32,64,32,64,2,1,1,1,16,8,8,75,1024,754974720,1855501369344,89.9883,7.81352,20619.4
1,CUTLASS,gemm,cutlass_tensorop_s1688111gemm_f16_64x32_64x2_tn_align4,not_verified,success,universal,6144,6144,24576,f16:row,f16:column,f32:column,1,0,4,1,tensorop,f32,64,32,64,2,1,1,1,16,8,8,75,1024,754974720,1855501369344,90.0515,7.80803,20604.9
1,CUTLASS,gemm,cutlass_tensorop_s1688212gemm_f16_64x32_64x2_tn_align4,not_verified,success,universal,7168,7168,28672,f16:row,f16:column,f32:column,1,0,4,1,tensorop,f32,64,32,64,2,2,1,1,16,8,8,75,1024,1027604480,2946450325504,107.867,8.87232,27315.6
1,CUTLASS,gemm,cutlass_tensorop_s1688211gemm_f16_64x32_64x2_tn_align4,not_verified,success,universal,7168,7168,28672,f16:row,f16:column,f32:column,1,0,4,1,tensorop,f32,64,32,64,2,2,1,1,16,8,8,75,1024,1027604480,2946450325504,107.421,8.90914,27428.9
1,CUTLASS,gemm,cutlass_tensorop_s1688112gemm_f16_64x32_64x2_tn_align4,not_verified,success,universal,7168,7168,28672,f16:row,f16:column,f32:column,1,0,4,1,tensorop,f32,64,32,64,2,1,1,1,16,8,8,75,1024,1027604480,2946450325504,142.157,6.73223,20726.8
1,CUTLASS,gemm,cutlass_tensorop_s1688111gemm_f16_64x32_64x2_tn_align4,not_verified,success,universal,7168,7168,28672,f16:row,f16:column,f32:column,1,0,4,1,tensorop,f32,64,32,64,2,1,1,1,16,8,8,75,1024,1027604480,2946450325504,142.195,6.7304,20721.2
1,CUTLASS,gemm,cutlass_tensorop_s1688212gemm_f16_64x32_64x2_tn_align4,not_verified,success,universal,8192,8192,32768,f16:row,f16:column,f32:column,1,0,4,1,tensorop,f32,64,32,64,2,2,1,1,16,8,8,75,1024,1342177280,4398180728832,158.733,7.87488,27708.1
1,CUTLASS,gemm,cutlass_tensorop_s1688211gemm_f16_64x32_64x2_tn_align4,not_verified,success,universal,8192,8192,32768,f16:row,f16:column,f32:column,1,0,4,1,tensorop,f32,64,32,64,2,2,1,1,16,8,8,75,1024,1342177280,4398180728832,162.088,7.71185,27134.5
1,CUTLASS,gemm,cutlass_tensorop_s1688112gemm_f16_64x32_64x2_tn_align4,not_verified,success,universal,8192,8192,32768,f16:row,f16:column,f32:column,1,0,4,1,tensorop,f32,64,32,64,2,1,1,1,16,8,8,75,1024,1342177280,4398180728832,212.227,5.88992,20723.9
1,CUTLASS,gemm,cutlass_tensorop_s1688111gemm_f16_64x32_64x2_tn_align4,not_verified,success,universal,8192,8192,32768,f16:row,f16:column,f32:column,1,0,4,1,tensorop,f32,64,32,64,2,1,1,1,16,8,8,75,1024,1342177280,4398180728832,212.199,5.89069,20726.6
1,CUTLASS,gemm,cutlass_tensorop_s1688212gemm_f16_64x32_64x2_tn_align4,not_verified,success,universal,9216,9216,36864,f16:row,f16:column,f32:column,1,0,4,1,tensorop,f32,64,32,64,2,2,1,1,16,8,8,75,1024,1698693120,6262232186880,231.248,6.84127,27080.1
1,CUTLASS,gemm,cutlass_tensorop_s1688211gemm_f16_64x32_64x2_tn_align4,not_verified,success,universal,9216,9216,36864,f16:row,f16:column,f32:column,1,0,4,1,tensorop,f32,64,32,64,2,2,1,1,16,8,8,75,1024,1698693120,6262232186880,230.213,6.87204,27201.9
1,CUTLASS,gemm,cutlass_tensorop_s1688112gemm_f16_64x32_64x2_tn_align4,not_verified,success,universal,9216,9216,36864,f16:row,f16:column,f32:column,1,0,4,1,tensorop,f32,64,32,64,2,1,1,1,16,8,8,75,1024,1698693120,6262232186880,301.705,5.24364,20756.1
1,CUTLASS,gemm,cutlass_tensorop_s1688111gemm_f16_64x32_64x2_tn_align4,not_verified,success,universal,9216,9216,36864,f16:row,f16:column,f32:column,1,0,4,1,tensorop,f32,64,32,64,2,1,1,1,16,8,8,75,1024,1698693120,6262232186880,301.793,5.2421,20750.1
1,CUTLASS,gemm,cutlass_tensorop_s1688212gemm_f16_64x32_64x2_tn_align4,not_verified,success,universal,10240,10240,40960,f16:row,f16:column,f32:column,1,0,4,1,tensorop,f32,64,32,64,2,2,1,1,16,8,8,75,1024,2097152000,8590144307200,330.763,5.90491,25970.7
1,CUTLASS,gemm,cutlass_tensorop_s1688211gemm_f16_64x32_64x2_tn_align4,not_verified,success,universal,10240,10240,40960,f16:row,f16:column,f32:column,1,0,4,1,tensorop,f32,64,32,64,2,2,1,1,16,8,8,75,1024,2097152000,8590144307200,335.661,5.81875,25591.7
1,CUTLASS,gemm,cutlass_tensorop_s1688112gemm_f16_64x32_64x2_tn_align4,not_verified,success,universal,10240,10240,40960,f16:row,f16:column,f32:column,1,0,4,1,tensorop,f32,64,32,64,2,1,1,1,16,8,8,75,1024,2097152000,8590144307200,412.789,4.73154,20810
1,CUTLASS,gemm,cutlass_tensorop_s1688111gemm_f16_64x32_64x2_tn_align4,not_verified,success,universal,10240,10240,40960,f16:row,f16:column,f32:column,1,0,4,1,tensorop,f32,64,32,64,2,1,1,1,16,8,8,75,1024,2097152000,8590144307200,412.722,4.7323,20813.4
1,CUTLASS,gemm,cutlass_tensorop_s1688221gemm_f16_64x64_32x2_tn_align4,not_verified,success,universal,1024,1024,4096,f16:row,f16:column,f32:column,1,0,4,1,tensorop,f32,64,64,32,2,2,2,1,16,8,8,75,1024,20971520,8592031744,0.305535,63.9248,28121.3
1,CUTLASS,gemm,cutlass_tensorop_s1688211gemm_f16_64x64_32x2_tn_align4,not_verified,success,universal,1024,1024,4096,f16:row,f16:column,f32:column,1,0,4,1,tensorop,f32,64,64,32,2,2,1,1,16,8,8,75,1024,20971520,8592031744,0.294231,66.3806,29201.6
1,CUTLASS,gemm,cutlass_tensorop_s1688121gemm_f16_64x64_32x2_tn_align4,not_verified,success,universal,1024,1024,4096,f16:row,f16:column,f32:column,1,0,4,1,tensorop,f32,64,64,32,2,1,2,1,16,8,8,75,1024,20971520,8592031744,0.293446,66.5583,29279.8
1,CUTLASS,gemm,cutlass_tensorop_s1688111gemm_f16_64x64_32x2_tn_align4,not_verified,success,universal,1024,1024,4096,f16:row,f16:column,f32:column,1,0,4,1,tensorop,f32,64,64,32,2,1,1,1,16,8,8,75,1024,20971520,8592031744,0.279067,69.9876,30788.4
1,CUTLASS,gemm,cutlass_tensorop_s1688221gemm_f16_64x64_32x2_tn_align4,not_verified,success,universal,2048,2048,8192,f16:row,f16:column,f32:column,1,0,4,1,tensorop,f32,64,64,32,2,2,2,1,16,8,8,75,1024,83886080,68727865344,2.27502,34.3404,30209.8
1,CUTLASS,gemm,cutlass_tensorop_s1688211gemm_f16_64x64_32x2_tn_align4,not_verified,success,universal,2048,2048,8192,f16:row,f16:column,f32:column,1,0,4,1,tensorop,f32,64,64,32,2,2,1,1,16,8,8,75,1024,83886080,68727865344,2.12332,36.7938,32368.1
1,CUTLASS,gemm,cutlass_tensorop_s1688121gemm_f16_64x64_32x2_tn_align4,not_verified,success,universal,2048,2048,8192,f16:row,f16:column,f32:column,1,0,4,1,tensorop,f32,64,64,32,2,1,2,1,16,8,8,75,1024,83886080,68727865344,2.11988,36.8536,32420.7
1,CUTLASS,gemm,cutlass_tensorop_s1688111gemm_f16_64x64_32x2_tn_align4,not_verified,success,universal,2048,2048,8192,f16:row,f16:column,f32:column,1,0,4,1,tensorop,f32,64,64,32,2,1,1,1,16,8,8,75,1024,83886080,68727865344,2.00078,39.0474,34350.6
1,CUTLASS,gemm,cutlass_tensorop_s1688221gemm_f16_64x64_32x2_tn_align4,not_verified,success,universal,3072,3072,12288,f16:row,f16:column,f32:column,1,0,4,1,tensorop,f32,64,64,32,2,2,2,1,16,8,8,75,1024,188743680,231947108352,7.64894,22.9811,30324.1
1,CUTLASS,gemm,cutlass_tensorop_s1688211gemm_f16_64x64_32x2_tn_align4,not_verified,success,universal,3072,3072,12288,f16:row,f16:column,f32:column,1,0,4,1,tensorop,f32,64,64,32,2,2,1,1,16,8,8,75,1024,188743680,231947108352,7.1344,24.6386,32511.1
1,CUTLASS,gemm,cutlass_tensorop_s1688121gemm_f16_64x64_32x2_tn_align4,not_verified,success,universal,3072,3072,12288,f16:row,f16:column,f32:column,1,0,4,1,tensorop,f32,64,64,32,2,1,2,1,16,8,8,75,1024,188743680,231947108352,7.06747,24.8719,32819
1,CUTLASS,gemm,cutlass_tensorop_s1688111gemm_f16_64x64_32x2_tn_align4,not_verified,success,universal,3072,3072,12288,f16:row,f16:column,f32:column,1,0,4,1,tensorop,f32,64,64,32,2,1,1,1,16,8,8,75,1024,188743680,231947108352,6.54316,26.8649,35448.8
1,CUTLASS,gemm,cutlass_tensorop_s1688221gemm_f16_64x64_32x2_tn_align4,not_verified,success,universal,4096,4096,16384,f16:row,f16:column,f32:column,1,0,4,1,tensorop,f32,64,64,32,2,2,2,1,16,8,8,75,1024,335544320,549789368320,17.7214,17.634,31024
1,CUTLASS,gemm,cutlass_tensorop_s1688211gemm_f16_64x64_32x2_tn_align4,not_verified,success,universal,4096,4096,16384,f16:row,f16:column,f32:column,1,0,4,1,tensorop,f32,64,64,32,2,2,1,1,16,8,8,75,1024,335544320,549789368320,17.0066,18.3752,32327.9
1,CUTLASS,gemm,cutlass_tensorop_s1688121gemm_f16_64x64_32x2_tn_align4,not_verified,success,universal,4096,4096,16384,f16:row,f16:column,f32:column,1,0,4,1,tensorop,f32,64,64,32,2,1,2,1,16,8,8,75,1024,335544320,549789368320,16.8467,18.5496,32634.8
1,CUTLASS,gemm,cutlass_tensorop_s1688111gemm_f16_64x64_32x2_tn_align4,not_verified,success,universal,4096,4096,16384,f16:row,f16:column,f32:column,1,0,4,1,tensorop,f32,64,64,32,2,1,1,1,16,8,8,75,1024,335544320,549789368320,15.6568,19.9594,35115
1,CUTLASS,gemm,cutlass_tensorop_s1688221gemm_f16_64x64_32x2_tn_align4,not_verified,success,universal,5120,5120,20480,f16:row,f16:column,f32:column,1,0,4,1,tensorop,f32,64,64,32,2,2,2,1,16,8,8,75,1024,524288000,1073794252800,36.3958,13.4159,29503.3
